Program name,Program Page url
Bachelor of Science in Aeronautics,https://erci.edu.sg/programmes/bachelors-degree-programmes/erau-bachelor-of-science-in-aeronautics/
Bachelor of Science in Aeronautical Science,https://erau.edu/degrees
Bachelor of Science in Aerospace Engineering,https://erau.edu/degrees
Bachelor of Science in Aerospace Physiology,https://erau.edu/degrees
Bachelor of Science in Air Traffic Management,https://erau.edu/degrees/bachelor/air-traffic-management
Bachelor of Science in Aviation Business Administration,https://www.spcollege.edu/friends-partners/community-resources/university-partnership-center/aviation-business-administration
Bachelor of Science in Aviation Maintenance Science,https://erau.edu/degrees
Bachelor of Science in Business Administration,https://erau.edu/degrees
Bachelor of Science in Business Analytics,https://erci.edu.sg/programmes/bachelors-degree-programmes/erau-bachelor-of-science-in-business-analytics/
Bachelor of Science in Computer Engineering,https://erau.edu/degrees
Bachelor of Science in Computer Science,https://erau.edu/degrees/bachelor/computer-science
Bachelor of Science in Cyber Intelligence and Security,https://che.sc.gov/sites/che/files/Documents/Meetings/2024/ACAP/March%2028/4.G.CCU%20New%20Program%20BA%20Cyber%20TI_ACAP.pdf
Bachelor of Science in Data Science,https://erau.edu/degrees
Bachelor of Science in Engineering,https://erau.edu/degrees
Bachelor of Science in Safety Management,https://erau.edu/degrees
"Bachelor of Science in Simulation Science, Games, and Animation",https://erau.edu/degrees
Bachelor of Science in Software Engineering,https://erau.edu/degrees
Associate in Science in Aeronautics,https://erau.edu/degrees
Associate of Science in Air Traffic Management,https://erau.edu/degrees/associate/air-traffic-management
Associate in Science in Aviation Business Administration,https://erau.edu/degrees/associate/aviation-business-administration
Associate in Science in Aviation Maintenance Science,https://erau.edu/degrees
Minor in Aeronautical Studies,https://worldwide.erau.edu/colleges/arts-sciences/pathways
Minor in Aeronautics,https://erau.edu/degrees
Minor in Aerospace Engineering,https://erau.edu/degrees
Minor in Aerospace Life Sciences,https://daytonabeach.erau.edu/degrees/minors
Minor in Air Cargo Management,https://erau.edu/degrees
Minor in Airline Operations,https://erau.edu/degrees
Minor in Airport Baggage Handling Systems Implementation,https://worldwide.erau.edu/colleges/arts-sciences/department-mathematics-science-technology
Minor in Airport Management,https://erci.edu.sg/programmes/bachelors-degree-programmes/erau-bachelor-of-science-in-aviation-business-administration/
Minor in Air Traffic Control,https://erau.edu/degrees
Minor in Air Transportation,https://www.reddit.com/r/AirForce/comments/15gttmz/what_did_you_do_with_your_degree/
Minor in Alternative Energy,https://campus.kennesaw.edu/colleges-departments/spceet/degrees-programs/minors/renewable-energy/index.php
Minor in Applied Data Science,https://www.youtube.com/@embry-riddle_worldwide_coas
Minor in Applied Mathematics,https://erau.edu/degrees
Minor in Applied Meteorology,https://daytonabeach.erau.edu/college-aviation/applied-aviation-sciences
Minor in Arabic and Middle Eastern Studies,https://erau.edu/degrees
"Minor in Artificial Intelligence, Ethics and Creativity",https://worldwide.erau.edu/colleges/arts-sciences/department-humanities-communication
Minor in Astronautics,https://daytonabeach.erau.edu/degrees/minors
Minor in Astronomy and Astrophysics,https://erau.edu/degrees
Minor in Aviation Law,https://daytonabeach.erau.edu/college-aviation/aeronautical-science
Minor in Aviation Maintenance Operations,https://erau.edu/degrees/minors
Minor in Aviation Maintenance Science Airframe,https://erau.edu/degrees
Minor in Aviation Maintenance Science Powerplant,https://talk.collegeconfidential.com/t/value-of-an-faa-powerplant-certification-as-an-aero-engineer/2003578
Minor in Aviation Management,https://erau.edu/degrees
Minor in Aviation Safety,https://erau.edu/degrees
"Minor in Aviation, Technology and Society",https://worldwide.erau.edu/colleges/arts-sciences/department-humanities-communication
Minor in Avionics Line Maintenance,https://daytonabeach.erau.edu/college-aviation/aviation-maintenance-science
Minor in Biomedical Engineering,https://admission.ucla.edu/apply/minors
Minor in Biomedical Sciences,https://erau.edu/degrees
Minor in Business Administration,https://erau.edu/degrees
Minor in Chemistry,https://erau.edu/degrees
Minor in Chinese Studies,https://prescott.erau.edu/college-business-security-intelligence/foreign-languages
Minor in Communication,https://worldwide.erau.edu/colleges/arts-sciences/department-humanities-communication
Minor in Communication and Broadcast Media,https://www.westmont.edu/office-registrar/academic-policies-and-procedures/majors-and-minors
Minor in Computational Mathematics,https://erau.edu/degrees
Minor in Computer Aided Design/Computer Aided Manufacturing,https://advising.utah.edu/majors/quick-look/index.php
Minor in Computer Science,https://erau.edu/degrees
Minor in Computer Security,https://prescott.erau.edu/degrees/minors
"Minor in Crisis, Risk, and Resilience Communication",https://erau.edu/degrees
Minor in Cyber Intelligence and Security,https://erau.edu/degrees
Minor in Cybersecurity Application and Management,https://erau.edu/degrees
Minor in Cybersecurity Engineering,https://erau.edu/degrees/minors
Minor in Data Science,https://erau.edu/degrees
Minor in Defense Studies,https://prescott.erau.edu/degrees/minors
Minor in Diplomatic and Military History,https://erau.edu/degrees
Minor in Economics,https://erau.edu/degrees
Minor in Electrical and Computer Engineering,https://daytonabeach.erau.edu/degrees/minors
Minor in Electrical Engineering,https://erau.edu/degrees
Minor in Emergency Management,https://daytonabeach.erau.edu/college-arts-sciences/security-studies
Minor in Emergency Planning and Management,https://prescott.erau.edu/degrees/minors
Minor in Emergency Services,https://erau.edu/degrees/bachelor/homeland-security
Minor in Engineering Science,https://erau.edu/degrees
Minor in Engineering Sciences,https://www.scribd.com/document/911096319/B-S-in-Aeronautics-ERAU-Curriculum-Plan
Minor in Entrepreneurship,https://daytonabeach.erau.edu/degrees/minors
Minor in Environmental Science,https://erau.edu/degrees
Minor in Finance,https://erau.edu/degrees
Minor in Flight,https://erau.edu/degrees
Minor in Flight Test and Simulation,https://erau.edu/degrees
Minor in Forensic Accounting & Fraud Examination,https://erau.edu/degrees
Minor in Forensic Biology,https://erau.edu/degrees
Minor in Geographic Information Systems,https://nwas.org/2021-fall-scholarship-recipients-announced/
Minor in Global Conflict Studies,https://daytonabeach.erau.edu/college-arts-sciences/security-studies
Minor in Helicopter Operations and Safety,https://erau.edu/course-catalogs
Minor in Homeland Security,https://erau.edu/degrees
Minor in Human Factors,https://erau.edu/degrees
Minor in Human Factors Psychology,https://daytonabeach.erau.edu/college-arts-sciences/human-factors
Minor in Human Resources,https://worldwide.erau.edu/degrees/minors
Minor in Humanistic STEM,https://scispace.com/pdf/what-is-humanistic-stem-and-why-do-we-need-it-y3ejua52fu.pdf
Minor in Humanities,https://erau.edu/degrees
Minor in Industrial/Organizational Psychology,https://www.taylor.edu/academics/degrees/industrial-organizational
Minor in Intelligence,https://erau.edu/degrees
Minor in International History,https://erau.edu/degrees
Minor in International Relations,https://catalog.illinois.edu/undergraduate/minors/
Minor in Latin American Studies,https://daytonabeach.erau.edu/college-arts-sciences/humanities-communications/language-classes-culture-minors
Minor in Leadership,https://erau.edu/degrees/minors
Minor in Logistics Management,https://www.quora.com/What-minor-should-I-choose-as-a-logistics-and-supply-chain-management-major
Minor in Management,https://erau.edu/degrees
Minor in Management Information Systems,https://erau.edu/degrees
Minor in Mandarin Chinese,https://prescott.erau.edu/college-business-security-intelligence/foreign-languages
Minor in Marketing,https://erau.edu/degrees
Minor in Mathematics,https://erau.edu/degrees
Minor in Mechanical Engineering,https://prescott.erau.edu/degrees/minors
Minor in Military Science,https://erau.edu/degrees
Minor in Military Studies,https://erau.edu/degrees
Minor in Occupational Safety and Health,https://www.scribd.com/document/911096319/B-S-in-Aeronautics-ERAU-Curriculum-Plan
Minor in Physics,https://erau.edu/degrees
Minor in Project Management,https://erau.edu/degrees
Minor in Propulsion,https://erau.edu/degrees
Minor in Psychology,https://erau.edu/degrees
Minor in Research Foundations,https://erau.edu/course-catalogs
Minor in Robotic Systems,https://erau.edu/degrees
Minor in Robotics,https://daytonabeach.erau.edu/degrees/minors
Minor in Russian Studies,https://erau.edu/degrees
Minor in Science Literacy,https://erau.edu/degrees
Minor in Security and Intelligence,https://www.scribd.com/document/911096319/B-S-in-Aeronautics-ERAU-Curriculum-Plan
Minor in Small Uncrewed Aircraft Systems (sUAS) Operation,https://erau.edu/degrees
Minor in Space Operations,https://daytonabeach.erau.edu/degrees/minors
Minor in Space Physics,https://erau.edu/degrees
"Minor in Space Policy, History and Culture",https://erau.edu/degrees
Minor in Space Studies,https://worldwide.erau.edu/degrees/minors
Minor in Spanish,https://en.wikipedia.org/wiki/Academic_minor
Minor in Supply Chain Management in Aviation and Aerospace,https://daytonabeach.erau.edu/degrees/minors
Minor in Systems Engineering,https://erau.edu/degrees
Minor in Technical Intelligence,https://prescott.erau.edu/degrees/minors
Minor in Technical Management,https://erau.edu/degrees
Minor in Terrorism Studies,https://erau.edu/degrees
Minor in Uncrewed Aircraft Systems,https://www.sdstate.edu/programs/undergraduate/uncrewed-aircraft-systems-minor
Minor in Uncrewed Aircraft Systems Applications,https://erau.edu/degrees
Minor in Uncrewed Aircraft Systems (UAS) in Public Safety,https://erau.edu/degrees
