,Minor in Diplomatic and Military History,,,,,Graduate,Fall 2026,,,,Not Required,Optional,,Required,"To declare the Minor in Diplomatic and Military History, a student must be in good academic standing and must have a designated faculty advisor from the Department of Global Security and Intelligence Studies. As this is a minor, the primary application requirements are for general undergraduate admission to the university. Required Documents for undergraduate admission include: Official high school transcripts or official GED scores. Optional Documents include: SAT or ACT scores, Letters of recommendation, and a 250-500 word essay.",Not Required,,True,True,False,False,False,False,False,False,False,False,False,False,False,False,False,False,,,,College of Arts and Sciences,"$42,732/Year",,,,,,,"The Minor in Diplomatic and Military History at Embry-Riddle Aeronautical University is designed to expose students to the historical development of international relations, military conflict, and diplomacy. Students will gain a deep understanding of historical events, their causes, consequences, and the evolution of diplomatic and military strategies. The minor complements various majors by providing a crucial historical context for careers in international affairs, national security, intelligence, and defense industries. Through this minor, students will develop critical thinking, analytical, and research skills applicable to a wide range of professional fields.",,https://erau.edu/degrees,,,"$1,780.50",FALSE,False,,4.0,2.0,,,,,,,,,,,,,,,,,,False,False,,,,,,,,,,,,,,,,,,,,,,,"Up to $24,000 per year",,"Merit-Based Scholarships, University Grants",FALSE,,,FALSE,FALSE,,
,Minor in Economics,,,,,Undergraduate,Fall 2026,,,,,,,Required,,,,True,True,False,False,False,False,False,False,False,False,False,False,False,False,False,False,,,,David B. O'Maley College of Business,"$42,734/Year",,,,,,,"An Embry-Riddle Aeronautical University Minor in Economics is the study of how people allocate scarce resources for production, distribution, and consumption, both individually and collectively. With the study of economics, you will gain a better understanding of how the world works, which will allow you to make better decisions in your personal and professional life. This minor, offered through the Department of Global Security and Intelligence Studies, is intended for Embry-Riddle students seeking to gain a deeper understanding of economic concepts. A minor in economics will complement almost any major and can provide valuable preparation for careers in business, management, finance, data analytics, and government or for further study in law, business, or economics at the graduate level.",,https://erau.edu/degrees,,,"$1,780.58",FALSE,False,,4.0,2.0,,,,,,,,,,,,,,,,,,False,False,,,,,,,,,,,,,,,,,,,,,,,"$5,000 - $22,000 per year",,Merit-based,FALSE,,,FALSE,FALSE,,
,Minor in Electrical and Computer Engineering,,,,,Undergraduate,Fall 2026,,,,,,Not Required,Required,"The minor requires 18 credit hours of coursework in Electrical and Computer Engineering.

Required courses are:
EE 223 - Electrical Engineering I
EE 224 - Electrical Engineering II
EE 335 - Electrical and Computer Engineering Fundamentals
EE 401 - Digital Systems Design
EE 420 - Control Systems Analysis and Design
and one EE or CEC elective (300-400 level, at least 3 credits, excluding Senior Design and Cooperative Education).

To declare this minor, a student must have a minimum cumulative grade point average of 2.0.",,,True,False,False,False,False,False,False,False,False,False,False,False,False,False,False,False,,,,College of Engineering,"$42,226/Year",,,,,,,,,https://daytonabeach.erau.edu/degrees/minors,,,"$1,759/Credit",FALSE,True,,4.0,2.0,,,,,,,,,,,,,,,,,,False,False,,,,,,,,,,,,,,,,,,,,,,,,,"Merit-based, Need-based, Departmental",FALSE,,,FALSE,FALSE,,
,Minor in Electrical Engineering,,,,,Undergraduate,Fall 2026,,,,,,,Required,,,,True,True,False,False,False,False,False,False,False,False,False,False,False,False,False,False,,,,College of Engineering,"$21,495 per semester",,,,,,,"The Electrical Engineering minor is intended for students who wish to supplement their major field of study with a concentration of Electrical Engineering courses. To be granted the Electrical Engineering minor, students must satisfy the requirements listed in the Minor in Electrical Engineering section of the catalog, including a minimum of 15 credit hours of approved coursework. At least nine of the 15 credit hours must be taken at Embry-Riddle. A minimum cumulative GPA of 2.0 in the courses used for the minor is required. A maximum of six credit hours taken to satisfy requirements for the minor can also satisfy requirements in the student's major and/or other minor(s). A maximum of three credits of undergraduate research (EE 499) may be applied toward the minor. The specific requirements for the Minor in Electrical Engineering are outlined in the catalog. Upon completion of the Electrical Engineering minor, students will be able to: Apply fundamental concepts of electrical engineering to solve problems related to circuits, electronics, and digital systems. Utilize appropriate tools and techniques for the analysis, design, and simulation of electrical engineering components and systems. Communicate effectively about technical topics in electrical engineering.",,https://erau.edu/degrees,,,1791,FALSE,False,,4.0,2.0,,,,,,,,,,,,,,,,,,False,False,,,,,,,,,,,,,,,,,,,,,,,"Up to $20,000 per year",,"Merit-based, Need-based",FALSE,,,FALSE,FALSE,,
,Minor in Emergency Management,,,,,Graduate,Fall 2026,,,,Not Required,Not Required,Not Required,Required,,Not Required,,True,False,False,False,False,False,False,False,False,False,False,False,False,False,False,False,,,,College of Arts & Sciences,42614/Year,,,,,,,"The Emergency Management minor provides students with the foundational knowledge and critical skills necessary to manage and mitigate disasters and emergencies effectively. Students explore principles of preparedness, response, recovery, and risk assessment, preparing them for roles in various governmental, non-profit, and private organizations involved in emergency management and homeland security. The program covers topics such as disaster planning, crisis communication, and interagency coordination, emphasizing a holistic approach to safeguarding communities and critical infrastructure against a wide range of threats.",,https://daytonabeach.erau.edu/college-arts-sciences/security-studies,,,1776,FALSE,False,,4.0,2.0,,,,,,,,,,,,,,,,,,False,False,,,,,,,,,,,,,,,,,,,,,,,"Up to $24,000 per year",,Merit-based,FALSE,,,FALSE,FALSE,,
,Minor in Emergency Planning and Management,,,,,Graduate,Fall 2026,,,,Not Required,Optional,,Required,"To apply for admission, we require an application, official transcripts, and an application fee. Additional items such as a letter of recommendation, essay, and standardized test scores are encouraged but not required.",Not Required,,True,False,False,False,False,False,False,False,False,False,False,False,False,False,False,False,,,,College of Aviation,"$41,364 per year",,,,,,,,,https://prescott.erau.edu/degrees/minors,,,1723.5,FALSE,True,,4.0,2.0,,,,,,,,,,,,,,,,,,False,False,,,,,,,,,,,,,,,,,,,,,,,"from $6,000 up to $20,000 per academic year",,"Merit-Based Scholarships, Departmental & Other ERAU Scholarships",FALSE,,,FALSE,FALSE,,
,Minor in Emergency Services,,,,,Undergraduate,Fall 2026,,,,,,Not Required,Required,,,,True,False,False,False,False,False,False,False,False,False,False,False,False,False,False,False,,,,College of Aviation,42238/Year,,,,,,,,,https://erau.edu/degrees/bachelor/homeland-security,,18000,1760,FALSE,False,,4.0,2.0,,,,,,,,,,,,,,,,,,False,False,,,105.0,112.0,,,6.0,,,53.0,,79.0,,,,,,,,,,,up to 15000/year,,"Merit-based, Need-based",FALSE,,,FALSE,FALSE,,
,Minor in Engineering Science,,,,,Undergraduate,Fall 2026,,,,Not Required,Not Required,,Required,The Minor in Engineering Science is open to any student at Embry-Riddle.,Not Required,,True,False,False,False,False,False,False,False,False,False,False,False,False,False,False,False,,,,College of Engineering / College of Arts and Sciences,"$42,236/Year",,,,,,,"The Engineering Science Minor is for students pursuing a non-engineering degree who want to broaden their knowledge in the engineering field or prepare for graduate studies in an engineering discipline. Students will gain a fundamental understanding of engineering principles, allowing them to apply problem-solving skills to real-world challenges. This minor is offered at the Daytona Beach and Prescott Campuses.",,https://erau.edu/degrees,,,"$1,760",FALSE,True,,4.0,2.0,,,,,,,,,,,,,,,,,,False,False,,,,,,,,,,,,,,,,,,,,,,,"Up to $22,000",,Merit-based,FALSE,,,FALSE,FALSE,,
,Minor in Engineering Sciences,,,,,Undergraduate,Fall 2026,,,,,,Not Required,Required,,,,True,False,False,False,False,False,False,False,False,False,False,False,False,False,False,False,,,,,,,,,,,,,,https://www.scribd.com/document/911096319/B-S-in-Aeronautics-ERAU-Curriculum-Plan,,,"S$1,320",FALSE,True,,4.0,2.0,,,,,,,,,,,,,,,,,,False,False,,,105.0,,,,6.0,,,,,79.0,,,,,,,,,,,"up to S$7,500 per academic year",,"Merit-based, Need-based, Residency-based",FALSE,,,FALSE,FALSE,,
,Minor in Entrepreneurship,,,,,Undergraduate,Fall 2026,,,,,,Not Required,Required,,,,False,False,False,False,False,False,False,False,False,False,False,False,False,False,False,False,,,,David B. O'Maley College of Business,"$43,174/Year",,,,,,,"The Entrepreneurship minor provides students with the business skills to start a new company or develop an entrepreneurial mind to innovate and create new businesses within an established organization. Through the minor, students learn how to develop a business plan, conduct market research, find funding, and scale their new ventures to a profitable and sustainable enterprise. The Entrepreneurship minor is available to all students except Business Administration majors. This minor requires 15 credit hours of coursework. Required Courses: ENTR 201: Introduction to Entrepreneurship (3 credits), ENTR 301: New Venture Creation and Funding (3 credits), ENTR 401: Scaling and Commercializing New Ventures (3 credits), MGMT 321: Principles of Management (3 credits), MKTG 220: Principles of Marketing (3 credits).",,https://daytonabeach.erau.edu/degrees/minors,,,"$1,799/credit hour",FALSE,False,,4.0,2.0,,,,,,,,,,,,,,,,,,False,False,,,,,,,,,,,,,,,,,,,,,,,"$6,000 to $20,000",,Merit-based,FALSE,,,FALSE,FALSE,,
,Minor in Environmental Science,,,,,Undergraduate,Fall 2026,,,,,,Not Required,Required,,,,True,False,False,False,False,False,False,False,False,False,False,False,False,False,False,False,,,,College of Arts & Sciences,,,,,,,,"Explore the interdisciplinary field of environmental science with a minor from Embry-Riddle. Environmental Science is an interdisciplinary field, drawing on the sciences (e.g., biology, chemistry, geology, physics, atmospheric science) and mathematics, as well as engineering, social sciences, and the humanities, to understand environmental challenges facing the world today. Students completing the minor will gain an understanding of environmental issues from various perspectives, develop scientific literacy regarding environmental processes, and build a foundation in environmental management.",,https://erau.edu/degrees,,,"$1,812 per credit hour",FALSE,True,,4.0,2.0,,,,,,,,,,,,,,,,,,False,False,,,105.0,112.0,,,6.0,,,53.0,,79.0,,,,,,,,,,,"$10,000-$24,000 per year (Presidential Scholarship)",,"Merit-based, Alumni Legacy, Athletic",FALSE,,,FALSE,FALSE,,
,Minor in Finance,,,,,Undergraduate,Fall 2026,,,,,,,Required,,,,True,True,False,False,False,False,False,False,False,False,False,False,False,False,False,False,,,,David B. O'Maley College of Business,"$21,138/Semester or $42,276/Year",,,,,,,"A minor in Finance provides students with fundamental knowledge in the areas of corporate finance, investments and financial markets and institutions. Students completing the minor will be prepared for a wide range of career opportunities in the financial services industry, as well as roles requiring financial expertise in corporations, government and non-profit organizations. Through the minor, students learn to analyze financial data, evaluate investment opportunities and make sound financial decisions.",,https://erau.edu/degrees,The College of Business is accredited by the Accreditation Council for Business Schools and Programs (ACBSP).,,"$1,761.50",FALSE,False,,4.0,2.0,,,,,,,,,,,,,,,,,,False,False,,,,,,,,,,,,,,,,,,,,,,,"$5,000 to $20,000 per year",,Merit-based,FALSE,,,FALSE,FALSE,,
,Minor in Flight,,,,,Undergraduate,Fall 2026,,,,,,Not Required,Required,The Minor in Flight is available to all students except for those majoring in Aeronautical Science.,,,True,False,False,False,False,False,False,False,False,False,False,False,False,False,True,False,,,,College of Aviation,"$43,074/Year",,,,,,,"The Minor in Flight is designed for Embry-Riddle Aeronautical University students who desire a basic flight experience in conjunction with their major. It offers students the opportunity to learn fundamental flight skills and concepts, providing a hands-on introduction to aviation. While not leading to a pilot certificate directly, it complements various majors by offering practical knowledge in flight operations and aircraft systems. Students will explore basic aerodynamics, aircraft performance, navigation principles, and aviation safety.",,https://erau.edu/degrees,,,"$1,795 per credit hour",FALSE,True,,4.0,2.0,,,,,,,,,,,,,,,,,,False,False,,,,,,,,,,,,,,,,,,,,,,,"$5,000 - $20,000 per year",,Merit-based,FALSE,,,FALSE,FALSE,,
,Minor in Flight Test and Simulation,,,,,Undergraduate,Fall 2026,,,,Not Required,Not Required,Not Required,Required,"To enter the minor, students must have completed EGR 115, CS 125 or CS 225, and PS 118 or PS 250.",Not Required,,True,False,True,True,False,False,False,True,False,False,False,True,True,True,False,False,,,,College of Aviation,"$21,367/Semester",,,,,,,The Flight Test and Simulation Minor offers students a challenging opportunity to supplement their primary degree program by gaining exposure to the principles of flight test and the application of flight simulation and modeling. Students completing the Flight Test and Simulation Minor will understand the principles of flight test and the application of flight simulation and modeling. The minor provides an excellent opportunity for students to complement their major area of study by gaining skills necessary for employment in the flight test or flight simulation and modeling industries. The Flight Test and Simulation Minor is available at the Daytona Beach Campus.,,https://erau.edu/degrees,,,"$1,780.50/Credit Hour",FALSE,True,,4.0,,,,,,,,,,,,,,,,,,,False,False,,,105.0,112.0,,,6.0,,,53.0,,79.0,,,,,,,,,,,,,Merit-based,FALSE,,,FALSE,FALSE,,
,Minor in Forensic Accounting & Fraud Examination,,,,,Undergraduate,Fall 2026,,,,,,Not Required,Required,,,,True,True,False,False,False,False,False,False,False,False,False,False,False,False,False,False,,,,David B. O'Maley College of Business,"$42,556 / Year",,,,,,,"The Forensic Accounting and Fraud Examination Minor provides students with an understanding of various fraud schemes, their detection and prevention, and the process of investigating fraud. This program will also help students develop skills in litigation support, forensic analysis, financial forensics, and the use of technology in forensic accounting. In addition, students will learn how to prepare forensic reports and communicate findings effectively. This minor is designed for students interested in careers in forensic accounting, fraud examination, internal auditing, and other related fields.",,https://erau.edu/degrees,,,"$1,773.17",FALSE,False,,4.0,2.0,,,,,,,,,,,,,,,,,,False,False,,,,,,,,,,,,,,,,,,,,,,,"Up to $15,000 per year",,Merit-based,FALSE,,,FALSE,FALSE,,
,Minor in Forensic Biology,,,,,Undergraduate,Fall 2026,,,,,,Not Required,Required,,,,True,False,False,False,False,False,False,False,False,False,False,False,False,False,False,False,,,,College of Arts & Sciences,43034/Year,,,,,,,"Our Forensic Biology minor provides an overview of the role of biology within a forensic context, covering areas from crime scene investigation to laboratory testing. Topics include general biology, molecular biology, genetics, and forensic applications of biology. You'll gain valuable knowledge that can be applied to fields like law enforcement, forensic science, and criminal justice.",,https://erau.edu/degrees,,,1793/Credit Hour,FALSE,True,,4.0,2.0,,,,,,,,,,,,,,,,,,False,False,,,105.0,112.0,,,6.0,,,53.0,,79.0,,,,,,,,,,,"$8,000 - $22,000 per year",,Merit-Based Scholarships,FALSE,,,FALSE,FALSE,,
,Minor in Geographic Information Systems,,,,,Graduate,Fall 2026,,,,,,,Required,,,,True,True,False,False,False,False,False,False,False,False,False,False,False,False,False,False,,,,,,,,,,,,,,https://nwas.org/2021-fall-scholarship-recipients-announced/,,,,FALSE,False,,,,,,,,,,,,,,,,,,,,,False,False,,,,,,,,,,,,,,,,,,,,,,,,,,FALSE,,,FALSE,FALSE,,
,Minor in Global Conflict Studies,,,,,Undergraduate,Fall 2026,,,,,,Not Required,Required,,,,True,False,False,False,False,False,False,False,False,False,False,False,False,False,False,False,,,,College of Arts & Sciences,"$20,838/Semester or $41,676/Year",,,,,,,"If you are interested in issues surrounding peace, war, and conflict resolution, you may consider a Minor in Global Conflict Studies. This minor examines the causes and consequences of global conflict as well as various methods of dispute resolution. The minor helps students develop critical analysis skills for understanding international relations and conflict, and it allows them to hone their research, writing, and presentation skills.",,https://daytonabeach.erau.edu/college-arts-sciences/security-studies,,,1736.5,FALSE,False,,4.0,2.0,,,,,,,,,,,,,,,,,,False,False,,,,,,,,,,,,,,,,,,,,,,,"$5,000 - $24,000 per year",,"Merit-based, Departmental, Donor",FALSE,,,FALSE,FALSE,,
,Minor in Helicopter Operations and Safety,,,,,Undergraduate,Fall 2026,,,,,,Not Required,Required,,,,True,False,False,False,False,False,False,False,False,False,False,False,False,False,False,False,,,,College of Aviation,"$20,778/Semester",,,,,,,"The Helicopter Operations and Safety minor provides students with a detailed and comprehensive understanding of the theory, principles, and concepts related to vertical flight operations. The course curriculum is designed for students interested in a career in helicopter operations, either as a pilot or in management/support roles. The minor emphasizes the operational and safety aspects of rotorcraft, covering topics such as aerodynamic principles of rotary wing flight, helicopter systems, performance, weather considerations, air traffic control procedures, crew resource management, human factors, risk management, and accident investigation. Graduates will be equipped with specialized knowledge that is critical for safety-conscious and efficient helicopter operations across various sectors including commercial, public service, and military applications.",,https://erau.edu/course-catalogs,,,1732,FALSE,False,,4.0,2.0,,,,,,,,,,,,,,,,,,False,False,,,105.0,112.0,,,6.0,,,53.0,,79.0,,,,,,,,,,,"$5,000 - $18,000 per year",,Merit-based scholarships,FALSE,,,FALSE,FALSE,,
,Minor in Homeland Security,,,,,Undergraduate,Fall 2026,,,,,,Not Required,Required,,,,True,True,False,False,False,False,False,False,False,False,False,False,False,False,False,False,,,,College of Arts and Sciences,"$43,024/Year",,,,,,,"A minor in Homeland Security provides an overview of the challenges facing our nation's security and the strategies, policies, and systems designed to mitigate them. Students will gain an understanding of the complex interdisciplinary nature of homeland security issues, preparing them to pursue careers in a wide range of fields from law enforcement and intelligence to emergency management and cybersecurity. The minor enhances professional prospects for students in any discipline while providing a solid foundation for those interested in pursuing further studies in homeland security or related fields. Students completing this minor will gain an understanding of:
*   The complex nature of homeland security issues.
*   Strategic approaches to protecting national assets.
*   The various roles and responsibilities of government agencies.
*   Risk assessment and management in security contexts.
*   Cybersecurity challenges and responses.
*   Emergency planning and disaster response.",,https://erau.edu/degrees,,,"$1,793",FALSE,False,,4.0,2.0,,,,,,,,,,,,,,,,,,False,False,,,,,,,,,,,,,,,,,,,,,,,"$6,000 to $20,000 per year",,Merit-based,FALSE,,,FALSE,FALSE,,
,Minor in Human Factors,,,,,Graduate,Fall 2026,,,,Not Required,Not Required,Not Required,Required,The Minor in Human Factors is available to all degree-seeking students.,Not Required,,True,False,False,False,False,False,False,False,False,False,False,False,False,False,False,False,,,,College of Arts and Sciences,"$42,236/Year",,,,,,,"Learn how to apply human factors principles to the design of systems, products and services. Human factors is a multidisciplinary field that focuses on optimizing human-system performance, safety and usability. Students will explore topics such as human-computer interaction, cognitive psychology, ergonomics, human error and system design. Through hands-on projects and case studies, students will develop practical skills in human factors analysis, evaluation and design. The Human Factors minor is designed to complement a wide range of majors, including engineering, aviation, psychology, computer science and business, providing students with valuable expertise to enhance their career prospects in various industries.",,https://erau.edu/degrees,,,1759,FALSE,True,,4.0,2.0,,,,,,,,,,,,,,,,,,False,False,,,,,,,,,,,,,,,,,,,,,,,"$7,000 - $20,000 annually",,"Merit-based, Departmental",FALSE,,,FALSE,FALSE,,
,Minor in Human Factors Psychology,,,,,Graduate,Fall 2026,,,,,,Not Required,Required,,,,True,False,False,False,False,False,False,False,False,False,False,False,False,False,False,False,,,,College of Arts & Sciences,"$20,868/Semester",,,,,,,"A minor in Human Factors Psychology will allow students to understand human behavior and performance within a variety of systems in both the physical and social worlds. The minor is an excellent addition to technical degrees such as aerospace engineering, mechanical engineering, computer science, and aeronautical science. Students learn the basic principles of cognitive psychology, perception, and human factors. This knowledge allows students to consider human capabilities and limitations when designing a system. The minor requires a total of 18 credit hours beyond the general education requirements. Students must earn a grade of 'C' or better in each course to satisfy the minor requirements.",,https://daytonabeach.erau.edu/college-arts-sciences/human-factors,,,"$1,739",FALSE,True,,4.0,2.0,,,,,,,,,,,,,,,,,,False,False,,,105.0,112.0,,,6.0,,,53.0,,79.0,,,,,,,,,,,"$6,000 - $24,000 per year",,"Merit-based, Departmental, Athletic",FALSE,,,FALSE,FALSE,,
,Minor in Human Resources,,,,,Graduate,Fall 2026,,,,,,Not Required,Required,,,,True,False,False,False,False,False,False,False,False,False,False,False,False,False,False,False,,,,College of Business,$460 per credit hour,,,,,,,"The Minor in Human Resources will equip you with a fundamental understanding of the theories and principles of human resources, including how to attract, develop, motivate, and retain employees to meet the goals of an organization. The Minor in Human Resources provides students with the foundational knowledge and skills in key HR areas, including recruitment and selection, training and development, performance management, compensation and benefits, and employee relations. These skills are critical for successful careers in diverse industries, including aviation, aerospace, and business, and are essential for any manager. The knowledge gained in the minor is also applicable to students who plan to continue their education in a related graduate degree program or pursue professional HR certifications.",,https://worldwide.erau.edu/degrees/minors,,,460,FALSE,False,,4.0,2.0,,,,,,,,,,,,,,,,,,False,False,,,105.0,,,,6.0,,,53.0,,79.0,,,,,,,,,,,1800,10%,"Merit-based, Need-based, Affiliation-based",FALSE,,,FALSE,FALSE,,
,Minor in Humanistic STEM,,,,,Graduate,Fall 2026,,,,,,Not Required,Required,,,,True,False,False,False,False,False,False,False,False,False,False,False,False,False,False,False,,,,,,,,,,,,"Embry-Riddle Aeronautical University (ERAU) has developed an interdisciplinary HSTEM minor for students within any major to understand the ethical and societal impacts of technology and to learn how to communicate and lead across disciplines. The HSTEM minor will be housed in ERAU's College of Arts and Sciences (COAS). The HSTEM minor provides students with a foundational understanding of the humanities, social sciences, and ethics, with an emphasis on their application to STEM fields. It encourages students to think critically about the implications of scientific and technological advancements, fostering a sense of social responsibility and ethical awareness. Students will learn to analyze complex problems from multiple perspectives, communicate effectively across disciplinary boundaries, and develop innovative solutions that consider both technical feasibility and societal well-being. The minor prepares students to address the challenges of an increasingly complex and interconnected world, equipping them with the skills to navigate ethical dilemmas, promote social justice, and contribute to the responsible development and application of technology.",,https://scispace.com/pdf/what-is-humanistic-stem-and-why-do-we-need-it-y3ejua52fu.pdf,,,,FALSE,True,,,,,,,,,,,,,,,,,,,,,False,False,,,,,,,,,,,,,,,,,,,,,,,,,,FALSE,,,FALSE,FALSE,,
