Id,ProgramName,ProgramCode,Status,CreatedDate,UpdatedDate,Level,Term,TermCode,LiveDate,DeadlineDate,Resume,StatementOfPurpose,GreOrGmat,EnglishScore,Requirements,WritingSample,CollegeId,IsAnalyticalNotRequired,IsAnalyticalOptional,IsDuoLingoRequired,IsELSRequired,IsGMATOrGreRequired,IsGMATRequired,IsGRERequired,IsIELTSRequired,IsLSATRequired,IsMATRequired,IsMCATRequired,IsPTERequired,IsTOEFLIBRequired,IsTOEFLPBTRequired,IsEnglishNotRequired,IsEnglishOptional,AcademicYear,AlternateProgram,ApplicationType,Department,Fees,IsAvailable,ProgramType,AdmissionDepartmentId,CreatedBy,UpdatedBy,Concentration,Description,OtherConcentrations,ProgramWebsiteURL,Accredidation,AverageScholarshipAmount,CostPerCredit,IsRecommendationSystemOpted,IsStemProgram,MaxFails,MaxGPA,MinGPA,PreviousYearAcceptanceRates,QsWorldRanking,TotalAccepetedApplications,TotalCredits,TotalDeniedApplications,TotalI20sIssued,TotalScholarshipsAwarded,TotalSubmittedApplications,TotalVisasSecured,UsNewsRanking,CollegeApplicationFee,IsCollegePaying,MEContractNegotiatedFee,MyGradAppFee,ProgramCategory,IsCollegeApplicationFree,IsCouponAllowed,IsACTRequired,IsSATRequired,SftpDestinationId,MinimumACTScore,MinimumDuoLingoScore,MinimumELSScore,MinimumGMATScore,MinimumGreScore,MinimumIELTSScore,MinimumMATScore,MinimumMCATScore,MinimumPTEScore,MinimumSATScore,MinimumTOEFLScore,MLModelName,MinimumAnalyticalScore,MinimumEnglishScore,MinimumExperience,MinimumSopRating,WeightAnalytical,WeightEnglish,WeightExperience,WeightGPA,WeightSop,ScholarshipAmount,ScholarshipPercentage,ScholarshipType,IsNewlyLaunched,BatchId,IsImported,IsImportVerified,Is_Recommendation_Sponser,AnalyticalScore,MinimumLSATScore
,Master of Science in Aeronautics,,,,,Graduate,Fall 2026,,,,,,Optional,Required,,,,True,True,False,False,False,False,False,False,False,False,False,False,False,False,False,False,,,,College of Aeronautics,"$24,000 for the entire 30-credit program",,,,,,"Aviation/Aerospace Education Technology, Aviation/Aerospace Management, Aviation Safety Management Systems, Air Traffic Management, Space Studies, Unmanned Aircraft Systems, Aviation/Aerospace Operations","The Master of Science in Aeronautics (MSA) is Embry-Riddle's flagship graduate program, offering a technical, professional-oriented, and broad-based aviation/aerospace education. The MSA degree is for students who want to advance their current knowledge and experience in the aviation/aerospace industry, as well as for those who are seeking to transition into the field.

The Master of Science in Aeronautics degree program builds on Embry-Riddle’s strong aviation foundation, providing students with a deep understanding of aviation and aerospace operations, safety, security, and regulations. It is a professionally oriented program designed to meet the demands of the modern aerospace industry.

Students will gain a broad perspective on all facets of aeronautics, including air transportation, aircraft systems, human factors, maintenance management, aviation safety, and more.",,https://erau.edu/degrees,,,800,FALSE,False,2.0,4.0,2.5,,,,,,,,,,,,,,,,,,False,False,,,105.0,112.0,,,6.0,,,,,79.0,,,,,,,,,,,"Grants range from $500 to $1,500",10%,"Merit-based, Need-based",FALSE,,,FALSE,FALSE,,
,Master of Science in Aeronautics with Specialization in Aviation and Aerospace Sustainability,,,,,Graduate,Fall 2026,,,,Optional,Optional,Not Required,Required,"For admission to this program, applicants are required to have a bachelor’s degree with a minimum GPA of 2.5 from an accredited degree-granting institution. Applicants who already possess a master’s degree need only to have a bachelor’s degree from an accredited degree-granting institution.",,,True,False,False,False,False,False,False,False,False,False,False,False,False,False,False,False,,,,College of Aviation / College of Aeronautics,"$33,048/Year",,,,,,Aviation and Aerospace Sustainability,"The Master of Science in Aeronautics (MSA) degree is a broad, yet deep program designed to provide aviation and aerospace professionals with a keen understanding of aviation and aerospace operations, safety, security, systems, quality and management. Offered by the College of Aeronautics, the MSA is a completely online degree that allows students the flexibility to work on their studies anytime, anywhere in the world.

The curriculum provides a strong, technical foundation for those looking to advance their career. Graduates are prepared for leadership and management roles in all segments of aviation and aerospace, including airlines, airports, corporate aviation, government, and the U.S. military. The MSA has been a flagship, online program for Embry-Riddle since 1993 and is the academic pillar of our Worldwide Campus.",,https://erau.edu/degrees,The Master of Science in Aeronautics is accredited by the Aviation Accreditation Board International (AABI).,,"$1,836",FALSE,True,,4.0,2.5,,,,,,,,,,,,,,,,,,False,False,,,105.0,112.0,,,6.0,,,53.0,,79.0,,,,,,,,,,,,,Merit-based,FALSE,,,FALSE,FALSE,,
,Master of Science in Aeronautics with Specialization in Small Uncrewed Aircraft Systems (sUAS) Operations,,,,,Graduate,Fall 2026,,,,,,Not Required,Required,,,,True,True,False,False,False,False,False,False,False,False,False,False,False,False,False,False,,,,College of Aviation,"$32,724/Year",,,,,,Small Unmanned Aircraft Systems (sUAS) Operation,"The Master of Science in Aeronautics (MSA) degree gives students a technical look into the aviation and aerospace industry. Students gain the specific knowledge and skills needed to elevate their careers, whether that’s in flight, maintenance, safety, education or another related field.

This graduate program is designed for aviation professionals looking to advance their knowledge and for students who have a bachelor’s degree but wish to transition into the aviation industry. Graduates of the M.S. in Aeronautics program are set up for a competitive advantage to advance their careers.

Within the Small Unmanned Aircraft Systems (sUAS) Operation specialization, students will learn about topics critical to the sUAS operation industry including sUAS design, control and navigation, applications, data collection and processing as well as safety and human factors.",,https://erau.edu/degrees,,,1818,FALSE,False,,4.0,2.5,,,,,,,,,,,,,,,,,,False,False,,,105.0,112.0,,,6.0,,,,,79.0,,,,,,,,,,,"$5,000 - $13,500",,"Merit-based, Assistantships, Grants",FALSE,,,FALSE,FALSE,,
,Master of Science in Aeronautics with Specialization in Uncrewed and Autonomous Systems,,,,,Graduate,Fall 2026,,,,Required,Required,Not Required,Required,"Applicants for the Master of Science in Aeronautics (MSA) program must have a baccalaureate degree from an accredited degree-granting institution with a cumulative grade point average (CGPA) of 2.5 or higher on a 4.0 scale. Those who possess a baccalaureate degree with a CGPA less than 2.5 may be considered for conditional admission. Applicants should submit the following: 1. A completed graduate application for admission; 2. Official transcripts from all previously attended colleges and universities. Transcripts from any international institutions must be evaluated through a NACES approved agency, such as World Education Services, Inc. or an equivalent agency; 3. A resume outlining work experience. 4. Three letters of recommendation (forms provided). 5. A statement of purpose detailing why the student wants to pursue the MSA, and how this will help them achieve their professional goals.",Not Required,,True,False,False,False,False,False,False,False,False,False,False,False,False,False,False,False,,,,College of Aviation,$782 per credit hour (Worldwide/Online Campus),,,,,,Uncrewed and Autonomous Systems,"The Master of Science in Aeronautics (MSA) is a multi-disciplinary program that combines a core of aviation and aerospace courses with a choice of specialization options, enabling you to tailor a degree program that elevates your career. The MSA program is an online program that offers both convenience and quality and has been ranked as one of the best online graduate programs for the past seven years by U.S. News & World Report. Build on your aviation/aerospace foundation as you work toward a career in management with a degree that strategically positions you for growth. The program is ideal for professionals already in an aviation/aerospace career and for those who wish to enter the field. As an MSA graduate, you will have the skills necessary to succeed as a leader in today’s demanding aviation/aerospace industry. The Uncrewed and Autonomous Systems specialization focuses on the operational and safety aspects of uncrewed and autonomous systems, including design, development, policy, and procedures. Explore topics related to uncrewed and autonomous systems, such as command and control, human factors, data links, and payloads.",,https://erau.edu/degrees/master/aeronautics,,,782,FALSE,True,2.0,4.0,2.5,,,,,,,,,,,,,,,,,,False,False,,,105.0,112.0,,,6.0,,,,,79.0,,,,,,,,,,,,,"Merit-based, Need-based",FALSE,,,FALSE,FALSE,,
,Master of Science in Aeronautics with Specialization in Space Operations,,,,,Graduate,Fall 2026,,,,Required,Required,Not Required,Required,"Applicants for the Master of Science in Aeronautics program are required to have a bachelor’s degree from an accredited degree-granting institution with a cumulative grade point average (CGPA) of 2.5 or higher on a 4.0 scale. Applicants who already possess a master’s degree are required to have a 3.0 CGPA or higher at the graduate level. Applicants with an undergraduate CGPA of less than 2.5, or those with a graduate GPA of less than 3.0, must submit official Graduate Record Exam (GRE) scores of 150 or higher on the verbal section and 150 or higher on the quantitative section. Alternatively, applicants may submit official scores from the Graduate Management Admissions Test (GMAT) of 500 or higher. In addition to the documents required for admission to the university, applicants for the Master of Science in Aeronautics program must also submit a statement of purpose, and a resume. Letters of recommendation are not required, but applicants are welcome to submit them.",,,False,False,False,False,False,False,False,False,False,False,False,False,False,False,False,False,,,,College of Aviation,"$33,048/Year (based on 18 credits)",,,,,,Space Operations,"The Master of Science in Aeronautics (MSA) has a justly-earned reputation as a broad, technically-oriented professional degree program that has consistently attracted people already established, or seeking to establish, a career in aviation or aerospace. The degree prepares graduates for high-level, leadership positions in government and industry.

The MSA degree is a 30-credit-hour graduate program, offered fully online and at many of our Worldwide Campus locations, that students typically complete in two years. Students are required to take five core courses that cover core aspects of aeronautics, and then select five additional courses from one of several specializations.",,https://erau.edu/degrees,,,"$1,836 per credit hour",FALSE,True,,4.0,2.5,,,,,,,,,,,,,,,,,,False,False,,,105.0,,,,6.0,,,,,79.0,,,,,,,,,,,"$1,000 - $3,000",,"Merit-based, Graduate Assistantships",FALSE,,,FALSE,FALSE,,
,Master of Science in Aeronautics with Specialization in Aviation Safety,,,,,Graduate,Fall 2026,,,,Required,Required,Optional,Required,"To be considered for admission to the Master of Science in Aeronautics program, prospective students should hold a baccalaureate degree from an accredited degree-granting institution. In addition to a completed application package, which should include all of the items listed below, applicants should have a cumulative grade point average (CGPA) of 2.5 or higher on a 4.0 scale. Required documents include: a completed application, official transcripts from all attended academic institutions, a résumé or curriculum vitae (CV), a 250-500 word statement of purpose addressing your career goals, and two letters of recommendation. Graduate Record Exam (GRE) or Graduate Management Admission Test (GMAT) scores are not required.",Not Required,,True,False,False,False,False,False,False,False,False,False,False,False,False,False,False,False,,,,College of Aviation,"$32,674/Year",,,,,,Aviation Safety,"The Master of Science in Aeronautics (MSA) degree is a broad-based, flexible program designed for the aviation and aerospace professional. The MSA enhances your knowledge and pursuit of opportunity within the industry, covering topics from airport operations to aircraft design and beyond. In this program, students will gain an advanced understanding of aeronautics and the skills required to be a leader in the aviation industry. Our Aviation Safety specialization provides students with the technical skills required in the areas of accident investigation, safety management and human factors in aviation.",,https://erau.edu/degrees,,,"$1,750 per credit hour",FALSE,True,0.0,4.0,2.5,,,,,,,,,,,,,,,,,,False,False,,,105.0,,,,6.0,,,,,79.0,,,,,,,,,,,"$1,500",,"Merit-based, Alumni-based",FALSE,,,FALSE,FALSE,,
,Master of Science in Aeronautics with Specialization in Human Factors,,,,,Graduate,Fall 2026,,,,,,Optional,Required,,,,False,False,False,False,False,False,False,False,False,False,False,False,False,False,False,False,,,,College of Aviation,,,,,,,Human Factors,"The MSA Human Factors specialization is a multidisciplinary program that applies knowledge of human performance, limitations, and capabilities to the design of systems. The curriculum offers a broad education in the human factors discipline focusing on the human component in the design, development and operation of complex human-machine systems. The program provides graduates with the knowledge and skills necessary to be successful human factors professionals. Graduates are prepared for doctoral level studies in human factors or for a career as a human factors practitioner in government or industry. Program graduates will be qualified for positions in the military, civil and general aviation sectors of the aviation industry as well as other areas such as medical, automotive and nuclear fields.",,https://commons.erau.edu/cgi/viewcontent.cgi?article=1011&context=db-sgs-newletter,,,1836,FALSE,True,2.0,4.0,,,,,,,,,,,,,,,,,,,False,False,,,105.0,112.0,,,6.0,,,53.0,,79.0,,,,,,,,,,,"Up to $5,000 per year",10%,"Merit-based, Need-based, Affiliation-based",FALSE,,,FALSE,FALSE,,
,Master of Science in Aeronautics with Specialization in Aviation Maintenance,,,,,Graduate,Fall 2026,,,,Required,Required,Not Required,Required,"For admission to the Master of Science in Aeronautics program, students must have a bachelor’s degree with a minimum GPA of 2.5 from an accredited degree-granting institution. Applicants who do not meet this minimum GPA requirement can be considered on an individual basis if they show evidence of potential for success in a graduate program of study. Graduate Record Exam (GRE) or Graduate Management Admissions Test (GMAT) test scores are not required for admission to this program. Prerequisites: Completion of a bachelor's degree. Students are expected to have at least a fundamental understanding of aerodynamics, aircraft performance, propulsion, and structures from their undergraduate program. Students who have not met this prerequisite may be required to take MSA 505.",Not Required,,True,False,False,False,False,False,False,False,False,False,False,False,False,False,False,False,,,,College of Aeronautics,14094,,,,,,Aviation Maintenance,"A leader in aviation education, Embry-Riddle's Master of Science in Aeronautics offers an opportunity for students to not only obtain an advanced, competitive edge in the field, but also to choose a specialization that is tailored to their unique interests and career goals. Students in the Aeronautics master's degree program learn in a dynamic, high-tech environment from faculty who are experts in their fields. Embry-Riddle's alumni network and industry partnerships are a valuable resource for students to leverage when seeking mentorship and career advancement opportunities. The Master of Science in Aeronautics is a broad, flexible program that provides students with a solid technical foundation in aeronautics and the ability to customize their curriculum in one of our diverse areas of specialization.",,https://erau.edu/degrees/master/aeronautics,,,$748 per credit hour,FALSE,True,,4.0,2.5,,,,,,,,,,,,,,,,,,False,False,,,105.0,112.0,,,6.0,,,53.0,,79.0,,,,,,,,,,,"Up to $4,800",,"New student, Returning student, Affiliation-based",FALSE,,,FALSE,FALSE,,
,Master of Science in Aeronautics with Specialization in Aviation Cybersecurity,,,,,Graduate,Fall 2026,,,,Required,Required,Not Required,Required,"Admission to the Master of Science in Aeronautics (MSA) program requires a bachelor's degree from an accredited degree-granting institution. A cumulative grade point average (CGPA) of 2.5 or higher on a 4.0 scale is required for full admission into the MSA program. Applicants who have a CGPA of less than 2.5 may be considered for provisional admission. In addition to the documents required for admission to the university, applicants should also submit: A current resume; A Statement of Objectives which will serve as the applicant's writing sample; Three letters of recommendation (optional for students with a 3.0 CGPA or higher); Official GRE scores are not required for admission to the Master of Science in Aeronautics program.",Required,,True,False,False,False,False,False,False,False,False,False,False,False,False,False,False,False,,,,College of Aviation,"Total Program Tuition: $54,060 (Daytona Beach/Prescott) or $24,600 (Worldwide)",,,,,,Aviation Cybersecurity,"The Master of Science in Aeronautics (MSA) degree is a broad, flexible program that allows you to customize your coursework in an area of specialization. With the MSA, you can combine your existing technical expertise with an advanced aeronautics curriculum to prepare for an aviation/aerospace career in fields such as airline management, aviation safety, education, or airport management. The MSA curriculum is built upon a required core of 3 courses: Air Transportation, Aircraft and Spacecraft Development, and Aeronautical Research. These courses prepare students to investigate and solve problems currently facing the aviation and aerospace industries. MSA students then work with their advisors to customize a curriculum that matches their interests and career goals by choosing from a wide variety of electives and an area of specialization.",,https://erau.edu/degrees,,,"$1,802 per credit hour (Daytona Beach/Prescott) or $820 per credit hour (Worldwide)",FALSE,False,,4.0,2.5,,,,,,,,,,,,,,,,,,False,False,,,105.0,112.0,,,6.0,,,53.0,,79.0,,,,,,,,,,,,,Merit-based,FALSE,,,FALSE,FALSE,,
,Master of Science in Aerospace Business Analytics,,,,,Graduate,Fall 2026,,,,,,Optional,Required,,,,True,True,False,False,False,False,False,False,False,False,False,False,False,False,False,False,,,,College of Business,"$22,860 for the entire program (30 credits * $762/credit)",,,,,,,"The Master of Science in Aerospace Business Analytics degree from Embry-Riddle provides the analytical skills and business acumen necessary to expertly analyze and communicate critical business data to key decision-makers.

Students will develop their quantitative and analytical skills by blending business classes in areas such as finance, economics and statistics with aviation-related courses in subjects such as air transportation management and airline economics.

Embry-Riddle’s unique program emphasizes application over theory by combining the study of aerospace business with data analytics. Students will learn how to approach, analyze and communicate information in order to develop better business practices and results.

Available at Embry-Riddle’s Daytona Beach Campus, this degree is ideal for those who want to use their data and analytical skills to work in the aerospace and aviation sectors. The curriculum is focused on producing expert analysts who possess the creative thinking and problem-solving skills needed to succeed in business.",,https://erau.edu/degrees,The Master of Science in Aerospace Business Analytics is accredited by the Association of Collegiate Business Schools and Programs (ACBSP).,,$762 per credit hour,FALSE,False,,4.0,2.5,,,,,,,,,,,,,,,,,,False,False,,,105.0,112.0,,,6.0,,,53.0,,79.0,,,,,,,,,,,"$1,000 - $1,500",,"Merit-based, Need-based",FALSE,,,FALSE,FALSE,,
,Master of Science in Aerospace Engineering,,,,,Graduate,Fall 2026,,,,Required,Required,Not Required,Required,"An essay or statement of purpose (approximately 1,000 words) describing your professional goals and aspirations.
A professional résumé or curriculum vitae (CV).
Official transcripts from all previously attended colleges and universities.
Letters of Recommendation (three are recommended).
Official Graduate Record Exam (GRE) test scores are recommended for all applicants and required for those seeking a graduate assistantship. The GRE institution code is 5190. GRE scores are optional for graduates of ERAU.
For the MSAE program, quantitative reasoning score of 155 or higher and an analytical writing score of 4.0 or higher are preferred.
The GMAT may be accepted in lieu of the GRE.",Not Required,,False,True,False,False,False,False,False,True,False,False,False,False,True,True,False,False,,,,College of Engineering,"$33,624/Year (based on 18 credits)",,,,,,"Aerodynamics and Propulsion, Structural Mechanics and Materials, Guidance, Navigation, and Control","The Master of Science in Aerospace Engineering program at Embry-Riddle prepares graduates for success in the field of aerospace engineering. The curriculum provides an enhanced understanding and expertise in the disciplines of Aerodynamics & Propulsion, Dynamics & Control, and Structures & Materials. Graduates are ready for careers in design, development, and testing of aerospace vehicles and systems, as well as for doctoral study. The M.S.A.E. program is offered at both the Daytona Beach and Prescott campuses. While the curriculum is identical, each campus offers unique research opportunities and faculty expertise.",,https://erau.edu/degrees,,,1868,FALSE,True,,4.0,3.0,,,,,,,,,,,,,,,,,,False,False,,,,,,,6.0,,,,,79.0,,,,,,,,,,,"Graduate assistantships offer tuition waivers and stipends; grants up to $1,500/year are available.",,"Assistantships, Grants",FALSE,,,FALSE,FALSE,,
,"Master of Science in Aerospace Engineering with Concentration in Aerodynamics, Propulsion, Computational Aero and Fluid Dynamics, Transition and Turbulence, Aeroacoustics, Heat Transfer, and Combustion",,,,,Graduate,Fall 2026,,,,Optional,Optional,Optional,Required,"In addition to university graduate admission requirements, applicants must have a bachelor’s degree in aerospace engineering, mechanical engineering, or a closely related field from an accredited institution. A cumulative grade point average (CGPA) of 3.0 or higher is required. Applicants with a CGPA below 3.0 may be considered for admission on a case-by-case basis. The Graduate Record Examination (GRE) is not required for admission. Students with degrees in other engineering disciplines, physics, or mathematics may be required to complete prerequisite courses before being fully admitted to the program.",,,True,True,False,False,False,False,False,False,False,False,False,False,False,False,False,False,,,,College of Engineering,"$32,580/Year",,,,,,,,,https://pe.gatech.edu/degrees/aerospace-engineering,,,1810,FALSE,True,,4.0,3.0,,,,,,,,,,,,,,,,,,False,False,,,105.0,112.0,,,6.0,,,,,79.0,,,,,,,,,,,,,"Merit-based, Assistantships",FALSE,,,FALSE,FALSE,,
,Master of Science in Aerospace Engineering with Concentration in Dynamics and Control,,,,,Graduate,Fall 2026,,,,,,Optional,Required,,,,True,True,False,False,False,False,False,False,False,False,False,False,False,False,False,False,,,,College of Engineering,"$32,436/Year",,,,,,,,,https://www.csulb.edu/college-of-engineering/master-of-science-aerospace-engineering,,,1802,FALSE,False,,4.0,3.0,,,,,,,,,,,,,,,,,,False,False,,,105.0,112.0,,,6.0,,,,,79.0,,,,,,,,,,,"$1,500 - $6,000 per year",,"Merit-based, Need-based, Assistantships, Fellowships",FALSE,,,FALSE,FALSE,,
