Concentration name,description,program website url,Accreditation status,Program name,Program Page url,Level
,"The MS in Accounting Data Analytics and Technology program provides a unique blend of accounting, data analytics, and technology to meet the market needs for accountants and auditors with advanced data analytics skills. The accounting profession is in the midst of a technological disruption. Accounting professionals are expected to go beyond the debits and credits and become tech-savvy professionals. They should not only be skilled in accounting and auditing, but they also must have skills in data analytics and information systems that allow them to make informed decisions. This new program will provide a unique blend of accounting, data analytics, and technology to meet the new market needs for accountants and auditors with data analytics skills. This program is a STEM-designated program and is registered with the New York State Education Department for 150-credit hour-licensure.",https://catalog.pace.edu/graduate/lubin-school-business/accounting/accounting-data-analytics-technology-ms/,"The Lubin School of Business is dually accredited in business and accounting by the Association to Advance Collegiate Schools of Business (AACSB) International, an elite distinction shared by fewer than 2% of business schools worldwide.",Master of Science in Accounting Data Analytics and Technology,https://catalog.pace.edu/graduate/programs-a-z/,
"Public Accounting, CPA Prep","The Master of Business Administration in Public Accounting prepares students for entry and career advancement in the field of public accountancy by providing a course of study that satisfies the educational requirements for CPA licensure in New York State. While it is geared to the CPA candidate who lacks an undergraduate accounting degree, the program also provides a broader business perspective necessary for advancement to the highest levels of management. The Lubin School of Business is dually accredited in both business and accounting by the Association to Advance Collegiate Schools of Business (AACSB) International, an elite distinction shared by few other business schools in the world.",https://catalog.pace.edu/graduate/lubin-school-business/accounting/accounting-public-accounting-cpa-prep-mba/,"The Lubin School of Business is dually accredited in both business and accounting by the Association to Advance Collegiate Schools of Business (AACSB) International, an elite distinction shared by few other business schools in the world.","Master of Business Administration in Accounting, Public Accounting, CPA Prep",https://catalog.pace.edu/graduate/programs-a-z/,
"Public Accounting, CPA Prep","The Lubin MS in Accounting program will provide you with the critical knowledge of accounting principles and business applications to prepare you for a successful career. Our program is designed to create a path for you to become a certified public accountant (CPA). Students who complete the MS in Accounting program will satisfy the 150-credit-hour New York State requirement for CPA licensure and gain the analytical and technical skills that today's top firms and corporations are seeking. As an added benefit, we offer a CPA review course at a significantly reduced price for our graduate accounting students. We offer the accounting program in both New York City and Westchester.",https://catalog.pace.edu/graduate/lubin-school-business/accounting/accounting-public-accounting-cpa-prep-ms/,Pace University's Lubin School of Business is accredited for both business and accounting by AACSB International-The Association to Advance Collegiate Schools of Business. This elite distinction is held by fewer than 2% of business schools worldwide.,"Master of Science in Accounting, Public Accounting, CPA Prep",https://catalog.pace.edu/graduate/programs-a-z/,Master of Science
,"The Master of Science in Applied Artificial Intelligence (MS in AAI) program focuses on giving students a practical understanding of AI technologies and their applications in a variety of industries. Unlike traditional AI master’s programs that emphasize research and theory, this degree focuses on the practical application of AI. The curriculum covers a wide range of topics, including AI algorithms, natural language processing, deep learning, computer vision, and the development and management of AI projects. The program provides students with real-world problems and data sets, so that they can apply what they learn in class to real-world situations, preparing them for the challenges they will face in their careers. Students will gain the skills necessary to develop AI applications from start to finish, from initial design and data gathering to final deployment and maintenance. Our graduates will be well-prepared to take on positions as AI application developers, AI solution architects, AI project managers, and machine learning engineers, and to drive innovation and growth in their respective industries.",https://catalog.pace.edu/graduate/seidenberg-school-computer-science-information-systems/computer-science/applied-artificial-intelligence-ms/,,Master of Science in Applied AI,https://catalog.pace.edu/graduate/programs-a-z/,
Arts and Entertainment Management,"The Lubin MBA program is designed for business professionals and recent graduates who want to make a difference in their organizations and their communities. We combine the theory, application, and experience students need to become leaders who can create opportunities in a dynamic global business environment. Students develop analytical, practical, and interpersonal skills in a curriculum that gives them a solid foundation in all functional areas of business, as well as the flexibility to specialize in their areas of interest. The program prepares students to become leaders and provides a clear pathway to success and professional growth.

The Arts and Entertainment Management concentration focuses on the business aspects of producing and managing artists, artistic organizations, and events. Students gain comprehensive business expertise with a special focus on businesses that produce and manage artistic events, organizations, and artists in the non-profit and for-profit sectors.",https://catalog.pace.edu/graduate/lubin/business-administration-mba/,The Lubin School of Business at Pace University is among the less than 2% of business schools worldwide that are dual accredited by AACSB International—the Association to Advance Collegiate Schools of Business—in both business and accounting.,Master of Business Administration in Arts and Entertainment Management,https://catalog.pace.edu/graduate/programs-a-z/,MBA
,"The Master of Science in Arts and Entertainment Management is a 36-credit hour graduate degree that combines business and management theories with industry expertise to prepare students for leadership careers in creative industries. Arts and entertainment organizations are unique cultural enterprises. They face a range of challenges in their efforts to be artistically innovative and financially stable, and to provide stimulating work environments. This program provides students with the critical skills and professional experience needed to meet these challenges.",https://catalog.pace.edu/graduate/dyson-college-arts-sciences/media-communications-visual-arts/arts-entertainment-management-ms/,,Master of Science in Arts and Entertainment Management,https://catalog.pace.edu/graduate/programs-a-z/,MS
,"The Master of Science in Artificial Intelligence is a 30-credit program that provides students with a comprehensive understanding of AI theory and technologies. Students will learn how to design and build AI systems, apply AI techniques to solve real-world problems, and evaluate the ethical and social implications of AI. The program will prepare students for careers in the rapidly growing field of AI, in roles such as AI researcher, AI engineer, machine learning engineer, and data scientist. The program is offered fully online and asynchronously so students can advance their careers from anywhere in the world.

Program Learning Outcomes
Upon completion of the program, students will be able to:
- Demonstrate knowledge of AI and machine learning techniques and their applications.
- Design and develop AI systems using a variety of tools and platforms.
- Analyze and interpret data using statistical and machine learning methods.
- Apply ethical principles and professional responsibilities in the development and deployment of AI systems.
- Communicate technical concepts and results to both technical and non-technical audiences.",https://catalog.pace.edu/graduate/seidenberg-school-computer-science-information-systems/computer-science/artificial-intelligence-ms/,,Master of Science in Artificial Intelligence,https://catalog.pace.edu/graduate/programs-a-z/,
,"Our Master of Science in Biochemistry and Molecular Biology degree program offers you the laboratory experience and the academic background for a successful career in a wide variety of settings, including biotechnology, pharmaceutical, academic, or government laboratories. The program’s mission is to provide you with a high-quality education in the current theories and techniques of biochemistry and molecular biology in a diverse and nurturing learning environment that prepares students for employment or advanced degree programs.",https://www.pace.edu/program/biochemistry-and-molecular-biology-ms,,Master of Science in Biochemistry and Molecular Biology,https://www.pace.edu/program/biochemistry-and-molecular-biology-ms,Master of Science
,"Earn your Juris Doctor (JD) and a Master of Business Administration (MBA) in our highly-regarded joint-degree program. You’ll be uniquely prepared to solve complex challenges at the intersection of law and business, giving you a competitive edge in a wide variety of legal and business fields. Pace University is the only law school in the New York metropolitan area to offer a 4-year joint JD/MBA degree in business. This highly competitive program is a partnership between the Elisabeth Haub School of Law and the Lubin School of Business, both highly respected and nationally-ranked schools. You’ll become a part of our extensive alumni network of more than 8,000 in law and 30,000 in business, many of whom have reached the pinnacle of success in their fields. Benefit from our prime location in the business and legal hub of Westchester County, as well as our proximity to New York City, and access countless opportunities to build the skills you need for a career at the nexus of business and law.",https://www.pace.edu/program/juris-doctor-master-business-administration-jd-mba,The Elisabeth Haub School of Law is approved by the Council of the Section of Legal Education and Admissions to the Bar of the American Bar Association (ABA). The Lubin School of Business is dually accredited in business and accounting by the Association to Advance Collegiate Schools of Business (AACSB) International.,Master of Business Administration/Juris Doctor in Business Administration,https://prelaw.wisc.edu/wordpress/wp-content/uploads/2015/04/Dual-JD-Programs1.xlsx,
,"The MBA in Business Analytics program provides students with the skills and knowledge to analyze large data sets to make effective business decisions. Students gain a comprehensive understanding of business functional areas and quantitative skills and expertise in various analytical tools. The program is an intensive, 12-18-month program for students with strong quantitative backgrounds. The 39-credit MBA in Business Analytics curriculum provides a solid understanding of business fundamentals along with specialized expertise in business analytics. Our graduates are highly sought after by firms in finance, marketing, and operations. The MBA in Business Analytics program has STEM designation.",https://catalog.pace.edu/graduate/lubin/business-analytics-mba/,The Lubin School of Business is among the less than three percent of business schools worldwide with dual accreditation from AACSB International—the Association to Advance Collegiate Schools of Business—in both business and accounting.,Master of Business Administration in Business Analytics,https://catalog.pace.edu/graduate/programs-a-z/,
Business,"The Master of Business Administration (MBA) program at the Lubin School of Business is an exciting, contemporary, and professional curriculum, combining comprehensive business education with specialized concentrations. The MBA curriculum integrates a global perspective, social responsibility, ethical decision-making, and technology, providing a strong foundation for a variety of roles within the for-profit, non-profit, and public sectors. The curriculum is flexible, offering in-person and online options, and provides in-depth exploration of eight specialized areas of study: accounting, corporate finance, information systems, investment management, marketing management, strategy and international business, talent management, and business (a general track for non-business undergraduates). By utilizing experiential learning techniques such as consulting projects, case studies, field trips, guest speakers, and research projects, Lubin faculty combine theory and practice to enrich the graduate learning experience.",https://catalog.pace.edu/graduate/lubin-school-business/management-management-science/business-administration-mba/,"The Lubin School of Business at Pace University is accredited by AACSB International – The Association to Advance Collegiate Schools of Business. AACSB is the premier accrediting organization for business schools in the world. Lubin is dually accredited in both business and accounting, an elite distinction held by fewer than 2% of business schools worldwide.","Master of Business Administration in Business, General",https://catalog.pace.edu/graduate/programs-a-z/,
Health Care Emphasis,"The Doctor of Philosophy (PhD) program in Clinical Psychology (Health Care Emphasis) provides students with state-of-the-art training in the science and practice of clinical psychology. This program is a natural outgrowth of the department’s commitment to excellent scientist-practitioner training and is a complement to its well-established PsyD program in School-Clinical Child Psychology. The PhD program offers in-depth training in clinical assessment, diagnosis, and psychotherapy. This training is grounded in an understanding and appreciation of the scientific foundations of psychology. Coursework covers psychological theory, research, and practice in areas such as psychopathology, assessment, psychotherapy, health psychology, neuropsychology, research design, and statistics. Through specialized coursework and practica, students will be prepared to work with individuals with mental disorders in medical and other health care settings. The curriculum satisfies the educational requirements for professional psychology licensure in New York and other states.",https://catalog.pace.edu/graduate/schools/dyson-college-arts-sciences/dyson-graduate-programs-curriculum/doctoral-programs/,The PhD in Clinical Psychology (Health Care Emphasis) program is accredited by the Commission on Accreditation of the American Psychological Association (APA).,"Doctor of Philosophy in Clinical Psychology, Health Care Emphasis",https://catalog.pace.edu/graduate/schools/dyson-college-arts-sciences/dyson-graduate-programs-curriculum/doctoral-programs/,
,"The Master of Arts in Communications and Digital Media program provides students with the opportunity to acquire sophisticated knowledge about human communication and the skills necessary to succeed in a wide array of communication-related professions in the digital age. This program combines courses in the social sciences and humanities, creating an optimal learning experience for students in an intellectually challenging and professionally relevant curriculum. Our program offers the flexibility of a traditional Master’s program that can be completed entirely online, in-person, or a combination of both. Graduates of this program will be equipped for a broad range of professional positions in private or public sector organizations, as well as for further graduate study leading to a PhD.",https://catalog.pace.edu/graduate/dyson-college-arts-sciences/media-communications-visual-arts/communications-digital-media-ma/,,Master of Arts in Communications and Digital Media,https://catalog.pace.edu/graduate/programs-a-z/,MA
"['Advanced Computer Science', 'Artificial Intelligence', 'Cybersecurity', 'Data Science', 'Software Development and Engineering']","The Master of Science in Computer Science is a 30-credit program that provides students with high-quality education to advance their professional careers in the field of computer science. Students in this program will have the opportunity to take a wide range of computer science courses from core areas as well as special topics courses representing the latest developments in computer science. Students in this program will acquire knowledge and skills necessary to advance their career in areas such as software engineering, data science, mobile app development, artificial intelligence, cyber security, and other emerging computer science fields. All students must complete the 30-credit program with a minimum overall GPA of 3.0. The program curriculum is comprised of 10 courses that include three core required courses, three elective courses, and a four-course concentration option in a specific subject area.",https://catalog.pace.edu/graduate/seidenberg-school-computer-science-information-systems/computer-science/computer-science-ms/,,Master of Science in Computer Science,https://catalog.pace.edu/graduate/programs-a-z/,
,"The Doctor of Philosophy (PhD) in Computer Science is a research-based degree program that provides students with the opportunity to work at the forefront of computer science and interdisciplinary applications. The program will equip students with the skills needed to pursue research careers in academia or industry. Students in the program develop strong research skills through close mentorship by faculty members, in-depth study of a research area, and active participation in research activities. The Seidenberg School faculty members are active in a wide range of computer science research areas including, artificial intelligence, cybersecurity, human-computer interaction, mobile computing, networking, and security. Students have the opportunity to participate in ongoing research projects, present their work at conferences, and publish their results in journals. The program is committed to providing a supportive and intellectually stimulating environment for students to pursue their research interests. Students work on cutting-edge research in our research labs including the Cybersecurity Lab, the Robotics Lab, the Networking and Data Science Lab, and others.",https://catalog.pace.edu/graduate/schools/seidenberg-school-computer-science-information-systems/graduate-degree-programs/doctoral-programs/computer-science-phd/computer-science-phd.pdf,,Doctor of Philosophy in Computer Science,https://catalog.pace.edu/graduate/schools/seidenberg-school-computer-science-information-systems/graduate-degree-programs/doctoral-programs/computer-science-phd/computer-science-phd.pdf,
,"The Master of Science in Cybersecurity program provides students with the advanced knowledge and skills in the various technical and managerial aspects of cybersecurity required to be successful in this field. Students learn offensive and defensive cybersecurity, including how to identify and mitigate security vulnerabilities; how to design, implement, and maintain secure systems; and how to manage security policies and procedures. The program prepares students for leadership positions in the cybersecurity field in both the public and private sectors. With a focus on both the theoretical and practical aspects of cybersecurity, students graduate with the skills needed to tackle the most pressing security challenges facing organizations today.",https://catalog.pace.edu/graduate/seidenberg/computer-science-information-systems/cybersecurity-ms/,Pace University has been designated by the National Security Agency and the Department of Homeland Security as a National Center of Academic Excellence in Cyber Defense Education (CAE-CDE) since 2004.,Master of Science in Cybersecurity,https://catalog.pace.edu/graduate/programs-a-z/,Master of Science
,"The Master of Science in Data Science program at Pace University will prepare you for a career in the rapidly growing field of data science. You’ll gain a deep understanding of subjects like machine learning, big data analytics, and data visualization. The Seidenberg School’s location in the heart of New York City and its close ties with major companies and organizations will provide you with a multitude of internship and employment opportunities to help you build a solid foundation for your career. The MS in Data Science is a STEM-designated 30-credit program. Data science lies at the intersection of computer science and statistics. This program will offer a balanced and comprehensive curriculum on both sides. Students in this program will learn the latest technologies in big data analytics, machine learning, data mining, and data visualization. Students will have opportunities to work on big data projects using real world data sets in our Big Data Lab. The required capstone project will provide students with opportunities to apply what they have learned to solve real world problems.",https://www.pace.edu/program/data-science-ms,,Master of Science in Data Science,https://www.pace.edu/program/data-science-ms,Master of Science
,"As the field of homeland security continues to evolve, our society requires educated leaders and managers to protect the American people where they live and work. The fully online Master of Arts in Homeland Security from Pace University provides a unique opportunity for students to become leaders in the intelligence, law enforcement, and emergency management communities. We prepare you to understand and manage complex issues related to security policies, directives, and legal issues, all while helping you develop advanced skills in intelligence, counter-terrorism, consequence management, and inter-agency cooperation. The online homeland security master’s program is a 36-credit degree program taught by faculty who have served in leadership positions in the FBI, U.S. Secret Service, and the Department of Homeland Security, offering a unique opportunity to learn from and network with professionals actively working in the field.",https://online.pace.edu/programs/masters-homeland-security/,,Master of Arts in Homeland Security,https://online.pace.edu/articles/online-learning/top-10-online-programs-military-service-members-veterans/,Master of Arts
Literacy Specialist,"The School of Education offers a Master of Science in Education (MSED) in Literacy Specialist that leads to New York State certification for teachers who already possess initial certification in a related area. The program has two tracks: Birth-Grade 6 and Grades 5-12. Successful completion of the program and passing of the New York State Content Specialty Test in Literacy will lead to professional certification in teaching for candidates who have three years of teaching experience, including one year of literacy teaching experience with a mentor.
Program Goals/Outcomes
Upon completion of the program, students will be able to:
1. Demonstrate knowledge of the foundations of literacy.
2. Use a wide range of instructional practices, approaches, methods, and curriculum materials to support reading and writing instruction.
3. Use a variety of assessment tools and practices to plan and evaluate effective literacy instruction.
4. Create a literate environment that fosters reading and writing by integrating foundational knowledge, instructional practices, and curricular materials.
5. View literacy as a developmental process and implement instruction appropriate to the needs of the emerging, developing, and fluent reader.",https://catalog.pace.edu/graduate/schools/school-education/graduate-degree-programs/masters-science-education-msed/literacy-specialist-msed/,Pace University’s School of Education is nationally accredited by the Association for Advancing Quality in Educator Preparation (AAQEP).,"Master of Science in Education, Literacy Specialist",https://catalog.pace.edu/graduate/schools/school-education/graduate-degree-programs/masters-science-education-msed/literacy-specialist-msed/literacy-specialist-msed_text.pdf,
,,,,Master of Science in Physician Assistant Studies Completion Program,"https://www.google.com/search?q=time+in+New+York,+NY,+US",
