Concentration name,description,program website url,Accreditation status,Program name,Program Page url,Level
,"The Psychiatric Mental Health Nurse Practitioner (PMHNP) Program is a 42-credit Master of Science program for baccalaureate prepared registered nurses. Students are prepared to provide primary psychiatric and mental health care across the lifespan. The program builds on the undergraduate nursing foundation and provides advanced didactic and clinical practice in psychiatric mental health. Graduates are eligible to take the American Nurses Credentialing Center’s (ANCC) national certification examination for Psychiatric Mental Health Nurse Practitioners (Across the Lifespan). The PMHNP program is offered in an online format. Students come to campus at the beginning of each clinical course for an on-campus residency which will consist of lab, simulation, and other learning experiences.",https://catalog.pace.edu/graduate/college-health-professions/lienhard-school-nursing/psychiatric-mental-health-nurse-practitioner-ms/,The master's degree program in nursing...at Pace University are accredited by the Commission on Collegiate Nursing Education (http://www.ccneaccreditation.org).,Master of Science in Psychiatric Mental Health Nurse Practitioner Program,https://catalog.pace.edu/graduate/programs-a-z/,Master of Science
"Government Management, Healthcare Administration, Nonprofit Management","Pace University's Master of Public Administration (MPA) program has been educating and training leaders in public service for over 30 years. Our MPA program prepares students to become leaders who can address society’s most difficult managerial, economic, and social problems. We are looking for students who are committed to a public service career in a variety of fields including government, healthcare, and nonprofit management. The Pace MPA program gives students the necessary skills to effectively manage in this ever-changing environment, with an opportunity for specialization within the field. Students learn to effectively lead and manage organizations, develop and implement policy, and think strategically to anticipate and respond to the myriad challenges facing government and nonprofit organizations. Our accomplished faculty have deep subject matter expertise that they bring to the classroom from professional work as senior government officials, nonprofit executives, and public affairs consultants. Pace University’s MPA program is offered fully online and through a hybrid model that blends online and in-person classes.",https://catalog.pace.edu/graduate/dyson-college-arts-sciences/public-administration/public-administration-mpa/,"The Master of Public Administration Program is accredited by the National Association of Schools of Public Affairs and Administration (NASPAA), the recognized accrediting body of graduate public administration programs in the United States.",Master of Public Administration in Public Administration,https://catalog.pace.edu/graduate/programs-a-z/,Master
,"The Master of Public Health (MPH) program is designed to provide graduate, professional education for individuals who seek careers in the field of public health. The program is offered fully online to ensure maximum accessibility to graduate students, working professionals, career changers, and those currently working in the public health or health professions who seek to advance their careers. The curriculum is based on the traditional pillars of public health, which are biostatistics, environmental health sciences, epidemiology, health policy and management, and social and behavioral sciences. Students in the program develop knowledge and skills in these core areas and apply this knowledge to the practice of public health through elective course offerings and the completion of an applied practice experience and a culminating integrated learning experience.",https://catalog.pace.edu/graduate/college-health-professions/public-health/public-health-mph/,The Master of Public Health (MPH) program is accredited by the Council on Education for Public Health (CEPH).,Master of Public Health in Public Health,https://catalog.pace.edu/graduate/programs-a-z/,Master
,"The Master of Science in Publishing is a 36-credit-hour program that combines the study of print and digital media from books and magazines to websites, ebooks, and apps. The program is committed to offering an education that meets the needs of a rapidly changing industry by giving students a strong foundation in both print and digital publishing. In addition to a variety of courses in book and magazine publishing, the program's curriculum includes courses in financial management and business strategies, editing, intellectual property, marketing, websites, ebooks, mobile applications, design, and distribution. Students are encouraged to develop a specialty in either book publishing or magazine publishing. All classes are taught by leading executives in the publishing industry. Graduates go on to work at some of the world's most prestigious publishing houses. And, our location in the media capital of the world—New York City—gives our students the opportunity to learn from the best in the industry and make vital career connections. Publishing students have the chance to serve as staff members of the student-run literary magazine, Aphros, and to work in the publishing office, which produces a nationally distributed book each year.",https://www.pace.edu/program/publishing-ms,,Master of Science in Publishing,https://www.pace.edu/program/publishing-ms,
,"Lead the charge on the latest technologies with a Master of Science in Software Development and Engineering from Pace University’s Seidenberg School of Computer Science and Information Systems. You will develop an in-depth understanding of the concepts and principles of software development and engineering, learn about emerging technologies, and learn to apply this knowledge to real-world problems. The software development and engineering master’s program will provide a path to a career as a software engineer, software developer, enterprise software architect, or team leader through project-based learning. Throughout your coursework, you will have opportunities to engage in the design, development, and testing of complex software systems. In addition to a variety of elective courses, students in the software development and engineering master’s program have the option of pursuing a six-credit master’s thesis.",https://www.pace.edu/program/software-development-and-engineering-ms,,Master of Science in Software Development and Engineering,https://www.pace.edu/program/software-development-and-engineering-ms,Masters
,"The Advanced Certificate in Bilingual Education is for teachers who hold initial or professional certification in a content area or in teaching English to speakers of other languages (TESOL) and who wish to obtain the New York State Bilingual Education Extension. The program provides the candidate with the theoretical and practical knowledge needed to work in a variety of bilingual settings. Candidates will deepen their understanding of cultural, linguistic, and contextual diversity as they work with linguistically diverse students and their families.",https://catalog.pace.edu/graduate/school-education/teaching-learning/bilingual-education-advanced-certificate/,,Advanced Certificate in Bilingual Education,https://catalog.pace.edu/graduate/programs-a-z/,
,The Advanced Certificate in Early Childhood Extension Certification (Birth-Grade 2) program is for certified teachers who want to expand their knowledge and expertise to include the education of young children. This 12-credit certificate program is for teachers who hold an initial or professional certificate in Childhood Education (grades 1-6) and wish to obtain an extension certification to teach in early childhood settings (birth-grade 2).,https://catalog.pace.edu/graduate/schools/school-education/graduate-degree-programs/advanced-certificates/early-childhood-extension-certification/,,Advanced Certificate in Early Childhood Extension Certification (Birth-Grade 2),https://catalog.pace.edu/graduate/schools/school-education/graduate-degree-programs/advanced-certificates/early-childhood-extension-certification/,Advanced Certificate
,"The School of Education offers a 12-credit, fully online, advanced graduate certificate in Integrated Instruction for Literacy and Technology. The curriculum addresses theory, research, and evidence-based practices needed by teachers to integrate technology effectively in K-12 classrooms. Technology is emphasized as a medium for learning across the curriculum for all students.",https://catalog.pace.edu/graduate/seidenberg-school-computer-science-information-systems/school-education/integrated-instruction-literacy-technology-certificate-advanced-graduate-study/,,Certificate of Advanced Graduate Study in Integrated Instruction for Literacy and Technology,https://catalog.pace.edu/graduate/programs-a-z/,Certificate
"English, Mathematics, Social Studies, Biology, Chemistry, Earth Science, and Physics","The Advanced Certificate in Middle School Extension Certification is available for graduate candidates who hold a Masters Degree and initial certification in Childhood Education 1-6. This certificate extends the grade level for the certification area to include grades 7-9. It is offered for the following content areas: English, Mathematics, Social Studies, Biology, Chemistry, Earth Science, and Physics.",https://catalog.pace.edu/graduate/school-education/teaching-learning/middle-school-extension-certification-advanced-certificate/,"All teacher education, school counseling, and school psychology programs are accredited by the Association for Advancing Quality in Educator preparation (AAQEP).",Advanced Certificate in Middle School Extension Certification,https://catalog.pace.edu/graduate/programs-a-z/,
,"The Psychiatric Mental Health Nurse Practitioner (PMHNP) Certificate of Advanced Graduate Studies (CAGS) program is designed to prepare master’s and doctorally prepared nurses for advanced practice as a psychiatric mental health nurse practitioner (PMHNP). The CAGS is a non-degree granting program of study that is competency-based, providing core content in psychiatric mental health advanced practice nursing across the lifespan. Emphasis is on assessment and diagnosis of psychiatric disorders and co-morbid conditions; psychopharmacology, individual, group and family psychotherapy; and management of psychiatric disorders of patients across the lifespan. Students complete approximately 500 hours of supervised clinical practice. Upon completion of this program, graduates are eligible for New York State certification as a Psychiatric Nurse Practitioner and are eligible for national board certification by the American Nurses Credentialing Center (ANCC) as a Psychiatric Mental Health Nurse Practitioner.",https://catalog.pace.edu/graduate/lienhard-school-nursing/psychiatric-mental-health-nurse-practitioner-certificate/,"The baccalaureate degree program in nursing, master's degree program in nursing, and Doctor of Nursing Practice program at Pace University are accredited by the Commission on Collegiate Nursing Education, 655 K Street NW, Suite 750, Washington, DC 20001, 202-887-6791.",Psychiatric Mental Health Nurse Practitioner (PMHNP) Certificate,https://catalog.pace.edu/graduate/programs-a-z/,Certificate
,"The Secure Software and Information Engineering certificate program is intended for students who wish to specialize in the field of secure software engineering and information security and assurance. The program prepares students to understand the nature of secure software, and how to design, develop, and test such systems. Topics covered in this certificate program include secure software design, analysis, and testing, risk management, data mining for security, software security, network security, and cryptography. Students may complete this certificate program only, or apply these credits toward a Master’s degree in Computer Science, Information Systems, or Software Engineering.",https://catalog.pace.edu/graduate/schools/seidenberg-school-computer-science-information-systems/graduate-degree-programs/graduate-certificate-programs/secure-software-and-information-engineering-certificate/,,Advanced Certificate in Security and Information Assurance,https://catalog.pace.edu/graduate/schools/seidenberg-school-computer-science-information-systems/graduate-degree-programs/graduate-certificate-programs/secure-software-and-information-engineering-certificate/,Certificate
,"The Advanced Certificate in Software Development and Engineering (SDE) is designed for students who want to become a software engineer with advanced knowledge and practical skills for developing and managing large-scale software systems. This 12-credit graduate certificate offers a fast track to a software engineering career for students with an undergraduate degree in a related field and prior programming experience. The SDE program focuses on core concepts of the entire software development lifecycle, including requirements analysis, design, implementation, testing and maintenance. Students will learn the latest software engineering methodology and gain hands-on experience using modern development tools, techniques and technologies.",https://catalog.pace.edu/graduate/seidenberg-school-computer-science-information-systems/advanced-certificate-software-development-engineering/,,Advanced Certificate in Software Engineering Development,https://catalog.pace.edu/graduate/programs-a-z/,Certificate
,"The Certificate of Advanced Study (CAS) in Special Education is a 30-36 credit program that prepares candidates to work with students with disabilities from birth-grade 12. Candidates may choose from three specializations: Early Childhood (birth-grade 2), Childhood (grades 1-6), or Adolescence (grades 7-12). This advanced certificate program meets the academic requirements for initial and professional New York State certification in Teaching Students with Disabilities in the area of specialization selected.",https://catalog.pace.edu/graduate/schools/school-education/special-education-teaching-students-disabilities-all-grades-cas/,"All teacher preparation programs, and school counseling, school psychology, and school-district business leader programs are registered and approved by the New York State Education Department. The teacher preparation programs are also accredited by the Council for the Accreditation of Educator Preparation (CAEP).",Certificate of Advanced Graduate Study in Special Education: Teaching Students with Disabilities (All Grades),https://catalog.pace.edu/graduate/schools/school-education/,Certificate
,"The Certificate of Advanced Graduate Study in Teaching English as a Second Language (TESOL) is an 18-credit program for applicants who already possess a master’s degree and are certified teachers. It is designed to extend teachers’ knowledge and skills to include English language learners in K–12 settings. This program of study includes course work and field experience, leading to New York State certification in TESOL. All courses in this program have been approved by the New York State Department of Education.",https://catalog.pace.edu/graduate/schools/school-education/graduate-degree-programs/advanced-certificates/,All programs leading to licensure in the School of Education are accredited by the Association for Advancing Quality in Educator Preparation (AAQEP). All courses in this program have been approved by the New York State Department of Education.,Certificate of Advanced Graduate Study in Teaching English as a Second Language (TESOL),https://catalog.pace.edu/graduate/schools/school-education/graduate-degree-programs/advanced-certificates/,
Corporate Finance,"The Lubin MBA in Business Administration provides students with the critical skills and knowledge necessary to successfully lead and manage organizations in a dynamic global business environment. This degree includes in-depth study in key functional areas of business and a strong emphasis on developing the analytical, technical, and interpersonal skills necessary for effective decision-making and leadership. Students develop practical experience through case analyses, consulting assignments for businesses and not-for-profit organizations, and by participating in programs and centers unique to Lubin, including the Interactive and Direct Marketing (IDM) Lab, the Center for Global Business Programs, and the Center for Student Enterprise. The Lubin MBA is a 39-credit program with eight concentrations: Accounting, Corporate Finance, Information Systems, Investment Management, Marketing, Marketing Analytics, Strategy and International Business, and Talent Management.",https://catalog.pace.edu/graduate/lubin-school-business/master-business-administration/,The Lubin School of Business is accredited by the Association to Advance Collegiate Schools of Business (AACSB) International. This is the premier accrediting organization for business schools in the world. Pace University is accredited by the Middle States Commission on Higher Education.,Master of Business Administration in Corporate Finance,https://catalog.pace.edu/graduate/programs-a-z/,MBA
,"The Master of Science in Health Informatics prepares students for careers in the healthcare industry. The curriculum provides students with a solid foundation in health informatics. They take courses in data management, analytics and machine learning, security and privacy, UX and usability, mobile applications and systems, and healthcare leadership. They gain the necessary knowledge and skills in information technology and healthcare to support the needs of healthcare organizations.",https://catalog.pace.edu/graduate/seidenberg-school-computer-science-information-systems/computer-science/health-informatics-ms/,,Master of Science in Health Informatics,https://catalog.pace.edu/graduate/programs-a-z/,Master of Science
,"The Master of Science (MS) in Human-Centered Design (HCD) at Pace University is a unique interdisciplinary program that bridges the gap between art and information technology. Human-centered design places people at the forefront of the design process to create products, services, systems, and experiences that are not only useful but also usable and desirable. The HCD program provides students with practical research methods and design techniques to understand human needs, behaviors, and motivations. Students learn to conduct user research, analyze data, prototype ideas, and test designs with real users. The curriculum combines hands-on studio work with theoretical coursework, enabling students to develop a strong portfolio and a deep understanding of the principles of human-centered design. Students will learn the essentials of design thinking, user experience (UX) design, interaction design, information architecture, usability testing, and visual design. Graduates of the program will be prepared for careers as UX designers, interaction designers, product designers, user researchers, information architects, and UX strategists in a wide range of industries, including technology, healthcare, finance, and entertainment. The program is suitable for students from diverse backgrounds, including art, design, computer science, psychology, and business. No prior design or programming experience is required.",https://www.pace.edu/seidenberg/master-science-human-centered-design,,Master of Science in Human Centered Design,http://media.pace.edu/catalog/pace-university-2021-2022-graduate-catalog.pdf,Master of Science
"['Data Science', 'User Experience Design']","The Master of Science degree in Information Systems is an innovative program that blends management and technology. It is a STEM designated program. Students in the Information Systems master's program can opt for the general MS in IS degree or choose from one of two concentrations: Data Science or User Experience Design. All MS in IS students will learn to formulate and solve business problems by analyzing organizational data, designing data-driven services and products, and managing technology resources. Specifically, the MS in IS program focuses on key data and information management principles, data analytics, IT infrastructure, and data-driven decision making. The program is designed for students with diverse backgrounds, including business, liberal arts and sciences, and computer science. Our graduates are highly sought after by employers because they have a unique blend of business and technology skills. They understand how organizations work, how to identify business opportunities, and how to develop technology-enabled solutions. Information Systems graduates are prepared for careers that are in high demand in today's digital economy, such as business and systems analysts, data scientists, UX designers, technology consultants, and project managers.",https://catalog.pace.edu/graduate/schools/seidenberg-school-computer-science-information-systems/graduate-degree-programs/masters-science-programs/information-systems-ms/information-systems-ms.pdf,,Master of Science in Information Systems,https://catalog.pace.edu/graduate/schools/seidenberg-school-computer-science-information-systems/graduate-degree-programs/masters-science-programs/information-systems-ms/information-systems-ms.pdf,
,"The Master of Science in Applied Quantitative Economic Analysis and Policy is a 30-credit hour program that provides students with a strong foundation in economic and econometric theory as well as the tools of economic policy analysis. This program is STEM designated. Students will learn the tools necessary to analyze data, assess the impact of public policy, and to communicate the results of their analyses to a wide variety of audiences. The degree provides students with the advanced quantitative and applied research skills needed for careers as economic and policy analysts in the private and public sectors, and in non-profit organizations. Students gain expertise in a variety of software packages, including STATA, SAS, and R. The Master of Science in Applied Quantitative Economic Analysis and Policy degree culminates in a semester-long capstone project supervised by a full-time faculty member.",https://catalog.pace.edu/graduate/dyson-college-arts-sciences/economics/applied-quantitative-economic-analysis-policy-ms/,,Master of Science in Applied Quantitative Economic Analysis and Policy,https://catalog.pace.edu/graduate/programs-a-z/,Master of Science
Bilingual School Psychology,"The specialization in bilingual school psychology leads to the Master of Science in Education (MSEd) degree in School Psychology and eligibility for New York State certiﬁcation as a School Psychologist and the Bilingual Education Extension to the certiﬁcate. The program prepares graduates to provide a full range of school psychological services for diverse student populations. The program is committed to a multicultural perspective and seeks to recruit a diverse student body. Candidates are prepared as practitioners who can apply psychological principles to educational settings to help resolve learning and behavioral problems in children and adolescents. The program is designed to develop competencies in consultation, assessment, counseling, and research. There is special emphasis on developing multicultural competencies for working in urban schools. Students take a number of specialized courses to develop competence in working with culturally and linguistically diverse children and families and are placed in externship and internship sites with bilingual populations.",https://catalog.pace.edu/graduate/schools/dyson-college-arts-sciences/dyson-graduate-programs-curriculum/masters-science/school-psychology-specialization-bilingual-school-psychology-ms-ed/school-psychology-specialization-bilingual-school-psychology-ms-ed_text.pdf,The program is approved by the National Association of School Psychologists (NASP) and registered by the New York State Department of Education.,Master in Bilingual School Psychology,https://catalog.pace.edu/graduate/schools/dyson-college-arts-sciences/dyson-graduate-programs-curriculum/masters-science/school-psychology-specialization-bilingual-school-psychology-ms-ed/school-psychology-specialization-bilingual-school-psychology-ms-ed_text.pdf,MS Ed
,The Master of Science in Education in Childhood Education program is designed for students who have completed an undergraduate or graduate degree in a field other than education and are seeking a master’s degree and initial certification to teach in childhood settings (grades 1–6). Our program has a strong student-teaching component that provides students with numerous opportunities to work with children in a variety of school settings. Students in this program are not required to have a major in a specific content area but must have a broad liberal arts background.,http://catalog.pace.edu/graduate/school-education/teaching-learning/childhood-education-msed/,Pace University’s School of Education is accredited by The Council for the Accreditation of Educator Preparation (CAEP). This accreditation covers initial teacher preparation programs and advanced educator preparation programs. CAEP is recognized by the U.S. Department of Education and the Council for Higher Education Accreditation to accredit programs for the preparation of teachers and other professional school personnel.,Master in Childhood Education,https://catalog.pace.edu/graduate/programs-a-z/,Masters
