Program name,Program Page url
Bachelor of Science in Accounting,https://catalog.stonybrook.edu/content.php?catoid=8&navoid=483
Bachelor of Arts in Africana Studies,https://catalog.stonybrook.edu/content.php?catoid=8&navoid=483
Bachelor of Arts in Anthropology,https://www.stonybrook.edu/commcms/anthropology/undergraduate/
Bachelor of Science in Applied Mathematics & Statistics,https://catalog.stonybrook.edu/content.php?catoid=8&navoid=483
Bachelor of Arts in Art History & Criticism,https://catalog.stonybrook.edu/content.php?catoid=8&navoid=483
"Bachelor of Arts in Art, Studio",https://www.stonybrook.edu/commcms/admitted/pdfs/ars.pdf
Bachelor of Arts in Asian & Asian American Studies,https://catalog.stonybrook.edu/content.php?catoid=8&navoid=483
Bachelor of Science in Astronomy/Planetary Sciences,https://catalog.stonybrook.edu/preview_program.php?catoid=8&poid=530
Bachelor of Science in Atmospheric and Oceanic Sciences,https://www.stonybrook.edu/commcms/somas/education/undergraduate/degrees/atm
Bachelor of Science in Biochemistry,https://catalog.stonybrook.edu/content.php?catoid=8&navoid=483
Bachelor of Arts in Biology,https://catalog.stonybrook.edu/content.php?catoid=8&navoid=483
Bachelor of Science in Biology,https://catalog.stonybrook.edu/content.php?catoid=8&navoid=483
Bachelor of Engineering in Biomedical Engineering,https://catalog.stonybrook.edu/content.php?catoid=8&navoid=483
Bachelor of Science in Business Management,https://catalog.stonybrook.edu/content.php?catoid=8&navoid=483
Bachelor of Engineering in Chemical & Molecular Engineering,https://www.stonybrook.edu/commcms/matscieng/undergraduate-cme/Specializations.php
Bachelor of Arts in Chemistry,https://catalog.stonybrook.edu/content.php?catoid=8&navoid=483
Bachelor of Science in Chemistry,https://catalog.stonybrook.edu/content.php?catoid=8&navoid=483
Bachelor of Engineering in Civil Engineering,https://catalog.stonybrook.edu/content.php?catoid=8&navoid=483
Bachelor of Science in Climate Science,https://catalog.stonybrook.edu/content.php?catoid=8&navoid=483
Bachelor of Science in Clinical Laboratory Sciences,https://healthprofessions.stonybrookmedicine.edu/programs/clinical
Bachelor of Science in Coastal Environmental Studies,https://www.youtube.com/watch?v=QXxdVuYRPrg
Bachelor of Arts in Communication,https://catalog.stonybrook.edu/content.php?catoid=8&navoid=483
Bachelor of Engineering in Computer Engineering,https://www.stonybrook.edu/commcms/electrical/undergraduate/index.php
Bachelor of Science in Computer Science,https://catalog.stonybrook.edu/content.php?catoid=8&navoid=483
Bachelor of Fine Arts in Creative Writing,https://catalog.stonybrook.edu/content.php?catoid=8&navoid=483
Bachelor of Science in Data Science,https://datasciencemajor.stanford.edu/academics/undergraduate-data-science-bs-program
Bachelor of Arts in Earth & Space Sciences,https://www.stonybrook.edu/commcms/geosciences/undergraduate/ba-ess
Minor in Accounting,https://catalog.stonybrook.edu/content.php?catoid=8&navoid=483
Minor in Africana Studies,https://catalog.stonybrook.edu/content.php?catoid=8&navoid=483
Minor in Anthropology,https://catalog.stonybrook.edu/content.php?catoid=8&navoid=483
Minor in Applied Mathematics and Statistics,https://catalog.stonybrook.edu/preview_program.php?catoid=8&poid=519&returnto=485&print
Minor in Art History,https://catalog.stonybrook.edu/content.php?catoid=8&navoid=483
"Minor in Art, Studio",https://www.stonybrook.edu/ugrdbulletin/academicprograms/ars/
Minor in Asian American Studies,https://catalog.stonybrook.edu/content.php?catoid=8&navoid=485
Minor in Asian and Asian American Studies,https://www.stonybrook.edu/ugrdbulletin/academicprograms/aas/
Minor in Asian Thought,https://catalog.stonybrook.edu/content.php?catoid=8&navoid=483
Minor in Astronomy,https://catalog.stonybrook.edu/preview_program.php?catoid=8&poid=531&returnto=485
Minor in Bioengineering,https://catalog.stonybrook.edu/preview_program.php?catoid=8&poid=540&returnto=485
Minor in Biology,https://catalog.stonybrook.edu/content.php?catoid=8&navoid=483
Minor in Black Heritage Studies,https://www.stonybrook.edu/sb/bulletin/current-fall24/academicprograms/blh/degreesandrequirements.php
Minor in Chemistry,https://www.stonybrook.edu/commcms/chemistry/Education/undergraduate-program/undergradchemminor
Minor in China Studies,https://catalog.stonybrook.edu/content.php?catoid=8&navoid=483
Minor in Classics,https://catalog.stonybrook.edu/preview_program.php?catoid=8&poid=565&returnto=485
Minor in Climate Solutions,https://catalog.stonybrook.edu/content.php?catoid=8&navoid=483
Minor in Coastal Environmental Studies,https://catalog.stonybrook.edu/preview_program.php?catoid=8&poid=569&returnto=485
Minor in Communication,https://www.stonybrook.edu/commcms/journalism/undergraduate-students/minors.php
Minor in Communication and Innovation,https://catalog.stonybrook.edu/preview_program.php?catoid=8&poid=573&print
Minor in Computer Science,https://catalog.stonybrook.edu/content.php?catoid=8&navoid=483
Minor in Creative Writing,https://catalog.stonybrook.edu/content.php?catoid=8&navoid=483
Minor in Digital Arts,https://www.stonybrook.edu/sb/bulletin/current-fall24/academicprograms/dia/degreesandrequirements.php
Minor in Ecosystems and Human Impact,https://catalog.stonybrook.edu/content.php?catoid=8&navoid=483
Minor in Electrical Engineering,https://www.stonybrook.edu/ugrdbulletin/academicprograms/ese/
Minor in English,https://catalog.stonybrook.edu/content.php?catoid=8&navoid=483
"Minor in Environmental Design, Policy, and Planning",https://www.stonybrook.edu/ugrdbulletin/academicprograms/edp/
Minor in Environmental Engineering,https://catalog.stonybrook.edu/content.php?catoid=8&navoid=483
Minor in Environmental Humanities,https://catalog.stonybrook.edu/preview_program.php?catoid=8&poid=615
Minor in Environmental Studies,https://catalog.stonybrook.edu/content.php?catoid=8&navoid=483
Minor in Ethnomusicology,https://www.stonybrook.edu/sb/bulletin/current-fall24/academicprograms/eth/index.pdf
Minor in Film and Screen Studies,https://catalog.stonybrook.edu/content.php?catoid=8&navoid=483
Minor in Filmmaking,https://catalog.stonybrook.edu/content.php?catoid=8&navoid=483
Minor in Finance,https://catalog.stonybrook.edu/content.php?catoid=8&navoid=483
Minor in French,https://www.stonybrook.edu/commcms/languages-cultural-studies/programs/French_Language_and_Literature.php
Minor in Geology,https://www.stonybrook.edu/commcms/geosciences/undergraduate/index.php
Minor in Geospatial Science,https://catalog.stonybrook.edu/content.php?catoid=8&navoid=483
Minor in Globalization Studies and International Relations,https://www.stonybrook.edu/ugrdbulletin/academicprograms/gli/
"Minor in Health, Medicine, and Society",https://www.stonybrook.edu/commcms/sociology/undergraduate/
Minor in Hellenic Studies,https://catalog.stonybrook.edu/content.php?catoid=8&navoid=483
Minor in History,https://as.nyu.edu/departments/history/undergraduate/degree-options/the-minor-in-history.html
"Minor in History of Health, Science, and the Environment",https://catalog.stonybrook.edu/content.php?catoid=8&navoid=483
Minor in Industrial Engineering,https://catalog.stonybrook.edu/content.php?catoid=8&navoid=483
Minor in Information Systems,https://catalog.stonybrook.edu/content.php?catoid=8&navoid=483
Minor in Italian American Studies,https://catalog.stonybrook.edu/content.php?catoid=8&navoid=483
Minor in Italian Studies,https://catalog.unc.edu/undergraduate/programs-study/italian-minor/italian-minor.pdf
Minor in Japanese Studies,https://www.stonybrook.edu/ugrdbulletin/academicprograms/jnh/
Minor in Jazz Music,https://www.stonybrook.edu/ugrdbulletin/academicprograms/jaz/
Minor in Journalism,https://catalog.stonybrook.edu/content.php?catoid=8&navoid=483
Minor in Judaic Studies,https://stonybrook.edu/academics/majors-minors-and-programs/
Minor in Korean Studies,https://www.stonybrook.edu/sb/bulletin/current-fall24/academicprograms/kor/degreesandrequirements.php
Minor in Latin American and Caribbean Studies,https://catalog.stonybrook.edu/content.php?catoid=8&navoid=483
Minor in Linguistics,https://linguistics.stonybrook.edu/academics/Undergraduate/requirement
Minor in Manufacturing Engineering,https://www.stonybrook.edu/commcms/matscieng/all_undergrad/undergrad/_esg/Minors.php
Minor in Marine Sciences,https://www.stonybrook.edu/commcms/somas/education/undergraduate/minors.php
Minor in Mass Communication,https://catalog.stonybrook.edu/content.php?catoid=8&navoid=483
Minor in Materials Science,https://catalog.stonybrook.edu/content.php?catoid=8&navoid=483
Minor in Mathematics,https://catalog.stonybrook.edu/content.php?catoid=8&navoid=483
Minor in Mechanical Engineering,https://catalog.stonybrook.edu/content.php?catoid=8&navoid=483
Minor in Middle Eastern Studies,https://catalog.stonybrook.edu/misc/catalog_list.php?catoid=8
Minor in Music,https://catalog.stonybrook.edu/content.php?catoid=8&navoid=483
Minor in Music and Technology,https://www.reddit.com/r/SBU/comments/1h7ikds/music_technology_minor/
Minor in Music Theory,https://catalog.stonybrook.edu/content.php?catoid=8&navoid=483
Minor in Nanotechnology Studies,https://www.stonybrook.edu/commcms/nanotech/_pdf/NTS-brochure.pdf
Minor in Native American and Indigenous Studies,https://www.stonybrook.edu/ugrdbulletin/academicprograms/nai/
Minor in Optics,https://catalog.stonybrook.edu/preview_program.php?catoid=8&poid=702&returnto=485&print
Minor in Philosophy,https://academic-guide.fsu.edu/minors
Minor in Physics,https://www.stonybrook.edu/ugrdbulletin/academicprograms/phy/
Minor in Political Science,https://catalog.stonybrook.edu/content.php?catoid=8&navoid=483
Minor in Professional Writing,https://catalog.stonybrook.edu/content.php?catoid=8&navoid=483
Minor in Real Estate and Insurance,https://catalog.stonybrook.edu/preview_program.php?catoid=8&poid=683&returnto=485
Minor in Religious Studies,https://catalog.stonybrook.edu/content.php?catoid=8&navoid=483
Minor in Russian Studies,https://catalog.stonybrook.edu/content.php?catoid=8&navoid=483
Minor in South Asian Studies,https://catalog.stonybrook.edu/content.php?catoid=8&navoid=483
Minor in Spanish Language and Literature,https://www.stonybrook.edu/ugrdbulletin/academicprograms/spn/
Minor in Sustainability Studies,https://catalog.stonybrook.edu/content.php?catoid=8&navoid=483
Minor in Television Writing,https://www.stonybrook.edu/commcms/creative-writing-film-television/
Minor in Theatre Arts,https://catalog.stonybrook.edu/content.php?catoid=8&navoid=483
Minor in Women's and Gender Studies,https://www.stonybrook.edu/ugrdbulletin/academicprograms/wst/
Minor in Writing and Rhetoric,https://www.stonybrook.edu/commcms/writrhet/undergrad/minor.php
