,Echocardiography,,,,,BS,Fall,,,December 1,Not Required,Required,Not Required,"Applicants whose native language is not English must provide proof of English language proficiency. This can be met by providing one of the following: TOEFL iBT: 70, IELTS: 6.0, PTE Academic: 50, Duolingo English Test (DET): 100, ELS Language Center: Level 112, SAT Evidence-Based Reading and Writing: 510, ACT English: 21, or graduation from a high school in the U.S. or another country where English is the official language of instruction.","To be eligible for consideration to the Diagnostic Medical Sonography (DMS) program, the student must: Be accepted to the University of Findlay. Submit a completed DMS application via the online sonography application system (SICAS) by Jan. 15. Have a minimum cumulative GPA of 3.0 on a 4.0 scale. Must have a 'C' or better in all pre-requisite courses, including Anatomy & Physiology I & II with labs, Chemistry with lab, Medical Terminology, and Physics. Must complete a minimum of two job shadowing experiences for a total of 16 hours. Must submit two letters of recommendation. Must complete an interview. A written essay is part of the application and a written essay is also completed during the interview day.",Required,,True,False,False,False,False,False,False,False,False,False,False,False,False,False,False,False,,,,Office of Admissions,"39,132 per year",,,,,,Echocardiography,"Diagnostic medical sonography (DMS) is a multi-specialty profession which utilizes high-frequency sound waves to image the human body. Sonographers use their knowledge of anatomy, physiology and physics to create images which are analyzed by a physician to diagnose medical conditions. The University of Findlay offers a Bachelor of Science degree in Diagnostic Medical Sonography. Students can choose from two areas of concentration: General Sonography (Abdomen, Obstetrics and Gynecology) and Echocardiography (Cardiac Sonography). Echocardiography (Cardiac Sonography) involves evaluation of the anatomy and hemodynamics (blood flow) of the heart, its valves and related blood vessels.",,https://www.findlay.edu/academics/undergraduate,The Diagnostic Medical Sonography Program is accredited by the Commission on Accreditation of Allied Health Education Programs (CAAHEP) upon the recommendation of the Joint Review Committee on Education in Diagnostic Medical Sonography (JRC-DMS).,,920.0,True,False,,4.0,3.0,,,,,,,,,,,0,,,,,,,False,False,,,100.0,112.0,,,6.0,,,50.0,,70.0,,,,,,,,,,,"15,000 to 21,000",,"Merit-based, Endowed, Departmental",,,,,,,
,Economics,,,,,Minor,"Fall, Spring",,,,Not Required,Optional,Not Required,"For international students whose native language is not English, proof of English proficiency is required. Accepted tests and minimum scores include TOEFL iBT: 79, IELTS: 6.5, PTE Academic: 58, or Duolingo: 110. Completion of ELS Language Center's Level 112 is also accepted.","To be considered for admission, first-year students must submit a completed online application and official high school transcripts. The University of Findlay is test-optional. While not required for admission, students are encouraged to submit their ACT or SAT scores to be considered for some scholarships. Letters of recommendation and essays are not required for admission but can be submitted as supplemental materials.",Not Required,,True,True,False,False,False,False,False,False,False,False,False,False,False,False,False,False,,,,Office of Admissions,39588,,,,,,,The economics minor creates an opportunity for students to gain a working knowledge of the analytical tools that are useful in understanding the economic environment of business.,,https://findlay.smartcatalogiq.com/en/current/undergraduate-catalog/courses/econ-economics,Accreditation Council for Business Schools and Programs (ACBSP),,1040.0,True,False,,4.0,2.0,79%,,,,,,,,,,0,,,,,,,False,False,,,110.0,112.0,,,6.5,,,58.0,,79.0,,,,,,,,,,,"13,000 - 20,000",,"Merit-based, Endowed, Donor-Funded, Departmental",,,,,,,
,Education,,,,,BA,,,August 1,,,,,,,,,False,False,False,False,False,False,False,False,False,False,False,False,False,False,False,False,,,,Office of Admissions,39598,,,,,,,"The University of Findlay’s College of Education prepares students to become confident, caring, and competent educators. With a focus on experiential learning, students are in the classroom their first year.",,https://www.youtube.com/watch?v=Tzz2zlzQ7P4,Council for the Accreditation of Educator Preparation (CAEP),,1414.0,False,False,,4.0,2.75,,,,,,,,,,,0,,,,,,,False,False,,,,,,,,,,,,,,,,,,,,,,,"Up to $19,000 per year",,"Merit-based, Endowed, Grants",,,,,,,
,Elementary Education,,,,,BA,,,,Rolling admissions,Not Required,Not Required,Not Required,"Undergraduate applicants whose native language is not English, must provide proof of English proficiency by one of the following: TOEFL (61 iBT or 500 PBT), IELTS (6.0), PTE Academic (50), Duolingo English Test (95), or successful completion of ELS Level 112.",Required application materials: Completed undergraduate application (Findlay’s FREE online application or the Common Application); Official high school transcript(s) from all institutions attended; Official ACT or SAT scores (The University of Findlay is test-optional).,Not Required,,True,False,False,False,False,False,False,False,False,False,False,False,False,False,False,False,,,,Office of Admissions,39538 per year,,,,,,,"The Primary (P-5) License prepares candidates to teach prekindergarten through grade 5. Candidates are prepared to teach all content areas (reading, language arts, mathematics, science, and social studies) to students in these grades. From your very first year on campus to your senior student teaching block, you will engage in field experiences in a variety of settings including rural, suburban, and urban schools.",,https://www.findlay.edu/academics/undergraduate,Council for the Accreditation of Educator Preparation (CAEP),,1412.0,False,False,,4.0,3.0,,,,,,,,,,,0,,,,,,,False,False,,,95.0,112.0,,,6.0,,,50.0,,61.0,,,,,,,,,,,"Up to $19,000 per year",,Merit-based,,,,,,,
,English,,,,,BA,"Fall, Spring, Summer",,,,Optional,Required,Not Required,"Students from non-English speaking countries must submit one of the following as proof of English proficiency: TOEFL: 61 iBT, IELTS: 6.0, iTEP: 3.5, PTE Academic: 50, Duolingo: 95, ELS: graduation from level 112.","In addition to the online application and fee, applicants must submit:

Official transcripts of all previous college work. The UNH Graduate School requires a minimum GPA of 3.0.
Three letters of recommendation.
Statement of purpose (approximately 500 words), indicating your primary areas of interest and reasons for applying to our program.
Writing sample (10-20 pages of critical or analytical prose on a literary topic; do not submit creative writing).
Resume (optional).
GRE General Test is not required.",Required,,True,False,False,False,False,False,False,False,False,False,False,False,False,False,False,False,,,,Office of Admissions,39634,,,,,,"Creative Writing, General Writing, Literature, Teaching","The English major offers four emphases: Creative Writing, General Writing, Literature and Teaching. Students in the English program at the University of Findlay join a close-knit community of writers and scholars. The program provides a flexible curriculum that prepares students for a variety of careers by developing strong communication, critical thinking, and analytical skills.",,https://www.youtube.com/watch?v=WDFm_qCXO7A,,,1114.0,True,False,,4.0,2.5,86%,,,,,,,,,,0,,,,,,,False,False,,,95.0,112.0,,,6.0,,,50.0,,61.0,,,,,,,,,,,"Up to $18,000 per year",,"Merit-based, Endowed",,,,,,,
,English - Creative Writing Emphasis,,,,,BA,"Fall, Spring",,,,,,Not Required,"Students for whom English is not their native language must submit proof of English proficiency. This can be done by submitting one of the following: TOEFL minimum score of 61 iBT (500 PBT), IELTS minimum score of 6.0, iTEP minimum score of 3.5, PTE Academic minimum score of 50, Duolingo English Test minimum score of 95, or successful completion of ELS Language Centers level 112.","To be admitted to the University of Findlay as a first-year student, applicants are asked to complete the following steps: 1. Complete an application (Findlay's free online application or the Common App). 2. Request your official high school transcript be sent to the Office of Admissions. 3. Ask a teacher, school counselor or principal to complete a recommendation form or send a letter of recommendation on your behalf.",,,True,False,False,False,False,False,False,False,False,False,False,False,False,False,False,False,,,,Office of Admissions,39232 per year,,,,,,Creative Writing Emphasis,"A major in English leads to the Bachelor of Arts degree. Students may choose one of three emphases: General Writing, Creative Writing, or Literature.",,https://findlay.smartcatalogiq.com/en/current/undergraduate-catalog/major-requirements/college-of-arts-humanities-and-social-sciences/department-of-english-philosophy-and-religious-studies/english-engl/,,,1402.0,True,False,,4.0,2.0,86%,,,,,,,,,,FREE,,,,,,,False,False,,,95.0,112.0,,,6.0,,,50.0,,61.0,,,,,,,,,,,"$12,000 - $19,000 per year",,"Merit-based, Departmental, Athletic, Performance, Endowed",,,,,,,
,English - General Writing Emphasis,,,,,BA,"Fall, Spring, Summer",,,,,,,,,,,False,False,False,False,False,False,False,False,False,False,False,False,False,False,False,False,,,,Office of Admissions,39634,,,,,,General Writing Emphasis,"Earn a Bachelor of Arts degree in English with an emphasis in Creative Writing, General Writing or Teaching. The University of Findlay's English program prepares students for a variety of careers by developing their skills in critical thinking, close reading, and effective writing.",,https://english.fas.harvard.edu/,,,1348.0,False,False,,4.0,2.5,,,,,,,,,,,0,,,,,,,False,False,,,,,,,,,,,,,,,,,,,,,,,"Up to $19,000",,"Merit-Based, Endowed, Donor",,,,,,,
,English - Literature Emphasis,,,,,BA,"Fall, Spring",,,"Fall: Aug. 1, Spring: Dec. 1",,,Not Required,"If your native language is not English, you will need to submit proof of English proficiency. UNH accepts several options to meet this requirement: TOEFL iBT score of 80 or higher, IELTS score of 6.5 or higher, Duolingo English Test (DET) score of 105 or higher, or Pearson PTE Academic score of 59 or higher. UNH also accepts successful completion of UNH’s English as a Second Language (ESL) Institute Pathway program. The English proficiency requirement is waived if you are a native English speaker or have attended a school for at least 3 years where English is the primary language of instruction.","To apply, you will need to submit an online application or the Common Application and your official high school transcript. The University of Findlay has adopted a test-optional admission policy, so submitting ACT or SAT scores is not required for most students.",Not Required,,True,True,False,False,False,False,False,False,False,False,False,False,False,False,False,False,,,,Office of Admissions,39712,,,,,,Literature Emphasis,"Students in the Literature Emphasis immerse themselves in the study of great books. They analyze literature from various time periods and cultures, sharpening their critical thinking and writing skills in the process. This track is ideal for students planning to attend graduate school or pursue careers in law, education, or publishing.",,https://www.educations.com/ba/literature,,,825.0,False,False,,4.0,2.0,,,,,,,,,,,0,,,,,,,False,False,,,105.0,,,,6.5,,,59.0,,80.0,,,,,,,,,,,"14,000 - 19,000 per year",,"Merit-based, Endowed, Talent-based",,,,,,,
,English - Teaching Emphasis,,,,,BA,"Fall, Spring",,,,Not Required,Not Required,,,"To be considered for regular admission to the University of Findlay, applicants must complete the online application and submit their official high school transcript. Submission of official ACT/SAT scores is optional for this major.",Not Required,,True,False,False,False,False,False,False,False,False,False,False,False,False,False,False,False,,,,Office of Admissions,38232,,,,,,Teaching Emphasis,,,https://findlay.smartcatalogiq.com/en/current/undergraduate-catalog/major-requirements/college-of-arts-humanities-and-social-sciences/department-of-english-philosophy-and-religious-studies/english-engl/english-teaching-emphasis-ba/,,,1416.0,False,False,,4.0,2.5,,,,,,,,,,,0,,,,,,,False,False,,,,,,,,,,,,,,,,,,,,,,,13000 - 20000,,"Merit-based, Endowed, Athletic",,,,,,,
,English and Speech Teacher Education,,,,,BA,"Fall, Spring",,,,Not Required,Optional,Not Required,"Students for whom English is not their native language must submit evidence of their English proficiency by submitting one of the following: Test of English as a Foreign Language (TOEFL) with a minimum score of 61 iBT or 500 PBT, International English Language Testing System (IELTS) with a minimum score of 6.0, Pearson Test of English (PTE) with a minimum score of 50, Duolingo English Test with a minimum score of 95, or successful completion of the ELS Language Centers level 112. Students from countries where English is an official language and students who graduated from a U.S. high school are exempt.","To be considered for admission, applicants must submit an application for admission and official high school transcripts. Standardized test scores (ACT/SAT) are optional. While not required, applicants may also submit letters of recommendation and a personal statement.",Not Required,,True,True,False,False,False,False,False,False,False,False,False,False,False,False,False,False,,,,Office of Admissions,39598,,,,,,Teaching Emphasis,This major prepares students for the Adolescent/Young Adult Integrated Language Arts License (grades 7-12). Students must also complete the requirements for the adolescent/young adult education major to receive the license.,,https://findlay.smartcatalogiq.com/en/current/undergraduate-catalog/major-requirements/college-of-arts-humanities-and-social-sciences/department-of-english,,,1120.0,True,False,,4.0,2.75,,,,,,,,,,,0,,,,,,,False,False,,,95.0,112.0,,,6.0,,,50.0,,61.0,,,,,,,,,,,20000,,"Merit-based, Endowed",,,,,,,
,English Equestrian Studies,,,,,BS,,,,,Not Required,Not Required,Not Required,"Students from non-English speaking countries must submit one of the following as proof of English proficiency: Test of English as a Foreign Language (TOEFL) - minimum score of 61 (IBT), 173 (CBT), or 500 (PBT); International English Language Testing System (IELTS) - minimum score of 6.0; Pearson Test of English Academic (PTE) - minimum score of 50; Duolingo English Test - minimum score of 95; International Test of English Proficiency (iTEP) - minimum score of 3.5; Completion of ELS Language Center's level 112.","To be considered for admissions, you need to: Submit a free online application for admission. Submit official transcripts from your high school or secondary school. Submit official transcripts from any post-secondary institution attended. Submit official ACT or SAT scores. *University of Findlay is a test-optional institution. The submission of ACT/SAT scores is optional for admissions consideration.",Not Required,,True,False,False,False,False,False,False,False,False,False,False,False,False,False,False,False,,,,Office of Admissions,39598,,,,,,,"The English equestrian studies program at the University of Findlay has a long-standing reputation as one of the best in the country. Our program has won more Intercollegiate Horse Show Association (IHSA) national championships than any other college or university. We offer an Associate of Arts degree in English equestrian studies and a Bachelor of Science degree in English equestrian studies. You will receive daily riding instruction on high-quality horses as you work toward your degree. You will also learn about: Equine nutrition, Equine reproduction, Barn management, Preventive medicine.",,https://www.findlay.edu/academics/undergraduate,,,1410.0,False,False,,4.0,2.5,79%,,,,,,,,,,0,,,,,,,False,False,,,95.0,112.0,,,6.0,,,50.0,,61.0,,,,,,,,,,,18000,,Merit-based Scholarships,,,,,,,
,Entrepreneurship,,,,,Minor,"Fall, Spring",,August 1,Rolling Admissions,Not Required,Not Required,Not Required,"All students for whom English is not their native language must submit proof of English language proficiency. The University of Findlay accepts several different options to prove proficiency including: TOEFL (minimum score of 61 on the IBT), IELTS (minimum score of 6.0), PTE Academic (minimum score of 50), Duolingo English Test (minimum score of 95), or successful completion of ELS Language Center's level 112.","To be considered for admission to the University of Findlay, you must submit the following items:

1. Complete an online application
You may complete our free online application or add Findlay to your Common Application.
2. Request an official high school transcript
An official high school transcript must be sent directly from your high school to the University of Findlay's Office of Admissions.
3. Submit your ACT and/or SAT scores
Findlay is a test-optional university for the 2024-2025 academic year. Please contact the Office of Admissions with any questions.",Not Required,,True,False,False,False,False,False,False,False,False,False,False,False,False,False,False,False,,,,Office of Admissions,39232,,,,,,,"The Entrepreneurship Minor is designed for students who desire to start their own business or work in a small business environment. It is also valuable for those who wish to be intrapreneurs – innovators within large organizations. Students in the minor will learn how to identify and evaluate business opportunities, create and manage new ventures, and think creatively and innovatively.",,https://www.findlay.edu/academics/undergraduate,Accreditation Council for Business Schools and Programs (ACBSP),,947.0,False,False,,4.0,2.0,,,,,,,,,,,0,,,,,,,False,False,,,95.0,112.0,,,6.0,,,50.0,,61.0,,,,,,,,,,,"up to $20,000",,Merit-based,,,,,,,
,"Environment, Health, Safety & Sustainability",,,,,BS,"Fall, Spring, Summer",,,Rolling admissions,,,Not Required,"For graduate students, the minimum required score is: 6.5 IELTS, 79 TOEFL or 110 Duolingo.",Complete the free online application for admission. Request that your official high school transcripts be sent to the Office of Admissions from the high school from which you graduated. Request that your official ACT or SAT scores be sent to the Office of Admissions from the testing service. The University of Findlay is test-optional. Request that your official college transcripts be sent to the Office of Admissions from all colleges/universities you have attended (if applicable).,,,True,True,False,False,False,False,False,False,False,False,False,False,False,False,False,False,,,,Office of Admissions,39018,,,,,,,"The University of Findlay’s Environment, Health, Safety, and Sustainability (EH&S) program is prepared to launch you into a successful career in corporate and public sectors. This major focuses on the relationship between environmental sustainability and the health and safety of workers and the community. You will learn how to identify, evaluate, and control environmental and safety hazards, and how to develop and manage programs to prevent injuries and illnesses. Students benefit from hands-on learning through the All-Hazards Training Center and paid internships.",,https://www.findlay.edu/sciences/environmental-sustainability/,"The Bachelor of Science in Environment, Health, Safety, and Sustainability is accredited by the Applied and Natural Science Accreditation Commission of ABET","more than $29,000 per year",1044.0,False,True,,4.0,2.0,,,,,,,,,,,0,,,,,,,False,False,,,110.0,,,,6.5,,,,,79.0,,,,,,,,,,,"up to $18,000",,Merit-based,,,,,,,
,"Environmental, Safety & Occupational Health Management",,,,,BS,"Fall, Spring",,,Rolling admissions,,,Not Required,"If English is not your native language, you must provide proof of English proficiency by providing an official score report from one of the following testing agencies: TOEFL (iBT: 79-80, PBT: 550), IELTS (6.5), PTE Academic (58), Duolingo English Test (110), or completion of ELS Language Centers Level 112. Test scores must be less than two years old. Proof of English proficiency is not required from students whose native language is English and are from certain countries, or applicants who have completed 24+ semester hours of college-level coursework with a grade of 'C' or better from a U.S. college or university.",,,,False,False,False,False,False,False,False,False,False,False,False,False,False,False,False,False,,,,Office of Admissions,38988,,,,,,,"Findlay's Environmental, Safety & Occupational Health Management (ESOH) major provides you with the knowledge and skills to make a difference in the world by ensuring the health and safety of workers and the environment. Established in 1986, the Environmental, Safety and Occupational Health Management major is one of the top programs in the nation.",,https://www.findlay.edu/academics/undergraduate,"The Environmental, Safety and Occupational Health Management program is accredited by the Applied and Natural Science Accreditation Commission (ANSAC) of ABET. The Bachelor of Science in Environmental, Safety and Occupational Health Management is also accredited by the National Environmental Health Science and Protection Accreditation Council (EHAC).",,985.0,False,False,,4.0,2.5,,,,,,,,,,,0,,,,,,,False,False,,,110.0,112.0,,,6.5,,,58.0,,79.0,,,,,,,,,,,10000 - 17000,,Merit-based,,,,,,,
,Equine Business Management,,,,,BS,"Fall, Spring",,,,Not Required,Not Required,Not Required,"For international undergraduate admission, if English is not the applicant's first language, they must submit one of the following: TOEFL (79 iBT or 550 PBT), IELTS (6.5), PTE (53), Duolingo (110), or ELS Level 112 with a 2.5 GPA.","To be considered for admission, you will need to submit a completed application, your official high school transcript, and your ACT or SAT scores (if you choose to submit them). The University of Findlay has a test-optional admission policy. This allows students to choose at the point of application whether to submit ACT or SAT scores as part of their admission application.",Not Required,,True,False,False,False,False,False,False,False,False,False,False,False,False,False,False,False,,,,Office of Admissions,38062 per year,,,,,,,The equine industry is huge and diverse. It takes more than a love for horses to succeed; it takes business savvy. The University of Findlay’s Equine Business Management major is designed for students with a strong desire to work in the equine industry but not necessarily riding horses. This degree offers a unique combination of top-tier business education and hands-on equestrian experience.,,https://www.findlay.edu/sciences/equestrian-studies/,Accreditation Council for Business Schools and Programs (ACBSP),,1189.0,False,False,,4.0,2.0,,,,,,,,,,,0,,,,,,,False,False,,,110.0,112.0,,,6.5,,,53.0,,79.0,,,,,,,,,,,14000 - 18000 per year,,"Merit-based, Departmental, Endowed",,,,,,,
,Equine Studies,,,,,Associate of Arts,"Fall, Spring, Summer",,,Rolling admissions,Not Required,Optional,Not Required,"International applicants whose native language is not English must provide proof of English proficiency by submitting one of the following: Test of English as a Foreign Language (TOEFL), International English Language Testing System (IELTS), Pearson Test of English Academic (PTE), Duolingo English Test, ELS Language Centers.","To be considered for admission, first-time freshmen should submit the following:

Completed application for admission and scholarships
Official high school transcripts
Official ACT and/or SAT scores (optional)

Your admission counselor may request additional materials like letters of recommendation or a personal essay to help with their decision.",Not Required,,True,False,False,False,False,False,False,False,False,False,False,False,False,False,False,False,,,,Office of Admissions,39946,,,,,,English or Western riding,"The Associate of Arts in Equine Studies is a two-year degree designed to offer students the opportunity to increase their riding skills and experience, and to learn about the horse industry. Students in the program will select an emphasis in either English or Western riding. The curriculum includes general education courses, as well as riding and equine management classes.",,https://www.findlay.edu/academics/undergraduate,,,1288.0,True,True,,4.0,2.0,,,,,,,,,,,0,,,,,,,False,False,,,95.0,112.0,,,6.0,,,50.0,,61.0,,,,,,,,,,,"up to $18,000 per year",,"Merit-based, Endowed, Talent-based",,,,,,,
