,Adolescent/Young Adult Integrated Mathematics,,,,,Bachelor of Arts,,,,,,,Not Required,"International students must demonstrate adequate English language proficiency for admission to degree programs at the University of Findlay. This can be met by submission of an English proficiency test score. Accepted tests and minimum scores are: TOEFL: 79 iBT or 550 PBT, IELTS: 6.5, PTE Academic: 58, Duolingo English Test: 110, ELS: Graduation from level 112 with a grade of 2.5 or higher.","First-time freshmen can apply to the University of Findlay using our free online application or through the Common App. Applicants must send official high school transcripts. The University of Findlay has a test-optional admission policy for most of its direct-from-high-school applicants, so sending ACT or SAT test scores is optional.",,,True,False,False,False,False,False,False,False,False,False,False,False,False,False,False,False,,,,Office of Admissions,39598,,,,,,,"University of Findlay’s Adolescent/Young Adult Integrated Mathematics Program prepares you for a career in teaching mathematics to students in grades 7-12. You will learn how to verify mathematical facts, solve problems, and use mathematical models to represent real-world phenomena. In addition, you will learn how to use technology to teach mathematics and how to assess student learning.",,https://www.findlay.edu/education/undergraduate-programs/adolescent-young-adult-mathematics,Council for the Accreditation of Educator Preparation (CAEP),,840.0,False,False,,,2.5,,,,,,,,,,,0,,,,,,,False,False,,,110.0,112.0,,,6.5,,,58.0,,79.0,,,,,,,,,,,14000 - 20000,,Merit-based,,,,,,,
,Adolescent/Young Adult Life Science,,,,,BS,"Fall, Spring",,,,,,Not Required,"Students must submit one of the following to meet the English proficiency requirement: TOEFL: 61 iBT, IELTS: 6.0, iTEP: 3.5, PTE Academic: 50, Duolingo: 95, ELS: 112 level, SAT evidence-based reading and writing score of 480, ACT English score of 21.","To be considered for admission, you will need to complete an online application and submit your official high school transcripts. Official college transcripts are required if you have taken any college-level coursework.",,,True,False,False,False,False,False,False,False,False,False,False,False,False,False,False,False,,,,Office of Admissions,39538,,,,,,Life Science,"Adolescent/young adult licensure prepares you to teach students in grades 7-12. If you want to help these students navigate their way through high school while teaching a subject you love, this is the program for you!",,https://www.findlay.edu/academics/undergraduate,Council for the Accreditation of Educator Preparation (CAEP),,1378.0,True,True,,4.0,2.75,,,,,,,,,,,0,,,,,,,False,False,,,95.0,112.0,,,6.0,,,50.0,,61.0,,,,,,,,,,,16000 - 20000,,Merit-based,,,,,,,
,Adolescent/Young Adult Mathematics,,,,,BS,,,,,Not Required,Not Required,Not Required,"Applicants from non-English speaking countries must provide proof of English proficiency. This can be met by providing ONE of the following: TOEFL: 61 iBT, IELTS: 6.0, iTEP: 3.5, PTE Academic: 50, Duolingo English Test: 95, ELS: level 112.","To apply as a first-time freshman, please submit the following: Completed online application or Common Application. Official high school transcript. Official ACT and/or SAT scores (optional).",Not Required,,True,True,False,False,False,False,False,False,False,False,False,False,False,False,False,False,,,,Office of Admissions,"38,988 per year",,,,,,,"Adolescent/young adult - integrated mathematics is a four-year program that prepares students for licensure in mathematics for grades 7-12. You will take a combination of education and mathematics courses. The education courses will cover instructional styles, theories of learning and assessment. The mathematics courses will cover calculus, probability, statistics and geometry. Field experience is a major component of the program. You will continuously be in the field observing and teaching in a classroom throughout your four years.",,https://www.findlay.edu/education/undergraduate-programs/adolescent-young-adult-mathematics,The College of Education programs are accredited by the Council for the Accreditation of Educator Preparation (CAEP).,,1577.0,False,True,,,2.5,,,,,,,,,,,0,,,,,,,False,False,,,95.0,112.0,,,6.0,,,50.0,,61.0,,,,,,,,,,,14000 - 19000,,Merit-based,,,,,,,
,Adolescent/Young Adult Science,,,,,BS,"Fall, Spring",,,,Not Required,Not Required,Not Required,"All students whose native language is not English are required to submit evidence of English proficiency. Accepted tests include TOEFL (61 iBT/500 PBT), IELTS (6.0), PTE Academic (50), Duolingo English Test (95), or completion of ELS Language Center Level 112.","To apply for admission to the University of Findlay as a first-year student, you will need to: Complete the application for admission. You can apply using the University of Findlay's application or by using the Common Application. Submit your official high school transcript. The University of Findlay is test-optional for most majors, meaning we do not require an ACT or SAT score for admission.",Not Required,,True,True,False,False,False,False,False,False,False,False,False,False,False,False,False,False,,,,Office of Admissions,39266,,,,,,"Life Science, Physical Science: Chemistry, Physical Science: Physics, Earth Science","Adolescent/Young Adult (AYA) Science candidates are prepared to teach students in grades 7-12. Candidates are prepared for licensure in one of the following areas: Life Science, Physical Science: Chemistry, Physical Science: Physics, Earth Science. 

If you enjoy science and working with teenagers, a career in science education may be the right fit for you. As a science teacher, you'll combine your passion for science and desire to help students learn. Science teachers are in high demand nationwide, and Findlay's education program will prepare you for the classroom.",,https://www.findlay.edu/education/undergraduate-programs/adolescent-young-adult-science,,,1309.0,True,True,,,3.0,,,,,,,,,,,0,,,,,,,False,False,,,95.0,112.0,,,6.0,,,50.0,,61.0,,,,,,,,,,,"13,000 - 19,000 per year",,"Merit-based, Endowed, Talent-based",,,,,,,
,Adolescent/Young Adult Social Studies,,,,,BA,"Fall, Spring",,,,Not Required,Not Required,Not Required,"If English is not your first language, you will need to provide proof of English proficiency. This can be done by submitting one of the following: TOEFL: minimum score of 61 iBT (Internet-based Test) or 500 PBT (Paper-based Test); IELTS: minimum score of 6.0; PTE Academic: minimum score of 50; Duolingo English Test: minimum score of 95; ELS: successful completion of ELS Language Center's Level 112.","To be considered for regular admission, applicants will need to submit a completed application for admission and official high school transcripts. The University of Findlay is test-optional for most undergraduate majors, including Adolescent/Young Adult Social Studies. ACT or SAT scores are not required for admission for this major.",Not Required,,True,True,False,False,False,False,False,False,False,False,False,False,False,False,False,False,,,,Office of Admissions,39528,,,,,,,"The Adolescent/Young Adult Integrated Social Studies Program at the University of Findlay prepares students for a career in teaching social studies to adolescents and young adults in grades 7-12. Students will learn how to plan and implement lessons, assess student learning, and manage a classroom. They will also gain a deep understanding of the social studies content they will be teaching, including history, geography, government, and economics.",,https://www.findlay.edu/academics/undergraduate,The College of Education is accredited by the Council for the Accreditation of Educator Preparation (CAEP).,,1318.0,False,False,,,,79%,,,,,,,,,,0,,,,,,,False,False,,,95.0,112.0,,,6.0,,,50.0,,61.0,,,,,,,,,,,"$10,000 - $19,000",,"Merit-based, Endowed, Grants",,,,,,,
,All Hazards Emergency Management,,,,,,"Fall, Spring",,,,Not Required,Required,Not Required,"In addition to the program specific admission requirements, international students must provide proof of English Language Proficiency by submitting one of the following: An official TOEFL score of 550 (paper-based), 213 (computer-based), or 79-80 (Internet-based) with minimum of 18 on each sub-score for the IBT; An official IELTS score of 6.5, with 6.0 on each sub-score; PTE Academic score of 59; An official Duolingo score of 110; Successful completion of ELS level 112.","To be considered for admission to the All Hazards Emergency Management program, students must meet the general requirements for admission to graduate study at the University of Findlay and have completed a bachelor's degree from an accredited institution.

In order to be admitted to the Master of Science in All Hazards Emergency Management program, the following must be submitted:
1. Graduate application and fee.
2. Official transcript(s) from all institutions of higher education attended.
3. Two letters of recommendation.
4. Personal statement detailing professional goals and reasons for seeking admission to the Master of Science in All Hazards Emergency Management.
5. A cumulative undergraduate grade point average of 3.0 or higher is required. Students not meeting the 3.0 grade point average may be considered for conditional acceptance.",Not Required,,True,False,True,True,False,False,False,True,False,False,False,True,True,True,False,False,,,,Graduate Admissions,39538,,,,,,,"The certificate in All Hazards Emergency Management prepares students to lead and manage in crisis situations. The curriculum is designed to provide students with a comprehensive understanding of the phases of emergency management: mitigation, preparedness, response, and recovery.",,https://findlay.smartcatalogiq.com/en/current/graduate-catalog,,,1013.0,True,False,,4.0,2.0,,,,,,,,,,,0,,,,,,,False,False,,,110.0,112.0,,,6.5,,,59.0,,79.0,,,,,,,,,,,13000 - 19000,,Merit-based,,,,,,,
,Animal Science - Industry Option,,,,,BS,"Fall, Spring",,,,,,Not Required,"All applicants whose native language is not English must provide evidence of English language proficiency. Proficiency can be demonstrated by submitting official scores from one of the following: TOEFL: 70 iBT / 525 PBT, IELTS: 6.0, PTE: 50, Duolingo: 100, ELS: Completion of Level 112","To be considered for admission, you will need: Completed online application or Common Application; Official high school transcript; Official ACT and/or SAT scores (optional).",,,True,False,False,False,False,False,False,False,False,False,False,False,False,False,False,False,,,,Office of Admissions,"39,528 per year",,,,,,Industry Option,"The industry option is a combination of business and animal science. This option is designed for students who are interested in the business side of the animal industry. Students in this option will take courses in animal science as well as courses in accounting, marketing, management, and economics.",,https://www.findlay.edu/sciences/animal-science/industry,,,870.0,False,False,,4.0,3.0,,,,,,,,,,,0,,,,,,,False,False,,,100.0,112.0,,,6.0,,,50.0,,70.0,,,,,,,,,,,"Up to $18,000 per year",,Merit-based,,,,,,,
,Animal Science - Pre-Veterinary Medicine Option,,,,,BS,Rolling Admissions,,,,,,Not Required,"International students must demonstrate English proficiency. Accepted tests and minimum scores include: TOEFL 61 iBT or 500 PBT, IELTS 6.0, PTE 50, Duolingo English Test 95, or completion of ELS Language Centers Level 112. Students from English-speaking countries or who have graduated from a U.S. high school may be exempt.","The University of Findlay has a rolling admissions policy. For first-time freshmen, the following are required for admission consideration:

Application for Admission (There is no application fee.)
Official high school transcript or GED

The University of Findlay is test-optional, meaning you are not required to submit your ACT or SAT test scores for admission.",,,True,False,False,False,False,False,False,False,False,False,False,False,False,False,False,False,,,,Office of Admissions,39528,,,,,,Pre-Veterinary Medicine Option,"This option is designed for students who wish to attend veterinary school. The curriculum is rigorous and includes chemistry, biology, physics and mathematics, as well as the animal science courses. Students will have the opportunity to work with a variety of animals, including beef and dairy cattle, sheep, goats, swine and horses.",,https://www.findlay.edu/academics/undergraduate,,,1416.0,False,False,,4.0,2.0,78%,,,,,,,,,,0,,,,,,,False,False,,,95.0,112.0,,,6.0,,,50.0,,61.0,,,,,,,,,,,13000 - 18000,,Merit-based,,,,,,,
,Animal Science - Science Option,,,,,BS,,,,,Not Required,Not Required,,"International undergraduate students are required to submit one of the following to demonstrate English proficiency: TOEFL (61 iBT or 500 PBT), IELTS (6.0), PTE Academic (50), iTEP (3.5), Duolingo (95), or completion of ELS Language Center's Level 112. Exemptions apply to students from certain countries or those who have completed 24+ semester hours at an accredited U.S. college or university.","To be considered for admission, you will need to submit: A completed application, Official high school transcript.",Not Required,,True,False,False,False,False,False,False,False,False,False,False,False,False,False,False,False,,,,Office of Admissions,39232,,,,,,Science Option,"The science option is designed for students interested in graduate school or careers in research, nutrition, reproduction or genetics. Strong emphasis is placed on chemistry, biology and physics.",,https://www.findlay.edu/academics/undergraduate,,,1192.0,False,True,,4.0,2.0,,,,,,,,,,,0,,,,,,,False,False,,,95.0,112.0,,,6.0,,,50.0,,61.0,,,,,,,,,,,"11,000 - 19,000",,"Merit-based, Endowed, Departmental",,,,,,,
,Animal Sciences and Husbandry,,,,,BS,"Fall, Spring, Summer",,,,Not Required,Not Required,Not Required,"International students must demonstrate English proficiency by meeting one of the following requirements: a minimum TOEFL score of 61 iBT or 500 PBT, a minimum IELTS score of 6.0, a minimum PTE score of 50, a minimum Duolingo score of 95, or successful completion of ELS Level 112.","To apply for admission to the University of Findlay, we ask that you complete the application and submit your official high school transcript.",Not Required,,True,True,False,False,False,False,False,False,False,False,False,False,False,False,False,False,,,,Office of Admissions,38812,,,,,,Science Option,"The science option prepares students to work with animals in a variety of capacities. This option is for students interested in the scientific aspects of animal management including breeding and genetics, nutrition, physiology, growth, behavior and management systems. This option is also excellent preparation for graduate school.",,https://www.findlay.edu/sciences/animal-science/science,,,1563.0,False,True,,4.0,2.5,,,,,,,,,,,0,,,,,,,False,False,,,95.0,112.0,,,6.0,,,50.0,,61.0,,,,,,,,,,,"$13,000 - $18,000 per year",,"Merit-based, Need-based",,,,,,,
,Art,,,,,BA,"Fall, Spring",,,,Not Required,Not Required,Not Required,"For direct admission, international undergraduate applicants must provide proof of English proficiency through one of the following: TOEFL with a score of 61 iBT, IELTS with a score of 6.0, PTE with a score of 50, Duolingo English Test with a score of 95, or successful completion of ELS Level 112 with a 2.5 GPA. Students from certain countries may be exempt.","To apply as a new freshman, you will need to complete our FREE online application and submit your official high school transcript. The University of Findlay is test-optional. This means that if you have a cumulative high school GPA of a 2.5 or higher, you do not have to submit your ACT or SAT scores to be considered for admission to most majors.",Not Required,,True,False,False,False,False,False,False,False,False,False,False,False,False,False,False,False,,,,Office of Admissions,39588,,,,,,"Digital Media Design, Graphic Design, Photography, Printmaking, Painting, Drawing, Ceramics","As an art major, you’ll gain a broad-based education in the visual arts with the flexibility to focus on a specific discipline. You will develop your technical and conceptual skills while building a professional portfolio. This degree offers a mix of hands-on studio courses, art history, and general education requirements.",,https://www.findlay.edu/arts-humanities-social-sciences/art/art-major,,,1414.0,True,False,,4.0,2.5,,,,,,,,,,,0,,,,,,,False,False,,,95.0,112.0,,,6.0,,,50.0,,61.0,,,,,,,,,,,13000 - 18000,,Merit-based,,,,,,,
,Art History,,,,,Minor,"Fall, Spring",,,,Not Required,Not Required,Not Required,"International applicants must demonstrate English proficiency. This can be met by achieving a minimum score on one of the following exams: TOEFL iBT (61), TOEFL PBT (500), IELTS (6.0), PTE (50), or Duolingo (95). Completion of ELS Language Centers Level 112 also satisfies the requirement. The proficiency exam may be waived for students from native English-speaking countries or for those who score 19 or higher on the ACT English section or 500 or higher on the SAT Evidence-Based Reading & Writing section.","To apply for admission to the University of Findlay, we ask that you complete the following steps: 1. Complete the online application and submit it with no application fee. 2. Request your official high school transcript to be sent to the Office of Admissions.",Not Required,,True,False,False,False,False,False,False,False,False,False,False,False,False,False,False,False,,,,Office of Admissions,39634,,,,,,,,,https://www.findlay.edu/academics/undergraduate,,,1421.0,False,False,,4.0,2.5,,,,,,,,,,,0,,,,,,,False,False,,,95.0,112.0,,,6.0,,,50.0,,61.0,,,,,,,,,,,"up to $19,000",,"Merit-based, Endowed, Donor-Funded, Athletic",,,,,,,
,Art Management,,,,,BA,"Fall, Spring",,,Rolling Admissions,Not Required,Not Required,Not Required,"International students must provide proof of English proficiency. This can be met by submitting one of the following: TOEFL iBT score of 61, IELTS score of 6.0, PTE score of 50, Duolingo English Test score of 95, or completion of ELS Language Center's Level 112.","To be considered for admission to the University of Findlay, we ask that you please submit the following: 1. A completed application for undergraduate admission. Apply online for free at findlay.edu/apply. 2. Official high school transcripts. Your high school counselor can submit your transcript electronically or mail it to the Office of Admissions. Findlay has a test-optional admission policy. Students may submit ACT or SAT test scores, but they are not required for the basis of admission.",Not Required,,True,False,False,False,False,False,False,False,False,False,False,False,False,False,False,False,,,,Office of Admissions,39814,,,,,,,"The Art Management major is designed for the student who loves art and has an aptitude for business. This degree combines art courses with business and communication courses to prepare students for entry-level positions in museums, galleries, non-profit arts organizations and auction houses.",,https://www.findlay.edu/academics/undergraduate,,,1390.0,False,False,,4.0,2.0,,,,,,,,,,,0,,,,,,,False,False,,,95.0,112.0,,,6.0,,,50.0,,61.0,,,,,,,,,,,"Up to $20,000",,"Merit-based, Talent-based, Endowed",,,,,,,
,Art Teacher Education,,,,,BA,"Fall, Spring",,August 1,Rolling Admissions,Not Required,Not Required,Not Required,"Proof of English Proficiency is required for international undergraduate applicants. One of the following must be submitted: TOEFL (61 iBT or 500 PBT), IELTS (6.0), PTE Academic (50), Duolingo (95), or ELS (level 112).","To apply, prospective students must submit an online application and official high school transcripts. The University of Findlay has a test-optional policy, meaning the submission of ACT or SAT scores is optional for admission.",Not Required,,True,False,False,False,False,False,False,False,False,False,False,False,False,False,False,False,,,,Office of Admissions,39594,,,,,,,"As a visual arts education major, you will be prepared to teach art to students in grades pre-K through 12. You will complete the requirements for a Bachelor of Arts in Visual Arts as well as the professional education coursework required for the Multi-Age Visual Arts License.",,https://www.findlay.edu/academics/undergraduate,The University of Findlay’s Art Program is accredited by the National Association of Schools of Art and Design (NASAD).,,1100.0,False,False,,4.0,2.5,,,,,,,,,,,0,,,,,,,False,False,,,95.0,112.0,,,6.0,,,50.0,,61.0,,,,,,,,,,,"Up to $20,000 per year",,"Merit-based, Talent-based, Endowed",,,,,,,
,Biochemistry,,,,,BS,"Fall, Spring",,August 1,Rolling admissions,Not Required,Not Required,Not Required,Applicants for whom English is not their native language must provide proof of English language proficiency. Acceptable tests and minimum scores include: TOEFL Internet-based (iBT): 61; TOEFL Paper-based (PBT): 500; IELTS: 6.0; PTE Academic: 50; Duolingo English Test: 95; ELS Language Center: Successful completion of Level 112.,"To apply for admission to the University of Findlay, applicants must submit the following: Application for Admission and an Official High School Transcript. The University of Findlay is test-optional, which means applicants may choose to submit their ACT or SAT scores, but it is not required for admission or scholarships.",Not Required,,True,False,False,False,False,False,False,False,False,False,False,False,False,False,False,False,,,,Office of Admissions,39232,,,,,,,"The biochemistry major prepares students for graduate study in biochemistry and related fields; professional school (medicine, dentistry, pharmacy, or veterinary medicine); or entry-level positions in clinical, industrial, or government laboratories.",,https://findlay.smartcatalogiq.com/en/current/undergraduate-catalog/major-requirements/college-of-sciences/department-of-physical-sciences/chemistry-chem/biochemistry-bs,,,1050.0,False,True,,4.0,2.0,,,,,,,,,,,0,,,,,,,False,False,,,95.0,112.0,,,6.0,,,50.0,,61.0,,,,,,,,,,,Up to full tuition,Up to 100%,"Merit-based, Need-based, Talent-based, Athletic",,,,,,,
,Biblical Studies,,,,,BA,"Fall, Spring",,,,Not Required,Not Required,Not Required,Students must submit one of the following to demonstrate English proficiency: Official TOEFL score of 61 iBT (internet-based test) or 500 PBT (paper-based test); Official IELTS score of 6.0; Official Pearson Test of English (PTE) Academic score of 50; Official Duolingo score of 95; Successful completion of ELS level 112.,"Application Requirements for First-Time Freshmen include: a completed Application for Admission and Scholarships, an official High School Transcript, and optional ACT/SAT Test Scores.",Not Required,,True,False,False,False,False,False,False,False,False,False,False,False,False,False,False,False,,,,Office of Admissions,39528,,,,,,,"Religious studies is an academic discipline that looks at religious beliefs, behaviors and institutions. It describes, compares, interprets and explains religion, emphasizing systematic, historically based, and cross-cultural perspectives. Students in the religious studies program at the University of Findlay are prepared for a variety of careers including: Social work, Non-profit sector, Journalism, Law, Ministry, Graduate school.",,https://www.findlay.edu/arts-humanities-social-sciences/religious-studies/religious-studies,,,1137.0,False,False,,4.0,2.0,,,,,,,,,,,0,,,,,,,False,False,,,95.0,112.0,,,6.0,,,50.0,,61.0,,,,,,,,,,,"Up to $19,000 per year",,"Merit-based, Need-based, Departmental",,,,,,,
,Bilingual and Multicultural Education,,,,,Minor,"Fall, Spring, Summer",,,,Not Required,Not Required,Not Required,"Students from non-English speaking countries must provide proof of English proficiency. This can be done by providing a score from one of the following: TOEFL: 61 iBT, IELTS: 6.0, PTE: 50, Duolingo (DET): 95, iTEP: 3.5, ELS: Completion of Level 112.","To complete your application for admission, you'll need to submit the following: High school transcript or GED results.",Not Required,,True,False,False,False,False,False,False,False,False,False,False,False,False,False,False,False,,,,Office of Admissions,39292,,,,,,,"In the TESOL and Bilingual Education program, you will explore the relationship between language and culture and its impact on learning. You also will have the chance to create and execute lessons in the field. This program prepares you to teach English learners in a variety of contexts.",,https://www.findlay.edu/academics/undergraduate,The College of Education is accredited by the Council for the Accreditation of Educator Preparation (CAEP).,,1424.0,False,False,,4.0,2.75,,,,,,,,,,,0,,,,,,,False,False,,,95.0,112.0,,,6.0,,,50.0,,61.0,,,,,,,,,,,"up to $21,000",,"Merit-based, Talent, Legacy",,,,,,,
