,Bachelor of Arts in Germanic and Slavic Languages and Literatures – German Studies Concentration,,,,,,,,,,Optional,Required,Not Required,True,"Admission to this major is open to any UNC Charlotte student in good academic standing with a GPA of 2.00 or better. For general university admission, in addition to your academic record, UNC Charlotte considers standardized test scores (if you choose to submit them), essay, and your extracurricular activities and what you’ve accomplished outside of the classroom.",Not Required,,True,True,False,False,False,False,,False,False,False,False,False,False,False,False,False,,,,College of Liberal Arts & Sciences,"$7,490/Year (NC Resident), $22,726/Year (Non-Resident)",,,,,,German Studies Concentration,"The Bachelor of Arts in Germanic and Slavic Languages and Literatures provides a strong background in German language, literature, and culture, while also giving students an opportunity to study a Slavic language and culture. The German Studies Concentration offers students an in-depth study of German language, literature, and culture (including film, history, and contemporary society) while also allowing them to study Russian, a related language, and its culture. Through a strong program of study, students develop advanced German language skills, critical thinking abilities, and an appreciation for other cultures. The program prepares students for careers in fields such as business, education, government, translation, and international relations, or for continued study in graduate school. Students have the opportunity to study abroad, participate in internships, and engage in undergraduate research.",,https://catalog.unc.edu/undergraduate/programs-study/,,,"$289.00/Credit Hour (NC Resident), $846.00/Credit Hour (Non-Resident)",,False,,4.0,2.0,,,,,,,,,,,7490,,,,,,,False,False,,,115.0,,,,6.5,,,59.0,,83.0,,,,,,,,,,,,,"Merit-based, Need-based, Special Talent",,,,,,,
,Bachelor of Arts in Germanic and Slavic Languages and Literatures – Russian Language and Culture Concentration,,,,,,Fall 2026,,,,,,Not Required,True,,,,,,False,False,False,False,,False,False,False,False,False,False,False,False,False,,,,College of Liberal Arts & Sciences,,,,,,,Russian Language and Culture Concentration,"The Bachelor of Arts in Germanic and Slavic Languages and Literatures is a degree program designed to provide students with advanced proficiency in German or Russian, as well as a comprehensive understanding of the literature, history, and culture of the German-speaking and Russian-speaking worlds. The program aims to foster critical thinking, analytical skills, and cross-cultural competence, preparing students for careers in diverse fields such as education, international business, diplomacy, translation, and graduate studies. Students choose one of two concentrations: German Language and Culture or Russian Language and Culture. Both concentrations emphasize rigorous language training complemented by in-depth study of relevant literary, historical, and cultural topics. Through immersive coursework and opportunities for study abroad, students develop a nuanced appreciation for linguistic and cultural diversity, equipping them to engage effectively with global challenges and opportunities.",,https://catalog.unc.edu/undergraduate/programs-study/,,,,,,,4.0,2.0,,,,,,,,,,,,,,,,,,,,,,105.0,112.0,,,6.0,,,50.0,,70.0,,,,,,,,,,,,,,,,,,,,
,Bachelor of Arts in Germanic and Slavic Languages and Literatures – Slavic and East European Studies Concentration,,,,,,,,,,Not Required,Required,Not Required,True,"To apply for first-year admission, applicants must submit an online application (via the Future 49er Portal, Common App, or CFNC), a non-refundable application fee, and an official high school transcript. A personal essay is also required. UNC Charlotte is test-optional for first-year applicants for Spring 2024 and Fall 2024 terms, meaning applicants can choose whether or not to submit ACT or SAT test scores.",Not Required,,True,False,False,False,False,False,,False,False,False,False,False,False,False,False,False,,,,College of Humanities & Earth and Social Sciences,,,,,,,Slavic and East European Studies Concentration,"The Bachelor of Arts in Germanic and Slavic Languages and Literatures offers concentrations in German Studies, Russian Studies, and Slavic and East European Studies. All concentrations include instruction in the relevant languages, literatures, and cultures in depth, as well as an interdisciplinary exploration of the region’s history, politics, and related fields. In all concentrations, students are encouraged to participate in study abroad programs in Germany, Russia, or other relevant countries in order to achieve the necessary linguistic proficiency and cultural competency.",,https://catalog.unc.edu/undergraduate/programs-study/,,,,,False,,4.0,2.0,,,,,,,,,,,,,,,,,,False,False,,,105.0,112.0,,,6.0,,,50.0,,70.0,,,,,,,,,,,,,"University-wide scholarships, college-specific scholarships, departmental scholarships, Merit scholarships",,,,,,,
,Bachelor of Arts in Global Studies,,,,,,Fall 2026,,,,,,Not Required,True,,,,,,False,False,False,False,,False,False,False,False,False,False,False,False,False,,,,College of Liberal Arts & Sciences,"NC Resident: $5,162.98/Semester; Non-NC Resident: $11,986.98/Semester",,,,,,,"The Bachelor of Arts in Global Studies offers students a deep and critical understanding of the forces and factors that shape the interconnected contemporary world. The program is inherently interdisciplinary, drawing on a range of humanities and social science fields to provide a comprehensive approach to global issues. Students choose one of seven concentrations, each allowing for a more in-depth study of a particular region or cross-cutting theme. In all concentrations, students will cultivate critical thinking, communication, and research skills through rigorous coursework, foreign language study, and experiential learning opportunities. All students complete a required study abroad or international internship experience, equipping them with practical intercultural skills and knowledge. The program prepares students for careers in government, non-governmental organizations (NGOs), international business, and education, as well as for graduate study in related fields.",,https://catalog.unc.edu/undergraduate/programs-study/,,,NC Resident: $423.83/Credit; Non-NC Resident: $992.50/Credit,,,,4.0,2.0,,,,,,,,,,,"NC Resident: $5,162.98/Semester; Non-NC Resident: $11,986.98/Semester",,,,,,,,,,,105.0,112.0,,,6.0,,,50.0,,70.0,,,,,,,,,,,,,,,,,,,,
,Bachelor of Arts in Haitian Creole,,,,,,Fall 2026,,,,,,,,,,,,,False,False,False,False,,False,False,False,False,False,False,False,False,False,,,,,,,,,,,,,,https://catalog.unc.edu/undergraduate/programs-study/,,,,,,,4.0,2.0,,,,,,,,,,,,,,,,,,,,,,,,,,,,,,,,,,,,,,,,,,,,"Merit-based, Need-based",,,,,,,
,Bachelor of Arts in Hindi-Urdu,,,,,,,,,,,,Not Required,True,,,,,,False,False,False,False,,False,False,False,False,False,False,False,False,False,,,,College of Liberal Arts & Sciences,,,,,,,,"The Hindi-Urdu program at UNC Charlotte offers students the opportunity to learn modern standard Hindi and Urdu, the two most prominent languages of South Asia, and gain familiarity with the cultures of the Hindi-Urdu speaking world. These languages are grammatically very similar; the main difference is their writing systems, which are respectively Devanagari and Perso-Arabic. The Hindi-Urdu major can lead to a Bachelor of Arts (B.A.) degree, while the minor can complement a major in another discipline such as political science, history, international studies, or religious studies. With around half a billion speakers, Hindi-Urdu is the fourth most commonly spoken language in the world, and there is a growing demand for trained professionals with knowledge of Hindi-Urdu in fields such as business, foreign service, education, and social work. Our program offers five levels of language training as well as courses in culture and literature, making it among the most comprehensive Hindi-Urdu programs in the southeastern United States.",,https://languages.charlotte.edu/student-opportunities/scholarships/,,,,,,,4.0,,,,,,,,,,,,,,,,,,,,,,,105.0,112.0,,,6.0,,,50.0,,70.0,,,,,,,,,,,$500 - $1000,,"Merit-based, Need-based",,,,,,,
,Bachelor of Arts in History,,,,,,Fall 2026,,,,,,Not Required,True,,,,,,False,False,False,False,,False,False,False,False,False,False,False,False,False,,,,College of Humanities & Earth and Social Sciences,,,,,,,,"The Bachelor of Arts in History program exposes students to a wide range of human experience and helps them develop skills fundamental to any profession requiring clear thinking and communication. The curriculum emphasizes analytical and interpretive skills; understanding of political, social, economic, and cultural change; and appreciation of diverse cultures and perspectives on the human past. The program also supports the discovery and exploration of intellectual passions that are the hallmarks of a liberally educated individual. The history curriculum is global in scope, allowing students to explore the human past in all parts of the world, from antiquity to the present. The department offers courses in U.S., European, Asian, African, Latin American, and Middle Eastern history, as well as courses in historical methodologies. Additionally, students can take advantage of numerous internship and study abroad opportunities, including the Public History Internship, which provides hands-on experience in museums, archives, and historical sites. An interdisciplinary minor in Public History is also available. Graduates of the program are well-prepared for diverse career paths, including teaching, law, public service, journalism, business, archival and museum work, or graduate study in history and related fields.",,https://catalog.unc.edu/undergraduate/programs-study/,,,,,,,4.0,2.0,,,,,,,,,,,,,,,,,,,,,,105.0,112.0,,,6.0,,,48.0,,70.0,,,,,,,,,,,,,"Merit-based, Need-based",,,,,,,
,Bachelor of Arts in Latin American Studies,,,,,,Fall 2026,,,,Not Required,Required,Not Required,True,"First-year applicants must submit: an application for admission and application fee, an official high school transcript, and an essay. The submission of official SAT or ACT scores is optional for most applicants.",Not Required,,True,True,False,False,False,False,,False,False,False,False,False,False,False,False,False,,,,College of Humanities & Earth and Social Sciences,,,,,,,,"Latin American Studies (LTAM) is an interdisciplinary program that investigates the history, cultures, politics, and social dynamics of Latin America and the Caribbean from the pre-colonial period to the present. The program is designed to provide students with a comprehensive understanding of the diverse societies and cultures of the region, as well as the historical and contemporary challenges and opportunities they face. Students will develop critical thinking skills, cross-cultural understanding, and proficiency in Spanish or Portuguese. Graduates of the Latin American Studies program are prepared for a wide range of careers in fields such as international relations, government, non-profit organizations, education, journalism, and business, as well as for graduate study in Latin American Studies or related disciplines.",,https://catalog.unc.edu/undergraduate/programs-study/,,,,,False,,4.0,2.0,,,,,,,,,,,,,,,,,,False,False,,,110.0,112.0,,,6.0,,,48.0,,70.0,,,,,,,,,,,,,"Merit-based, Need-based",,,,,,,
,"Bachelor of Arts in Linguistics, Interpretation, and Translation",,,,,B.A.,,,,,,,Not Required,True,,,,,,False,False,False,False,,False,False,False,False,False,False,False,False,False,,,,College of Humanities & Earth and Social Sciences,,,,,,,,"The Bachelor of Arts in Linguistics, Interpretation, and Translation (LIT) offers an interdisciplinary approach to the study of language and communication. It combines theoretical and applied linguistics, the science of interpreting and translation, and cross-cultural communication to prepare students for careers in diverse professional fields. The program emphasizes global literacy, critical thinking, and effective communication, equipping graduates with the skills necessary to navigate complex linguistic and cultural landscapes. Through rigorous coursework, practical training, and experiential learning opportunities, students develop proficiency in at least one foreign language (Spanish, German, French, or Japanese), gain a deep understanding of linguistic structures, acquire interpreting and translation techniques, and cultivate an appreciation for linguistic and cultural diversity. The program is designed to provide a solid foundation for those interested in pursuing graduate studies in linguistics, interpreting, translation, or related fields, as well as for those seeking immediate employment in areas such as diplomacy, international business, healthcare, legal services, community outreach, and education.",,https://catalog.unc.edu/undergraduate/programs-study/,,,,,,,4.0,2.0,,,,,,,,,,,,,,,,,,,,,,115.0,112.0,,,6.0,,,50.0,,70.0,,,,,,,,,,,,,Merit-based,,,,,,,
,Bachelor of Arts in Media and Journalism,,,,,,Fall 2026,,,,,,Not Required,True,,,,,,False,False,False,False,,False,False,False,False,False,False,False,False,False,,,,College of Liberal Arts & Sciences,,,,,,,"Digital Video and Film, Journalism, Public Relations, Sports Communication","The Bachelor of Arts in Media and Journalism provides students with a strong liberal arts education and professional training for careers in a wide array of media and media-related fields, including journalism, public relations, digital media production, sports communication, and advertising. Graduates are prepared for positions in news organizations (print, broadcast, and online), public relations and strategic communication firms, corporate communication departments, advertising agencies, production companies, and other media-focused enterprises. Students develop critical thinking skills, ethical decision-making abilities, and professional competencies in areas such as writing, editing, visual storytelling, multimedia production, strategic communication planning, and media analytics.",,https://catalog.unc.edu/undergraduate/programs-study/media-journalism-major-ba/,,,,,,,4.0,2.0,,,,,,,,,,,,,,,,,,,,,,100.0,112.0,,,6.0,,,50.0,,70.0,,,,,,,,,,,,,"Merit-based, financial need, or other criteria",,,,,,,
,Bachelor of Arts in Music,,,,,,,,,,Not Required,Not Required,Not Required,True,"Admission to the Department of Music is a two-part process. First, students must apply for admission to the University through the UNC Charlotte Undergraduate Admissions Office. Second, students must complete an online Music Application and a performance audition on a primary instrument or voice. Auditions are held on campus on specific dates (see music.charlotte.edu for details). Admission to the University does not guarantee admission to the Department of Music. Music majors must successfully pass a performance audition to be accepted into the program.",Not Required,,True,False,False,False,False,False,,False,False,False,False,False,False,False,False,False,,,,College of Arts + Architecture,,,,,,,,"The Bachelor of Arts in Music (BA) is designed for students seeking a broad education in music within a liberal arts context. This degree allows students to pursue their interests in music while also exploring other academic disciplines. The program provides a strong foundation in music theory, history, and performance, preparing students for diverse careers in music, further graduate study, or a range of professions that value critical thinking, creativity, and interdisciplinary understanding.",,https://catalog.unc.edu/undergraduate/programs-study/,,,,,False,,4.0,2.0,,,,,,,,,,,,,,,,,,False,False,,,110.0,112.0,,,6.0,,,50.0,,70.0,,,,,,,,,,,,,"Merit-based scholarships, Need-based scholarships",,,,,,,
,Bachelor of Arts in Music History and Literature,,,,,B.A.,Fall 2026,,,,,,Not Required,True,,,,,,True,True,False,False,,True,False,False,False,True,True,True,False,False,,,,College of Arts + Architecture,"$4,421/Year (In-State); $18,698/Year (Out-of-State)",,,,,,Music History & Literature,"The Music History & Literature Concentration is for students who want to explore music through a humanities-based approach. It emphasizes the study of music history, theory, and cultural contexts, preparing students for graduate study, careers in arts administration, or other fields requiring strong research and writing skills.",,https://coaa.charlotte.edu/music/,The Department of Music is an accredited institutional member of the National Association of Schools of Music (NASM).,,$307.20/credit (In-State); $901.95/credit (Out-of-State),,,,4.0,2.0,79%,,,,,,,,,,"$2,951.90/Year",,,,,,,,,,,105.0,112.0,,,6.0,,,50.0,,70.0,,,,,,,,,,,"Awards range from $1,000 to $4,000 per year",,Talent-based,,,,,,,
,Bachelor of Arts in North American Studies,,,,,,Fall 2026,,,,,,Not Required,True,,,,,,False,False,False,False,,False,False,False,False,False,False,False,False,False,,,,College of Liberal Arts & Sciences,,,,,,,,"The Bachelor of Arts in North American Studies explores the cultures, societies, and histories of Canada, Mexico, the Caribbean, and the United States, as well as the connections among them. The program emphasizes global and transnational approaches to understanding North America, providing students with critical tools to engage with the region’s diverse peoples, experiences, and contexts. The program offers an interdisciplinary approach to North American Studies, drawing on courses from a range of fields, including Africana Studies, Anthropology, Communication Studies, Criminal Justice, English, Geography and Earth Sciences, Global Studies, History, Languages and Culture Studies, Latin American Studies, Political Science, Psychology, Religious Studies, Sociology, and Women's and Gender Studies. The program offers students an opportunity to learn about North America in historical and contemporary contexts, preparing them for careers in government, journalism, education, NGOs, and the private sector. The program also offers students the opportunity to conduct original research on a topic of their choice and to engage with community partners through internships and other experiential learning opportunities.",,https://catalog.unc.edu/undergraduate/programs-study/,,,,,,,4.0,2.0,,,,,,,,,,,,,,,,,,,,,,105.0,112.0,,,6.0,,,50.0,,70.0,,,,,,,,,,,,,"Merit-based scholarships, need-based grants",,,,,,,
,"Bachelor of Arts in Peace, War, and Defense",,,,,,,,,,,,Not Required,True,,,,,,False,False,False,False,,False,False,False,False,False,False,False,False,False,,,,College of Liberal Arts & Sciences,,,,,,,,"The Bachelor of Arts in Peace, War, and Defense provides students with an interdisciplinary understanding of the causes of war and peace. Students learn about the role of diplomacy, international law, and conflict resolution in preventing and resolving conflicts, as well as the history, theory, and practice of warfare. The program also examines the social, political, economic, and cultural factors that contribute to conflict and cooperation between states and non-state actors. Students in the program develop critical thinking, analytical, and communication skills necessary for careers in government, non-governmental organizations, international organizations, and the private sector, as well as for graduate study in related fields. The program is housed in the Department of Political Science and Public Administration.",,https://catalog.unc.edu/undergraduate/programs-study/,,,,,,,4.0,2.0,,,,,,,,,,,,,,,,,,,,,,105.0,112.0,,,6.0,,,50.0,,70.0,,,,,,,,,,,,,"Merit-based, Need-based",,,,,,,
,Bachelor of Arts in Philosophy,,,,,,Fall 2026,,,,,,Not Required,True,,,,,,False,False,False,False,,False,False,False,False,False,False,False,False,False,,,,College of Liberal Arts & Sciences,,,,,,,,"Philosophy provides an excellent liberal arts education by developing critical thinking, argumentative, analytical, and writing skills. These skills are highly valued by employers, graduate programs, and professional schools. Students in the Philosophy B.A. program study topics in ethics, logic, metaphysics, epistemology, social and political philosophy, aesthetics, and the history of philosophy, among others. Students will learn to analyze complex concepts, evaluate arguments, and construct well-reasoned positions on fundamental questions.",,https://catalog.unc.edu/undergraduate/programs-study/,,,,,,,4.0,2.0,,,,,,,,,,,,,,,,,,,,,,115.0,112.0,,,6.0,,,50.0,,70.0,,,,,,,,,,,,,"Merit-based, Need-based",,,,,,,
,Bachelor of Arts in Political Science,,,,,,Fall 2026,,,,,,Not Required,True,,,,,,False,False,False,False,,False,False,False,False,False,False,False,False,False,,,,College of Humanities & Earth and Social Sciences,"$7,624/Year (in-state), $21,766/Year (out-of-state)",,,,,,"International Relations, Public Policy","The Bachelor of Arts in Political Science is designed for students interested in studying the theory and practice of government and politics. This program examines political ideas, institutions, policies, and behavior, both domestically and internationally. Students will develop critical thinking skills, research abilities, and a deep understanding of political systems, preparing them for careers in government, non-profit organizations, law, journalism, business, or for further graduate study.",,https://research.com/degrees/best-online-political-science-degree-programs,,,"$373.52/credit (in-state), $999.67/credit (out-of-state)",,,,4.0,2.0,,,,,,,,,,,"$7,624/Year (in-state), $21,766/Year (out-of-state)",,,,,,,,,,,105.0,112.0,,,6.0,,,50.0,,70.0,,,,,,,,,,,,,"Merit-based, Need-based",,,,,,,
,Bachelor of Arts in Public Policy Analysis,,,,,,,,,,,,Not Required,True,,,,,,True,True,False,False,,True,False,False,False,True,True,True,False,False,,,,College of Liberal Arts & Sciences,"$7,409 (In-state, Annual), $22,860 (Out-of-state, Annual)",,,,,,,"The Public Policy Analysis, B.A. is an interdisciplinary program designed to prepare students for careers in public, private, and non-profit organizations that focus on the analysis, development, and implementation of public policies. Students will gain a strong foundation in economic, political, and social theories, as well as quantitative and qualitative research methods essential for effective policy analysis. The program emphasizes critical thinking, ethical decision-making, and communication skills necessary to address complex societal challenges. Graduates will be equipped to evaluate policy alternatives, contribute to evidence-based policy making, and advocate for policy changes that promote social welfare.",,https://catalog.unc.edu/undergraduate/programs-study/,,,"$211.00 (In-state, part-time), $923.00 (Out-of-state, part-time)",,,,4.0,2.0,,,,,,,,,,,7409,,,,,,,,,,,105.0,112.0,,,6.0,,,50.0,,70.0,,,,,,,,,,,,,"Merit-based, Need-based",,,,,,,
,Bachelor of Arts in Religious Studies,,,,,,Fall 2026,,,,,,Not Required,True,,,,,,False,False,False,False,,False,False,False,False,False,False,False,False,False,,,,College of Humanities & Earth and Social Sciences,"In-State: $7,376/year; Out-of-State: $20,972/year (based on 2023-2024 rates)",,,,,,,"The Bachelor of Arts (B.A.) in Religious Studies is designed to expose students to a variety of religious traditions, regions, and theoretical approaches. Students will develop critical thinking and analytical skills, as well as an understanding of the diversity of human cultures and beliefs. Our graduates are well-prepared for careers in fields such as education, journalism, public service, and non-profit organizations, as well as for further graduate study in religious studies or related disciplines. The B.A. program in Religious Studies provides students with an academic and non-sectarian approach to understanding the diverse roles of religion in human cultures, both past and present. Through rigorous coursework, students develop a range of valuable skills, including critical thinking, analytical reasoning, research, and written and oral communication. These skills are highly valued by employers in a wide array of fields and provide excellent preparation for graduate study in a variety of disciplines.",,https://www.educations.com/bachelors-degree/humanities-studies/north-america/distance-learning,,,In-State: $145.50/credit hour (tuition only); Out-of-State: $731.50/credit hour (tuition only) (based on 2023-2024 rates),,,,4.0,2.0,79.5% (Fall 2023),,,,,,,,,,,,,,,,,,,,,105.0,112.0,,,6.0,,,50.0,,70.0,,,,,,,,,,,,,"Merit-based, Need-based, Major-specific",,,,,,,
