,Minor in African Studies,,,,,,Fall 2026,,,,Not Required,Not Required,Not Required,,"To declare a minor in Africana Studies, students should see the Africana Studies undergraduate coordinator. The Africana Studies minor consists of 18 credit hours. Students must complete all coursework for the minor with a grade of C or above.",Not Required,,True,False,False,False,False,False,,False,False,False,False,False,False,False,False,False,,,,College of Liberal Arts & Sciences,,,,,,,,"The African Studies minor is an interdisciplinary program designed to give undergraduate students a broad understanding of the African continent and its diverse peoples, cultures, and institutions. The program helps students develop analytical tools to understand the historical and contemporary challenges facing African societies and their relationships with the global community.
Students who pursue the minor will take courses across disciplines, including Anthropology, Art and Art History, Communication Studies, Dance, English, History, Languages and Culture Studies, Music, Political Science and International Studies, Religious Studies, and Sociology.
The minor requires 18 credit hours, including a 3-credit core course and 15 credit hours of electives from an approved list of courses. At least nine of the 15 elective credits must be at the 3000-level or above. Students must maintain a minimum GPA of 2.0 in courses counted toward the minor. For more information, please contact Dr. Dylan Craig, Director of the African Studies minor.",,https://catalog.unc.edu/undergraduate/programs-study/,,,"$318.25/credit hour (NC Resident), $1,586.33/credit hour (Non-NC Resident)",,False,,4.0,2.0,,,,,,,,,,,"$3,819.00/Year (NC Resident), $19,036.00/Year (Non-NC Resident)",,,,,,,False,False,,,,,,,,,,,,,,,,,,,,,,,,,"Merit-based, Need-based",,,,,,,
,Minor in American Indian and Indigenous Studies,,,,,,Fall 2026,,,,Not Required,Not Required,Not Required,False,"To declare a minor, a student must be in good academic standing (2.0 GPA) and complete a Change of Major/Minor form with their major advisor or in the college that houses their major.",Not Required,,True,False,False,False,False,False,,False,False,False,False,False,False,False,False,False,,,,College of Liberal Arts & Sciences,,,,,,,,"The American Indian and Indigenous Studies (AIIS) Minor at UNC Charlotte is an interdisciplinary minor designed to provide students with a foundational knowledge of the diverse cultures, histories, literatures, social issues, and political sovereignty of Indigenous peoples across the Americas. The minor offers students the opportunity to learn from multiple perspectives (humanities, social sciences, health, education, arts, and languages) and to engage in critical analysis and thoughtful discussions regarding topics such as tribal sovereignty, cultural revitalization, environmental justice, health disparities, and the ongoing impacts of colonialism. The AIIS minor prepares students to engage effectively and ethically with Indigenous communities and to advocate for social justice in diverse professional fields and graduate programs. It complements a wide range of majors including, but not limited to, Anthropology, Communication Studies, Criminal Justice, Education, English, History, International Studies, Political Science, Public Health, Psychology, Social Work, Sociology, and Women’s and Gender Studies.",,"https://www.google.com/search?q=time+in+Charlotte,+NC,+US",,,,,False,,4.0,2.0,,,,,,,,,,,,,,,,,,False,False,,,,,,,,,,,,,,,,,,,,,,,,,,,,,,,,
,Minor in American Studies,,,,,,,,,,Not Required,Not Required,Not Required,False,Undergraduate students in good academic standing are eligible to apply.,Not Required,,True,False,False,False,False,False,,False,False,False,False,False,False,False,True,False,,,,College of Humanities & Earth and Social Sciences,,,,,,,,"The American Studies minor is an interdisciplinary program designed to give students a broad understanding of the United States. Through the minor, students learn to critically analyze the many dimensions of American culture, including its history, literature, arts, and social movements. Students learn to use different disciplinary approaches (from fields such as history, English, political science, sociology, religious studies, and art history) to examine American life. The minor encourages students to consider the complexity of American culture, its diversity, and its place in the world. The American Studies minor helps students to develop skills in critical thinking, research, and communication, which are valuable in a wide range of careers.",,https://academics.charlotte.edu/program/american-studies-minor-on-campus-online/,,5041,,,False,,4.0,2.0,79.2% (Fall 2023),801-850,,,,,,,,,,,,,,,,False,False,,,,,,,,,,,,,,,,,,,,,,,,,"Merit-based, Need-based, Departmental",,,,,,,
,Minor in Anthropology,,,,,Minor,Fall 2026,,,,,,Not Required,False,,,,,,False,False,False,False,,False,False,False,False,False,False,False,False,False,,,,College of Humanities & Earth and Social Sciences,,,,,,,,"The Anthropology minor provides students with a broad background in the subfields of cultural anthropology, archaeology, biological anthropology, and linguistic anthropology. An anthropology minor offers students an understanding of human diversity across time and space. The minor consists of 18 credit hours of anthropology courses, including 6 credits of core courses and 12 credits of electives. The minor is appropriate for students in any major, as anthropology courses complement a wide range of academic interests. For example, students interested in international relations, human health, social justice, or cultural heritage could benefit greatly from the coursework in this minor.",,https://catalog.unc.edu/undergraduate/programs-study/,,,,,,,4.0,2.0,,,,,,,,,,,,,,,,,,,,,,,,,,,,,,,,,,,,,,,,,,,,"Scholarships, grants, loans, and work-study",,,,,,,
,Minor in Applied Sciences and Engineering,,,,,,,,,,,,Not Required,False,,,,,,False,False,False,False,,False,False,False,False,False,False,False,False,False,,,,The William States Lee College of Engineering,,,,,,,,"The Applied Sciences and Engineering Minor provides an interdisciplinary program of study open to students from all colleges. The Minor provides opportunities for students to learn how to apply the scientific method and engineering principles to solve real-world problems. The coursework and project-based learning experiences are designed to enhance students’ critical thinking skills, problem-solving abilities, creativity, innovation, and teamwork. Students who complete the Minor will be well-prepared for a variety of careers in industry, government, and academia, as well as for further graduate study in science and engineering.",,https://catalog.unc.edu/undergraduate/programs-study/,,,,,,,4.0,2.0,,,,,,,,,,,,,,,,,,,,,,,,,,,,,,,,,,,,,,,,,,,,,,,,,,,
,Minor in Arabic,,,,,,,,,,,,Not Required,False,,,,,,False,False,False,False,,False,False,False,False,False,False,False,False,False,,,,College of Humanities & Earth and Social Sciences,,,,,,,,"The Minor in Arabic Studies focuses on the language, literature, and culture of the Arab world. The program also provides insights into the religions and societies of Arabic-speaking people and addresses current issues and challenges in the Arab world. Students completing the Minor in Arabic Studies will be able to demonstrate: Proficiency in Arabic language at an intermediate level, Knowledge of the history, societies, and cultures of Arabic-speaking people, Understanding of Arab literature and intellectual traditions.",,https://languages.charlotte.edu/programs/undergraduate-programs/arabic-studies-minor/,,,,,,,4.0,2.0,,,,,,,,,,,,,,,,,,,,,,,,,,,,,,,,,,,,,,,,,,,,"Language Study, Study Abroad",,,,,,,
,Minor in Archaeology,,,,,,Fall 2026,,,,Not Required,Not Required,Not Required,,"Students can declare the Minor in Archaeology at any time. Students should declare the minor as early as possible in order to receive proper advising. To declare the minor, students should contact the program coordinator.",Not Required,,True,False,False,False,False,False,,False,False,False,False,False,False,False,False,False,,,,College of Liberal Arts & Sciences,,,,,,,,"Archaeology is the study of human societies through material culture, focusing on societies and their interactions across time and space. The interdisciplinary minor in Archaeology introduces students to the principles, methods, and theories of archaeology while providing them with a historical and comparative understanding of the material record of human cultural adaptation. The minor examines major trends in world archaeology, from the beginnings of human culture to the more recent past. A variety of courses are offered, ranging from Old World archaeology (e.g., Egyptian, Near Eastern, Greek and Roman) to New World archaeology (e.g., North, Middle, and South America). The minor also provides courses on the history of archaeology, archaeological methods, and archaeological theory. Students are encouraged to develop their interests through electives and experiential learning in the field or laboratory.",,https://catalog.unc.edu/undergraduate/programs-study/,,,,,False,,4.0,2.0,,,,,,,,,,,,,,,,,,False,False,,,,,,,,,,,,,,,,,,,,,,,,,"Merit-based, Need-based",,,,,,,
,Minor in Art History,,,,,,,,,,Not Required,Not Required,Not Required,False,Students who wish to declare a Minor in Art History must have a GPA of at least 2.0. The minor is declared online.,Not Required,,True,False,False,False,False,False,,False,False,False,False,False,False,False,False,False,,,,College of Arts + Architecture,,,,,,,,"The Minor in Art History offers an opportunity for students in any discipline to engage with the study of art, architecture, and visual culture from a global perspective. Courses focus on the analysis of visual objects, the historical contexts in which they were created, and the various ways they have been interpreted throughout history. Minors will learn research methods and theoretical approaches used in the discipline of art history while honing their skills in visual analysis, critical thinking, and written and oral communication. The minor offers flexibility for students to explore a range of art historical periods and geographies while developing a focused area of interest. Students may opt to complete an internship to gain practical experience in the field.",,https://catalog.unc.edu/undergraduate/programs-study/,,,,,False,,4.0,2.0,,,,,,,,,,,,,,,,,,False,False,,,,,,,,,,,,,,,,,,,,,,,,,Merit-based,,,,,,,
,Minor in Asian Studies,,,,,,Fall 2026,,,,Not Required,Not Required,Not Required,False,Students who wish to declare a minor in Asian Studies must meet with the program director. Students must have a minimum GPA of 2.0.,Not Required,,True,False,False,False,False,False,,False,False,False,False,False,False,False,False,False,,,,College of Liberal Arts & Sciences,,,,,,,,"The minor in Asian Studies is a sixteen (16) credit hour interdisciplinary program in Asian cultures and civilizations. The minor is sponsored by the Department of Global Studies with contributing faculty from Anthropology, Art and Art History, Dance, Geography and Earth Sciences, History, Languages and Culture Studies, and Political Science and International Studies. The minor provides students with a broad and interdisciplinary understanding of Asian cultures, history, and current events. Through its interdisciplinary approach, the minor enables students to appreciate the richness and diversity of Asian cultures from a variety of perspectives. It provides training for employment in federal, state, and local governments, international organizations, and multinational corporations and prepares students for graduate studies in international affairs.",,https://catalog.unc.edu/undergraduate/programs-study/,,,,,False,,4.0,2.0,,,,,,,,,,,,,,,,,,False,False,,,,,,,,,,,,,,,,,,,,,,,,,"Merit-based, Need-based",,,,,,,
,Minor in Baccalaureate Education in Science and Teaching (BEST),,,,,,Fall 2026,,,,,,Not Required,False,,,,,,False,False,False,False,,False,False,False,False,False,False,False,False,False,,,,Cato College of Education,"$7,623/Year (in-state), $20,859/Year (out-of-state)",,,,,,,"The Baccalaureate Education in Science and Teaching (BEST) Minor is designed to broaden STEM majors’ career opportunities by preparing them to teach high school science, mathematics, or computer science. The minor is offered for STEM majors at UNC Charlotte who desire to add high school licensure to their degree.",,https://education.charlotte.edu/academic-programs/undergraduate-degrees/,,,"$317.63/credit (in-state), $869.13/credit (out-of-state)",,,,4.0,2.75,79.4%,901-950,,,,,,,,,,,,,,,,,,,,,,,,,,,,,,,,,,,,,,,,"Up to $5,000",,"Merit-based, Need-based",,,,,,,
,Minor in Behavioral Sciences,,,,,,Fall 2026,,,,,,Not Required,False,To declare this minor a student must have a GPA of at least 2.0.,,,True,False,False,False,False,False,,False,False,False,False,False,False,False,False,False,,,,College of Liberal Arts & Sciences,,,,,,,General Concentration,"The Minor in Behavioral Science offers a single general concentration. This interdisciplinary minor allows students to apply the tools and concepts of multiple behavioral science disciplines, including psychology, sociology, anthropology, geography, political science, and economics, to analyze real-world problems. The coursework is designed to help students understand the many factors that influence individual, group, and organizational behavior, and develop critical thinking and communication skills through the study of diverse perspectives on human behavior. It complements a wide array of majors, providing students with a valuable credential and enhancing their ability to address complex issues in various professional settings, including health care, education, public policy, and business.",,https://healthpsych.charlotte.edu/concentration-areas/general/,,,$289.00/credit (in-state); $927.00/credit (out-of-state),,False,,4.0,2.0,,,,,,,,,,,,,,,,,,False,False,,,,,,,,,,,,,,,,,,,,,,,,,"Merit-based, need-based, talent-based",,,,,,,
,Minor in Biology,,,,,,Fall 2026,,,,Not Required,Not Required,Not Required,False,Students can declare this minor by using the online program declaration system in Banner Self-Service. A grade of C or above is required in all courses for the minor.,Not Required,,True,False,False,False,False,False,,False,False,False,False,False,False,False,False,False,,,,College of Science,"$7,783.00/Year (in-state); $22,847.00/Year (out-of-state)",,,,,,,The minor in biology offers a valuable credential for students majoring in other sciences or in fields requiring a fundamental knowledge of biology. The minor is also open to students in other colleges. The minor requires a minimum of 18 semester hours with a minimum GPA of 2.0 in the minor and an overall GPA of 2.0 in courses applicable to the minor. A grade of C or better is required in each course counted toward the minor.,,https://catalog.unc.edu/undergraduate/programs-study/,,,$138.89/credit (in-state tuition); $711.21/credit (out-of-state tuition),,True,,4.0,2.0,,,,,,,,,,,"$7,783.00/Year (in-state); $22,847.00/Year (out-of-state)",,,,,,,False,False,,,,,,,,,,,,,,,,,,,,,,,,,"Merit-based, special talent, or financial need",,,,,,,
,Minor in Bioinformatics,,,,,,Fall 2026,,,,,,Not Required,False,,,,,,False,False,False,False,,False,False,False,False,False,False,False,False,False,,,,College of Computing and Informatics and College of Liberal Arts & Sciences,"$7,831.50/Year (In-state) or $21,900.50/Year (Out-of-state)",,,,,,,"The Undergraduate Minor in Bioinformatics provides students with a foundational understanding of the principles, methodologies, and applications of bioinformatics. It is designed for students interested in the interdisciplinary field that combines biology, computer science, mathematics, and statistics to analyze and interpret biological data. Students pursuing this minor will gain expertise in computational tools and techniques used to manage, analyze, and visualize large biological datasets, such as genomic, proteomic, and transcriptomic data. The curriculum covers key areas including sequence alignment, phylogenetic analysis, gene expression analysis, and structural bioinformatics. This minor prepares students for careers or further studies in bioinformatics, computational biology, biotechnology, and related fields, equipping them with the necessary skills to address complex biological problems using computational approaches.",,"https://www.google.com/search?q=time+in+Charlotte,+NC,+US",,,$326.31/credit (In-state) or $912.52/credit (Out-of-state),,,,4.0,2.0,,,,,,,,,,,,,,,,,,,,,,,,,,,,,,,,,,,,,,,,,,,,"Merit-based, Need-based",,,,,,,
,Minor in Business Administration,,,,,,Fall 2026,,,,,,Not Required,False,"The Minor in Business Administration is available to students in all colleges at UNC Charlotte except the Belk College of Business. Students must meet all course prerequisites and have a minimum 2.5 overall GPA to be admitted to the minor. A minimum grade of C is required in each course in the minor.

The 18-credit hour minor requires the following courses:
ACCT 2121 Principles of Financial Accounting (3)
ECON 2101 Principles of Economics-Macro (3)
ECON 2102 Principles of Economics-Micro (3)
INFO 2130 Introduction to Business Computing (3)
MGMT 3140 Management and Organizational Behavior (3)
MKTG 3110 Principles of Marketing (3)",,,True,False,False,False,False,False,,False,False,False,False,False,False,False,False,False,,,,Belk College of Business,"NC Resident: $3,927/semester; Non-Resident: $11,895/semester (for 12+ credit hours)",,,,,,,,,https://www.colorado.edu/academics/minor-business,,,NC Resident: $213.69/credit hour; Non-Resident: $879.31/credit hour,,False,,4.0,2.5,,801-850,,,,,,,,,"NC Resident: $3,927/semester; Non-Resident: $11,895/semester (for 12+ credit hours)",,,,,,,False,False,,,,,,,,,,,,,,,,,,,,,,,,,"University-wide, College/departmental, External",,,,,,,
,Minor in Chemistry,,,,,,Fall 2026,,,,,,Not Required,False,,,,,,False,False,False,False,,False,False,False,False,False,False,False,False,False,,,,College of Liberal Arts & Sciences,,,,,,,,"A minor in Chemistry is designed for students who want to develop a fundamental understanding of chemistry, but who are not majoring in chemistry. This minor can complement a variety of majors in the College of Liberal Arts & Sciences, the College of Engineering, and the College of Health & Human Services, among others. Students will gain knowledge and skills in general, organic, and analytical chemistry, as well as an introduction to physical and inorganic chemistry concepts. The minor provides a strong foundation for students interested in careers requiring a basic understanding of chemical principles or for those considering graduate studies in interdisciplinary fields.",,https://catalog.unc.edu/undergraduate/programs-study/,,,,,,,4.0,2.0,,,,,,,,,,,,,,,,,,,,,,,,,,,,,,,,,,,,,,,,,,,,"Merit-based, Need-based",,,,,,,
,Minor in Chinese,,,,,,Fall 2026,,,,Not Required,Not Required,Not Required,True,Students who want to declare a minor in Chinese should fill out the online form.,Not Required,,True,False,False,False,False,False,,False,False,False,False,False,False,False,False,False,,,,College of Humanities & Earth and Social Sciences,,,,,,,,"The Minor in Chinese introduces students to the Chinese language and culture through a series of language, culture, and literature courses. Students must complete at least 18 hours of coursework above the 1201 level, and must earn a grade of C or above in all courses used to satisfy the requirements of the minor.",,https://languages.charlotte.edu/programs/undergraduate-majors-and-minors/,,,"In-State: $369.38, Out-of-State: $1,078.88 (Tuition & Fees per credit hour for 2023-2024)",,False,,4.0,2.0,80%,901-950,,,,,,,,,,,,,,,,False,False,,,115.0,112.0,,,6.0,,,50.0,,70.0,,,,,,,,,,,,,"Merit-based, Talent-based, Leadership-based, Need-based",,,,,,,
,Minor in Civic Life and Leadership,,,,,,,,,,,,Not Required,False,,,,,,False,False,False,False,,False,False,False,False,False,False,False,False,False,,,,College of Liberal Arts & Sciences,"$7,571.50/Year (In-state); $21,828.50/Year (Out-of-state)",,,,,,,,,https://teal.charlotte.edu/wp-content/uploads/sites/949/2023/11/Urban-Youth-and-Communities-Minor-Plan-of-Study-Fall-2023.pdf,,,$184.25/Credit (In-state tuition); $778.25/Credit (Out-of-state tuition),,,,4.0,2.0,79.5%,,,,,,,,,,"$7,571.50/Year (In-state); $21,828.50/Year (Out-of-state)",,,,,,,,,,,,,,,,,,,,,,,,,,,,,,,,,"University-wide, College-based, and Departmental scholarships",,,,,,,
,Minor in Classical Humanities,,,,,,Fall 2026,,,,,,Not Required,False,,,,,,False,False,False,False,,False,False,False,False,False,False,False,False,False,,,,College of Humanities & Earth and Social Sciences,"In-State: $7,489/year; Out-of-State: $20,805/year",,,,,,,"A Minor in Classical Studies complements almost any major and provides a strong foundation for future study in a variety of fields, including archaeology, art history, law, medicine, museum studies, and many others. Our Classical Studies program offers courses in Greek and Latin languages, Classical Literature (in translation), Greek and Roman history, archaeology, mythology, and art. Courses are taught by award-winning faculty with a wide range of expertise. A Classical Studies minor can broaden your knowledge and perspective in a variety of fields. Because Classical Studies focuses on close reading and analysis of texts, ancient authors, and historical contexts, students develop excellent critical thinking, communication, and problem-solving skills which are highly valued by employers. It is a particularly good foundation for further study in areas such as Law, Medicine, and Graduate studies in the Humanities.",,https://languages.charlotte.edu/programs/undergraduate-programs/classics/,,,"In-State: $641.75/credit hour; Out-of-State: $1,259.00/credit hour",,,,4.0,2.0,,,,,,,,,,,,,,,,,,,,,,,,,,,,,,,,,,,,,,,,,,"$2,000 to full ride",,"Merit-based, Need-based, Departmental",,,,,,,
,Minor in Climate Change,,,,,,,,,,,,Not Required,False,"To declare a minor in Climate Change, students must have a GPA of at least 2.0. A minor in Climate Change requires 18 credit hours. All courses must be passed with a grade of C or better. At least half the credit hours must be taken at UNC Charlotte. Courses taken on a Pass/No Credit basis may not be used toward the minor. Students must take courses from three categories as listed below: Required Core Courses, Climate System, and Human Dimensions.",,,True,False,False,False,False,False,,False,False,False,False,False,False,False,True,False,,,,College of Science,"In-State: $12,002/year, Out-of-State: $42,442/year (based on 2023-2024 full-time undergraduate tuition and fees)",,,,,,,"The Department of Earth and Environmental Sciences offers a minor in Earth and Environmental Sciences for students who wish to supplement their major with knowledge about the Earth System (e.g., geology, meteorology, oceanography) and the environment (e.g., pollution, environmental impacts, and natural resources).",,https://academics.charlotte.edu/program/earth-and-environmental-sciences-minor-on-campus/,,,"In-State: $500.09/credit hour, Out-of-State: $1,768.42/credit hour (2023-2024 rates)",,True,,4.0,2.0,,,,,,,,,,,,,,,,,,False,False,,,,,,,,,,,,,,,,,,,,,,,,,"Merit-based, Need-based",,,,,,,
,Minor in Coaching Education,,,,,,,,,,Not Required,Not Required,Not Required,False,"The minor in coaching education is an 18-credit hour minor offered by the Department of Kinesiology. The minor requires six (6) credit hours of required coursework, and 12 credit hours of elective coursework from an approved list of courses. A minimum GPA of 2.0 is required in the minor coursework. To declare the minor, students must have a 2.0 GPA, meet with the Minor Advisor, and complete the “Change/Add Major/Minor” form in Banner Self-Service.",Not Required,,True,False,False,False,False,False,,False,False,False,False,False,False,False,False,False,,,,College of Health and Human Services,"In-State: $7,490 per year; Out-of-State: $21,136 per year",,,,,,,"Students interested in coaching at any level benefit from Lasell's Minor in Coaching. Designed to complement any major, the Minor provides students with fundamental knowledge in sport psychology, injury prevention, strength and conditioning, and sport administration. Graduates are prepared to seek coaching positions in a variety of settings from youth sports to high school and collegiate sports. Students may also obtain national certification from the American Sport Education Program (ASEP).",,https://www.lasell.edu/academics/schools-and-programs/school-of-health-sciences/programs/health-sciences-minors/coaching-minor.html,,,In-State: $337.95; Out-of-State: $907.10,,False,,4.0,2.0,,,,,,,,,,,,,,,,,,False,False,,,,,,,,,,,,,,,,,,,,,,,,,"Merit-based, Need-based",,,,,,,
