Resume,StatementOfPurpose,Requirements,WritingSample,IsAnalyticalNotRequired,IsAnalyticalOptional,IsStemProgram,IsACTRequired,IsSATRequired,MinimumACTScore,MinimumSATScore,extraction_level,Program name,Program Page url,IsRecommendationSystemOpted,error
Not Required,Not Required,"To apply for undergraduate admission, students must submit a completed SUNY Application or Common Application, an official high school transcript, one letter of recommendation, and an application essay or personal statement. SUNY Brockport is test-optional, meaning SAT/ACT scores are not required for admission.",Not Required,True,False,True,False,False,,,program,"Earth Science Major (BA, BS)",https://www.brockport.edu/academics/catalogs/programs/,,
Not Required,Not Required,"To earn a minor in earth science, a student must complete a minimum of 18 credits in earth science courses (ESCI), including at least nine credits at the 300/400 level, with a minimum grade of C- in each course and a minimum cumulative GPA of 2.0 in the minor.",Not Required,True,False,True,False,False,,,program,Earth Science Minor,https://www.brockport.edu/academics/catalogs/programs/,,
Not Required,Not Required,Students intending to major in economics should declare their major as early as possible by contacting the department.,Not Required,True,False,False,False,False,,,program,Economics Major,https://www.brockport.edu/academics/catalogs/programs/,,
,,,,,,,,,,,error,Economics Minor,https://www.brockport.edu/academics/catalogs/programs/,,"Invalid operation: The `response.text` quick accessor requires the response to contain a valid `Part`, but none were returned. The candidate's [finish_reason](https://ai.google.dev/api/generate-content#finishreason) is 12."
,,,,,,,,,,,error,"English Major (BA, BS)",https://www.brockport.edu/academics/catalogs/programs/,,"Invalid operation: The `response.text` quick accessor requires the response to contain a valid `Part`, but none were returned. The candidate's [finish_reason](https://ai.google.dev/api/generate-content#finishreason) is 12."
Not Required,Not Required,"A minimum of 18 credits are required for the minor, at least nine of which must be taken in residence at Brockport. A minimum grade of C is required in all minor courses. The pass/fail grading option is not permitted for courses in the minor.",Not Required,True,True,False,False,False,,,program,English Minor,https://www.brockport.edu/academics/catalogs/programs/,,
Not Required,Not Required,,Not Required,True,False,False,False,False,,,program,Entrepreneurship & Innovation Minor,https://www.brockport.edu/academics/catalogs/programs/,,
,,,,,,,,,,,error,Environmental Science Major (BS),https://www.brockport.edu/academics/catalogs/programs/,,"Invalid operation: The `response.text` quick accessor requires the response to contain a valid `Part`, but none were returned. The candidate's [finish_reason](https://ai.google.dev/api/generate-content#finishreason) is 12."
Not Required,Not Required,"The Environmental Science minor is available to any student and requires a minimum of 20 credits. The minor provides a strong, interdisciplinary framework for understanding how the natural world works, how it is affected by human activity, and what we can do to protect environmental quality and create a more sustainable future for ourselves and for other species. A grade of C or higher is required for all courses to count towards the minor.",Not Required,True,False,True,False,False,,,program,Environmental Science Minor,https://www.brockport.edu/academics/catalogs/programs/,,
Not Required,Not Required,"To declare a minor in environmental studies, students must have a cumulative GPA of at least 2.0. Minors are available to all majors except Environmental Science.",Not Required,True,False,True,False,False,,,program,Environmental Studies Minor,https://www.brockport.edu/academics/catalogs/programs/,,
,,,,,,,,,,,error,Exercise Science Major (BS),https://www.brockport.edu/academics/catalogs/programs/,,"Invalid operation: The `response.text` quick accessor requires the response to contain a valid `Part`, but none were returned. The candidate's [finish_reason](https://ai.google.dev/api/generate-content#finishreason) is 12."
Not Required,Not Required,"To declare a film studies minor, a student should meet with the coordinator of the Film Studies Program.",Not Required,True,False,False,False,False,,,program,Film Studies Minor,https://www.brockport.edu/academics/catalogs/programs/,,
,,,,,,,,,,,error,Finance Major (BS),https://www.brockport.edu/academics/catalogs/programs/,,"Invalid operation: The `response.text` quick accessor requires the response to contain a valid `Part`, but none were returned. The candidate's [finish_reason](https://ai.google.dev/api/generate-content#finishreason) is 12."
Not Required,Not Required,"To declare the finance minor, students must first complete the Declaration of Major/Minor form and obtain the signature of the department chairperson. Forms are available in the department office.",Not Required,True,False,False,False,False,,,program,Finance Minor,https://www.brockport.edu/academics/catalogs/programs/,,
,,,,,,,,,,,error,Forensic Science Major (BS),https://www.brockport.edu/academics/catalogs/programs/,,"Invalid operation: The `response.text` quick accessor requires the response to contain a valid `Part`, but none were returned. The candidate's [finish_reason](https://ai.google.dev/api/generate-content#finishreason) is 12."
,,,,,,,,,,,error,Forensic Science Minor,https://www.brockport.edu/academics/catalogs/programs/,,"Invalid operation: The `response.text` quick accessor requires the response to contain a valid `Part`, but none were returned. The candidate's [finish_reason](https://ai.google.dev/api/generate-content#finishreason) is 12."
Not Required,Not Required,SUNY Brockport requires the following items to complete your application: A completed application (we are on the SUNY Application and the Common Application); Your official high school transcript; One letter of recommendation from a school counselor or teacher.,Not Required,True,False,True,False,False,,,program,"Geology Major (BA, BS)",https://www.brockport.edu/academics/catalogs/programs/,,
,,,,,,,,,,,error,Geology Minor,https://www.brockport.edu/academics/catalogs/programs/,,"Invalid operation: The `response.text` quick accessor requires the response to contain a valid `Part`, but none were returned. The candidate's [finish_reason](https://ai.google.dev/api/generate-content#finishreason) is 12."
Not Required,Not Required,"Formal application for admission to the major is submitted to the Department of Art after completion of the five foundation courses. In addition to the course requirements, a student must have a minimum GPA of 2.5 in all art courses attempted.",Not Required,True,False,False,False,False,,,program,Graphic Design Major,https://www.brockport.edu/academics/catalogs/programs/,,
,,,,,,,,,,,error,Graphic Design Minor,https://www.brockport.edu/academics/catalogs/programs/,,"Invalid operation: The `response.text` quick accessor requires the response to contain a valid `Part`, but none were returned. The candidate's [finish_reason](https://ai.google.dev/api/generate-content#finishreason) is 12."
,,,,,,,,,,,error,Health and Society Major (BS),https://www.brockport.edu/academics/catalogs/programs/,,"Invalid operation: The `response.text` quick accessor requires the response to contain a valid `Part`, but none were returned. The candidate's [finish_reason](https://ai.google.dev/api/generate-content#finishreason) is 12."
Not Required,Optional,"To apply, prospective students must submit a completed application (either The SUNY Application or The Common Application) and an official high school transcript. A letter of recommendation and a personal essay/statement are optional but encouraged. SUNY Brockport is test-optional, meaning SAT or ACT test scores are not required for admission.",Not Required,True,False,False,False,False,,,program,Healthcare Administration Major (BS),https://www.brockport.edu/academics/catalogs/programs/,,
Not Required,Not Required,,Not Required,True,False,False,False,False,,,program,Hip-Hop Minor,https://www.brockport.edu/academics/catalogs/programs/,,
,,,,,,,,,,,error,"History Major (BA, BS)",https://www.brockport.edu/academics/catalogs/programs/,,"Invalid operation: The `response.text` quick accessor requires the response to contain a valid `Part`, but none were returned. The candidate's [finish_reason](https://ai.google.dev/api/generate-content#finishreason) is 12."
,,,,,,,,,,,error,History Minor,https://www.brockport.edu/academics/catalogs/programs/,,"Invalid operation: The `response.text` quick accessor requires the response to contain a valid `Part`, but none were returned. The candidate's [finish_reason](https://ai.google.dev/api/generate-content#finishreason) is 12."
,,,,,,,,,,,error,"Integrative Studies Online Degree Completion Program (BA, BS)",https://www.brockport.edu/academics/catalogs/programs/,,"Invalid operation: The `response.text` quick accessor requires the response to contain a valid `Part`, but none were returned. The candidate's [finish_reason](https://ai.google.dev/api/generate-content#finishreason) is 12."
Not Required,Required,"To apply for admission, you’ll need to submit the following: Completed Application (SUNY Application or Common Application), Official High School Transcript(s), Letter of Recommendation (optional, but encouraged), Essay/Personal Statement, Standardized Test Scores (optional).",Not Required,True,False,False,False,False,,,program,International Business Major (BS),https://www.brockport.edu/academics/catalogs/programs/,,
,,,,,,,,,,,error,International Studies Major (BA),https://www.brockport.edu/academics/catalogs/programs/,,"Invalid operation: The `response.text` quick accessor requires the response to contain a valid `Part`, but none were returned. The candidate's [finish_reason](https://ai.google.dev/api/generate-content#finishreason) is 12."
,,,,,,,,,,,error,International Studies Minor,https://www.brockport.edu/academics/catalogs/programs/,,"Invalid operation: The `response.text` quick accessor requires the response to contain a valid `Part`, but none were returned. The candidate's [finish_reason](https://ai.google.dev/api/generate-content#finishreason) is 12."
Not Required,Not Required,"Successful candidates for freshman admission typically have a strong, college-preparatory curriculum from an accredited high school. At a minimum, students are recommended to have completed: 4 units of English, 4 units of Social Studies, 3-4 units of Math (including Algebra 2), 3-4 units of Science, 2-4 units of a foreign language. Overall GPA and strength of curriculum are primary factors in the review process.",Not Required,True,False,False,False,False,,,program,"Journalism and Broadcasting Major (BA, BS)",https://www.brockport.edu/academics/catalogs/programs/,,
Not Required,Required,"Students must be accepted as a major in the department. To be accepted, students must meet the following requirements:
1. Complete a major declaration form.
2. Students must have a minimum cumulative Brockport GPA of 2.5 on a minimum of 12 credits taken at Brockport to declare this major.
3. Students must have a minimum major GPA of 2.5 based on PES 311. If the student has not completed this course at the time of declaration, they will be granted conditional major status. When the course is completed, the student must have a minimum major GPA of 2.5.",Not Required,True,False,False,False,False,,,program,Kinesiology Major (BS),https://www.brockport.edu/academics/catalogs/programs/,,
Not Required,Not Required,"A minimum of 18 credits are required for the Kinesiology minor. A minimum grade of ""C"" is required in all Kinesiology minor courses. Required Courses (6 credits): PES 310 Exercise Physiology (3 credits), PES 320 Biomechanics (3 credits). Electives (12 credits): Choose 12 credits from the courses listed on the program website.",Not Required,True,False,True,False,False,,,program,Kinesiology Minor,https://www.brockport.edu/academics/catalogs/programs/,,
Not Required,Not Required,"To be admitted to the legal studies minor, a student must have a minimum overall GPA of 2.0.",Not Required,True,False,False,False,False,,,program,Legal Studies Minor,https://www.brockport.edu/academics/catalogs/programs/,,
Not Required,Not Required,Students intending to complete the minor in long term care administration must consult with and have their course selection approved by their major advisor and the long term care minor coordinator.,Not Required,True,False,False,False,False,,,program,Long Term Care Minor,https://www.brockport.edu/academics/catalogs/programs/,,
,,,,,,,,,,,error,Marketing Major (BS),https://www.brockport.edu/academics/catalogs/programs/,,"Invalid operation: The `response.text` quick accessor requires the response to contain a valid `Part`, but none were returned. The candidate's [finish_reason](https://ai.google.dev/api/generate-content#finishreason) is 12."
Not Required,Not Required,Students must have a minimum cumulative GPA of 2.0 to be admitted to the marketing minor.,Not Required,True,False,False,False,False,,,program,Marketing Minor,https://www.brockport.edu/academics/catalogs/programs/,,
Not Required,Required,"To apply as a first-year student, you will need to submit the following: SUNY Application or Common Application, Official High School Transcript, One Letter of Recommendation, and a Personal Essay/Statement. SUNY Brockport is test-optional, so SAT/ACT scores are not required but can be submitted.",Not Required,True,False,True,False,False,,,program,"Mathematics Major (BA, BS)",https://www.brockport.edu/academics/catalogs/programs/,,
,,,,,,,,,,,error,Mathematics Minor,https://www.brockport.edu/academics/catalogs/programs/,,"Invalid operation: The `response.text` quick accessor requires the response to contain a valid `Part`, but none were returned. The candidate's [finish_reason](https://ai.google.dev/api/generate-content#finishreason) is 12."
,,,,,,,,,,,error,Media Production Minor,https://www.brockport.edu/academics/catalogs/programs/,,"Invalid operation: The `response.text` quick accessor requires the response to contain a valid `Part`, but none were returned. The candidate's [finish_reason](https://ai.google.dev/api/generate-content#finishreason) is 12."
Not Required,Not Required,"To be admitted to the Medical Technology major, students must meet the following qualifications: An overall GPA of 2.5 or above at the time of application to the major. A GPA of 2.5 or above in all required science and mathematics courses. Completion of at least four of the required science and mathematics courses, three of which must include a laboratory. Submission of the 'Intent to Continue in the Medical Technology Major' form by October 1 of the sophomore year. Submission of clinical year application by September 1 of the junior year.",Not Required,True,False,True,False,False,,,program,Medical Technology Major (BS),https://www.brockport.edu/academics/catalogs/programs/,,
Not Required,Not Required,Applicants must submit a completed SUNY Application or Common Application and an official high school transcript. A letter of recommendation and a personal essay are optional but recommended. SUNY Brockport is test-optional.,Not Required,True,False,True,False,False,,,program,"Meteorology Major (BA, BS)",https://www.brockport.edu/academics/catalogs/programs/,,
Not Required,Not Required,,Not Required,True,False,True,False,False,,,program,Meteorology Minor,https://www.brockport.edu/academics/catalogs/programs/,,
,,,,,,,,,,,error,Military Science Minor (Commission),https://www.brockport.edu/academics/catalogs/programs/,,"Invalid operation: The `response.text` quick accessor requires the response to contain a valid `Part`, but none were returned. The candidate's [finish_reason](https://ai.google.dev/api/generate-content#finishreason) is 12."
,,,,,,,,,,,error,Military Science Minor (Non-commission),https://www.brockport.edu/academics/catalogs/programs/,,"Invalid operation: The `response.text` quick accessor requires the response to contain a valid `Part`, but none were returned. The candidate's [finish_reason](https://ai.google.dev/api/generate-content#finishreason) is 12."
,,,,,,,,,,,error,Multimedia Journalism Minor,https://www.brockport.edu/academics/catalogs/programs/,,"Invalid operation: The `response.text` quick accessor requires the response to contain a valid `Part`, but none were returned. The candidate's [finish_reason](https://ai.google.dev/api/generate-content#finishreason) is 12."
,,,,,,,,,,,error,Museum Studies & Public History Minor,https://www.brockport.edu/academics/catalogs/programs/,,"Invalid operation: The `response.text` quick accessor requires the response to contain a valid `Part`, but none were returned. The candidate's [finish_reason](https://ai.google.dev/api/generate-content#finishreason) is 12."
,,,,,,,,,,,error,Music Business Minor,https://www.brockport.edu/academics/catalogs/programs/,,"Invalid operation: The `response.text` quick accessor requires the response to contain a valid `Part`, but none were returned. The candidate's [finish_reason](https://ai.google.dev/api/generate-content#finishreason) is 12."
,,,,,,,,,,,error,Music Minor,https://www.brockport.edu/academics/catalogs/programs/,,"Invalid operation: The `response.text` quick accessor requires the response to contain a valid `Part`, but none were returned. The candidate's [finish_reason](https://ai.google.dev/api/generate-content#finishreason) is 12."
Not Required,Not Required,,Not Required,True,False,False,False,False,,,program,Musical Theatre Minor,https://www.brockport.edu/academics/catalogs/programs/,,
,,,,,,,,,,,error,Neuroscience Major (BS),https://www.brockport.edu/academics/catalogs/programs/,,"Invalid operation: The `response.text` quick accessor requires the response to contain a valid `Part`, but none were returned. The candidate's [finish_reason](https://ai.google.dev/api/generate-content#finishreason) is 12."
,,,,,,,,,,,error,Nursing Accelerated (Second Degree) Bachelor's to BSN Program,https://www.brockport.edu/academics/catalogs/programs/,,"Invalid operation: The `response.text` quick accessor requires the response to contain a valid `Part`, but none were returned. The candidate's [finish_reason](https://ai.google.dev/api/generate-content#finishreason) is 12."
Not Required,Required,"Admission to the nursing major is competitive. The following criteria are the minimum standards for consideration for acceptance into the nursing major:
1. Minimum cumulative GPA of 3.0 or higher.
2. Minimum grade of “C” or higher and a combined GPA of 3.0 or higher in the prerequisite science courses: BIO 221, BIO 281, CHM 205.
3. Successful completion of the Test of Essential Academic Skills (TEAS) with a minimum total score in the “Proficient” range (58.7%). The TEAS exam may be taken a maximum of two times. The highest score will be utilized in the application process.
4. A personal statement addressing the following prompt (500 words or less): In what ways will you, as a student nurse, contribute to the nursing profession and the vision of the SUNY Brockport Department of Nursing?
5. A completed application by published deadlines.",Not Required,True,False,False,False,False,,,program,Nursing Major (BSN),https://www.brockport.edu/academics/catalogs/programs/,,
,,,,,,,,,,,error,Nursing RN-to-BSN Fast-Track (BSN),https://www.brockport.edu/academics/catalogs/programs/,,"Invalid operation: The `response.text` quick accessor requires the response to contain a valid `Part`, but none were returned. The candidate's [finish_reason](https://ai.google.dev/api/generate-content#finishreason) is 12."
Not Required,Required,"First-year applicants must submit a completed SUNY Application or Common Application, which includes a required personal essay. An official high school transcript is also required. A letter of recommendation is optional but encouraged. Submission of SAT/ACT scores is optional as SUNY Brockport is test optional.",Not Required,True,False,False,False,False,,,program,"Philosophy Major (BA, BS)",https://www.brockport.edu/academics/catalogs/programs/,,
Not Required,Not Required,"To earn a minor in philosophy, a student must complete 18 credits in philosophy, including at least nine credits at the 300/400 level. All courses for the minor must be completed with a grade of 'C' or higher.",Not Required,True,False,False,False,False,,,program,Philosophy Minor,https://www.brockport.edu/academics/catalogs/programs/,,
Not Required,Not Required,"To apply as a freshman, students must submit either the SUNY Application or the Common Application and an official high school transcript. SUNY Brockport is test-optional, so applicants can choose whether or not to submit SAT/ACT scores. A letter of recommendation and a personal essay or statement are optional but strongly encouraged.",Not Required,True,False,False,False,False,,,program,Physical Education Teacher Education Major (BS),https://www.brockport.edu/academics/catalogs/programs/,,
Not Required,Not Required,"To apply for freshman admission, please submit the following: a completed application (SUNY Application or Common Application), official high school transcript(s), and one letter of recommendation. SUNY Brockport is test optional, meaning you have the choice to submit your SAT/ACT scores for consideration.",Not Required,True,False,True,False,False,,,program,Physics Major (BS),https://www.brockport.edu/academics/catalogs/programs/,,
Not Required,Not Required,"A minor in physics requires the completion of 18-20 credits in physics, including PHS 235 College Physics I, PHS 240 College Physics II, PHS 305 Modern Physics, and 7-9 credits of physics (PHS) electives at the 300/400 level. At least 9 of the 18-20 credits must be taken at Brockport. To declare a physics minor, students should contact a faculty member in the Department of Physics.",Not Required,True,False,True,False,False,,,program,Physics Minor,https://www.brockport.edu/academics/catalogs/programs/,,
,,,,,,,,,,,error,"Political Science Major (BA, BS)",https://www.brockport.edu/academics/catalogs/programs/,,"Invalid operation: The `response.text` quick accessor requires the response to contain a valid `Part`, but none were returned. The candidate's [finish_reason](https://ai.google.dev/api/generate-content#finishreason) is 12."
,,,,,,,,,,,error,Political Science Minor,https://www.brockport.edu/academics/catalogs/programs/,,"Invalid operation: The `response.text` quick accessor requires the response to contain a valid `Part`, but none were returned. The candidate's [finish_reason](https://ai.google.dev/api/generate-content#finishreason) is 12."
Not Required,Not Required,"To be admitted to the Pre-professional Health Minor, students must have an overall GPA of 3.2 or greater. To continue in the minor, students must earn a C or higher in all minor courses and maintain a 3.0 overall GPA.",Not Required,True,False,True,False,False,,,program,Pre-Professional Health Minor,https://www.brockport.edu/academics/catalogs/programs/,,
Not Required,Not Required,Students interested in dentistry should declare the minor as soon as possible and meet with the pre-health advisor to discuss the dental school admission process and requirements. The Dental Pathway Minor requires completion of a total of 18 credits.,Not Required,True,False,True,False,False,,,program,Pre-professional Studies: Dental Pathway Minor,https://www.brockport.edu/academics/catalogs/programs/,,
Not Required,Not Required,"Students must have an overall GPA of 3.0 or higher. Students are accepted on a rolling basis, so apply any time. Students must have also completed BIO 121: Foundations of Biology with a grade of a “B” or higher. After meeting these requirements, students may declare the minor by filling out and submitting the Undergraduate Program Declaration Form from the Office of Registration and Records.",Not Required,True,False,True,False,False,,,program,Pre-professional Studies: Medical Pathway Minor,https://www.brockport.edu/academics/catalogs/programs/,,
Not Required,Not Required,,Not Required,True,False,True,False,False,,,program,Pre-professional Studies: Optometry Pathway Minor,https://www.brockport.edu/academics/catalogs/programs/,,
,,,,True,False,True,False,False,,,program,Pre-professional Studies: Physician's Assistant Pathway Minor,https://www.brockport.edu/academics/catalogs/programs/,,
Not Required,Not Required,,Not Required,True,False,True,False,False,,,program,Pre-professional Studies: Veterinary Pathway Minor,https://www.brockport.edu/academics/catalogs/programs/,,
Not Required,Not Required,"To be considered for admission to SUNY Brockport as a freshman, applicants must submit either the SUNY Application or the Common Application along with an official high school transcript. Other application materials such as SAT/ACT scores, an essay or personal statement, and letters of recommendation are optional but recommended.",Not Required,True,False,True,False,False,,,program,"Psychology Major (BA, BS)",https://www.brockport.edu/academics/catalogs/programs/,,
Not Required,Not Required,"The Online Psychology Major is a degree completion program designed for students who have earned at least 48 college credits. To be considered for admission, applicants should have a cumulative GPA of at least a 2.5 from all colleges attended and must submit official college transcripts from all previously attended colleges.",Not Required,True,False,False,False,False,,,program,Psychology Major Online Degree Completion Program,https://www.brockport.edu/academics/catalogs/programs/,,
