Resume,StatementOfPurpose,Requirements,WritingSample,IsAnalyticalNotRequired,IsAnalyticalOptional,IsStemProgram,IsACTRequired,IsSATRequired,MinimumACTScore,MinimumSATScore,extraction_level,Program name,Program Page url,IsRecommendationSystemOpted,error
Not Required,Not Required,"To declare a minor in psychology, students must complete PSH 110 Principles of Psychology with a grade of C or better and be in good academic standing (2.0 GPA or higher).",Not Required,True,False,False,False,False,,,program,Psychology Minor,https://www.brockport.edu/academics/catalogs/programs/,,
,,,,,,,,,,,error,Public Health Major (BS),https://www.brockport.edu/academics/catalogs/programs/,,"Invalid operation: The `response.text` quick accessor requires the response to contain a valid `Part`, but none were returned. The candidate's [finish_reason](https://ai.google.dev/api/generate-content#finishreason) is 12."
,,,,,,,,,,,error,Public Relations Minor,https://www.brockport.edu/academics/catalogs/programs/,,"Invalid operation: The `response.text` quick accessor requires the response to contain a valid `Part`, but none were returned. The candidate's [finish_reason](https://ai.google.dev/api/generate-content#finishreason) is 12."
Not Required,Not Required,,Not Required,True,False,False,False,False,,,program,Religion and Culture Minor,https://www.brockport.edu/academics/catalogs/programs/,,
,,,,,,,,,,,error,Social Media Minor,https://www.brockport.edu/academics/catalogs/programs/,,"Invalid operation: The `response.text` quick accessor requires the response to contain a valid `Part`, but none were returned. The candidate's [finish_reason](https://ai.google.dev/api/generate-content#finishreason) is 12."
Required,Required,"Admission to the Social Work major is competitive and separate from admission to the University. Requirements include: a minimum of 42 credits of college-level work, a minimum overall GPA of 2.5, and completion of specific prerequisite courses including Introduction to Social Work (SWO 201) and English Composition (ENG 112) with a grade of 'C' or better. Applicants must submit a completed Social Work Major Application Form, a current Degree Audit Reporting System (DARS) report, a two-to-three page personal statement, a résumé, and three references.",Not Required,True,False,False,False,False,,,program,Social Work Major (BS),https://www.brockport.edu/academics/catalogs/programs/,,
,,,,,,,,,,,error,"Sociology Major (BA, BS)",https://www.brockport.edu/academics/catalogs/programs/,,"Invalid operation: The `response.text` quick accessor requires the response to contain a valid `Part`, but none were returned. The candidate's [finish_reason](https://ai.google.dev/api/generate-content#finishreason) is 12."
,,,,,,,,,,,error,Sociology Minor,https://www.brockport.edu/academics/catalogs/programs/,,"Invalid operation: The `response.text` quick accessor requires the response to contain a valid `Part`, but none were returned. The candidate's [finish_reason](https://ai.google.dev/api/generate-content#finishreason) is 12."
Not Required,Not Required,"To be considered for freshman admission, you'll need to submit the following: Complete and submit ONE of the following: SUNY Application or Common Application. High school transcript(s). Letter of recommendation (optional but encouraged). Personal Essay (optional but encouraged).",Not Required,True,False,False,False,False,,,program,"Spanish Major (BA, BS)",https://www.brockport.edu/academics/catalogs/programs/,,
Not Required,Not Required,A minimum grade of “C” is required for all minor courses. A minimum of nine credits in the minor must be taken at Brockport.,Not Required,True,False,False,False,False,,,program,Spanish Minor,https://www.brockport.edu/academics/catalogs/programs/,,
,,,,,,,,,,,error,Sport Management Major (BS),https://www.brockport.edu/academics/catalogs/programs/,,"Invalid operation: The `response.text` quick accessor requires the response to contain a valid `Part`, but none were returned. The candidate's [finish_reason](https://ai.google.dev/api/generate-content#finishreason) is 12."
,,,,,,,,,,,error,Sustainability (BS),https://www.brockport.edu/academics/catalogs/programs/,,"Invalid operation: The `response.text` quick accessor requires the response to contain a valid `Part`, but none were returned. The candidate's [finish_reason](https://ai.google.dev/api/generate-content#finishreason) is 12."
Required,Not Required,"Students who wish to major in Theatre must audition/interview for acceptance into the program. Auditions and interviews occur on campus and online in November and February of the academic year. The Department will accept transfer students into the Theatre Major at any time, pending a successful audition/interview. All prospective Theatre Majors and transfer students should contact the department to arrange an audition and interview before submitting a university application. Admission to the major is contingent upon successful audition/interview AND acceptance to the university.",Not Required,True,False,False,False,False,,,program,"Theatre Major (BA, BS)",https://www.brockport.edu/academics/catalogs/programs/,,
,,,,,,,,,,,error,Theatre Minor,https://www.brockport.edu/academics/catalogs/programs/,,"Invalid operation: The `response.text` quick accessor requires the response to contain a valid `Part`, but none were returned. The candidate's [finish_reason](https://ai.google.dev/api/generate-content#finishreason) is 12."
,,,,,,,,,,,error,Tourism & Event Management Minor,https://www.brockport.edu/academics/catalogs/programs/,,"Invalid operation: The `response.text` quick accessor requires the response to contain a valid `Part`, but none were returned. The candidate's [finish_reason](https://ai.google.dev/api/generate-content#finishreason) is 12."
Not Required,Required,"To apply for this undergraduate program, prospective students must submit a completed application (either the SUNY Application or the Common Application), official high school transcript(s), an essay or personal statement, and one letter of recommendation.",Not Required,True,False,True,False,False,,,program,"Water Resources Major (BA, BS)",https://www.brockport.edu/academics/catalogs/programs/,,
,,,,,,,,,,,error,Water Resources Minor,https://www.brockport.edu/academics/catalogs/programs/,,"Invalid operation: The `response.text` quick accessor requires the response to contain a valid `Part`, but none were returned. The candidate's [finish_reason](https://ai.google.dev/api/generate-content#finishreason) is 12."
,,,,,,,,,,,error,"Women & Gender Studies Major (BA, BS)",https://www.brockport.edu/academics/catalogs/programs/,,"Invalid operation: The `response.text` quick accessor requires the response to contain a valid `Part`, but none were returned. The candidate's [finish_reason](https://ai.google.dev/api/generate-content#finishreason) is 12."
Not Required,Not Required,"To declare a minor in Women and Gender Studies, students should obtain the required form from the Office of Academic Advisement, complete it in consultation with a Women and Gender Studies faculty member, obtain the necessary signatures and return it to the Office of Academic Advisement, Rakov Center.",Not Required,True,False,False,False,False,,,program,Women & Gender Studies Minor,https://www.brockport.edu/academics/catalogs/programs/,,
