Concentration name,description,program website url,Accreditation status,Program name,Program Page url,Level
German Studies Concentration,"The Bachelor of Arts in Germanic and Slavic Languages and Literatures provides a strong background in German language, literature, and culture, while also giving students an opportunity to study a Slavic language and culture. The German Studies Concentration offers students an in-depth study of German language, literature, and culture (including film, history, and contemporary society) while also allowing them to study Russian, a related language, and its culture. Through a strong program of study, students develop advanced German language skills, critical thinking abilities, and an appreciation for other cultures. The program prepares students for careers in fields such as business, education, government, translation, and international relations, or for continued study in graduate school. Students have the opportunity to study abroad, participate in internships, and engage in undergraduate research.",https://catalog.unc.edu/undergraduate/programs-study/germanic-slavic-languages-literatures-ba/german-studies-concentration/,,Bachelor of Arts in Germanic and Slavic Languages and Literatures – German Studies Concentration,https://catalog.unc.edu/undergraduate/programs-study/,
Russian Language and Culture Concentration,"The Bachelor of Arts in Germanic and Slavic Languages and Literatures is a degree program designed to provide students with advanced proficiency in German or Russian, as well as a comprehensive understanding of the literature, history, and culture of the German-speaking and Russian-speaking worlds. The program aims to foster critical thinking, analytical skills, and cross-cultural competence, preparing students for careers in diverse fields such as education, international business, diplomacy, translation, and graduate studies. Students choose one of two concentrations: German Language and Culture or Russian Language and Culture. Both concentrations emphasize rigorous language training complemented by in-depth study of relevant literary, historical, and cultural topics. Through immersive coursework and opportunities for study abroad, students develop a nuanced appreciation for linguistic and cultural diversity, equipping them to engage effectively with global challenges and opportunities.",https://catalog.unc.edu/undergraduate/programs-study/germanic-slavic-languages-literatures-ba/,,Bachelor of Arts in Germanic and Slavic Languages and Literatures – Russian Language and Culture Concentration,https://catalog.unc.edu/undergraduate/programs-study/,
Slavic and East European Studies Concentration,"The Bachelor of Arts in Germanic and Slavic Languages and Literatures offers concentrations in German Studies, Russian Studies, and Slavic and East European Studies. All concentrations include instruction in the relevant languages, literatures, and cultures in depth, as well as an interdisciplinary exploration of the region’s history, politics, and related fields. In all concentrations, students are encouraged to participate in study abroad programs in Germany, Russia, or other relevant countries in order to achieve the necessary linguistic proficiency and cultural competency.",https://catalog.unc.edu/undergraduate/programs-study/germanic-slavic-languages-literatures-ba/,,Bachelor of Arts in Germanic and Slavic Languages and Literatures – Slavic and East European Studies Concentration,https://catalog.unc.edu/undergraduate/programs-study/,
,"The Bachelor of Arts in Global Studies offers students a deep and critical understanding of the forces and factors that shape the interconnected contemporary world. The program is inherently interdisciplinary, drawing on a range of humanities and social science fields to provide a comprehensive approach to global issues. Students choose one of seven concentrations, each allowing for a more in-depth study of a particular region or cross-cutting theme. In all concentrations, students will cultivate critical thinking, communication, and research skills through rigorous coursework, foreign language study, and experiential learning opportunities. All students complete a required study abroad or international internship experience, equipping them with practical intercultural skills and knowledge. The program prepares students for careers in government, non-governmental organizations (NGOs), international business, and education, as well as for graduate study in related fields.",https://catalog.unc.edu/undergraduate/programs-study/global-studies-ba/,,Bachelor of Arts in Global Studies,https://catalog.unc.edu/undergraduate/programs-study/,
,,,,Bachelor of Arts in Haitian Creole,https://catalog.unc.edu/undergraduate/programs-study/,
,"The Hindi-Urdu program at UNC Charlotte offers students the opportunity to learn modern standard Hindi and Urdu, the two most prominent languages of South Asia, and gain familiarity with the cultures of the Hindi-Urdu speaking world. These languages are grammatically very similar; the main difference is their writing systems, which are respectively Devanagari and Perso-Arabic. The Hindi-Urdu major can lead to a Bachelor of Arts (B.A.) degree, while the minor can complement a major in another discipline such as political science, history, international studies, or religious studies. With around half a billion speakers, Hindi-Urdu is the fourth most commonly spoken language in the world, and there is a growing demand for trained professionals with knowledge of Hindi-Urdu in fields such as business, foreign service, education, and social work. Our program offers five levels of language training as well as courses in culture and literature, making it among the most comprehensive Hindi-Urdu programs in the southeastern United States.",https://languages.charlotte.edu/academics/undergraduate-programs/hindi-urdu/,,Bachelor of Arts in Hindi-Urdu,https://languages.charlotte.edu/student-opportunities/scholarships/,
,"The Bachelor of Arts in History program exposes students to a wide range of human experience and helps them develop skills fundamental to any profession requiring clear thinking and communication. The curriculum emphasizes analytical and interpretive skills; understanding of political, social, economic, and cultural change; and appreciation of diverse cultures and perspectives on the human past. The program also supports the discovery and exploration of intellectual passions that are the hallmarks of a liberally educated individual. The history curriculum is global in scope, allowing students to explore the human past in all parts of the world, from antiquity to the present. The department offers courses in U.S., European, Asian, African, Latin American, and Middle Eastern history, as well as courses in historical methodologies. Additionally, students can take advantage of numerous internship and study abroad opportunities, including the Public History Internship, which provides hands-on experience in museums, archives, and historical sites. An interdisciplinary minor in Public History is also available. Graduates of the program are well-prepared for diverse career paths, including teaching, law, public service, journalism, business, archival and museum work, or graduate study in history and related fields.",https://catalog.unc.edu/undergraduate/programs-study/history-department/history-ba/,,Bachelor of Arts in History,https://catalog.unc.edu/undergraduate/programs-study/,
,"Latin American Studies (LTAM) is an interdisciplinary program that investigates the history, cultures, politics, and social dynamics of Latin America and the Caribbean from the pre-colonial period to the present. The program is designed to provide students with a comprehensive understanding of the diverse societies and cultures of the region, as well as the historical and contemporary challenges and opportunities they face. Students will develop critical thinking skills, cross-cultural understanding, and proficiency in Spanish or Portuguese. Graduates of the Latin American Studies program are prepared for a wide range of careers in fields such as international relations, government, non-profit organizations, education, journalism, and business, as well as for graduate study in Latin American Studies or related disciplines.",https://catalog.unc.edu/undergraduate/liberal-arts-sciences/global-studies/latin-american-studies-ba/,,Bachelor of Arts in Latin American Studies,https://catalog.unc.edu/undergraduate/programs-study/,
,"The Bachelor of Arts in Linguistics, Interpretation, and Translation (LIT) offers an interdisciplinary approach to the study of language and communication. It combines theoretical and applied linguistics, the science of interpreting and translation, and cross-cultural communication to prepare students for careers in diverse professional fields. The program emphasizes global literacy, critical thinking, and effective communication, equipping graduates with the skills necessary to navigate complex linguistic and cultural landscapes. Through rigorous coursework, practical training, and experiential learning opportunities, students develop proficiency in at least one foreign language (Spanish, German, French, or Japanese), gain a deep understanding of linguistic structures, acquire interpreting and translation techniques, and cultivate an appreciation for linguistic and cultural diversity. The program is designed to provide a solid foundation for those interested in pursuing graduate studies in linguistics, interpreting, translation, or related fields, as well as for those seeking immediate employment in areas such as diplomacy, international business, healthcare, legal services, community outreach, and education.",https://catalog.unc.edu/undergraduate/programs-study/linguistics-interpretation-translation-ba/,,"Bachelor of Arts in Linguistics, Interpretation, and Translation",https://catalog.unc.edu/undergraduate/programs-study/,B.A.
"Digital Video and Film, Journalism, Public Relations, Sports Communication","The Bachelor of Arts in Media and Journalism provides students with a strong liberal arts education and professional training for careers in a wide array of media and media-related fields, including journalism, public relations, digital media production, sports communication, and advertising. Graduates are prepared for positions in news organizations (print, broadcast, and online), public relations and strategic communication firms, corporate communication departments, advertising agencies, production companies, and other media-focused enterprises. Students develop critical thinking skills, ethical decision-making abilities, and professional competencies in areas such as writing, editing, visual storytelling, multimedia production, strategic communication planning, and media analytics.",https://catalog.unc.edu/undergraduate/programs-study/media-journalism-major-ba/,,Bachelor of Arts in Media and Journalism,https://catalog.unc.edu/undergraduate/programs-study/media-journalism-major-ba/,
,"The Bachelor of Arts in Music (BA) is designed for students seeking a broad education in music within a liberal arts context. This degree allows students to pursue their interests in music while also exploring other academic disciplines. The program provides a strong foundation in music theory, history, and performance, preparing students for diverse careers in music, further graduate study, or a range of professions that value critical thinking, creativity, and interdisciplinary understanding.",https://catalog.unc.edu/undergraduate/programs-study/music-ba/,,Bachelor of Arts in Music,https://catalog.unc.edu/undergraduate/programs-study/,
Music History & Literature,"The Music History & Literature Concentration is for students who want to explore music through a humanities-based approach. It emphasizes the study of music history, theory, and cultural contexts, preparing students for graduate study, careers in arts administration, or other fields requiring strong research and writing skills.",https://coaa.charlotte.edu/music/degrees-programs/ba-music/music-history-literature,The Department of Music is an accredited institutional member of the National Association of Schools of Music (NASM).,Bachelor of Arts in Music History and Literature,https://coaa.charlotte.edu/music/,B.A.
,"The Bachelor of Arts in North American Studies explores the cultures, societies, and histories of Canada, Mexico, the Caribbean, and the United States, as well as the connections among them. The program emphasizes global and transnational approaches to understanding North America, providing students with critical tools to engage with the region’s diverse peoples, experiences, and contexts. The program offers an interdisciplinary approach to North American Studies, drawing on courses from a range of fields, including Africana Studies, Anthropology, Communication Studies, Criminal Justice, English, Geography and Earth Sciences, Global Studies, History, Languages and Culture Studies, Latin American Studies, Political Science, Psychology, Religious Studies, Sociology, and Women's and Gender Studies. The program offers students an opportunity to learn about North America in historical and contemporary contexts, preparing them for careers in government, journalism, education, NGOs, and the private sector. The program also offers students the opportunity to conduct original research on a topic of their choice and to engage with community partners through internships and other experiential learning opportunities.",https://catalog.unc.edu/undergraduate/programs-study/north-american-studies-ba/,,Bachelor of Arts in North American Studies,https://catalog.unc.edu/undergraduate/programs-study/,
,"The Bachelor of Arts in Peace, War, and Defense provides students with an interdisciplinary understanding of the causes of war and peace. Students learn about the role of diplomacy, international law, and conflict resolution in preventing and resolving conflicts, as well as the history, theory, and practice of warfare. The program also examines the social, political, economic, and cultural factors that contribute to conflict and cooperation between states and non-state actors. Students in the program develop critical thinking, analytical, and communication skills necessary for careers in government, non-governmental organizations, international organizations, and the private sector, as well as for graduate study in related fields. The program is housed in the Department of Political Science and Public Administration.",https://catalog.unc.edu/undergraduate/programs-study/peace-war-defense-ba/,,"Bachelor of Arts in Peace, War, and Defense",https://catalog.unc.edu/undergraduate/programs-study/,
,"Philosophy provides an excellent liberal arts education by developing critical thinking, argumentative, analytical, and writing skills. These skills are highly valued by employers, graduate programs, and professional schools. Students in the Philosophy B.A. program study topics in ethics, logic, metaphysics, epistemology, social and political philosophy, aesthetics, and the history of philosophy, among others. Students will learn to analyze complex concepts, evaluate arguments, and construct well-reasoned positions on fundamental questions.",https://catalog.unc.edu/undergraduate/programs-study/philosophy/philosophy-ba/,,Bachelor of Arts in Philosophy,https://catalog.unc.edu/undergraduate/programs-study/,
"International Relations, Public Policy","The Bachelor of Arts in Political Science is designed for students interested in studying the theory and practice of government and politics. This program examines political ideas, institutions, policies, and behavior, both domestically and internationally. Students will develop critical thinking skills, research abilities, and a deep understanding of political systems, preparing them for careers in government, non-profit organizations, law, journalism, business, or for further graduate study.",https://nineronline.uncc.edu/program/bachelor-arts-political-science,,Bachelor of Arts in Political Science,https://research.com/degrees/best-online-political-science-degree-programs,
,"The Public Policy Analysis, B.A. is an interdisciplinary program designed to prepare students for careers in public, private, and non-profit organizations that focus on the analysis, development, and implementation of public policies. Students will gain a strong foundation in economic, political, and social theories, as well as quantitative and qualitative research methods essential for effective policy analysis. The program emphasizes critical thinking, ethical decision-making, and communication skills necessary to address complex societal challenges. Graduates will be equipped to evaluate policy alternatives, contribute to evidence-based policy making, and advocate for policy changes that promote social welfare.",https://catalog.unc.edu/undergraduate/programs-study/public-policy-analysis-ba/,,Bachelor of Arts in Public Policy Analysis,https://catalog.unc.edu/undergraduate/programs-study/,
,"The Bachelor of Arts (B.A.) in Religious Studies is designed to expose students to a variety of religious traditions, regions, and theoretical approaches. Students will develop critical thinking and analytical skills, as well as an understanding of the diversity of human cultures and beliefs. Our graduates are well-prepared for careers in fields such as education, journalism, public service, and non-profit organizations, as well as for further graduate study in religious studies or related disciplines. The B.A. program in Religious Studies provides students with an academic and non-sectarian approach to understanding the diverse roles of religion in human cultures, both past and present. Through rigorous coursework, students develop a range of valuable skills, including critical thinking, analytical reasoning, research, and written and oral communication. These skills are highly valued by employers in a wide array of fields and provide excellent preparation for graduate study in a variety of disciplines.",https://religiousstudies.charlotte.edu/academics/undergraduate-program/bachelor-arts,,Bachelor of Arts in Religious Studies,https://www.educations.com/bachelors-degree/humanities-studies/north-america/distance-learning,
,"Sociology is the scientific study of human social life. This includes examining the social causes and consequences of human behavior, social relationships, and social organization. Sociologists study virtually every aspect of human society: the family; racial, ethnic, and gender relations; social class; crime and deviance; social movements; health and illness; education; religion; law; politics; and organizations. A Bachelor of Arts degree in Sociology provides students with knowledge of social theory and various research methods. This background prepares students for graduate study in Sociology, Law, Public Health, Urban Planning, Business, and other fields. It also provides an excellent foundation for a variety of careers in government, education, non-profit organizations, and business. Sociology majors develop marketable skills, including critical thinking, problem solving, teamwork, data analysis, and communication. The Sociology program at UNC Charlotte offers three concentrations: Applied Sociology; Crime and Justice; and Medical Sociology. The Applied Sociology concentration prepares students for careers in the private and public sector that require program planning and evaluation skills, as well as a more general understanding of social issues. The Crime and Justice concentration provides students with knowledge and skills related to criminology, deviance, and law within a social context. The Medical Sociology concentration prepares students for careers in health-related organizations and graduate training in health professions, public health, or medical sociology.",https://catalog.unc.edu/undergraduate/programs-study/sociology-ba/,,Bachelor of Arts in Sociology,https://catalog.unc.edu/undergraduate/programs-study/,
,"The Bachelor of Arts in Spanish is a program for students seeking an in-depth study of the Spanish language, Hispanic literatures, and cultures from across the globe. Students complete 42 credit hours above the 2000-level, including a minimum of 24 credit hours at the 3000-level and above and a minimum of 15 credit hours at the 4000-level. All students completing a B.A. in Spanish must participate in an approved study abroad program.

Learning Outcomes:
Upon completion of the program, students should be able to:
*   Interpret and analyze complex materials in Spanish
*   Express complex ideas orally in Spanish
*   Express complex ideas in writing in Spanish
*   Analyze and evaluate literary and cultural texts
*   Employ knowledge of the linguistic components of the Spanish language
*   Communicate effectively with members of Hispanic communities
*   Demonstrate cultural competence in the Hispanic world
*   Evaluate language learning strategies and apply them effectively",https://catalog.unc.edu/undergraduate/programs-study/spanish-ba/,,Bachelor of Arts in Spanish,https://catalog.unc.edu/undergraduate/programs-study/,
,"The Bachelor of Arts (B.A.) in Art degree is a liberal arts program, offering students the flexibility to pursue a double major or a minor in another discipline while completing an undergraduate degree in the visual arts. The B.A. program requires 39 credit hours in Art (including Art History). Students pursuing the B.A. in Art may not declare a concentration. Graduates with a B.A. in Art pursue a range of careers or graduate school opportunities including teaching, arts administration, museum and gallery work, or other professions in creative industries. The B.A. in Art offers general education courses as well as intermediate and advanced courses in a variety of visual art areas and art history, allowing students to explore the visual arts in a variety of mediums and forms.",https://academics.charlotte.edu/program/art-b-a-on-campus/,,Bachelor of Arts in Studio Arts,https://academics.charlotte.edu/program/art-b-a-on-campus/,
,"The Bachelor of Arts in Art provides students with a broad exposure to the visual arts and art history while providing a foundation in fundamental art processes and theories. Students select one concentration from the following options: Art History, Art Therapy, Community Arts, Digital Media, Drawing, Fibers, Graphic Design, Illustration, Painting, Photography, Print Media, Sculpture. This program allows students to combine their art studies with an additional major or minor in another academic discipline. The B.A. degree provides students with opportunities to develop their intellectual, aesthetic, and creative potential while preparing them for careers in fields where a flexible education, critical thinking, and visual communication skills are important. Graduates are prepared for careers in fields such as art and gallery management, art administration, public relations, visual communication, arts education, and arts programming, or for graduate studies in a range of art and humanities disciplines. Graduates of the Art (B.A.) may also apply to graduate programs for careers in counseling, art therapy, public health and other related fields that utilize visual art making within a therapeutic, community-based or arts integrated context.",https://catalog.unc.edu/undergraduate/programs-study/art-ba/,,Bachelor of Arts in Visual Arts,https://catalog.unc.edu/undergraduate/programs-study/,
,,,,Bachelor of Arts in Women's Studies,https://interdisciplinarystudies.charlotte.edu/academics/ba-interdisciplinary-studies/,
,,,,Bachelor of Science in Applied Sciences,https://catalog.wit.edu/sciences-humanities/sciences/applied-sciences-bs/applied-sciences-bs.pdf,
,"The Bachelor of Science in Astronomy degree program at UNC Charlotte focuses on the quantitative study of the universe beyond the Earth. The curriculum provides students with a broad background in physics and mathematics, along with specialized coursework in astronomy and astrophysics. Students develop a fundamental understanding of astronomical phenomena, observational techniques, and theoretical models. The program prepares students for graduate studies in astronomy, astrophysics, or related fields, as well as for careers in science education, planetariums, observatories, and technical industries requiring strong analytical and problem-solving skills.",https://catalog.unc.edu/undergraduate/programs-study/physics-astronomy/astronomy-bs/,,Bachelor of Science in Astronomy,https://catalog.unc.edu/undergraduate/programs-study/,
,,,,Bachelor of Science in Bioinformatics,https://artsci.tamu.edu/statistics/academics/undergraduate/bs-in-bioinformatics.html,
,,,,Bachelor of Science in Biology,https://bsc.ua.edu/undergraduate/bachelor-of-science-in-biology/,
