Concentration name,description,program website url,Accreditation status,Program name,Program Page url,Level
,"The Bachelor's Degree in Geographic Information Science (GIScience) is an interdisciplinary program designed to provide students with a strong foundation in GIScience concepts, theories, and applications. The program integrates knowledge from geography, computer science, statistics, and other related fields to equip students with the skills needed to analyze spatial data, develop mapping applications, and solve real-world problems. Graduates of the program are prepared for careers in various sectors, including urban planning, environmental management, public health, business, and government, where spatial data analysis and visualization are critical.",https://www.gisdegree.org/programs/bachelors/,,Minor in Geographic Information Sciences,https://www.gisdegree.org/programs/bachelors/,
,"The minor in Geography is administered by the Department of Geography and Earth Sciences. Students who minor in Geography gain insight into the dynamic processes that shape our world, from physical environments to human populations. Geographers study these phenomena and processes at local to global scales. The minor offers students the opportunity to learn foundational concepts in physical geography, human geography, and geographic information science (GIS). This minor is an excellent complement to majors in the social sciences, natural sciences, and other interdisciplinary areas of study. Graduates with a Geography minor are prepared for a variety of careers in both the private and public sectors including environmental management, urban and regional planning, cartography, and many others.",https://catalog.unc.edu/undergraduate/programs-study/geography-minor/,,Minor in Geography,https://catalog.unc.edu/undergraduate/programs-study/,
,"The Department of Earth and Environmental Sciences offers a minor in Geological Sciences. A minor in Geological Sciences consists of 18 semester hours. Six hours must be at the 3000-level or above. All courses must be passed with a grade of C or above. To declare the minor, a student must have a GPA of 2.0 or greater. The minor requires a minimum of 18 semester hours in Geology courses, with at least six hours at the 3000 level or above. No more than six semester hours of transfer credit may be applied to the minor. No more than six semester hours of applied credit can be counted towards the minor. No more than three hours of GEOL 4600 may be applied to the minor.",https://geoearth.charlotte.edu/academics/undergraduate-programs/minor-geological-sciences,,Minor in Geological Sciences,https://geoearth.charlotte.edu/,
,"A minor in German provides students with linguistic and cultural skills that prepare them for a wide range of careers in education, communication, business, industry, and government. The German language program aims to develop students’ communicative competence and cultural knowledge through rigorous language training, courses in German literature, linguistics, film, and culture, and study abroad opportunities. Students of German develop critical thinking, analytical, and communication skills applicable to many fields. The minor may be combined with a major in any field. German is an important language in business, international relations, sciences, and the arts.",https://catalog.charlotte.edu/preview_program.php?catoid=30&poid=7790,,Minor in German Language,https://catalog.ufl.edu/UGRD/colleges-schools/UGLAS/GMN_UMN/,
,"The Minor in German Studies is designed to equip students with proficiency in the German language and a comprehensive understanding of German-speaking cultures. Through a blend of language courses, literature, and cultural studies, students will develop critical thinking skills and a global perspective. The program aims to foster intercultural communication skills, preparing students for diverse careers or further academic pursuits where knowledge of German is an asset.",https://academics.charlotte.edu/program/german-minor-on-campus/,,Minor in German Studies,https://academics.charlotte.edu/program/german-minor-on-campus/,
,"The Film Studies Minor is an interdisciplinary program designed to give undergraduates a coherent understanding of film both as an art form and as a social, political, and economic force. Students are introduced to the formal properties of film; to historical developments in both American and international cinema; and to critical theories concerning various approaches to film study. With courses in departments such as English, Communication Studies, Languages and Culture Studies, and History, the minor draws on a wide range of expertise and perspectives across campus. The minor provides a foundation in film studies for students in any major and prepares them for further study in graduate programs or for careers in the film industry.",https://academics.charlotte.edu/program/film-studies-minor-on-campus/,,Minor in Global Cinema,https://academics.charlotte.edu/program/film-studies-minor-on-campus/,
,,,,Minor in Global Studies,https://catalog.csumb.edu/preview_program.php?catoid=9&poid=1829&returnto=461,
,"The Minor in Greek is an excellent complement to degrees in fields such as Classics, History, Philosophy, Religious Studies, English, Political Science, and Art History, as well as many others. Through the study of the Greek language and culture, students will broaden their understanding of Greek civilization and its influence on the modern world. Courses expose students to the origins of Western literature, history, philosophy, drama, and political thought and provide insight into Greek perspectives on human life, society, and the cosmos. Students will gain proficiency in reading and understanding ancient Greek and will learn to analyze primary sources critically. The Minor in Greek supports career paths in education, law, medicine, government, library science, ministry, and journalism, among others.",https://catalog.unc.edu/undergraduate/programs-study/languages-culture-studies/greek-minor/,,Minor in Greek,https://catalog.unc.edu/undergraduate/programs-study/,Minor
,"The Haitian Creole Minor, offered through the Department of Languages and Culture Studies, provides students with proficiency in Haitian Creole, a language spoken by over 12 million people worldwide. Haitian Creole is an important language in Florida, New York, Boston, Montreal, and other metropolitan areas that have large Haitian diasporas. It is the language of Haiti, an important partner of the U.S. in the Caribbean. A minor in Haitian Creole will give students a competitive advantage for careers related to health, social work, law, education, business, and other service professions, particularly in south Florida and other regions with large Haitian populations. Many of our students have chosen to pair Haitian Creole with a major in Health Systems Management, Political Science, International Studies, Nursing, or Spanish.",https://catalog.unc.edu/undergraduate/programs-study/languages-culture-studies/haitian-creole-minor/,,Minor in Haitian Creole,https://catalog.unc.edu/undergraduate/programs-study/,
,,,,Minor in Hindi-Urdu,https://www.jmu.edu/academics/undergraduate/minors/modern-foreign-languages.shtml,
,"The Minor in History is designed for students who desire to supplement a major in another field with a strong grounding in historical studies. Through a combination of coursework covering various periods and regions, students will develop critical thinking, research, and analytical skills. The minor offers flexibility, allowing students to explore their historical interests while complementing their primary academic pursuits.",https://catalog.unc.edu/undergraduate/programs-study/history-minor/,,Minor in History,https://catalog.unc.edu/undergraduate/programs-study/,
,"The Minor in Information Science provides students with the fundamental knowledge and skills of information science including aspects related to people, information, and technology. It focuses on the life cycle of information in organizations, how people interact with information and technology, and how information and computing technologies are used to support organizational processes. The minor is suitable for students in a wide variety of majors, especially those in Business, Communication, Education, Psychology, and Sociology.",https://catalog.unc.edu/undergraduate/programs-study/information-science-minor/,,Minor in Information Science,https://catalog.unc.edu/undergraduate/programs-study/,
,"A minor in Latin American Studies at UNC Charlotte provides students with a multidisciplinary approach to the study of Latin America and the Caribbean, including their diverse peoples, histories, cultures, politics, and socioeconomic issues. Students have the opportunity to develop linguistic proficiency in Spanish or Portuguese, and gain regional expertise, critical thinking, and communication skills applicable to careers in a wide array of fields, including education, government, business, non-profit organizations, international relations, and graduate studies. Students can choose from a range of courses in departments such as Africana Studies, Anthropology, Art History, Communication Studies, Dance, Economics, English, Geography and Earth Sciences, Global Studies, History, Languages and Culture Studies, Music, Political Science and International Relations, Religious Studies, and Sociology. Students are encouraged to pursue an education abroad experience in Latin America or the Caribbean, and internship opportunities are also available locally and abroad.",https://latinamericanstudies.charlotte.edu/undergraduate-program/,,Minor in Latin American Studies,https://latinamericanstudies.charlotte.edu/undergraduate-program/,
,"The Linguistics, Interpretation, and Translation (LIT) Minor is housed in the Department of Languages and Culture Studies. It is an interdisciplinary minor designed to provide students with a foundational knowledge of linguistics, the academic discipline that studies the structure of language, and its practical application in the fields of interpretation and translation. The minor requires 18 credit hours and is open to all students. The LIT minor provides excellent preparation for careers that involve work with people from diverse linguistic and cultural backgrounds. Potential career paths include interpreters and translators, speech-language pathologists, computational linguists, language teachers, forensic linguists, technical writers, and editors, among others. Students will also be well-prepared for graduate study in related fields, such as linguistics, TESOL, or speech-language pathology.",https://catalog.unc.edu/undergraduate/programs-study/linguistics-interpretation-translation-minor/,,"Minor in Linguistics, Interpretation, and Translation",https://catalog.unc.edu/undergraduate/programs-study/,
,"The Minor in Literature and Culture provides students with the opportunity to pursue an interest in literary studies and critical methods outside of the major. It consists of 18 credit hours, including one required course, ENGL 2100: Introduction to Literary Studies, and five elective courses. Students can select courses from across the English Department’s offerings, including courses in American, British, and Anglophone literatures; film studies; women’s and gender studies; and cultural studies.",https://english.charlotte.edu/programs/undergraduate-program-information/minors/,,Minor in Literature and Culture,https://english.charlotte.edu/programs/undergraduate-program-information/minors/,
,"The minor in mathematics is designed for students who desire a strong mathematical background to enhance their major area of study. The minor is flexible enough to accommodate various interests from application driven students to those with a desire for more theoretical mathematics. The minor also provides a strong foundation for students who might consider graduate study in various quantitative fields. Students will develop an understanding of calculus, differential equations, linear algebra, and discrete mathematics. In addition, students will develop critical thinking skills, problem-solving abilities, and an appreciation for the role of mathematics in various disciplines.",https://catalog.unc.edu/undergraduate/programs-study/mathematics-minor/,,Minor in Mathematics,https://catalog.unc.edu/undergraduate/programs-study/,
,"The minor in Media and Journalism provides students with an overview of media practices and critical analysis skills related to media and journalism. Students will explore the history, ethics, practices, and impact of journalism, public relations, and related media industries. Through a combination of theoretical and practical coursework, students will develop a foundational understanding of media communication, including writing for media, digital content creation, and media literacy.",https://communication.charlotte.edu/undergraduate-programs/minors/,,Minor in Media and Journalism,https://communication.charlotte.edu/undergraduate-programs/minors/,
,"The Health and Medical Humanities (HMH) minor provides an interdisciplinary approach to healthcare. It complements majors in both the sciences (e.g., Biology, Chemistry, Public Health) and the humanities (e.g., English, History, Philosophy, Religious Studies) and is appropriate for students interested in a broad range of careers in healthcare, including clinical practice, health policy, and public health. Students minoring in HMH will learn to analyze diverse historical, cultural, philosophical, and ethical issues related to health, illness, and medical care. The minor emphasizes the complex interactions of healthcare with society, culture, ethics, and policy and aims to foster critical thinking, communication skills, and an understanding of diverse perspectives. Students complete 18 credit hours, including 6 credits of required courses and 12 credits of elective courses in two clusters. The minor is housed in the Department of Philosophy.",https://academics.charlotte.edu/program/health-medical-humanities-minor-on-campus/,,Minor in Medicine,https://academics.charlotte.edu/program/health-medical-humanities-minor-on-campus/,
,"The Music Performance Minor provides an opportunity for students in any major to continue studying and performing music while pursuing a different academic path. This minor is especially useful for students who enjoy performing, want to improve their performance skills, and wish to perform in large and small ensembles. Participation in ensembles and weekly applied lessons are core to the curriculum.",https://academics.charlotte.edu/program/music-performance-minor-on-campus/,,Minor in Music,https://academics.charlotte.edu/program/music-performance-minor-on-campus/,
,"The Minor in Music History and Literature provides an in-depth study of the history of Western music. Students completing the Minor will gain knowledge of important figures, styles, and genres in music history, and they will develop skills in critical thinking and research through the study of diverse repertoire and analytical approaches. The Minor will develop students' abilities in written and oral communication, encouraging them to engage with music as an intellectual and cultural phenomenon. The Minor is an excellent complement to majors in the humanities, such as English, History, Philosophy, and Religious Studies, and to majors in other areas within the arts, such as Music, Dance, Theater, or Art History. The Minor in Music History and Literature is not open to students pursuing the B.A. in Music (Music History and Literature concentration).",https://catalog.unc.edu/undergraduate/programs-study/music-history-literature-minor/,,Minor in Music History and Literature,https://catalog.unc.edu/undergraduate/programs-study/,
,"The minor in Neuroscience and Neurobiology is designed to introduce students to the multidisciplinary study of the nervous system. Students will gain a fundamental understanding of the structure and function of the nervous system, from molecular and cellular levels to systems and behavioral aspects. The curriculum explores topics such as neuroanatomy, neurophysiology, neuropharmacology, developmental neuroscience, cognitive neuroscience, and neurological disorders. This minor is suitable for students pursuing majors in various fields including Biology, Psychology, Health Sciences, Computer Science, and Engineering, providing a strong foundation for those interested in careers in research, healthcare, biotechnology, or further graduate studies in neuroscience. The program emphasizes critical thinking, experimental design, data analysis, and scientific communication.",https://catalog.unc.edu/undergraduate/programs-study/neuroscience-neurobiology-minor/,,Minor in Neuroscience and Neurobiology,https://catalog.unc.edu/undergraduate/programs-study/,
,"The North American Studies minor offers students an interdisciplinary approach to understanding the United States, Canada, and Mexico as a continental space. Students explore the region from a variety of perspectives, including history, politics, economics, literature, and culture. The minor requires a minimum of 18 credit hours, including specific courses in History and Political Science, and electives from a range of disciplines. Students will gain a broad understanding of the historical, social, and cultural dynamics that have shaped North America, preparing them for careers in education, public service, international relations, and more.",https://academics.charlotte.edu/programs/north-american-studies-minor,,Minor in North American Studies,https://academics.charlotte.edu/program-type/minor/,
,"The Peace, War, and Defense (PWD) Minor provides students an opportunity to learn more about the critical issues surrounding peace and conflict. The interdisciplinary nature of the minor requires students to consider historical, ethical, political, economic, social, and military dimensions of peace and war studies. Through these courses, students will explore topics such as political violence, civil rights, human rights, global affairs, national security, terrorism, international relations, military history, and much more. The minor provides a strong complement for students majoring in areas such as Political Science, History, Criminal Justice, Geography, International Studies, and other disciplines within the College of Liberal Arts & Sciences. Given the interdisciplinary focus, it also pairs well with majors across the university. The PWD minor prepares students to analyze the causes and consequences of conflict and develop skills for conflict resolution. It provides a foundation for careers in government, intelligence, foreign service, law, international organizations, national security, or non-governmental organizations. The minor consists of 18 credit hours; nine (9) hours of required courses and nine (9) hours of electives from an approved list of courses. A grade of C or better is required in all courses counting toward the minor. For more information, please see the Academic Catalog.",https://academics.charlotte.edu/academic-program/peace-war-defense-minor,,"Minor in Peace, War, and Defense",https://academics.charlotte.edu/program-type/minor/,
,"The minor in Philosophy is designed to introduce students to the main areas of philosophical inquiry and to develop their abilities to analyze complex problems and construct and evaluate arguments. The minor provides a background for students interested in a variety of post-graduate fields, including law, education, business, and theology, and for students pursuing careers in fields that require strong critical thinking, analytical, and communication skills.",https://catalog.unc.edu/undergraduate/programs-study/philosophy-minor/,,Minor in Philosophy,https://catalog.unc.edu/undergraduate/programs-study/,
,"The Minor in Physical Education Teaching and Coaching requires 18 credit hours and is designed to provide professional preparation for students interested in teaching physical education in public schools and coaching athletics at various levels (e.g., K-12, community). It is intended to complement an undergraduate major (e.g., Exercise Science, Psychology) for students who aspire to careers in fields such as physical education, coaching, athletic administration, and strength and conditioning. The minor includes courses in physical education teaching methods, motor skill development, sport pedagogy, exercise physiology, first aid/CPR, and coaching principles. It does not lead to initial teaching licensure but provides foundational knowledge and skills applicable to various roles in physical activity and sport.",https://catalog.unc.edu/undergraduate/programs-study/physical-education-teaching-coaching-minor/,,Minor in Physical Education Teaching and Coaching,https://catalog.unc.edu/undergraduate/programs-study/,
,"A minor in Physics requires 20 semester hours of Physics courses beyond PHYS 1101 and PHYS 1102. Physics minors are required to take PHYS 2101, PHYS 2102, PHYS 3101, PHYS 3102, and at least one other 3000- or 4000-level Physics course. Any substitution for these courses must be approved by the Department of Physics and Optical Science.

Course List
PHYS 2101 - General Physics I (3)
PHYS 2102 - General Physics II (3)
PHYS 3101 - Modern Physics (3)
PHYS 3102 - Analytical Mechanics (3)

Electives (choose one)
PHYS 3000- or 4000-level (3)",https://catalog.unc.edu/undergraduate/programs-study/physics-optical-science/physics-minor/,,Minor in Physics,https://catalog.unc.edu/undergraduate/programs-study/,
,A minor in political science consists of 18 semester hours of course work in political science with a minimum grade of C in each course. The 18 semester hours must include at least 9 semester hours at the 3000-level or above. POLS 1110 Introduction to American Politics and Government or POLS 1120 Introduction to Comparative Politics is required. A maximum of six (6) semester hours from transfer credit may count toward the minor. The specific courses for the minor are to be determined in consultation with the Political Science Department Minor Advisor.,https://catalog.unc.edu/undergraduate/programs-study/political-science-minor/,,Minor in Political Science,https://catalog.unc.edu/undergraduate/programs-study/,
,"The minor in Public Policy Analysis is designed for students interested in how public policy decisions are made and implemented. The minor focuses on the analytical tools and critical thinking skills necessary for understanding complex policy problems, evaluating policy options, and assessing policy outcomes. Students will develop an understanding of the institutions and processes involved in public policy making, as well as the economic, social, and political factors that influence policy decisions. This minor is suitable for students from a wide range of disciplines who wish to enhance their understanding of public policy and its impact on society. It provides a strong foundation for careers in government, non-profit organizations, advocacy groups, and further graduate study in public policy, public administration, or law.",https://catalog.unc.edu/undergraduate/programs-study/public-policy-analysis-minor/,,Minor in Public Policy Analysis,https://catalog.unc.edu/undergraduate/programs-study/,
,"The Minor in Religious Studies exposes students to the academic study of religion as a human phenomenon. Through a diverse array of courses, students develop a sophisticated understanding of religion, including its history, theories, practices, and impacts on individuals, societies, and cultures across the globe. Students will encounter diverse religious traditions and expressions in various cultural and historical contexts, learn how to analyze and compare them, and critically reflect on the nature of religion as a cultural system. Because the academic study of religion is inherently interdisciplinary, the minor appeals to students across the humanities, social sciences, and professional fields. The minor requires six courses (18 credit hours). For more information, see the Religious Studies program website.",https://catalog.unc.edu/undergraduate/programs-study/religious-studies-minor/,,Minor in Religious Studies,https://catalog.unc.edu/undergraduate/programs-study/,
,"The Minor in Social and Economic Justice provides students with an interdisciplinary understanding of the causes and consequences of social inequality, poverty, and other forms of oppression. Students will engage with a range of theoretical and methodological approaches to understanding social justice issues, and they will explore strategies for promoting social change. The minor is designed to complement a wide range of majors by providing students with critical analytical skills, ethical reasoning, and a commitment to social justice.",https://catalog.unc.edu/undergraduate/programs-study/social-economic-justice-minor/,,Minor in Social and Economic Justice,https://catalog.unc.edu/undergraduate/programs-study/social-economic-justice-minor/,
,"Sociology is the scientific study of social life, social change, and the social causes and consequences of human behavior. Sociologists investigate the structure of groups, organizations, and societies, and how people interact within these contexts. Since all human behavior is social, the subject matter of sociology is vast, ranging from the intimate family to the hostile mob; from organized crime to religious cults; from the divisions of race, gender, and social class to the shared beliefs of a common culture; and from the sociology of work to the sociology of sports. The Sociology Minor provides students with an understanding of social life and social forces that shape behavior.",https://catalog.unc.edu/undergraduate/programs-study/sociology-minor/,,Minor in Sociology,https://catalog.unc.edu/undergraduate/programs-study/,
