,PhD in Counseling Psychology,,,,,PhD,Fall,,,"December 1, 2025",Required,Required,GRE,"Applicants are required to take one of the following exams and receive the minimum score to be considered for admission: TOEFL iBT minimum score of 79, TOEFL PBT minimum score of 550, IELTS minimum overall band score of 6.5, PTE minimum score of 53, or Duolingo English Test minimum score of 110. UA also accepts successful completion of Level 112 at an ELS Language Center in the U.S. in place of the tests listed above.","The deadline for applications for the Counseling Psychology Ph.D. program is December 1st for Fall admission. All application materials, including those sent from other institutions (i.e. letters of recommendation and transcripts), must be received by this date to be considered for admission. Our program uses a mentorship model and applicants must identify one or two potential faculty advisors in their personal statement.

Application Materials to be Submitted Online:
- Completed University of Akron Graduate School online application
- A current résumé or curriculum vita (CV)
- A personal statement of 2-3 pages that describes your interest in counseling psychology, our program in particular, and your professional goals. Please also identify one or two faculty members with whom you would like to work and describe how your research interests align with their work.
- Three letters of recommendation. Please request letters from individuals who can attest to your academic ability and your potential for graduate study in psychology.
- Transcripts from ALL colleges and universities attended.
- The Graduate Record Examination (GRE) is not required for admission to this program.
- A writing sample. Please choose a paper written for an undergraduate or graduate course that you feel best represents your writing ability.",Required,,True,False,False,False,True,False,True,False,False,False,False,False,False,False,False,False,,,,College of Health and Human Sciences,"$18,894.30/Year (Ohio Resident)",,,,,,,"The Counseling Psychology Ph.D. program at The University of Akron is a scientist-practitioner based program with a strong social justice mission that prepares students for careers as counseling psychologists in a variety of settings. The program has been continuously accredited by the American Psychological Association (APA) since 1987. The University of Akron’s Counseling Psychology Ph.D. program emphasizes the following areas: multicultural competence and social justice, group work, research, supervision and training, and psychological assessment. We seek students who are interested in becoming leading practitioners and researchers. The program typically takes 5 years to complete, including a yearlong internship. Our Ph.D. program is one of only two APA-accredited doctoral programs in Counseling Psychology in the state of Ohio.",,https://www.uakron.edu/academics_majors/graduate_programs/,The program has been continuously accredited by the American Psychological Association (APA) since 1987.,,$629.81/credit hour (Ohio Resident),,False,,4.0,3.25,,,,,,,,,,,"$18,894.30/Year (Ohio Resident)",,,,,,,False,False,,,110.0,112.0,,,6.5,,,53.0,,79.0,,,,,,,,,,,"$15,000 stipend and a full tuition waiver",,Graduate assistantships,,,,,,,
,Master of Arts in Counseling: Clinical Mental Health Counseling,,,,,Master of Arts,Fall,,,,Required,Required,Optional,"All international applicants must submit evidence of English language proficiency. Acceptable evidence includes minimum scores on the TOEFL (79 iBT or 550 PBT), IELTS (6.5), PTE Academic (53), Duolingo English Test (110), or completion of ELS Level 112.",Graduate School application and fee; Official transcripts from all institutions attended; GPA of at least 3.0 on a 4.0 scale; Three letters of recommendation; Statement of purpose; Resume/CV; GRE scores - (Waived for Fall 2024 admissions); Interview with program faculty,Not Required,,True,False,False,False,False,False,False,False,False,False,False,False,False,False,False,False,,,,School of Counseling,"$14,604/Year (in-state)",,,,,,Clinical Mental Health Counseling,"The Master of Arts in Clinical Mental Health Counseling is a 60-semester-hour program designed to prepare counseling professionals to work with individuals, families, and groups to address personal and social problems. Students are prepared to practice in a variety of settings, such as community mental health centers, hospitals, private counseling agencies, and private practice. Graduates of this program are qualified to seek licensure as a professional counselor in Ohio and in most other states.",,https://www.uakron.edu/academics_majors/graduate_programs/,The Clinical Mental Health Counseling Program at The University of Akron is accredited by the Council for Accreditation of Counseling and Related Educational Programs (CACREP).,,$608.44/credit (in-state),False,False,0.0,4.0,2.75,,1001-1200,,,,,,,,,"$14,604/Year (in-state)",,,,,,,False,False,,,110.0,112.0,,,6.5,,,53.0,,79.0,,,,,,,,,,,,,"Assistantships, Fellowships, Scholarships",,,,,,,
,Master of Arts in Counseling: Marriage and Family Therapy/Counseling,,,,,Master,Fall,,August 2025,"January 15, 2026",,,Not Required,"All applicants whose native language is not English must demonstrate English language proficiency. The University of Akron Graduate School accepts TOEFL, IELTS, PTE Academic, and Duolingo English Test scores.",,,,,,False,False,False,False,False,False,False,False,False,False,False,False,False,False,,,,School of Counseling,"$13,728/Year (in-state), $21,199/Year (out-of-state)",,,,,,Marriage and Family Therapy/Counseling,"The Marriage and Family Therapy/Counseling (MFT/C) program is a 60-semester hour, CACREP-accredited program that prepares students with specialized knowledge and skills to work with individuals, couples, and families from a systemic/relational perspective. The program is designed to meet the educational requirements for licensure in the state of Ohio as a Licensed Professional Counselor (LPC) and a Licensed Marriage and Family Therapist (LMFT). The program has also been approved by the International Registry of Counsellor Education Programmes (IRCEP), an international affiliate of CACREP, which facilitates opportunities for our graduates to seek credentials in other countries.",,https://www.uakron.edu/academics_majors/graduate_programs/,"The Marriage and Family Therapy/Counseling (MFT/C) program is a ... CACREP-accredited program. ... The program has also been approved by the International Registry of Counsellor Education Programmes (IRCEP), an international affiliate of CACREP...",,"$571.98/credit (in-state), $883.29/credit (out-of-state)",,,,4.0,2.75,,,,,,,,,,,,,,,,,,,,,,110.0,112.0,,,6.5,,,53.0,,79.0,,,,,,,,,,,,,"Scholarships, Assistantships, Fellowships",,,,,,,
,Master of Arts in Education: School Counseling,,,,,Masters,"Summer, Fall",,August of the year prior to admission,January 15,,,Not Required,"Applicants whose native language is not English must submit proof of English proficiency unless they have a bachelor's or master's degree from a U.S. institution. The University of Akron accepts TOEFL, IELTS, PTE and Duolingo.",,,,,,False,False,False,False,False,False,False,False,False,False,False,False,False,False,,,,LeBron James Family Foundation School of Education,11554/Year,,,,,,,"The School Counseling Program at The University of Akron is a 60-semester-hour, CACREP-accredited program that prepares students to meet the academic, career, and social/emotional developmental needs of children and adolescents in schools. Students are prepared to become professional school counselors in elementary, middle, and high school settings. The program meets the academic requirements for the State of Ohio Department of Education School Counselor license (K-12). It also provides the academic background necessary for students to become Licensed Professional Counselors (LPC) in the state of Ohio. Students complete a common core of counseling classes along with specific coursework in school counseling. This program requires both a practicum (100 hours) and an internship (600 hours). Students interested in pursuing a doctoral degree in Counselor Education and Supervision can transition into our Ph.D. program. The School Counseling program is offered in a traditional (in-person) format on the main campus in Akron.",,https://www.uakron.edu/academics_majors/graduate_programs/,CACREP-accredited,,566.23/Credit,,,,4.0,2.75,,,,,,,,,,,11554/Year,,,,,,,,,,,110.0,,,,6.5,,,53.0,,79.0,,,,,,,,,,,,,"Assistantships, Fellowships, Scholarships",,,,,,,
,PhD in Engineering: Polymer Engineering,,,,,,"Fall, Spring",,,,,,Not Required,International applicants are required to demonstrate proficiency in the English language. Applicants must submit one of the following: Test of English as a Foreign Language (TOEFL) with a minimum score of 79 (internet-based) or 550 (paper-based); International English Language Testing System (IELTS) with a minimum score of 6.5; Pearson Test of English (PTE) with a minimum score of 53; Duolingo with a minimum score of 110; or successful completion of ELS Language Centers Level 112.,,,,,,False,False,False,False,False,False,False,False,False,False,False,False,False,False,,,,College of Engineering and Polymer Science,"$15,162.12/Year (In-State), $22,151.52/Year (Out-of-State)",,,,,,Polymer Engineering,"The Doctor of Philosophy in Engineering degree program at The University of Akron is an interdisciplinary program that provides students with an opportunity to perform high level and ground-breaking research. Students select a specialization within one of the engineering disciplines offered through our five engineering departments. The College of Engineering and Polymer Science has a strong research reputation and is consistently ranked among the best engineering schools. Our faculty are active researchers, leaders in their fields, and are always looking to take on motivated students in their research group. The faculty work collaboratively with a number of centers on campus, industries, and government labs. Our Ph.D. students are highly sought after by industry, national labs and academia.",,https://www.uakron.edu/academics_majors/graduate_programs/,,,"$766.70/credit (In-State), $1,155.00/credit (Out-of-State)",,,,4.0,3.0,,,,,,,,,,,"$15,162.12/Year (In-State), $22,151.52/Year (Out-of-State)",,,,,,,,,,,110.0,112.0,,,6.5,,,53.0,,79.0,,,,,,,,,,,"Stipends for the 2023-24 academic year are $30,000",,Teaching or research assistantships,,,,,,,
,Master of Business Administration with Concentration in Business Analytics,,,,,,"Fall, Spring, Summer",,,,,,Either,"All international applicants must demonstrate English proficiency. Minimum scores for admission without condition are: 79 for the internet-based TOEFL (iBT), 550 for the paper-based TOEFL (PBT), 6.5 for the IELTS, 53 for the PTE, or 110 for the Duolingo English Test. Successful completion of the ELS Language Centers' Level 112 is also accepted. Some applicants may be exempt from this requirement.",,,,,,False,False,True,False,False,False,False,False,False,False,False,False,False,False,,,,College of Business,"$16,932.60/Year (Ohio Resident)",,,,,,Business Analytics,"The University of Akron's Master of Business Administration (MBA) degree program is designed for individuals who have a bachelor's degree in any field. The program emphasizes strategic decision-making and developing skills to succeed in a rapidly changing business climate. The College of Business is one of only 194 business schools in the world to hold dual accreditation from AACSB International in both business and accounting. Why Akron? The UA MBA provides an excellent return on investment. Our program is flexible, affordable and high-quality, giving you the skills needed to compete in a global economy. We offer a wide range of graduate business courses that enable you to customize your education to meet your career goals. In addition to a general MBA, we offer 12 specializations, including a new specialization in healthcare management.",,https://www.uakron.edu/academics_majors/graduate_programs/,The College of Business is one of only 194 business schools in the world to hold dual accreditation from AACSB International in both business and accounting.,,940.7,,,,4.0,3.0,,,,,,,,,,,,,,,,,,,,,,110.0,112.0,,,6.5,,,53.0,,79.0,,,,,,,,,,,,,Graduate assistantships,,,,,,,
,Master of Business Administration with Concentration in Finance,,,,,Master,"Fall, Spring, and Summer",,,,,,Optional,"International applicants must provide proof of English proficiency. Accepted tests include TOEFL (minimum 79 iBT or 550 PBT), IELTS (minimum 6.5), PTE Academic (minimum 53), or Duolingo English Test (minimum 105). Completion of Level 112 of the ELS Language Centers' Intensive English Program also satisfies this requirement.",,,,,,False,False,False,False,False,False,False,False,False,False,False,False,False,False,,,,College of Business,"$27,951.12 (Total program tuition for Ohio residents)",,,,,,Finance,"The Master of Business Administration (MBA) program at The University of Akron is designed for individuals from all academic backgrounds who are ready to lead, innovate, and make a significant impact in the business world. Our program is tailored to provide a flexible, yet rigorous curriculum that combines core business principles with specialized knowledge, preparing you for the challenges of today's dynamic global market. Our program is offered in three flexible formats to fit your schedule: Traditional Part-Time MBA (on-campus), Online MBA (100% online), and a Full-Time Two-Year MBA Cohort. Each of these options delivers the same high-quality education and access to our dedicated faculty and resources. Whether you are looking to advance in your current career, switch industries, or start your own venture, our MBA program provides the tools, network, and experience to achieve your professional goals.",,https://www.uakron.edu/academics_majors/graduate_programs/,The University of Akron’s College of Business is one of only 190 universities in the world to hold dual AACSB accreditation in both business and accounting.,,"$776.42 per credit hour for Ohio residents, $1,192.83 per credit hour for non-residents",,,,4.0,3.0,,,,,,,,,,,,,,,,,,,,,,105.0,112.0,,,6.5,,,53.0,,79.0,,,,,,,,,,,,,"Merit-based, Need-based",,,,,,,
,Master of Business Administration with Concentration in Risk Management & Insurance,,,,,MBA,"Fall, Spring, Summer",,,,,,Either,"Applicants whose native language is not English must submit evidence of English language proficiency. The Graduate School accepts any one of the following: TOEFL iBT minimum score 79, IELTS minimum score 6.5, PTE Academic minimum score 53, Duolingo English Test minimum score 110, or successful completion of ELS Language Centers Level 112.",,,,,,False,False,True,False,False,False,False,False,False,False,False,False,False,False,,,,College of Business,"Approximately $24,700 for the entire program for Ohio residents and $38,100 for non-residents.",,,,,,Risk Management and Insurance,"The University of Akron’s Master of Business Administration (MBA) program gives students a global perspective on business, a strategic mindset to overcome challenges, and the confidence to build and lead teams. Students will develop their knowledge and skills in functional areas of business, including finance, management, and marketing. Our program is designed for working professionals, offering a flexible format to complete the program in two years or at your own pace. With Saturday and online MBA options available, students can earn their degree while working full-time. The Risk Management and Insurance concentration prepares students for leadership positions in the corporate risk management and insurance fields. Course topics include corporate risk management, employee benefits, insurance operations, and more.",,https://www.uakron.edu/academics_majors/graduate_programs/,"The College of Business is accredited by AACSB International, the premier accrediting agency for business schools.",,"Ohio Resident: $686.04/credit; Non-Ohio Resident: $1,058.22/credit",,,,4.0,3.0,,,,,,,,,,,,,,,,,,,,,,110.0,112.0,,,6.5,,,53.0,,79.0,,,,,,,,,,,"Stipends for graduate assistantships range from $4,500 to $9,000 per academic year.",,"Merit-based scholarships, Graduate Assistantships",,,,,,,
,Master of Business Administration with Concentration in Global Technological Innovation,,,,,,,,,,,,,,,,,,,False,False,False,False,False,False,False,False,False,False,False,False,False,False,,,,,,,,,,,,,,https://www.wtamu.edu/academics/college-business/academics/graduate-programs/index.html,,,,,,,,,,,,,,,,,,,,,,,,,,,,,,,,,,,,,,,,,,,,,,,,,,,,,,,,,,,
,Master of Business Administration with Concentration in Health Care Management,,,,,Master,"Fall, Spring, Summer",,,,,,Not Required,"If your native language is not English, you will need to submit proof of English proficiency. Accepted tests include TOEFL (minimum score of 79 iBT or 550 PBT), IELTS (minimum score of 6.5), PTE (minimum score of 53), Duolingo (minimum score of 105), or successful completion of ELS Language Centers Level 112.",,,,,,False,False,False,False,False,False,False,False,False,False,False,False,False,False,,,,College of Business,"Ohio Resident: $28,670.40; Non-Ohio Resident: $42,656.40",,,,,,Health Care Management,"The Master of Business Administration (MBA) program at The University of Akron is designed for individuals who are looking for a graduate business program that helps them grow as a business leader, professionally and personally. Our program provides a global perspective of business, a strategic point of view, and a focus on responsible leadership and ethical decision-making. Students master the functional areas of business and learn to apply this knowledge in a team setting. By focusing on the development of these skills, our graduates are prepared to meet the challenges of the competitive global business environment. With flexible class options, a diverse student body, and a dedicated career services office, the UA MBA offers a great opportunity for students to move forward in their career and in their life.",,https://www.uakron.edu/academics_majors/graduate_programs/,The College of Business is one of only 190 universities in the world to hold dual AACSB accreditation in business and accounting.,,"Ohio Resident: $690.62/credit; Non-Ohio Resident: $1,079.12/credit",,,,4.0,2.75,,,,,,,,,,,,,,,,,,,,,,105.0,112.0,,,6.5,,,53.0,,79.0,,,,,,,,,,,"Minimum stipend of $12,000 for a nine-month contract, plus a full tuition scholarship for graduate assistants.",100% tuition waiver for graduate assistants,Graduate Assistantships,,,,,,,
,Master of Business Administration with Concentration in Interdisciplinary,,,,,MBA,"Fall, Spring, Summer",,,,Required,Required,Not Required,"The University of Akron requires one of the following as proof of English proficiency: Test of English as a Foreign Language (TOEFL) iBT score of 79 (or 550 for paper-based test), International English Language Testing System (IELTS) score of 6.5, Pearson Test of English (PTE) Academic score of 53, Duolingo score of 110, or Successful completion of the English Language Institute's Level 112.","In addition to the requirements of the Graduate School, the College of Business Administration requires that applicants submit scores from the Graduate Management Admission Test (GMAT) or the Graduate Record Examination (GRE), a current résumé, statement of purpose and two letters of recommendation.",Not Required,,False,False,False,False,False,False,False,False,False,False,False,False,False,False,False,False,,,,College of Business Administration,"Ohio Resident: $25,615.08 (total for 36 credits); Non-Ohio Resident: $42,313.68 (total for 36 credits)",,,,,,Interdisciplinary,"The Interdisciplinary Concentration MBA is a flexible program designed for individuals whose educational or career objectives are not met by the structured concentrations offered within the College of Business. The plan of study is mutually developed by the student and the MBA Programs Office to meet specific academic and career goals. An Interdisciplinary MBA requires a minimum of nine elective credits at the 600 level that are concentrated in a specific area. These electives may be from a discipline outside the College of Business such as communication, engineering, or law.",,https://bulletin.uakron.edu/graduate/colleges-programs/business-administration/business-interdisciplinary-mba/business-interdisciplinary-mba.pdf,AACSB International,,"Ohio Resident: $711.53; Non-Ohio Resident: $1,175.38",False,True,,4.0,2.75,,,,,,,,,,,,,,,,,,False,False,,,110.0,112.0,,,6.5,,,53.0,,79.0,,,,,,,,,,,"$500 - $2,500",,"Merit-based, Need-based",,,,,,,
,Master of Business Administration with Concentration in International Business,,,,,,"Fall, Spring, Summer",,,,Required,Required,Optional,"Applicants whose native language is not English must demonstrate English language proficiency. You must submit a satisfactory score from one of the following tests: Test of English as a Foreign Language (TOEFL) - Internet-based test (iBT): 79, International English Language Testing System (IELTS): 6.5, Pearson Test of English (PTE) Academic: 53, Duolingo English Test: 110, ELS Language Centers: Level 112.","To be considered for admission to the MBA program, applicants must have a bachelor's degree from an accredited college or university. The Admissions Committee considers the complete application package, including academic background, GMAT/GRE scores (if not waived), work experience, resume, letter of recommendation, and personal statement.",Not Required,,False,False,False,False,False,False,False,False,False,False,False,False,False,False,False,False,,,,College of Business,"The total investment for the MBA program can be as low as $25,000",,,,,,International Business,"The Master of Business Administration (MBA) program at The University of Akron is designed to provide graduate students from all backgrounds the opportunity to greatly enhance their business career. We offer several options to help students with different needs and backgrounds reach their goals. The Flexible MBA is a part-time option and our most popular program. We also offer a full-time option called the Accelerated MBA. Graduates of our MBA program go on to become successful managers and leaders in a wide variety of industries and sectors including corporate, non-profit, and government.",,https://www.uakron.edu/academics_majors/graduate_programs/,The College of Business is accredited in both business and accounting by AACSB International (the Association to Advance Collegiate Schools of Business).,,"$681.42 per credit hour (Ohio Resident), $1,073.34 per credit hour (Non-Ohio Resident)",False,False,,4.0,3.0,,,,,,,,,,,,,,,,,,False,False,,,110.0,112.0,,,6.5,,,53.0,,79.0,,,,,,,,,,,"$1,000 to $4,000",,"Merit-based, Assistantships",,,,,,,
,Master of Business Administration with Concentration in Management,,,,,Master's,"Fall, Spring, Summer",,,,,,Optional,"International applicants must demonstrate English proficiency. Accepted tests include TOEFL (minimum 79 iBT or 550 PBT), IELTS (minimum 6.5), PTE (minimum 53), or Duolingo (minimum 110). Completion of the University of Akron’s English Language Institute program or waivers for applicants from specific countries or with U.S. degrees are also options.",,,,,,False,False,False,False,False,False,False,False,False,False,False,False,False,False,,,,College of Business,"$24,837.12 (Ohio Resident, for 36 credits), $35,727.12 (Non-Ohio Resident, for 36 credits)",,,,,,Management,"The Master of Business Administration (MBA) degree at The University of Akron is a dynamic program that balances a deep understanding of business theory with a strong focus on real-world applications. Our flexible program is designed for students with an undergraduate degree in any major. We teach you how to think critically and analytically, communicate effectively, and lead with purpose. The MBA program provides a broad foundation across all business disciplines, including accounting, finance, management, and marketing. You will develop critical business skills and gain insights into leading in the global economy. All this in a program that works for you: classes are offered on campus at night and online. Our MBA degree is flexible, with options to customize your degree. You can earn an MBA with a concentration, add a graduate business certificate, or participate in a joint degree program. All options add great value to your MBA degree.",,https://www.uakron.edu/academics_majors/graduate_programs/,The College of Business is one of only 194 business schools in the world to hold dual accreditation in business and accounting from AACSB International. This achievement signifies our commitment to quality business education and places us in the top 5% of business schools worldwide.,,"$689.92 (Ohio Resident), $992.42 (Non-Ohio Resident)",,,2.0,4.0,2.75,,,,,,,,,,,"24837.12 (Ohio Resident), 35727.12 (Non-Ohio Resident)",,,,,,,,,,,110.0,,,,6.5,,,53.0,,79.0,,,,,,,,,,,"Up to $2,000; Graduate Assistantships include a full tuition waiver and stipend",,"Merit-based, Need-based, Fellowships, Graduate Assistantships",,,,,,,
