,PhD in Computer Science,,,,,,Fall,,,,Required,Required,Optional,"All international applicants whose native language is not English are required to take an English proficiency test, unless they meet the waiver requirements. Clarkson accepts the following tests and scores: TOEFL: 80 iBT, IELTS: 6.5, Duolingo: 115, PTE Academic: 56.","Online Application Form
Statement of purpose.
Résumé or curriculum vitae.
Three letters of recommendation.
Official transcripts from all institutions attended.
Official GRE scores (optional). Note that the GRE requirement may be waived for exceptional students with a proven research record.
Official TOEFL or IELTS scores, if applicable.",,,False,True,False,False,False,False,False,False,False,False,False,False,False,False,False,False,,,,School of Arts & Sciences,"$32,526/Year",,,,,,,"The PhD in computer science is a research-oriented degree that emphasizes the creation of new knowledge in the field of computer science.

Students in the program:

Engage in a focused course of study in an advanced area of specialization.
Conduct independent research.
Advance the state of the art in the field by publishing their results.
Work closely with faculty who are active researchers, who also bring their classroom teaching to a high level of excellence.

The Department of Computer Science has established strengths in the areas of algorithms, artificial intelligence, computer vision, cybersecurity, data mining and machine learning, distributed systems, graphics, parallel computing and programming languages.

All admitted PhD students receive four years of financial support in the form of a teaching or research assistantship, which includes a stipend and tuition waiver. This support is based on a student's satisfactory progress toward their degree. Admission to the PhD program is highly competitive.",,https://www.clarkson.edu/academics/graduate/programs,,,1807,False,True,,4.0,3.0,,751-800,,,,,,,,,,,,,,,,False,False,,,115.0,,,,6.5,,,56.0,,80.0,,,,,,,,,,,,Full tuition waiver,"Teaching Assistantship, Research Assistantship",,,,,,,
,PhD in Electrical and Computer Engineering,,,,,PhD,"Fall, Spring",,,,Required,Required,Not Required,"International applicants must demonstrate English language proficiency. This can be done by submitting test scores from TOEFL (minimum 80 iBT or 550 PBT), IELTS (minimum 6.5), PTE (minimum 56), Duolingo (minimum 115), or by successfully completing Level 112 in the ELS Language Centers program. The English proficiency requirement may be waived if the applicant has a degree from a university where the language of instruction is English and is in a country where English is the primary language.","In addition to the online application form and application fee, you will need to submit: A statement of purpose (approximately 500 words); A current résumé or curriculum vitae (CV); Letters of recommendation; Official transcripts from all post-secondary institutions (colleges and universities) attended. International applicants may have to provide additional materials.",,,True,False,False,False,False,False,False,False,False,False,False,False,False,False,False,False,,,,Wallace H. Coulter School of Engineering,"$1,758/Credit Hour",,,,,,"['Biometrics and information processing', 'Cyber-physical and autonomous systems', 'Cybersecurity and data fusion', 'Energy and power systems', 'Sensing, communications, and networking']","The PhD program in electrical and computer engineering at Clarkson is an interdisciplinary, research-based program. You will receive close personal attention from our highly respected faculty. They are leaders in their fields. You can also work directly with prominent research centers, such as the Center for Advanced Materials Processing (CAMP), the Center for Identification Technology Research (CITeR) and the Institute for a Sustainable Environment (ISE). Students in the program must pass a PhD candidacy examination and defend a dissertation containing an original and significant contribution to knowledge. In addition, six graduate-level courses beyond the MS degree are required. Students can receive financial support through research and teaching assistantships, as well as fellowships and tuition scholarships.",,https://www.clarkson.edu/academics/graduate/programs,,,1758,,True,,4.0,3.0,,,,,,,,,,,"$1,758/Credit Hour",,,,,,,False,False,,,115.0,112.0,,,6.5,,,56.0,,80.0,,,,,,,,,,,"Minimum academic year stipend is $30,160",100%,"Teaching Assistantship, Research Assistantship",,,,,,,
,PhD in Engineering Science,,,,,,"Fall, Spring",,,,Required,Required,Not Required,"If your native language is not English, you must take the Test of English as a Foreign Language (TOEFL) or the International English Language Testing System (IELTS) exam. We require a minimum TOEFL score of 80 (Internet-based) or 550 (paper-based), a minimum IELTS score of 6.5, a minimum PTE score of 56 or a minimum Duolingo score of 115. Applicants who have obtained a degree from an institution where the language of instruction is English are not required to submit English proficiency exam scores.","A completed online application form. A $50 application fee is required for all applicants. We offer fee waivers for participants in certain programs. Statement of Purpose: One- to two-page essay describing your reasons for pursuing graduate study, your academic and professional interests and your career goals. Resume or Curriculum Vitae (CV). Letters of Recommendation: Two or three letters of recommendation are required for most programs. Transcripts: An official transcript from every college or university you have attended is required. Standardized Test Scores (GRE/GMAT): For most programs, standardized test scores are optional for master's degree applicants and recommended for PhD applicants. Some programs require them. For Engineering Science (PhD), the GRE is recommended, but not required. English Proficiency: All applicants who are not citizens of a native English-speaking country must submit proof of English proficiency.",Not Required,,True,True,False,False,False,False,False,False,False,False,False,False,False,False,False,False,,,,Wallace H. Coulter School of Engineering,,,,,,,"Advanced Manufacturing, Aerospace Engineering, Chemical and Biomolecular Engineering, Civil and Environmental Engineering, Electrical and Computer Engineering, Materials Science and Engineering, Mechanical Engineering","The Engineering Science (ES) PhD program is a cross-disciplinary program designed to give you maximum flexibility to pursue research that crosses traditional departmental boundaries. The program allows for a plan of study that complements your specific research interests and provides depth in one particular subject while offering a broad understanding of related subjects.

As a student, you will work closely with a faculty advisor to select courses and define a research topic that aligns with your personal interests and future career goals. The goal of the program is to produce PhD graduates who are independent researchers capable of performing high-level research in academic or industrial settings.",,https://www.clarkson.edu/academics/graduate/programs,,,1856,,True,1.0,4.0,3.0,,,,,,,,,,,,,,,,,,False,False,,,115.0,,,,6.5,,,56.0,,80.0,,,,,,,,,,,Full tuition waiver,100,"Teaching assistantships, Research assistantships",,,,,,,
,PhD in Environmental Science and Engineering,,,,,,Fall,,September,January 15,Required,Required,Optional,"Applicants whose native language is not English must submit evidence of their English proficiency. Accepted tests include TOEFL iBT with a minimum score of 80, IELTS with a minimum score of 6.5, PTE Academic with a minimum score of 56, Duolingo English Test with a minimum score of 115, or successful completion of ELS Language Centers Level 112.","The following items are required for application to this program: Online Application Form. Résumé. Statement of Purpose. Three Letters of Recommendation. Official Transcripts. Official GRE Scores: Optional for PhD applicants. For international applicants, an English proficiency test is required (TOEFL, IELTS, or Duolingo English Test).",,,True,False,False,False,False,False,False,False,False,False,False,False,False,False,False,False,,,,Wallace H. Coulter School of Engineering,,,,,,,"['Environmental Chemistry', 'Environmental Health', 'Environmental Management and Policy', 'Water Resources']","The PhD in Environmental Science and Engineering program at Clarkson University is a unique, interdisciplinary degree that provides students the chance to work alongside world-class faculty on high-impact research projects. Our students are deeply committed to making the world a better place by creating solutions to environmental problems like water and air pollution, contaminated lands and climate change. As a student in this program, you will expand your breadth of knowledge across disciplines and acquire in-depth skills in a specific area of interest. You will conduct innovative, original research and publish your findings in peer-reviewed journals. You will also participate in conferences, submit grant proposals and develop your professional network. You will graduate ready to take on a leadership role in environmental science and engineering.",,https://www.clarkson.edu/academics/graduate/programs,,,1754,,True,,4.0,3.0,,,,,,,,,,,,,,,,,,False,False,,,115.0,112.0,,,6.5,,,56.0,,80.0,,,,,,,,,,,"Annual stipend of around $31,000",100% tuition waiver,Teaching or research assistantships,,,,,,,
,PhD in Materials Science and Engineering,,,,,,"Fall, Spring",,,,,,GRE,"For international applicants whose native language is not English, a valid TOEFL, IELTS, PTE or Duolingo score is required. The minimum acceptable scores are: TOEFL iBT: 80, IELTS: 6.5, PTE: 56, or Duolingo: 115.",,,,,,False,False,True,False,True,False,False,False,False,False,False,False,False,False,,,,Wallace H. Coulter School of Engineering,"$33,156/Year",,,,,,,"The Doctor of Philosophy (PhD) in Materials Science and Engineering is an interdisciplinary program providing students a doctoral-level education in the science and engineering of materials. As a student, you will investigate how the structure of a material on an atomic and microscopic level relates to its macroscopic properties, including its mechanical, electrical, thermal and optical behaviors. At Clarkson, you will gain an understanding of structure-property relationships in different classes of materials, including ceramics, composites, electronic materials, glasses, metals, polymers and semiconductors. You will also develop expertise in applying this understanding to engineer better and more useful materials.",,https://www.clarkson.edu/academics/graduate/programs,,,1732,,,1.0,4.0,3.0,,741-750,,,,,,,,,"$33,156/Year",,,,,,,,,,,115.0,,,,6.5,,,56.0,,80.0,,,,,,,,,,,"The current stipend for qualified doctoral candidates is $30,000 for 12 months. Doctoral students who are awarded a research or teaching assistantship are also awarded a tuition scholarship that covers up to 30 credits hours of tuition per academic year.",,"Teaching assistantships, research assistantships, fellowships",,,,,,,
,PhD in Mathematics,,,,,PhD,Fall,,,January 15,,,Not Required,All students whose native language is not English are required to take an English proficiency exam. Acceptable exams and minimum scores are below: Test of English as a Foreign Language (TOEFL iBT): Minimum score of 80; International English Language Testing System (IELTS): Minimum score of 6.5; Pearson Test of English (PTE): Minimum score of 56; Duolingo English Test: Minimum score of 115. The English proficiency requirement may be waived if the applicant has studied for at least three years in a country where English is the native language and has completed a bachelor's degree from that country prior to enrolling at Clarkson.,,,,,,False,False,False,False,False,False,False,False,False,False,False,False,False,False,,,,School of Arts & Sciences,"$20,784/Semester",,,,,,,"The doctor of philosophy (PhD) in mathematics is a research-oriented degree that emphasizes independent research, original contributions to the field of mathematics, and the development of expertise in a chosen area of specialization. Our curriculum is designed to provide you with a broad foundation in pure and applied mathematics, as well as the specialized knowledge and research skills necessary to conduct independent research.

As a graduate student, you will have the opportunity to work closely with our faculty members, who are experts in a wide range of mathematical fields, including algebra, analysis, combinatorics, differential equations, numerical analysis, and statistics. You will also have access to state-of-the-art research facilities, including high-performance computing clusters and a dedicated mathematics library.",,https://www.clarkson.edu/academics/graduate/programs,,,1732,,,,4.0,,,,,,,,,,,,"$20,784/Semester",,,,,,,,,,,115.0,,,,6.5,,,56.0,,80.0,,,,,,,,,,,,,"Teaching Assistantship, Research Assistantship",,,,,,,
,PhD in Mechanical Engineering,,,,,PhD,"Fall, Spring",,,January 15 (priority deadline),Required,Required,Optional,"All applicants whose native language is not English must submit proof of English proficiency. We accept the Test of English as a Foreign Language (TOEFL) iBT - minimum overall score of 80, International English Language Testing System (IELTS) - minimum overall score of 6.5, Duolingo English Test - minimum overall score of 115, Pearson Test of English (PTE) - minimum score of 56, or successful completion of ELS Educational Services - completion of Level 112. The English proficiency requirement can be waived if the applicant has completed a degree from an institution where the language of instruction is English.","All applicants must apply online. Required documents include a resume or curriculum vitae, a statement of purpose, official transcripts from all institutions attended, and three letters of recommendation. English proficiency test scores are required for international applicants. The GRE is not required for this program.",Not Required,,True,False,False,False,False,False,False,False,False,False,False,False,False,False,False,False,,,,Wallace H. Coulter School of Engineering,30552,,,,,,"['Solid Mechanics, Materials and Manufacturing', 'Thermal and Fluid Science and Engineering', 'Robotics, Dynamical Systems and Control']","The Doctor of Philosophy (PhD) in Mechanical Engineering at Clarkson is a research-based degree. Students in the PhD program will be provided with an opportunity for an in-depth study of a specialized area within mechanical engineering. The goal of the program is to produce graduates who can define and conduct independent, cutting-edge research and will become the next generation of leaders in academia and industry.",,https://www.clarkson.edu/academics/graduate/programs,,,1280,True,True,,4.0,3.0,,,,,,,,,,,30552,,,,,,,False,False,,,115.0,112.0,,,6.5,,,56.0,,80.0,,,,,,,,,,,,,"Teaching assistantships, Research assistantships, Fellowships",,,,,,,
,PhD in Physics,,,,,,Fall,,,January 15,Required,Required,Optional,"All international applicants must submit proof of English proficiency. This can be done by submitting an official score report from one of the following testing agencies: TOEFL (minimum score of 80 on the iBT), IELTS (minimum score of 6.5), PTE (minimum score of 56), or Duolingo English Test (minimum score of 115). The requirement may be waived if you have a degree from a country where English is the native language or from an institution where English is the language of instruction.","To be considered for admission to the physics graduate program, applicants must meet the general requirements for admission to the Graduate School. In addition, they must: Have a bachelor's degree in physics or a related field with sufficient preparation to undertake graduate study in physics. Submit satisfactory scores on the Graduate Record Examination (GRE) general test. (This requirement is optional for Fall 2024 admissions.) Have three letters of recommendation. International students must demonstrate English proficiency.",Not Required,,False,True,False,False,False,False,False,False,False,False,False,False,False,False,False,False,,,,School of Arts & Sciences,20817/Semester,,,,,,,"The PhD program in physics provides students with advanced knowledge of the core areas of physics and trains them to perform high-level, independent research in one of several active, well-funded subdisciplines. Students gain expertise in both theoretical and experimental aspects of physics and learn to apply their knowledge to novel problems. Students who complete the PhD program will be well-prepared for a career in academia or industry. Faculty research at Clarkson is focused in the areas of applied physics, including complex systems and soft condensed matter physics and optics. Most students enter the graduate program directly from an undergraduate physics program. However, students with a degree in another area of science or engineering may be admitted, though they may be required to take some undergraduate physics courses before being fully accepted into the graduate program.",,https://www.clarkson.edu/academics/graduate/programs,,"Annual stipend of at least $30,000, plus a full tuition scholarship",1821,,True,,4.0,3.25,,,,,,,,,,,20817/Semester,,,,,,,False,False,,,115.0,,,,6.5,,,56.0,,80.0,,,,,,,,,,,"Annual stipend of at least $30,000, plus a full tuition scholarship",100%,Research or Teaching Assistantships,,,,,,,
,Doctor of Physical Therapy (DPT),,,,,Doctoral,Summer,,June,November 1 (Priority Deadline),,Required,Not Required,"Applicants who are not native English speakers must submit a Test of English as a Foreign Language (TOEFL), International English Language Testing System (IELTS), Pearson Test of English (PTE) or Duolingo English Test (DET) score report. Scores must be sent directly from the testing service.","All applicants must have the following:
- A bachelor's degree from an accredited institution. This must be completed before starting the DPT program.
- A minimum undergraduate GPA of 3.0. This includes all undergraduate coursework at all institutions attended.
- A minimum prerequisite GPA of 3.0. This includes all prerequisite coursework at all institutions attended.
- Completion of all prerequisite courses. All prerequisites must be completed within the last ten years with a grade of C or better. All prerequisite science courses must be for science majors.
- Observation hours: 40 hours of observation with a licensed physical therapist in at least two different settings are required. These hours must be completed before your application is submitted. This can include inpatient, outpatient, acute care, rehab/subacute, extended care, school/preschool, home health, industrial/occupational health and more. We will accept a letter from a physical therapist in lieu of observation hours if your experience was impacted by the COVID-19 pandemic.
- Three letters of recommendation are required: one from a physical therapist, one from a college professor and one from an individual of your choice (not a friend or family member).
- The Graduate Record Examination (GRE) is not required.
- TOEFL scores for non-native English speakers. For more information, please visit the International Graduate Students Admissions page.
- All applications are done through PTCAS and will include an essay portion.",Not Required,,True,False,True,False,False,False,False,True,False,False,False,True,True,False,False,False,,,,Lewis School of Health Sciences,"$46,022/Year",,,,,,"['Education', 'Research', 'Sports Physical Therapy']","Clarkson’s Doctor of Physical Therapy (DPT) program prepares you for a rewarding career as a physical therapist. We're an established leader in the field and one of the oldest physical therapy schools in the nation. Our expert faculty will prepare you to be an autonomous, evidence-informed physical therapy practitioner. As a Clarkson DPT student, you will learn to apply principles of patient-centered care. You'll work with patients from diverse backgrounds as a part of an interprofessional healthcare team. This is a comprehensive, three-year, full-time program. You can also specialize in a particular area of physical therapy. There are three optional concentrations to choose from: education, research and sports physical therapy.",,https://www.clarkson.edu/academics/graduate/programs,"The Doctor of Physical Therapy Program at Clarkson University is accredited by the Commission on Accreditation in Physical Therapy Education (CAPTE), 3030 Potomac Ave., Suite 100, Alexandria, Virginia 22305-3085; telephone: 703-706-3245; email: accreditation@apta.org; website: http://www.capteonline.org.",,,True,False,2.0,4.0,3.0,,,,,,,,,,,,,,,,,,False,False,,,115.0,,,,6.5,,,56.0,,80.0,,,,,,,,,,,,,Merit-based,,,,,,,
,Advanced Certificate in Business,,,,,Advanced Certificate,,,,,Required,Required,Not Required,,"Students can apply for graduate credit and complete one of our Advanced Business Certificates using the standard graduate business application. A GMAT or GRE is not required for the Advanced Business Certificates. General application requirements for graduate programs include: Online Application and Fee, Statement of Purpose, Resume or CV, Letters of Recommendation, and Official Transcripts.",Not Required,,True,False,False,False,False,False,False,False,False,False,False,False,False,False,True,False,,,,David D. Reh School of Business,19050,,,,,,,"The Advanced Certificate in Business is a 15-credit-hour program offered through the Reh School of Business. It provides a foundation of business knowledge for individuals who may not have an undergraduate degree in business. This includes students currently enrolled in a Clarkson graduate program, as well as working professionals who want to strengthen their knowledge of core business principles to enhance their career.",,https://www.clarkson.edu/academics/majors-minors/business-certificates,The David D. Reh School of Business is accredited by the Association to Advance Collegiate Schools of Business (AACSB). Fewer than five percent of business schools worldwide have this distinction.,,1270,,False,,4.0,3.0,,1001-1200,,,,,,,,,19050,,,,,,,False,False,,,,,,,,,,,,,,,,,,,,,,,,,Merit-based,,,,,,,
,Advanced Certificate in Business of Energy,,,,,Certificate,"Fall, Spring, Summer",,,,Required,Required,Not Required,,"All applicants must submit the following: an online application and application fee, a current resume, a statement of purpose, official transcripts from all post-secondary institutions attended, and letters of recommendation. Clarkson has waived the GMAT/GRE requirement for most graduate programs.",,,True,False,False,False,False,False,False,False,False,False,False,False,False,False,False,False,,,,David D. Reh School of Business,17352,,,,,,,"The energy industry is rapidly changing, driven by technological innovations and new business models focused on sustainable, reliable and affordable energy. In the Advanced Certificate in Business of Energy program at Clarkson University, you can sharpen your business acumen and broaden your understanding of the evolving energy landscape. In just nine months, our online program prepares you for leadership roles in a variety of fields that intersect with energy, including business, policy and engineering. No matter your undergraduate background, you will gain the skills you need to become a successful energy professional. In our 12-credit certificate program, you'll gain the foundational knowledge of how the energy industry works, from production to delivery. Through an interdisciplinary curriculum and close interactions with our world-class faculty, you'll acquire expertise in financial management, energy systems and technology, and the industry's environmental and social impact.",,"https://www.northcountrynow.com/stories/online-business-of-energy-graduate-certificate-program-offered-through-clarkson-university,49308","The David D. Reh School of Business is accredited by the Association to Advance Collegiate Schools of Business (AACSB International), a seal of excellence earned by fewer than five percent of business schools worldwide.",,1446,,False,,4.0,3.0,,,,,,,,,,,17352,,,,,,,False,False,,,,,,,,,,,,,,,,,,,,,,,,,Merit-based,,,,,,,
,Advanced Certificate in Business Fundamentals,,,,,Certificate,"Fall, Spring, Summer",,,,Required,Required,Not Required,"For international applicants, an English proficiency test may be required. Accepted tests include TOEFL (80 iBT/550 PBT), IELTS (6.5), Duolingo (115), PTE Academic (56), or ELS Level 112.",A completed online application form. A bachelor’s degree from an accredited institution. Transcripts of all previous college coursework. Two letters of recommendation. A resume or curriculum vitae. A statement of purpose.,Not Required,,True,False,False,False,False,False,False,False,False,False,False,False,False,False,False,False,,,,David D. Reh School of Business,15432,,,,,,,"As the economy and workforce in New York’s Capital Region continue to grow, the demand for business leaders has increased. Our 15-credit Advanced Certificate in Business Fundamentals is ideal for anyone looking to make a career change or take on a leadership role in their organization. This certificate will provide the business principles and critical skills that employers demand. It can be completed in as little as nine months and all courses are offered in the evenings to meet the scheduling needs of working professionals. All credits earned can be seamlessly applied to our MBA program if you later decide to pursue a graduate degree.",,https://www.clarkson.edu/academics/graduate/programs,,,1286 per credit hour,,False,,,,,751-760,,,,,,,,,15432,,,,,,,False,False,,,115.0,112.0,,,6.5,,,56.0,,80.0,,,,,,,,,,,,,Merit-based,,,,,,,
