Program name,Program Page url
Accounting BS,https://www.rit.edu/study/undergraduate
Accounting Technology AAS,https://www.rit.edu/study/undergraduate
Actuarial Science Minor,https://www.rit.edu/study/actuarial-science-minor
Administrative Support Technology AAS,https://www.rit.edu/study/undergraduate
Advertising and Public Relations BS,https://www.rit.edu/study/advertising-and-public-relations-bs
Applied Arts and Sciences AAS,https://www.rit.edu/study/undergraduate
Applied Cognitive Neuroscience Minor,https://www.rit.edu/study/undergraduate
Applied Computer Technology AAS,https://www.rit.edu/study/undergraduate
Applied Computer Technology AOS,https://www.rit.edu/study/undergraduate
Applied Liberal Arts AS,https://www.rit.edu/study/applied-liberal-arts-as
Applied Mathematics BS,https://www.rit.edu/study/applied-mathematics-bs
Applied Mechanical Technology AAS,https://www.rit.edu/study/undergraduate
Applied Modern Language and Culture BS,https://www.rit.edu/study/undergraduate
Applied Statistics and Data Analytics BS,https://www.rit.edu/study/undergraduate
Applied Statistics Minor,https://www.rit.edu/study/undergraduate
Architectural and Civil Drafting Technology AAS,https://www.rit.edu/study/undergraduate
Architectural and Civil Drafting Technology AOS,https://www.rit.edu/ntid/sites/rit.edu.ntid/files/nce/employers/PMP2023/Architectural%20and%20Civil%20Drafting%20Technology%202023.pdf
Art of Science/Science of Art Minor,https://www.rit.edu/study/undergraduate
ASL-English Interpretation BS,https://www.rit.edu/study/undergraduate
Astronomy Minor,https://www.rit.edu/study/undergraduate
Biochemistry BS,https://www.monroecc.edu/auditsheets.nsf/Web+By+College/E7FC7403EA535A78852589C1004DFD6D
Bioinformatics Analysis Minor,https://www.rit.edu/study/undergraduate
Bioinformatics and Computational Biology BS,https://study.uq.edu.au/study-options/programs/bachelor-science-2461/bioinformatics-bioinc2461
Biology BS,https://www.rit.edu/study/undergraduate
Biology: Cellular and Molecular Minor,https://www.rit.edu/study/biology-cellular-and-molecular-minor
Biology: Ecology and Evolution Minor,https://www.rit.edu/study/biology-ecology-and-evolution-minor
Biomedical Engineering BS,https://www.rit.edu/study/biomedical-engineering-bs
Biomedical Sciences BS,https://www.rit.edu/study/undergraduate
Biotechnology and Molecular Bioscience BS,https://www.rit.edu/study/biotechnology-and-molecular-bioscience-bs
Business AS,https://www.rit.edu/marketing/sites/rit.edu.marketing/files/docs/pdfs/NTID_Associate_+_Bachelors_Brochure.pdf
Business Administration AAS,https://www.youtube.com/watch?v=56Ef4jYrdCo
Business Technology AOS,https://www.rit.edu/study/undergraduate
Chemical Engineering BS,https://www.rit.edu/study/chemical-engineering-bs
Chemical Engineering Systems Analysis Minor,https://www.rit.edu/study/undergraduate
Chemistry BS,https://www.rit.edu/study/undergraduate
Chemistry Minor,https://www.mines.edu/academics/program/minor-chemistry/
Civil Engineering Technology BS,https://www.rit.edu/study/undergraduate
Civil Technology AAS,https://www.rit.edu/study/undergraduate
Communication BS,https://www.rit.edu/study/undergraduate
Community Development and Inclusive Leadership BS,https://www.rit.edu/study/undergraduate
Computational Mathematics BS,https://www.rit.edu/study/computational-mathematics-bs
Computer Engineering BS,https://www.rit.edu/study/undergraduate
Computer Engineering Minor,https://www.rit.edu/study/undergraduate
Computer Engineering Technology BS,https://www.rit.edu/study/computer-engineering-technology-bs
Computer Science BS,https://www.shiksha.com/studyabroad/usa/universities/rochester-institute-of-technology/bs-computer-science
Computing and Information Technologies BS,https://www.rit.edu/study/undergraduate
Criminal Justice BS,https://www.rit.edu/study/undergraduate
Cybersecurity BS,https://www.rit.edu/study/cybersecurity-bs
Design and Imaging Technology AAS,https://www.rit.edu/study/undergraduate
Design and Imaging Technology AOS,https://www.rit.edu/study/undergraduate
Diagnostic Medical Sonography (Ultrasound) BS,https://www.rit.edu/study/undergraduate
3D Digital Design BFA,https://www.rit.edu/study/undergraduate
Economics BS,https://www.rit.edu/study/undergraduate
Electrical Engineering BS,https://www.rit.edu/study/electrical-engineering-bs
Electrical Engineering Minor,https://www.rit.edu/study/undergraduate
Electrical Engineering Technology BS,https://www.rit.edu/study/undergraduate
Engineering Management Minor,https://www.rit.edu/study/undergraduate
English BS,https://www.rit.edu/study/undergraduate
Environmental Science BS,https://www.youtube.com/watch?v=VHkoOsfY0R8
Environmental Science Minor,https://www.rit.edu/study/environmental-science-minor
"Environmental Sustainability, Health and Safety BS",https://www.rit.edu/study/undergraduate
Exercise Science BS,https://www.rit.edu/study/exercise-science-bs
Film and Animation BFA,https://www.rit.edu/study/undergraduate
Finance BS,https://www.rit.edu/study/undergraduate
Furniture Design AOS,https://sketchlist.com/blog/role-of-furniture-design/
Game Design and Development BS,https://www.youtube.com/watch?v=8wZfkpSuh3A
General Science AS,https://www.rit.edu/study/general-science-as
Global Business Management BS,https://www.rit.edu/study/undergraduate
Global Futures BS,https://www.rit.edu/news/new-global-futures-interdisciplinary-degree-equips-grads-toolbox-lifelong-success
Global Public Health BS,https://www.rit.edu/study/undergraduate
Graphic Design BFA,https://www.rit.edu/study/undergraduate
History BS,https://www.rit.edu/study/undergraduate
Hospitality and Tourism Management BS,https://www.rit.edu/study/undergraduate
Human-Centered Computing BS,https://www.frontiersin.org/journals/computer-science/articles/10.3389/fcomp.2023.1139350/pdf
"Humanities, Computing, and Design BS",https://www.rit.edu/study/humanities-computing-and-design-bs
Illustration BFA,https://www.rit.edu/study/undergraduate
Imaging Science BS,https://www.rit.edu/study/undergraduate
Imaging Science Minor,https://www.rit.edu/study/undergraduate
Individualized Program BS,https://www.rit.edu/study/individualized-program-bs
Industrial Design BFA,https://www.rit.edu/study/undergraduate
Industrial Engineering BS,https://www.rit.edu/study/industrial-engineering-bs
Industrial Engineering Minor,https://www.rit.edu/study/industrial-engineering-minor
Information Technology AS,https://www.rit.edu/study/information-technology-as
Interior Design BFA,https://www.rit.edu/study/undergraduate
International and Global Studies BS,https://www.rit.edu/study/undergraduate
Laboratory Science Technology AAS,https://www.rit.edu/study/undergraduate
Laboratory Science Technology AOS,https://www.rit.edu/ntid/sites/rit.edu.ntid/files/nce/visitors/laboratorysciencetechnology_0.pdf
Management Information Systems (MIS) BS,https://www.rit.edu/study/undergraduate
Marketing BS,https://www.rit.edu/study/undergraduate
Mathematics Minor,https://www.rit.edu/study/undergraduate
Mechanical Engineering BS,https://www.rit.edu/study/undergraduate
Mechanical Engineering Minor,http://bulletin.engineering.nyu.edu/preview_program.php?catoid=15&poid=4470
Mechanical Engineering Technology BS,https://vertexaisearch.cloud.google.com/grounding-api-redirect/AUZIYQHMzeyfF_uzvV9xb6cnmd1dgnCoTZ0cXhsQmdUI_VLVpqovOiBtuq5X6tNkAyVhGJ2D-HU2fCj5U-8MxAe0fTCVw9P5K_n9sIeIucVYmu8SBjMxsTEdyHRY0oKjBFDMbbKKQ5YWliIMRlo4oj6wsGLF
Mechatronics Engineering Technology BS,https://www.rit.edu/study/undergraduate
Medical Illustration BFA,https://www.rit.edu/study/medical-illustration-bfa
Microelectronic Engineering BS,https://www.rit.edu/study/undergraduate
Microelectronic Engineering Minor,https://www.rit.edu/study/microelectronic-engineering-minor
Mobile Application Development AAS,https://www.rit.edu/study/undergraduate
Motion Picture Science BS,https://www.rit.edu/study/undergraduate
Museum Studies BS,https://www.youtube.com/watch?v=a0ZLQp3jvIY
Neuroscience BS,https://www.rit.edu/study/undergraduate
New Media Design BFA,https://www.rit.edu/study/new-media-design-bfa
New Media Interactive Development BS,https://www.rit.edu/study/undergraduate
Nutritional Sciences BS,https://www.rit.edu/healthsciences/sites/rit.edu.healthsciences/files/docs/Resources/1-NutrSci_BS.pdf
Optical Science Minor,https://www.rit.edu/study/undergraduate
Packaging Science BS,https://www.rit.edu/study/undergraduate
Philosophy BS,https://www.rit.edu/study/undergraduate
Photographic and Imaging Arts BFA,https://www.rit.edu/study/undergraduate
Photographic Sciences BS,https://www.reddit.com/r/rit/comments/1dbysd7/what_are_my_chances_of_getting_into_rit/
Physics BS,https://www.rit.edu/study/undergraduate
Physics Minor,https://www.rit.edu/study/physics-minor
Physician Assistant BS/MS,https://www.rit.edu/study/undergraduate
Political Science BS,https://www.rit.edu/study/undergraduate
Precision Manufacturing Technology AOS,https://www.rit.edu/ntid/sites/rit.edu.ntid/files/nce/employers/PMP2023/Precision%20Manufacturing%20Technology%202023.pdf
Psychology BS,https://www.rit.edu/study/undergraduate
Quantum Information Science and Technology Minor,https://www.rit.edu/study/undergraduate
Robotics and Manufacturing Engineering Technology BS,https://www.rit.edu/study/undergraduate
Sociology and Anthropology BS,https://www.rit.edu/study/sociology-and-anthropology-bs
Software Engineering BS,https://www.rit.edu/study/undergraduate
Studio Arts BFA,https://www.rit.edu/study/undergraduate
Supply Chain Management BS,https://www.rit.edu/study/undergraduate
Sustainable Product Development Minor,https://www.rit.edu/study/undergraduate
3D Graphics Technology AAS,https://www.rit.edu/ntid/nccc/programs/3d-graphics-technology
"Women's, Gender, and Sexuality Studies BS",https://www.rit.edu/study/undergraduate
Associate of Applied Science in Accounting Technology,https://www.rit.edu/study/undergraduate
Associate of Applied Science in Administrative Support Technology,https://www.rit.edu/study/undergraduate
Associate of Applied Science in Applied Arts and Sciences,https://www.rit.edu/study/undergraduate
Associate of Applied Science in Applied Computer Technology,https://www.rit.edu/study/applied-computer-technology-aas
Associate of Applied Science in Applied Mechanical Technology,https://www.rit.edu/program-directory/6859965
Associate of Applied Science in Architectural and Civil Drafting Technology,https://www.rit.edu/ntid/sites/rit.edu.ntid/files/nce/employers/PMP2023/Architectural%20and%20Civil%20Drafting%20Technology%202023.pdf
Associate of Applied Science in Business Administration,https://www.youtube.com/watch?v=56Ef4jYrdCo
Associate of Applied Science in Civil Technology,https://www.rit.edu/study/civil-technology-aas
Associate of Applied Science in Design and Imaging Technology,https://www.rit.edu/study/undergraduate
Associate of Applied Science in 3D Graphics Technology,https://www.rit.edu/ntid/sites/rit.edu.ntid/files/nce/employers/PMP2023/3D%20Graphics%20Technology%202023.pdf
Associate of Applied Science in Laboratory Science Technology,https://www.rit.edu/ntid/sites/rit.edu.ntid/files/nce/visitors/laboratorysciencetechnology_0.pdf
Associate of Applied Science in Mobile Application Development,https://www.rit.edu/study/undergraduate
Associate of Occupational Studies in Applied Computer Technology,https://www.rit.edu/study/applied-computer-technology-aos
Associate of Occupational Studies in Architectural and Civil Drafting Technology,https://www.rit.edu/study/architectural-and-civil-drafting-technology-aas
Associate of Occupational Studies in Business Technology,https://www.rit.edu/study/undergraduate
Associate of Occupational Studies in Design and Imaging Technology,https://www.rit.edu/ntid/vcs
Associate of Occupational Studies in Furniture Design,https://www.rit.edu/study/undergraduate
Associate of Occupational Studies in Laboratory Science Technology,https://www.rit.edu/ntid/sites/rit.edu.ntid/files/nce/visitors/laboratorysciencetechnology_0.pdf
Associate of Occupational Studies in Precision Manufacturing Technology,https://www.rit.edu/ntid/nccc/programs/precision-manufacturing-technology
Associate of Science in Applied Liberal Arts,https://www.rit.edu/study/undergraduate
Associate of Science in Business,https://www.rit.edu/study/undergraduate
Associate of Science in General Science,https://www.rit.edu/study/undergraduate
Associate of Science in Information Technology,https://www.rit.edu/study/undergraduate
Bachelor of Fine Arts in 3D Digital Design (3D Visualization Option),https://www.rit.edu/study/undergraduate
Bachelor of Fine Arts in 3D Digital Design (Game Arts Option),https://www.rit.edu/study/undergraduate
Bachelor of Fine Arts in Film and Animation (Animation Option),https://www.rit.edu/study/film-and-animation-bfa-animation-option
Bachelor of Fine Arts in Film and Animation (Production Option),https://www.rit.edu/study/undergraduate
Bachelor of Fine Arts in Graphic Design,https://talk.collegeconfidential.com/t/chance-me-please-nc-state-ucla-psu-etc/3614243?page=2
Bachelor of Fine Arts in Illustration,https://www.rit.edu/program-directory/6974959
Bachelor of Fine Arts in Industrial Design,https://www.rit.edu/study/industrial-design-bfa
Bachelor of Fine Arts in Interior Design,https://www.rit.edu/study/undergraduate
Bachelor of Fine Arts in Medical Illustration,https://www.learnmedical.art/medical-illustration-schools/rochester-institute-of-technology
Bachelor of Fine Arts in New Media Design,https://www.rit.edu/study/undergraduate
Bachelor of Fine Arts in Photographic and Imaging Arts (Advertising Photography Option),https://www.rit.edu/study/undergraduate
Bachelor of Fine Arts in Photographic and Imaging Arts (Fine Art Photography Option),https://www.rit.edu/study/photographic-and-imaging-arts-bfa-fine-art-photography-option
Bachelor of Fine Arts in Photographic and Imaging Arts (Photojournalism Option),https://www.rit.edu/study/undergraduate
Bachelor of Fine Arts in Photographic and Imaging Arts (Visual Media Option),https://www.rit.edu/study/undergraduate
Bachelor of Fine Arts in Studio Arts (Ceramics Option),https://www.rit.edu/study/undergraduate
Bachelor of Fine Arts in Studio Arts (Furniture Design Option),https://www.rit.edu/study/undergraduate
Bachelor of Fine Arts in Studio Arts (Glass Option),https://www.rit.edu/program-directory/6860325
Bachelor of Fine Arts in Studio Arts (Metals and Jewelry Design Option),https://www.rit.edu/study/undergraduate
Bachelor of Fine Arts in Studio Arts (Painting Option),https://www.rit.edu/study/studio-arts-bfa
Bachelor of Fine Arts in Studio Arts (Printmaking Option),https://www.rit.edu/study/studio-arts-bfa-printmaking-option
Bachelor of Fine Arts in Studio Arts (Sculpture and Expanded Forms Option),https://www.rit.edu/study/undergraduate
Bachelor of Science in Accounting,https://www.rit.edu/study/undergraduate
Bachelor of Science in Advertising and Public Relations,https://www.rit.edu/study/undergraduate
Bachelor of Science in Applied Mathematics,https://www.rit.edu/study/applied-mathematics-bs
Bachelor of Science in Applied Modern Language and Culture (Chinese Option),https://www.rit.edu/study/undergraduate
Bachelor of Science in Applied Modern Language and Culture (French Option),https://www.rit.edu/study/undergraduate
Bachelor of Science in Applied Modern Language and Culture (Japanese Option),https://www.rit.edu/study/undergraduate
Bachelor of Science in Applied Modern Language and Culture (Spanish Option),https://www.rit.edu/study/undergraduate
Bachelor of Science in Applied Statistics and Data Analytics,https://www.rit.edu/study/applied-statistics-and-data-analytics-bs
Bachelor of Science in ASL-English Interpretation,https://www.rit.edu/study/asl-english-interpretation-bs
Bachelor of Science in Biochemistry,https://www.monroecc.edu/auditsheets.nsf/Web+By+College/E7FC7403EA535A78852589C1004DFD6D
Bachelor of Science in Bioinformatics and Computational Biology,https://www.rit.edu/study/undergraduate
Bachelor of Science in Biology,https://www.rit.edu/study/undergraduate
Bachelor of Science in Biomedical Engineering,https://www.rit.edu/study/undergraduate
Bachelor of Science in Biomedical Sciences,https://catalog.tamu.edu/undergraduate/veterinary-medicine-biomedical-sciences/biomedical-sciences-bs/
Bachelor of Science in Biotechnology and Molecular Bioscience,https://www.rit.edu/science/sites/rit.edu.science/files/2019-08/GSoLS_UndergraduateStudentHandbookAY2019-20.pdf
Bachelor of Science in Chemical Engineering,https://www.rit.edu/study/undergraduate
Bachelor of Science in Chemistry,https://www.rit.edu/study/undergraduate
Bachelor of Science in Civil Engineering Technology,https://www.rit.edu/study/undergraduate
Bachelor of Science in Communication (Journalism Option),https://www.rit.edu/study/undergraduate
Bachelor of Science in Community Development and Inclusive Leadership,https://www.rit.edu/ntid/liberalstudies/lead-program
Bachelor of Science in Computational Mathematics,https://www.rit.edu/study/undergraduate
Bachelor of Science in Computer Engineering (Artificial Intelligence Option),https://www.rit.edu/study/undergraduate
Bachelor of Science in Computer Engineering (Secure Systems Option),https://www.rit.edu/study/computer-engineering-bs-secure-systems-option
Bachelor of Science in Computer Engineering Technology,https://www.rit.edu/study/undergraduate
Bachelor of Science in Computer Science,https://www.rit.edu/study/computer-science-bs
Bachelor of Science in Computing and Information Technologies,https://www.rit.edu/study/computing-and-information-technologies-bs
Bachelor of Science in Criminal Justice,https://www.rit.edu/study/criminal-justice-bs
Bachelor of Science in Cybersecurity,https://www.rit.edu/study/undergraduate
Bachelor of Science in Diagnostic Medical Sonography (Ultrasound),https://www.rit.edu/study/diagnostic-medical-sonography-ultrasound-bs
Bachelor of Science in Economics,https://www.rit.edu/study/undergraduate
Bachelor of Science in Electrical Engineering (Artificial Intelligence Option),https://www.rit.edu/study/undergraduate
Bachelor of Science in Electrical Engineering (Clean and Renewable Energy Option),https://www.rit.edu/study/undergraduate
Bachelor of Science in Electrical Engineering (Computer Engineering Option),https://www.rit.edu/study/undergraduate
Bachelor of Science in Electrical Engineering (Microelectronics Option),https://www.rit.edu/study/electrical-engineering-bs-microelectronics-option
Bachelor of Science in Electrical Engineering (Robotics Option),https://www.rit.edu/study/electrical-engineering-bs-robotics-option
Bachelor of Science in Electrical Engineering Technology,https://www.rit.edu/study/undergraduate
Bachelor of Science in English,https://www.rit.edu/study/undergraduate
Bachelor of Science in Environmental Science,https://www.youtube.com/watch?v=VHkoOsfY0R8
"Bachelor of Science in Environmental Sustainability, Health and Safety (Environmental Sustainability Option)",https://www.rit.edu/study/undergraduate
"Bachelor of Science in Environmental Sustainability, Health and Safety (Health and Safety Option)",https://www.rit.edu/study/undergraduate
"Bachelor of Science in Environmental Sustainability, Health and Safety (Surveying and Geospatial Analysis Option)",https://www.rit.edu/study/undergraduate
Bachelor of Science in Exercise Science,https://www.rit.edu/study/undergraduate
Bachelor of Science in Finance,https://www.rit.edu/study/finance-bs
Bachelor of Science in Game Design and Development,https://www.rit.edu/study/undergraduate
Bachelor of Science in Global Business Management,https://www.rit.edu/study/undergraduate
Bachelor of Science in Global Futures,https://www.rit.edu/news/new-global-futures-interdisciplinary-degree-equips-grads-toolbox-lifelong-success
Bachelor of Science in Global Public Health,https://www.rit.edu/study/undergraduate
Bachelor of Science in History,https://www.rit.edu/study/undergraduate
Bachelor of Science in Hospitality and Tourism Management,https://www.rit.edu/study/undergraduate
Bachelor of Science in Human-Centered Computing,https://www.rit.edu/study/undergraduate
"Bachelor of Science in Humanities, Computing, and Design",https://www.rit.edu/study/humanities-computing-and-design-bs
Bachelor of Science in Imaging Science,https://www.rit.edu/study/undergraduate
Bachelor of Science in Individualized Program,https://www.rit.edu/study/undergraduate
Bachelor of Science in Industrial Engineering,https://www.rit.edu/study/undergraduate
Bachelor of Science in International and Global Studies,https://www.rit.edu/study/undergraduate
Bachelor of Science in Management Information Systems,https://www.rit.edu/study/management-information-systems-mis-bs
Bachelor of Science in Marketing,https://www.rit.edu/study/undergraduate
Bachelor of Science in Mechanical Engineering (Aerospace Engineering Option),https://www.rit.edu/study/undergraduate
Bachelor of Science in Mechanical Engineering (Automotive Engineering Option),https://www.rit.edu/study/undergraduate
Bachelor of Science in Mechanical Engineering (Bioengineering Option),https://www.rit.edu/study/undergraduate
Bachelor of Science in Mechanical Engineering (Energy and the Environment Option),https://www.rit.edu/study/undergraduate
Bachelor of Science in Mechanical Engineering Technology (Product Design Option),https://www.mtu.edu/mmet/undergraduate/degree/
Bachelor of Science in Mechanical Engineering Technology (Robotics and Automation Option),https://indoglobalstudies.org/course-detail?course_id=692&university_id=44
Bachelor of Science in Mechatronics Engineering Technology,https://www.rit.edu/study/undergraduate
Bachelor of Science in Microelectronic Engineering,https://www.rit.edu/study/undergraduate
Bachelor of Science in Motion Picture Science,https://www.rit.edu/study/undergraduate
Bachelor of Science in Museum Studies,https://www.youtube.com/watch?v=a0ZLQp3jvIY
Bachelor of Science in Neuroscience,https://www.rit.edu/study/undergraduate
Bachelor of Science in New Media Interactive Development,https://www.reddit.com/r/rit/comments/1kbz2e/opinions_on_new_media_interactive_development/
Bachelor of Science in Nutritional Sciences,https://www.rit.edu/healthsciences/sites/rit.edu.healthsciences/files/docs/Resources/1-NutrSci_BS.pdf
Bachelor of Science in Packaging Science,https://www.rit.edu/study/packaging-science-bs
Bachelor of Science in Philosophy,https://www.rit.edu/study/undergraduate
Bachelor of Science in Photographic Sciences,https://www.reddit.com/r/rit/comments/1dbysd7/what_are_my_chances_of_getting_into_rit/
Bachelor of Science in Physics,https://www.rit.edu/study/undergraduate
Bachelor of Science in Political Science,https://www.rit.edu/study/undergraduate
Bachelor of Science in Psychology,https://www.rit.edu/study/psychology-bs
Bachelor of Science in Robotics and Manufacturing Engineering Technology,https://www.rit.edu/study/undergraduate
Bachelor of Science in Sociology and Anthropology,https://www.rit.edu/study/sociology-and-anthropology-bs
Bachelor of Science in Software Engineering,https://www.youtube.com/watch?v=0RAxQ8QJB7g
Bachelor of Science in Supply Chain Management,https://www.rit.edu/study/supply-chain-management-bs
"Bachelor of Science in Women's, Gender, and Sexuality Studies",https://www.rit.edu/study/undergraduate
Bachelor of Science/Master of Science in Physician Assistant,https://www.collegetransitions.com/dataverse/accelerated-physician-assistant-programs/
Construction Management Minor,https://www.rit.edu/study/undergraduate
Deaf Cultural Studies-American Sign Language Certificate,https://www.rit.edu/study/deaf-cultural-studies-american-sign-language-certificate
Diagnostic Medical Sonography (Ultrasound) Certificate,https://www.rit.edu/study/diagnostic-medical-sonography-ultrasound-certificate
Echocardiography (Cardiac Ultrasound) Certificate,https://www.rit.edu/study/undergraduate
Exercise Science Certificate,https://www.rit.edu/study/exercise-science-certificate
Flexible Packaging Minor,https://www.rit.edu/study/flexible-packaging-minor
Health Systems Administration Certificate,https://www.rit.edu/study/health-systems-administration-certificate
Integrated Electronics Certificate,https://www.rit.edu/study/undergraduate
Latino/Latina/Latin American Studies Minor,https://www.rit.edu/study/undergraduate
Manufacturing Systems Minor,https://www.rit.edu/study/manufacturing-systems-minor
Media Arts and Technology Minor,https://www.rit.edu/study/undergraduate
Organizational Change and Leadership Certificate,https://www.rit.edu/study/undergraduate
Packaging Science Minor,https://www.rit.edu/study/undergraduate
Performing Arts Certificate,https://www.rit.edu/study/undergraduate
Plastics Engineering and Technology Minor,https://www.rit.edu/study/undergraduate
Robotics and Automation Minor,https://www.rit.edu/study/robotics-and-automation-minor
Structural Design Minor,https://www.rit.edu/study/undergraduate
Surface Mount Electronics Manufacturing Minor,https://www.sdstate.edu/sites/default/files/file-archive/2024-04/Surface%20Mount%20Technology%20%28New%20Minor%29.pdf
Water Resources Minor,https://www.rit.edu/study/water-resources-minor
