,Business Technology MS Online,,,,,MS,"Fall, Spring, Summer",,,,Required,Required,Not Required,"All graduate applicants are required to demonstrate English proficiency. Stony Brook University accepts scores from the TOEFL iBT, IELTS, Duolingo, and PTE Academic tests. The requirement may be waived for applicants who have received a degree from an institution in the United States or another country on the waiver list.","To be considered for admission, applicants must have a bachelor’s degree from an accredited institution. Applicants must also have a cumulative grade point average of 3.00 or higher. In addition to the online application, fee and transcripts, applicants must submit the following: A current resume; A personal statement that addresses the following question: How would you describe the unique characteristics of the business technology field and how will earning this MS degree position you for the career you want?; Three letters of recommendation; Official score report for the GRE or GMAT exam. The GRE/GMAT requirement may be waived if the applicant meets one of the following criteria: An undergraduate GPA of 3.2 or higher from an accredited institution. An earned master’s or doctoral degree from an accredited institution. 5+ years of relevant professional work experience.",Not Required,,False,False,False,False,False,False,False,False,False,False,False,False,False,False,False,False,,,,School of Professional Development,16950,,,,,,,"The Master of Science in Business Technology degree prepares students to be successful technology leaders and managers in today’s knowledge-based economy. The program has been redesigned to integrate business and technology to develop an applied understanding of the integration of people, processes, data, and devices that are so vital to every organization. The program offers students an opportunity to take advantage of cutting-edge business technology topics with practical skills to solve real-world problems. We recognize and support the growing need for leaders who can help companies navigate the world of ever-changing technology and use it as a strategic advantage.",,https://www.stonybrook.edu/commcms/online-education/degrees/,,,565,False,True,2.0,4.0,3.0,,396,,,,,,,,,16950.0,,,,,,,False,False,,,105.0,,,,6.5,,,53.0,,80.0,,,,,,,,,,,1500,50%,"Merit-based, Need-based",,,,,,,
,Cellular Physiology and Molecular Biophysics PhD,,,,,PhD,Fall,,,,Not Required,Required,Not Required,"International applicants are required to demonstrate English proficiency. Accepted tests and minimum scores for doctoral programs are: TOEFL iBT (90), IELTS (6.5 with no subsection below 6), Duolingo (115), or PTE (61).","GRE test: Not required
One official transcript of all previous college and university work.
A bachelor's degree in biophysics, chemistry, physics, engineering, biology or a related field.
A minimum undergraduate grade point average of 3.0.
Three letters of recommendation.
A personal statement describing research experience and career goals.
Non-native English speakers must take the TOEFL or IELTS exam and score above the required minimum.",Not Required,,True,False,False,False,False,False,False,False,False,False,False,False,False,False,False,False,,,,Renaissance School of Medicine,23920,,,,,,,"The Graduate Program in Physiology and Biophysics at Stony Brook University is a research-intensive course of study that leads to the PhD degree. The aim of the program is to train the next generation of scientists and educators by providing a strong foundation in physiology and biophysics and to facilitate development of critical thinking and communication skills. The research interests of the faculty are diverse and encompass most modern areas of physiology, biophysics and neuroscience. Our research employs a wide range of state-of-the art techniques to address questions at the molecular, cellular, organ and whole-animal levels.",,https://www.stonybrook.edu/grad/academics/,,"38,000 stipend per year",1000,True,True,,4.0,3.0,,396,,,,,,,,,23920.0,,,,,,,False,False,,,115.0,,,,6.5,,,61.0,,90.0,,,,,,,,,,,,,"Full tuition scholarship, stipend, and health insurance",,,,,,,
,Chemical and Molecular Engineering MS,,,,,Masters,Fall,,,,Not Required,Required,Optional,All graduate applicants who are not native or primary speakers of English must demonstrate English proficiency. The Graduate School's English proficiency requirements must be met.,"In addition to the Graduate School’s general admission requirements, applicants are expected to have a bachelor’s degree in chemical engineering or a closely related field from a college or university of recognized standing. Promise for graduate study is judged by the applicant’s undergraduate record, letters of recommendation and statement of purpose. All applicants are required to take the Graduate Record Examination (GRE) general test. International applicants who do not have a degree from an English-speaking university must also take the Test of English as a Foreign Language (TOEFL). Application materials must include: the completed application form, official transcripts of all college-level work, three letters of recommendation, statement of purpose and official GRE scores. International applicants whose native language is not English are also required to submit TOEFL scores.",Not Required,,False,False,False,False,False,False,False,False,False,False,False,False,False,False,False,False,,,,College of Engineering and Applied Sciences,22620,,,,,,,The M.S. degree in Chemical and Molecular Engineering is awarded after the successful completion of 30 graduate credits of approved courses with a cumulative grade point average of 3.0 or better. The student may select either a thesis or a non-thesis option. The thesis option requires 6 credits of thesis research in addition to 24 credits of course work. The non-thesis option requires a 3 credit design project in addition to 27 credits of course work. All students have to pass a written qualifying examination (WQ).,,https://www.stonybrook.edu/grad/academics/,,,943,False,True,,4.0,3.0,,396,,,,,,,,,22620.0,,,,,,,False,False,,,105.0,,,,6.5,,,53.0,,80.0,,,,,,,,,,,,,"Teaching Assistantships, Research Assistantships, Fellowships",,,,,,,
,Chemical and Molecular Engineering PhD,,,,,,Fall,,,January 15,Required,Required,Not Required,International students whose native language is not English are required to demonstrate English proficiency by submitting their official scores on the Test of English as a Foreign Language (TOEFL) or International English Language Testing System (IELTS).,"In addition to the general admission requirements of the Graduate School, admission to the Ph.D. program in Chemical and Molecular Engineering requires a B.S. or M.S. degree in chemical engineering, materials science and engineering, or a related discipline from an accredited institution. Applicants are expected to have a minimum cumulative grade point average of 3.0 on a 4.0 scale. The admission committee also holistically evaluates other credentials submitted by the applicant, including letters of recommendation, statement of purpose, and resume. The general GRE test is not required for admission.",Not Required,,True,False,False,False,False,False,False,False,False,False,False,False,False,False,False,False,,,,College of Engineering and Applied Sciences,23920,,,,,,,"The graduate program in Chemical and Molecular Engineering is designed to provide students with a sound basis in chemical engineering fundamentals, as well as the advanced research skills needed to solve modern problems in chemical engineering. It is a research-oriented program leading to the Doctor of Philosophy degree. The student, in consultation with a faculty advisor, designs a program of study that best suits his or her interests and career goals. Students in the PhD program typically complete all the coursework within the first one to two years and devote the remaining time to research. There are many research opportunities available for students. Please browse our faculty profiles to find your research interest.",,https://www.stonybrook.edu/grad/academics/,,,1008,True,True,,4.0,3.0,,396,,,,,,,,,23920.0,,,,,,,False,False,,,,,,,6.5,,,,,90.0,,,,,,,,,,,,,"Teaching assistantships, research assistantships, fellowships",,,,,,,
,Chemistry MAT,,,,,Masters,Fall,,,,Required,Required,GRE,"All international graduate applicants are required to demonstrate English proficiency. The University accepts TOEFL iBT, IELTS, Duolingo English Test, and PTE Academic. Minimum scores are: TOEFL iBT - 80, IELTS - 6.5 overall (no band below 6.0), Duolingo - 105, PTE - 53.","A bachelor's degree in Chemistry or a related discipline with at least 24 credits in college chemistry and 12 credits in related areas, i.e., physics, biology and mathematics, with an average of B or better. Required application materials: Online Application, Application Fee, Transcripts, 3 Letters of Recommendation, Resume or C.V., Personal Statement, English Proficiency. GRE General: Not Required.",Not Required,,True,False,False,False,True,False,True,False,False,False,False,False,False,False,False,False,,,,School of Professional Development,,,,,,,,"The Master of Arts in Teaching (M.A.T.) is a 15-month program that combines graduate-level coursework in Chemistry with pedagogical training for prospective secondary school teachers (grades 7-12). Upon successful completion of the program, students are awarded an M.A.T. degree and are recommended for New York State Initial Teacher Certification. Students completing the program may also be eligible for certification in other states, through reciprocity agreements. M.A.T. candidates take graduate courses in chemistry alongside Ph.D. students and master's students, and education courses specifically designed for M.A.T. science students, with a unique focus on how students learn science. The program includes two semesters of student teaching in local, partner districts, where candidates develop their teaching under the guidance of a highly qualified mentor teacher and a University supervisor.",,https://www.stonybrook.edu/grad/academics/,All of Stony Brook's teacher preparation programs are registered by the New York State Education Department and are accredited by the Council for the Accreditation of Educator Preparation (CAEP).,,471,,True,,4.0,3.0,,396,,,,,,,,,16956.0,,,,,,,False,False,,,105.0,,,,6.5,,,53.0,,80.0,,,,,,,,,,,1000,,Merit-based,,,,,,,
,Chemistry MS,,,,,Masters,Fall,,,,,Required,Not Required,"The Test of English as aForeign Language (TOEFL), the International English Language Testing System (IELTS), or the Duolingo English Test (DET) is required for all international applicants whose native language is not English.","Applicants should have an undergraduate major in chemistry or a related discipline with a solid background in chemistry. At a minimum, students should have successfully completed one year of general chemistry, one year of organic chemistry, one year of physical chemistry, and one year of physics. Additional courses in analytical chemistry, inorganic chemistry, and mathematics are also recommended. A minimum overall GPA of 3.0 is required.

The following are required for an application to be complete:

- A completed application form for admission to the Graduate School
- A nonrefundable application fee
- Official transcripts from all universities and colleges attended
- Three letters of recommendation
- A personal statement
- GRE scores are not required for admission.
- Official TOEFL or IELTS scores for international applicants whose native language is not English.",,,True,False,True,False,False,False,False,True,False,False,False,False,True,False,False,False,,,,College of Arts and Sciences,23240,,,,,,Chemical Education,"The Department of Chemistry offers a program of graduate study leading to the Master of Science degree. The program is designed for students who desire a broader and more profound knowledge of chemistry than can be obtained in a four-year undergraduate curriculum. Since the requirements for the degree are less specialized than those for the Ph.D. degree, it offers a suitable program for students with diverse career objectives. The Master’s degree in Chemistry is available with three options: with thesis, without thesis, and with concentration in Chemical Education. In each case, a minimum of 30 graduate credits must be satisfactorily completed. An average grade of B (3.0 grade point average) or better is required. The specific course and research requirements are decided upon by the student in consultation with the Graduate Program Director. The requirements listed below are intended only as guidelines. Normally, a full-time student can complete the program within two years.",,https://www.stonybrook.edu/commcms/chemistry/Education/masters-program/index.php,,,969,,True,1.0,4.0,3.0,,396,,,,,,,,,23240.0,,,,,,,False,False,,,,,,,,,,,,80.0,,,,,,,,,,,,,Partial tuition scholarships,,,,,,,
,Chemistry PhD,,,,,PhD,Fall,,,,Not Required,Required,Optional,"For international students, an official TOEFL score is required. A minimum score of 90 on the internet-based test (iBT) is required for admission. The IELTS and Duolingo are also accepted.","For admission to the Ph.D. program in Chemistry, a bachelor’s degree in chemistry is required with courses in general, organic, and physical chemistry. The Graduate School requires a minimum undergraduate grade point average of 3.00 on a 4.00 scale. Applicants must submit a completed application form, letters of recommendation, and a personal statement. The general GRE test is not required. International students whose native language is not English must also submit scores from the Test of English as a Foreign Language (TOEFL).",Not Required,,True,False,False,False,False,False,False,False,False,False,False,False,False,False,False,False,,,,College of Arts and Sciences,23260,,,,,,,"Welcome to the Graduate Program in Chemistry at Stony Brook University! The Department of Chemistry at Stony Brook is a premier center for research and education in the chemical sciences. We offer a vibrant and diverse program that includes a faculty of world-class scholars and an outstanding group of students and postdoctoral researchers. We offer a full range of degree programs in chemistry, with Ph.D. degrees in Chemical Physics and Chemistry.

The PhD program in chemistry is focused on preparing students for a variety of careers in academia, industry, and government. We provide a rigorous training program in the traditional areas of chemistry, as well as in a number of interdisciplinary areas. Our students graduate with a broad understanding of the chemical sciences, a deep knowledge in a particular research area, and the skills to succeed as independent scientists. The goal of the program is to bring each student to a level of knowledge and experimental or theoretical skill that will permit them, by the end of their program, to undertake significant research on their own. Students will take a number of graduate courses and will be required to pass a series of qualifying examinations. The major emphasis of the program is on research and the submission of an original and significant thesis is the highlight of the program. We offer students a choice of research opportunities in a wide range of areas that span the traditional disciplines of chemistry as well as interdisciplinary areas that include biological, materials, and physical sciences. Some specific research areas are listed under the faculty research pages.",,https://www.stonybrook.edu/commcms/chemistry/Education/phd-program/index.php,,35000,970,,True,,4.0,3.0,,396,,,,,,,,,23260.0,,,,,,,False,False,,,,,,,,,,,,90.0,,,,,,,,,,,35000,100,Full tuition scholarship and stipend,,,,,,,
,Children's Literature Certificate,,,,,Certificate,"Fall, Spring, Summer",,,,Required,Required,Not Required,"An applicant whose native language is not English must take an English proficiency exam. Stony Brook University accepts the following tests: Test of English as a Foreign Language (TOEFL) iBT, International English Language Testing System (IELTS), Duolingo English Test, Pearson Test of English (PTE) Academic.","Application Materials: A completed application form to the Graduate School. A non-refundable application fee. Two letters of recommendation from faculty under whom you have studied. One copy of official transcripts from each college or university you have attended. A brief statement of purpose (approximately 500 words) describing your reasons for seeking a certificate in Children’s Literature, your background in the subject, and your goals. A writing sample (approximately 10-20 pages) of your academic prose, preferably on a literary topic. A résumé that lists professional and educational experience. GRE scores are not required.",Required,,True,False,False,False,False,False,False,False,False,False,False,False,False,False,False,False,,,,School of Professional Development,7065,,,,,,,"This 18-credit certificate is designed for students with a BA who wish to pursue a specialization in the study of children's and young adult literature. It can be pursued as a stand-alone certificate or in conjunction with the MA. This program explores the history and development of children’s literature, its major genres, and a range of critical and theoretical approaches. Courses in children’s literature cover a variety of historical periods, from early modern to contemporary, as well as a variety of genres, from picture books and fantasy to realism and young adult literature. All courses will pay close attention to the ways in which representations of childhood are informed by issues of class, race, gender, and nation.",,https://www.stonybrook.edu/grad/academics/,,,471,False,False,,4.0,3.0,,396,,,,,,,,,7065.0,,,,,,,False,False,,,105.0,,,,6.5,,,53.0,,80.0,,,,,,,,,,,,,"Need-based, Merit-based",,,,,,,
,Civil Engineering Certificate,,,,,,,,,,,,,,,,,False,False,False,False,False,False,False,False,False,False,False,False,False,False,False,False,,,,,,,,,,,,,,https://www.bhadanisrecordedlectures.com/blog/overview-of-civil-engineering-certificate-courses,,,,False,False,,4.0,,,396,,,,,,,,,,,,,,,,False,False,,,,,,,,,,,,,,,,,,,,,,,,,,,,,,,,
,Civil Engineering MS,,,,,,"Fall, Spring",,,,Required,Required,GRE,International students whose native language is not English are required to take the Test of English as a Foreign Language (TOEFL). The minimum acceptable score is 85 on the internet-based test (iBT). This requirement is waived for students who have received a degree from an institution in which the language of instruction is English.,"All application materials must be submitted through the Apply Yourself online application system. The complete set of required materials is: Graduate School Application and Fee, Transcripts, Three Letters of Recommendation, Statement of Purpose, GRE scores (required for MS and PhD applicants), Resume, TOEFL or IELTS scores (for international students).",Not Required,,False,False,False,False,True,False,True,False,False,False,False,False,True,False,False,False,,,,College of Engineering and Applied Sciences,24770,,,,,,"['Structural Engineering', 'Geotechnical Engineering', 'Transportation Engineering', 'Water Resources Engineering', 'General Civil Engineering']","The Master of Science program is designed to provide students with the fundamentals of one or more of the civil engineering sub-disciplines. The program can be completed in three semesters of full-time study, with 30 graduate credits required for graduation. Both thesis and non-thesis options are available. The graduate program in civil engineering provides opportunities for professional development in such areas as structural engineering, geotechnical engineering, transportation engineering, and water resources and hydraulic engineering. In addition, the program offers a general option that allows the student to select a broader range of courses to meet their educational objectives.",,https://www.stonybrook.edu/commcms/civileng/,,,1033,True,True,,4.0,3.0,,396,,,,,,,,,24770.0,,,,,,,False,False,,,,,,,,,,,,85.0,,,,,,,,,,,,,"Teaching Assistantships, Research Assistantships",,,,,,,
,Civil Engineering PhD,,,,,PhD,Fall,,,January 15,Required,Required,Not Required,"All graduate applicants are required to demonstrate English proficiency. Accepted tests and minimum scores include TOEFL iBT (80), IELTS (6.5 overall, with no subsection score below 6), Duolingo English Test (105), and PTE Academic (53).",Applicants must have a B.S. or M.S. degree in civil engineering or a related engineering field from an accredited college or university. A grade point average of at least 3.0/4.0 is normally required for admission. The Graduate Record Examination (GRE) general test is not required. Three letters of recommendation. A personal statement (statement of purpose).,Not Required,,True,False,True,False,False,False,False,True,False,False,False,True,True,False,False,False,,,,College of Engineering and Applied Sciences,23280,,,,,,"['Structural Engineering', 'Geotechnical Engineering', 'Transportation Systems Engineering', 'Water Resources and Hydraulic Engineering']","The Doctor of Philosophy (Ph.D.) program in Civil Engineering is designed to prepare students for a career in research and/or academia. A high level of scholarship is expected of Ph.D. students and the program provides sufficient flexibility to allow for a focus on research in a chosen area of specialization within Civil Engineering. In consultation with their academic advisor, students design an individualized plan of graduate study and research that best meets their interests and career goals. Students must successfully complete a set of core courses and then additional coursework as advised by their Ph.D. committee to strengthen their preparation for the Qualifying examination. Students are also encouraged to participate in teaching or mentoring activities and attend departmental seminars. The Ph.D. program is centered on original research performed under the guidance of the student's research advisor culminating in a dissertation. Students entering the program with a Bachelor of Science degree should expect to spend a minimum of four years of full-time study to complete the program; those with a relevant master’s degree can complete the program in approximately three years.",,https://www.stonybrook.edu/grad/academics/,,,1008,True,True,,4.0,3.0,,396,,,,,,,,,,,,,,,,False,False,,,105.0,,,,6.5,,,53.0,,80.0,,,,,,,,,,,,,"Teaching Assistantships, Research Assistantships, Fellowships",,,,,,,
,Coaching Certificate,,,,,Certificate,"Fall, Spring, Summer",,,,,Required,Not Required,"An official TOEFL, IELTS, or Duolingo score report is required for all applicants who do not have English as their primary language. Minimum scores: TOEFL: 80 (iBT); IELTS: 6.5 overall band score with no band below 6.0; Duolingo: 105.","An earned master's degree with a GPA of 3.0 or higher. Be a state-certified teacher, administrator or pupil personnel services provider (e.g., school counselor, psychologist, social worker). Submit an online application to the Graduate School. Submit a statement of purpose. Submit two letters of recommendation. Submit official transcripts from all colleges and universities attended. Submit a copy of your New York State teaching or service certificate.",,,True,False,True,False,False,False,False,True,False,False,False,False,True,False,False,False,,,,School of Professional Development,5652,,,,,,,"The 18-credit Advanced Graduate Certificate in Coaching is a comprehensive, state-of-the-art program designed to prepare students for the New York State coaching certification. Candidates will be trained in the principles and practices of coaching as they relate to the psychological, physiological, and sociological aspects of the athlete. Candidates will complete a six-credit internship that provides an opportunity to coach under the direct supervision of a certified coach in the school setting.",,https://www.stonybrook.edu/commcms/spd/bulletin/programs/coaching.php,,,471,,False,1.0,4.0,3.0,,396,,,,,,,,,5652.0,,,,,,,False,False,,,105.0,,,,6.5,,,,,80.0,,,,,,,,,,,"Up to $1,500",,Merit-based,,,,,,,
,Cognitive Neuroscience Certificate,,,,,Certificate,"Fall, Spring",,,,,,Not Required,,"To be admitted to the certificate program, a student must meet the graduate school admission requirements and must be enrolled in a Stony Brook PhD program in one of the following departments: Anthropology, Applied Mathematics and Statistics, Biomedical Engineering, Computer Science, Ecology and Evolution, Linguistics, Neurobiology and Behavior, Psychology, or Sociology. To be admitted to the program, a student must have a faculty advisor who is a member of the Cognitive Science faculty.",,,True,False,False,False,False,False,False,False,False,False,False,False,False,False,False,False,,,,College of Arts and Sciences,7065,,,,,,,"The Graduate Certificate Program in Cognitive Neuroscience provides students with a solid foundation in the concepts and methods of cognitive neuroscience. Students will be exposed to a range of methodologies, including neuroimaging, electrophysiology, neuropsychology, and computational modeling. The program will involve students in the ongoing research of Stony Brook's strong and vibrant cognitive neuroscience faculty and will enrich their studies through a required proseminar that covers the most important and fundamental ideas and findings in the field.",,https://www.stonybrook.edu/grad/academics/,,,471,False,True,,4.0,3.0,,396,,,,,,,,,7065.0,,,,,,,False,False,,,,,,,,,,,,,,,,,,,,,,,,,"Fellowships, Assistantships",,,,,,,
