Id,ProgramName,ProgramCode,Status,CreatedDate,UpdatedDate,Level,Term,TermCode,LiveDate,DeadlineDate,Resume,StatementOfPurpose,GreOrGmat,EnglishScore,Requirements,WritingSample,CollegeId,IsAnalyticalNotRequired,IsAnalyticalOptional,IsDuoLingoRequired,IsELSRequired,IsGMATOrGreRequired,IsGMATRequired,IsGreRequired,IsIELTSRequired,IsLSATRequired,IsMATRequired,IsMCATRequired,IsPTERequired,IsTOEFLIBRequired,IsTOEFLPBTRequired,IsEnglishNotRequired,IsEnglishOptional,AcademicYear,AlternateProgram,ApplicationType,Department,Fees,IsAvailable,ProgramType,AdmissionDepartmentId,CreatedBy,UpdatedBy,Concentration,Description,OtherConcentrations,ProgramWebsiteURL,Accredidation,AverageScholarshipAmount,CostPerCredit,IsRecommendationSystemOpted,IsStemProgram,MaxFails,MaxGPA,MinGPA,PreviousYearAcceptanceRates,QsWorldRanking,TotalAccepetedApplications,TotalCredits,TotalDeniedApplications,TotalI20sIssued,TotalScholarshipsAwarded,TotalSubmittedApplications,TotalVisasSecured,UsNewsRanking,CollegeApplicationFee,IsCollegePaying,MEContractNegotiatedFee,MyGradAppFee,ProgramCategory,IsCollegeApplicationFree,IsCouponAllowed,IsACTRequired,IsSATRequired,SftpDestinationId,MinimumACTScore,MinimumDuoLingoScore,MinimumELSScore,MinimumGMATScore,MinimumGreScore,MinimumIELTSScore,MinimumMATScore,MinimumMCATScore,MinimumPTEScore,MinimumSATScore,MinimumTOEFLScore,MLModelName,MinimumAnalyticalScore,MinimumEnglishScore,MinimumExperience,MinimumSopRating,WeightAnalytical,WeightEnglish,WeightExperience,WeightGPA,WeightSop,ScholarshipAmount,ScholarshipPercentage,ScholarshipType,IsNewlyLaunched,BatchId,IsImported,IsImportVerified,Is_Recommendation_Sponser,AnalyticalScore,MinimumLSATScore
,Accelerator Science Certificate,,,,,Certificate,Fall,,,January 15,,Required,Optional,"Foreign students are required to take the TOEFL or IELTS exam. The required minimum TOEFL score is 90 for the internet-based test. The required minimum IELTS score is 6.5, with no subsection below 6.","An undergraduate B.S. degree in physics, engineering or a related discipline, with a minimum cumulative GPA of 3.0. Three letters of recommendation. Graduate Record Examination (GRE) General Test is required. For international applicants, the Test of English as aForeign Language (TOEFL) is required. The application also includes a statement of purpose.",,,False,False,False,False,False,False,False,False,False,False,False,False,False,False,False,False,,,,College of Arts and Sciences,14925,,,,,,,"The Graduate Certificate in Accelerator Science at Stony Brook University aims to provide post-baccalaureate students with a solid and specialized background in the physics and technology of particle accelerators. This is achieved through a set of core courses that focus on accelerator physics and technology, along with a number of specialized elective courses and, notably, a practical training experience in one of the accelerator facilities operated by the Center for Accelerator Science and Education (CASE) at Stony Brook.",,https://www.stonybrook.edu/grad/academics/,,,995,,False,2.0,4.0,3.0,,396,,,,,,,,,14925.0,,,,,,,False,False,,,,,,,6.5,,,,,90.0,,,,,,,,,,,,,"Fellowships, Assistantships, Traineeships",,,,,,,
,Accountancy MSA,,,,,,Fall,,,,Required,Required,Either,"All international students must demonstrate English proficiency by submitting scores from at least one of the following exams: TOEFL, IELTS, Duolingo English Test.","Stony Brook University Graduate School online application
Application fee
One unofficial transcript from each university/college attended
GMAT or GRE score reports* (optional)
*GMAT/GRE scores are currently optional through the Fall 2025 semester.
Personal statement/essay
Resume or CV
Two letters of recommendation
TOEFL/IELTS score (for international students)
An interview may be required",Not Required,,True,True,False,False,True,False,False,False,False,False,False,False,False,False,False,False,,,,College of Business,28890,,,,,,,"The Master of Science in Accountancy (MSA) is a 30-credit, one-year graduate program that prepares students for careers in public accounting, industry, non-profit, and government. Stony Brook's MSA is designed for students with an undergraduate degree in accounting, as well as for those without an accounting background. The program offers a flexible curriculum that enables students to customize their coursework to their specific career goals. Core courses provide students with a strong foundation in the fundamentals of accounting, while electives allow them to specialize in areas such as forensic accounting, taxation, and information systems. In addition to our rigorous coursework, the MSA program provides students with opportunities to gain practical experience through internships and other experiential learning opportunities. We also have a strong network of alumni who are eager to help our students succeed.",,https://www.stonybrook.edu/commcms/business/graduates/msa-new.php,"The College of Business is accredited by AACSB International-the Association to Advance Collegiate Schools of Business, a hallmark of excellence earned by less than five percent of business schools worldwide.",,963,,True,,4.0,3.0,,396,,,,,,,,,28890.0,,,,,,,False,False,,,105.0,,,,6.5,,,,,80.0,,,,,,,,,,,,,Merit-based,,,,,,,
,Accounting and Analytics MS,,,,,MS,"Fall, Spring",,,,Required,Required,Either,"International Students must demonstrate English proficiency. You must submit one of the following: TOEFL, IELTS, Duolingo.","Admission is based on a holistic review of each applicant’s credentials, including prior academic performance, GMAT or GRE score, letters of recommendation, statement of purpose, and resume. Evidence of strong quantitative skills is important for admission. Prior work experience is valued, but not required.",,,False,False,False,False,True,False,False,False,False,False,False,False,False,False,False,False,,,,College of Business,29070,,,,,,,"The 30-credit, one-year Master of Science in Accounting program prepares students for a career in public accounting, and is designed to meet the educational requirements for CPA licensure in New York State. An undergraduate degree in accounting is not required, as we offer prerequisite courses in business and accounting that may be taken at Stony Brook as a non-matriculated student. Students will gain the knowledge of accounting, auditing, taxation, and technology necessary to become a successful accounting professional. They also have the ability to pursue specialized accounting knowledge by taking elective courses in topics such as forensic accounting, finance, operations management, human resources and marketing. The curriculum is enhanced with a strong emphasis on technology and quantitative analysis with courses in Business Analytics, and advanced data analytics in accounting. The required internship helps students gain hands-on professional experience to advance their career. Our experienced faculty include esteemed researchers and practitioners who are experts in their fields, dedicated to preparing students to become leaders in accounting.",,https://www.stonybrook.edu/grad/academics/,Stony Brook University's College of Business is accredited by AACSB International-the Association to Advance Collegiate Schools of Business. AACSB accreditation is the hallmark of excellence in business education and has been earned by less than five percent of the world's business programs.,,"In-state: $471, Out-of-state: $969",False,True,,4.0,3.0,,396,,,,,,,,,29070.0,,,,,,,False,False,,,105.0,,,,6.5,,,,,80.0,,,,,,,,,,,,,Scholarships for qualified students,,,,,,,
,Accounting MBA,,,,,MBA,"Fall, Spring",,,,Required,Required,Not Required,TOEFL or IELTS - international students only,"A bachelor's degree with a B or better cumulative grade point average. Official transcripts from all colleges and universities attended. A current resume. A personal statement/essay describing your reasons for pursuing the MBA degree and your short- and long-term career goals. Two letters of recommendation. It is strongly suggested that at least one letter be from a college professor. GMAT or GRE test score. (GMAT/GRE waivers are available for some highly qualified candidates.) International applicants who did not receive their primary undergraduate degree from a US institution will also need to submit one of the following: TOEFL, IELTS, or Duolingo English Test. An interview with an admissions representative.",Not Required,,False,False,False,False,False,False,False,False,False,False,False,False,False,False,False,False,,,,College of Business,60000,,,,,,Accounting,"The MBA in Accounting degree program is designed for students with an undergraduate major in accounting from a U.S. college or university. This full-time program, which can be completed in two semesters, allows graduates to meet the 150-credit hour requirement needed to sit for the CPA exam in New York State and many other states. Students can also qualify for advanced standing in the program, which will reduce their cost and time to degree. Stony Brook’s MBA in Accounting will not only prepare you for the CPA exam, but also to assume a leadership role in an accounting firm or corporation. In addition to a strong accounting foundation, the program features courses in finance, management, operations, and marketing, all taught by our world-class faculty. Graduates of the program are well prepared for careers in public accounting, corporate accounting, not-for-profit accounting, and government.",,https://www.stonybrook.edu/grad/academics/,"Stony Brook University's College of Business is accredited by AACSB International-the Association to Advance Collegiate Schools of Business, the premier accrediting agency for business schools in the world.",,1250,False,True,,4.0,3.0,,396,,,,,,,,,60000.0,,,,,,,False,False,,,,,,,,,,,,,,,,,,,,,,,,,Merit-based,,,,,,,
,Accounting MS,,,,,MS,Fall,,,,Required,Required,Either,"International applicants from non-English speaking countries are required to demonstrate proficiency in English by submitting scores from one of the following testing services: TOEFL, IELTS or Duolingo. The minimum required composite TOEFL iBT score is 80. The minimum required composite IELTS score is 6.5, with no subsection score below 6. The minimum required Duolingo score is 105.","An undergraduate degree from an accredited U.S. institution or the international equivalent. Undergraduate degree in accounting not required. A minimum undergraduate GPA of 3.2 is normally required for admission. Exceptional cases may be considered on an individual basis. A current resume. A statement of purpose. Two letters of recommendation, submitted online. The GMAT is not required but scores may be submitted to strengthen a candidate’s application. If you elect to submit scores, there is no minimum required score. International students are required to take the TOEFL or IELTS exam unless they have received a degree from an institution in which the primary language of instruction is English. Minimum TOEFL score is 85; minimum IELTS score is 6.5 with no subsection below 6. Prerequisites must be completed with a grade of C or higher.",,,True,True,False,False,True,False,False,False,False,False,False,False,False,False,False,False,,,,College of Business,31810,,,,,,"Accounting Analytics, Accounting and Financial Management","The Master of Science in Accounting (MSA) program is designed for students with an undergraduate degree in accounting who wish to focus on a particular area within the field or for students with an undergraduate degree in a discipline other than accounting who are interested in pursuing a career in accounting. This program offers students an opportunity to obtain a graduate degree from a top-ranked research university that is accredited by AACSB International, the premier accrediting agency for business schools. The program also positions students to become a Certified Public Accountant (CPA) in New York State. The MS in Accounting program has two tracks: Accounting Analytics and Accounting and Financial Management. The Accounting Analytics track is a STEM-designated program that provides students with the advanced data analytics skills they need for a successful career in the growing field of accounting analytics. The Accounting and Financial Management track provides students with technical accounting skills and prepares students for a career in public or corporate accounting.",,https://www.stonybrook.edu/grad/academics/,"The College of Business is accredited by AACSB International-the Association to Advance Collegiate Schools of Business, a prestigious body that recognizes the top business schools in the world.",,1326,True,True,,4.0,3.2,,396,,,,,,,,,31810.0,,,,,,,False,False,,,105.0,,,,6.5,,,,,80.0,,,,,,,,,,,,,Merit-based,,,,,,,
,Accelerated MBA,,,,,MBA,Fall,,,,Required,Required,Either,,"To be eligible to apply, students must: Be a current Stony Brook undergraduate student. Have a Stony Brook cumulative GPA of 3.2 or higher. Be on track to complete all of the requirements for your bachelor's degree by the time you start your first MBA class. Meet with an MBA advisor and an undergraduate advisor to ensure that you are on track to complete both degrees on time. Please complete our form to arrange an appointment. You must do this before you apply.",,,True,False,False,False,True,False,False,False,False,False,False,False,False,False,False,False,,,,College of Business,26490,,,,,,"Finance, Marketing, Health Care Management, Operations Management, Innovation, Accounting","The Combined Bachelor's/MBA program is an opportunity for ambitious undergraduate students to earn a bachelor's degree in their chosen major and a Master of Business Administration degree with a concentration in Finance, Marketing, Health Care Management, Operations Management, Innovation, or Accounting. Students in the Combined Bachelor's/MBA program will be able to complete all the requirements for both degrees in five years, saving a full year of time and tuition. Students may select from any of our six MBA concentrations, or they may opt for the general MBA and choose from a variety of electives that best suit their academic and career goals. This allows them the flexibility to design their own course of study in fields such as general management, human resources, or business analytics. The Combined Bachelor's/MBA program will prepare students for leadership roles in a variety of careers.",,https://www.stonybrook.edu/commcms/business/Undergraduates/mbafasttrack.php,The College of Business is accredited by AACSB International,,1104,False,True,,4.0,3.2,,396,,,,,,,,,26490.0,,,,,,,False,False,,,,,,,,,,,,,,,,,,,,,,,,,Merit-based,,,,,,,
,Accelerated MBA in Real Estate,,,,,,Fall,,,,Required,Required,Optional,"All students whose native language is not English are required to demonstrate English proficiency. Acceptable tests include TOEFL iBT, IELTS, PTE, or Duolingo. The requirement may be waived if the applicant has received a degree from a U.S. college or university or from a university in another country where English is the official language of instruction.","To apply to the MBA and MS programs in the College of Business, you will need the following: Online application and application fee; Official transcripts from all colleges and universities attended (an unofficial copy can be uploaded for application review, but official transcripts are required upon admission); A current resume or curriculum vitae, detailing professional experience, including titles, dates, and responsibilities; An essay detailing your reasons for pursuing a graduate degree and your academic and professional goals; Three letters of recommendation. The GMAT/GRE requirement is currently being waived for all applicants to the MBA programs. International students may need to provide TOEFL or IELTS scores.",,,True,False,False,False,False,False,False,False,False,False,False,False,False,False,False,False,,,,College of Business,50868,,,,,,,,,https://www.stonybrook.edu/commcms/business/graduates/mba-general-new.php,,,1413,False,True,,4.0,3.0,,396,,,,,,,,,50868.0,,,,,,,False,False,,,105.0,,,,6.5,,,53.0,,80.0,,,,,,,,,,,,,Merit-based,,,,,,,
,Accelerated Public Health MPH,,,,,Masters,Fall,,,,Required,Required,Not Required,International applicants whose native language is not English are required to take the TOEFL exam. A minimum score of 90 on the TOEFL iBT is required for admission. The Program in Public Health also accepts the IELTS exam. An overall score of 6.5 with no subsection below 6 is required.,"Applicants must be current Stony Brook University undergraduate students in good academic standing. GPA of 3.0 or better. Completed all SBU D.E.C. and major requirements to be eligible for graduation. Completed the following prerequisite courses with a grade of B or better: One semester of college-level mathematics (calculus preferred); One semester of social and behavioral sciences. Application Materials: An application to the Graduate School, A current résumé, A statement of purpose, Official transcripts from all colleges and universities attended, Three letters of recommendation. GRE test scores are not required for admission.",Not Required,,True,False,False,False,False,False,False,True,False,False,False,False,True,False,False,False,,,,School of Medicine,21195,,,,,,,"The Accelerated Master of Public Health (MPH) degree at Stony Brook University is designed for highly-qualified, currently-enrolled undergraduate and graduate students, as well as recent graduates, who wish to complete both a bachelor’s degree and a MPH degree, or a clinical doctorate and an MPH degree, in less time than it would take to complete them sequentially. Through our flexible accelerated programs, students gain advanced skills and knowledge to address complex public health issues and become leaders in the field.",,https://www.stonybrook.edu/grad/academics/,"The Program in Public Health at Stony Brook University is accredited by the Council on Education for Public Health (CEPH). Our program was first accredited in 2011 and was reaccredited in 2018 for a seven-year term, extending to July 1, 2025.",,471,,True,,4.0,3.0,,396,,,,,,,,,21195.0,,,,,,,False,False,,,,,,,6.5,,,,,90.0,,,,,,,,,,,,,Competitive scholarships,,,,,,,
,Adult-Gerontology Acute Care Nurse Practitioner Certificate,,,,,Advanced Graduate Certificate,Fall,,,,Required,Required,Not Required,All international students must demonstrate English proficiency. The Graduate School's minimum score for the internet-based TOEFL (iBT) is 80. The Graduate School's minimum IELTS score is 6.5 overall with no subsection below 6. The Graduate School's minimum Duolingo English Test (DET) score is 105. The Graduate School's minimum PTE Academic score is 53. This requirement is waived for applicants who have earned a degree from an institution in the United States or another English-speaking country.,"Master of Science degree in nursing with a major in one of the following advanced practice areas: nurse practitioner (adult, family, adult-gerontology primary care), clinical nurse specialist (adult health), or certified registered nurse anesthetist. For consideration for admission, applicants must have graduated from a program accredited by the Commission on Collegiate Nursing Education (CCNE) or the Accreditation Commission for Education in Nursing (ACEN).
Licensure as a Registered Nurse and Nurse Practitioner in New York State.
National certification as a nurse practitioner.
A minimum of one-year of full-time work experience (two years preferred) as a nurse practitioner in a hospital setting with the critically ill population.
Current ACLS certification.
Three letters of recommendation.
A personal statement.
A current resume.
Successful completion of an admission interview.
An undergraduate or graduate statistics course with a grade of C or better.
A cumulative GPA of 3.0.
All applicants to the School of Nursing are required to submit their application and supporting documents via NursingCAS (www.nursingcas.org).",Not Required,,True,False,False,False,False,False,False,False,False,False,False,False,False,False,False,False,,,,School of Nursing,10038,,,,,,,"The Advanced Certificate in Adult-Gerontology Acute Care Nurse Practitioner (AGACNP) program prepares acute care nurse practitioners to provide advanced nursing care to adult and gerontological patients with complex, acute, and chronic health conditions. This is a 27-credit program that includes 600 clinical hours. Students are prepared to provide a full spectrum of care from disease prevention to critical care in order to stabilize the patient’s condition, prevent complications, restore health and/or provide palliative care. Students who complete the program are eligible to take the American Nurses Credentialing Center (ANCC) or the American Association of Critical-Care Nurses (AACN) certification exam.",,https://www.stonybrook.edu/grad/academics/,"The baccalaureate degree program in nursing, master's degree program in nursing, Doctor of Nursing Practice program and advanced certificate programs at Stony Brook University School of Nursing are accredited by the Commission on Collegiate Nursing Education (http://www.ccneaccreditation.org).",,478,,True,1.0,4.0,3.0,,396,,,,,,,,,10038.0,,,,,,,False,False,,,105.0,,,,6.5,,,53.0,,80.0,,,,,,,,,,,,,"Merit-based, Need-based",,,,,,,
,Adult-Gerontology Acute Care Nurse Practitioner MSN,,,,,Masters,Fall,,,,Required,Required,Not Required,,"Unofficial transcripts from all colleges and universities attended. A bachelor's degree in nursing (BSN) from a program accredited by a national nursing accrediting agency. Minimum cumulative grade point average of 3.0 on a 4.0 scale. Current, unencumbered NYS RN license and registration. At least one year of recent acute care experience as a registered nurse. Current BLS certification. Three letters of recommendation. Personal Statement. Resume/CV. Official transcripts will be required if you are offered admission. Proof of English Proficiency for international students whose native language is not English.",Not Required,,True,False,False,False,False,False,False,False,False,False,False,False,False,False,True,False,,,,School of Nursing,29896,,,,,,,"The Adult-Gerontology Acute Care Nurse Practitioner program prepares the graduate with the knowledge and skills to provide advanced nursing care to the adult and gerontology population with complex, acute, and chronic health conditions. Emphasis is on the provision of health care services to patients who are acutely and critically ill in a variety of settings such as intensive care units, emergency departments, specialty labs, and specialty clinics. Clinical experiences with expert preceptors are provided in a variety of settings. Graduates of the Master of Science in Nursing in the Adult-Gerontology Acute Care Nurse Practitioner program will be eligible to sit for national certification through the American Nurses Credentialing Center (ANCC) or the American Association of Critical Care Nurses (AACN).",,https://www.stonybrook.edu/grad/academics/,"The master's degree program in nursing... at Stony Brook University School of Nursing are accredited by the Commission on Collegiate Nursing Education, 655 K Street NW, Suite 750, Washington, DC 20001, 202-887-6791.",,"$808 (In-state); $1,202 (Out-of-state)",False,False,2.0,4.0,3.0,,396,,,,,,,,,29896.0,,,,,,,False,False,,,,,,,,,,,,,,,,,,,,,,,,,"Merit-based, Need-based",,,,,,,
