,Media Management MS,,,,,MS,"Fall, Spring",,,,Required,Required,Optional,"TOEFL, IELTS, or other English language test scores may be required for international applicants. The Graduate School requires a minimum TOEFL iBT score of 80, an IELTS overall score of 6.5 (with no subsection below 6), a Duolingo score of 105, or a PTE Academic score of 53 for most programs.","We welcome applicants with a bachelor’s degree in any field. The application process is entirely online through the Stony Brook University Graduate School. All of the required materials should be uploaded with your application. In addition to a completed application form and fee, you will need to provide:

- Your resume.
- Official transcripts from every college or university you have attended, including community colleges and institutions where you may have taken only one or two classes. We accept unofficial transcripts for the review process. Please submit official transcripts upon admission to the program.
- A personal statement of 500-1,000 words that describes your interest in media management, career goals, and what you hope to get out of the program.
- Two letters of recommendation from professional or academic references. These should be requested and submitted electronically as part of the online application.

International students must also submit scores from the Test of English as a Foreign Language (TOEFL). The minimum acceptable score is 90 for the Internet-based test. We require an official score report from ETS. The Stony Brook University code is 2548.",Not Required,,True,False,False,False,False,False,False,False,False,False,False,False,False,False,False,False,,,,School of Communication and Journalism,23920,,,,,,,"The Master of Science in Media Management at Stony Brook University prepares students to manage the business operations of today’s media organizations. The media landscape is complex. New platforms, new business models and new technologies have disrupted traditional media. Our students are prepared to navigate this exciting, ever-changing environment. They are ready to lead. The curriculum focuses on business, including courses in finance, marketing, technology, leadership and entrepreneurship. Students learn about the business of media from experts in the field. Our instructors are top executives at some of the world’s leading media companies. This is where theory and practice come together. We provide the essential business skills and the real-world perspective to build a successful career. Our flexible scheduling — with all classes offered on nights and weekends in New York City — means students don’t have to put their careers on hold to advance them.",,https://www.stonybrook.edu/grad/academics/,,,1000,True,False,1.0,4.0,3.0,,396,,,,,,,,,,,,,,,,False,False,,,105.0,,,,6.5,,,53.0,,80.0,,,,,,,,,,,,,"Assistantships, Fellowships",,,,,,,
,Media Scoring and Production MM,,,,,MM,Fall,,,Jan 15,Required,Required,Not Required,"Applicants whose native language is not English are required to take an English proficiency exam. Stony Brook University accepts the following exams: TOEFL (Test of English as a Foreign Language), IELTS (International English Language Testing System), Duolingo English Test. The English proficiency exam is waived for students who have earned a degree from an institution in the United States or another English-speaking country.","A complete application consists of the following:

Online Application
Application Fee
Unofficial Transcripts
Three Letters of Recommendation
Personal Statement (Statement of Purpose)
Curriculum Vitae/Resume
TOEFL or IELTS scores (for international applicants only)
A live or pre-recorded audition/interview is required of all applicants. For the pre-recorded option, the required audition repertoire can be uploaded via the application portal. Those who wish to complete a live audition should contact the music graduate office (mus-grad@stonybrook.edu).

Please submit a portfolio of scores and recordings (in any media format). The selection of works should show a clear demonstration of your current skills in the field of scoring and production. Three to five works of contrasting character are expected. Recordings must be of high quality. You should indicate your role in the creation of each piece. This can be uploaded via the application portal.",Not Required,,True,False,False,False,False,False,False,False,False,False,False,False,False,False,False,False,,,,College of Arts and Sciences,11070,,,,,,,"The MM in Media Scoring and Production is a 36-credit, two-year degree program that will provide a thorough grounding in the creative, technological, historical, and practical aspects of scoring for visual media such as film, television, games, and advertising. The curriculum includes private composition lessons focused on media scoring, as well as two years of coursework in orchestration, music technology, and the history and business of media scoring. A key component of the program will be collaboration with student directors in the Stony Brook / Killer Films MFA in Film program on their film projects. Students in the MM in Media Scoring and Production will complete a culminating thesis project consisting of the score for an MFA thesis film.",,https://www.stonybrook.edu/grad/academics/,,,462,False,False,,4.0,3.0,,396,,,,,,,,,11070.0,,,,,,,False,False,,,105.0,,,,6.5,,,,,80.0,,,,,,,,,,,,,"Fellowships, Assistantships, Scholarships",,,,,,,
,Media Scoring and Production MM Online,,,,,MM,"Fall, Spring",,,,Optional,Required,Not Required,"All graduate applicants are required to demonstrate English proficiency. This requirement can be satisfied by one of the following: TOEFL: A minimum score of 80 on the internet based test (iBT). IELTS: A minimum overall score of 6.5, with no subsection score below 6. Duolingo English Test: A minimum score of 105.","Bachelor's degree in music (or equivalent experience) from an accredited university or college; Minimum undergraduate GPA of 3.0; Online application; Portfolio of three original works submitted as either PDF scores, audio files, or video files with links; Statement of Purpose: A 500-word essay detailing your interest in the program and career goals; Three letters of recommendation from individuals who can attest to your academic and/or professional potential; Official transcripts from all colleges and universities attended; Application fee.",Not Required,,True,False,False,False,False,False,False,False,False,False,False,False,False,False,False,False,,,,School of Professional Development,16950,,,,,,,"The Stony Brook University MM in Media Scoring and Production is a fully online, 30-credit degree designed for aspiring and early/mid-career media composers. With a focus on scoring for film, television, video games and other interactive media, the curriculum combines traditional conservatory-style compositional training with practical, project-based coursework using the latest music technology. The program is designed to be completed in one calendar year of full-time study, with a part-time option as well, making it accessible to working professionals and students worldwide. The Stony Brook MM in Media Scoring and Production is a rigorous, professionally oriented program that will prepare you for a successful career in the fast-paced and competitive world of media scoring.",,https://calendar.stonybrook.edu/site/staller-center/event/orpheus-chamber-orchestra---11918/,The Department of Music is a fully accredited member of the National Association of Schools of Music.,,565,False,False,,4.0,3.0,,396,,,,,,,,,16950.0,,,,,,,False,False,,,105.0,,,,6.5,,,,,80.0,,,,,,,,,,,1000,,"Merit-based, Need-based",,,,,,,
,Medical Humanities and Bioethics MA,,,,,,"Fall, Spring",,,,Required,Required,Not Required,"International applicants are required to have a minimum score on one of the following exams: TOEFL (iBT): 80, IELTS: 6.5 (with no band score below 6), Duolingo: 115, PTE Academic: 53.","An undergraduate degree from an accredited U.S. institution or the equivalent from a foreign institution.
Undergraduate GPA: No specific GPA is required, but a strong academic record is expected.
GRE Scores: GREs are not required.
Statement of Purpose describing the applicant’s academic interests and goals.
Writing Sample of at least ten pages.
Three letters of recommendation.
TOEFL for international students (see Graduate School requirements).
Resume or C.V.",Required,,True,False,False,False,False,False,False,False,False,False,False,False,False,False,False,False,,,,College of Arts and Sciences and Renaissance School of Medicine,23380,,,,,,"Clinical Ethics, Health Humanities","The Center for Medical Humanities, Compassionate Care, and Bioethics offers an MA program to train students in the key concepts and methods of medical humanities and clinical bioethics. The program emphasizes the importance of understanding the values and cultural contexts of illness, health, and medicine, and it fosters a compassionate, patient-centered approach to healthcare. The MA program offers two tracks: Track 1 focuses on clinical ethics, designed for health care professionals, medical, and other health professions students who wish to serve as ethics consultants; Track 2 focuses on health humanities, designed for students interested in doctoral studies and academic careers in the medical/health humanities, for journalists and other professional writers who wish to specialize in writing about medicine and health, and for students in any other discipline that connects with the program’s mission.",,https://www.stonybrook.edu/grad/academics/details.php?code=hcb&type=description&level=graduate_bulletin_data,,,975,False,False,,4.0,3.0,,396,,,,,,,,,23380.0,,,,,,,False,False,,,115.0,,,,6.5,,,53.0,,80.0,,,,,,,,,,,,,"Fellowships, Assistantships",,,,,,,
,Medical Physics Certificate,,,,,Certificate,Fall,,,,Required,Required,Not Required,"Applicants must prove English proficiency by submitting scores from a recent (within two years) TOEFL, IELTS, or Duolingo English test. The PTE Academic test is also accepted. Applicants from countries where English is the official language of instruction are exempted from this requirement.","A personal statement is required. A résumé is required. Official transcripts from all colleges and universities attended. A PhD in physics, medical physics, or a closely related field (e.g., engineering, physical chemistry, or computer science) is required for admission. Prerequisite coursework required for consideration includes: Two semesters of calculus-based physics (e.g., mechanics, E&M, modern physics), Multivariable calculus, Differential equations, Upper-level undergraduate courses in electricity and magnetism, quantum mechanics, and classical mechanics are required.",,,True,False,False,False,False,False,False,False,False,False,False,False,False,False,False,False,,,,Renaissance School of Medicine,11775,,,,,,,"The Certificate Program in Medical Physics at Stony Brook University is designed to provide the didactic component of the training for medical physicists in the specialty of diagnostic medical physics. The program is offered under the sponsorship of the Departments of Radiology and Radiation Oncology, and Biomedical Engineering. The program addresses the shortage of qualified medical physicists, which resulted from the changes in the requirements for certification by the American Board of Radiology (ABR). The goal is to train the next generation of medical physicists, who will ensure the safe and effective use of radiation in medicine. The program curriculum consists of a sequence of eight courses, which are offered over a two-year period, with two courses per semester. All classes are offered in the late afternoon or early evening, to accommodate students who are working full-time. Classes are offered at the Health Sciences Center, Stony Brook University.",,https://renaissance.stonybrookmedicine.edu/radiology/medical_physics,The Medical Physics Certificate Program at Stony Brook University has been granted accreditation by the Commission on Accreditation of Medical Physics Education Programs (CAMPEP).,,471,False,True,,4.0,3.0,,396,,,,,,,,,11775.0,,,,,,,False,False,,,105.0,,,,6.5,,,53.0,,80.0,,,,,,,,,,,,,"Fellowships, Assistantships",,,,,,,
,Medical Radiation Dosimetry Certificate,,,,,Certificate,Fall,,,,Required,Required,Not Required,,"The Medical Dosimetry program requires a Bachelor's degree from an accredited university. Applicants must have a cumulative GPA of at least a 3.0. Prerequisite coursework includes: Physics (two semesters with labs), Anatomy & Physiology (two semesters with labs), Pre-calculus, Medical Terminology, Oral and Written Communication. All prerequisite courses must have been completed with a grade of a C or better and within the past 10 years. ARRT certification in Radiation Therapy is required at the time of application. In addition to the online Graduate School application, the following supplemental materials must be submitted: Official transcripts from all colleges/universities attended; Three letters of recommendation; Personal statement indicating interest in the program and career goals; Copy of ARRT certification in Radiation Therapy; Resume; Observation hours documentation (a minimum of 24 observation hours are required).",Not Required,,True,False,False,False,False,False,False,False,False,False,False,False,False,False,False,False,,,,School of Health Professions,16170,,,,,,,"The Medical Radiation Dosimetry Advanced Certificate is a full-time, 12-month program. The program is offered as either a campus-based or an online distance learning program. All students, campus-based and online, are required to complete a one-year clinical practicum at one of our many clinical affiliates. The mission of the program is to educate students to become competent, compassionate, and professional medical dosimetrists, and to provide them with the knowledge and skills necessary for a successful career in medical radiation dosimetry. The program prepares students with the fundamental concepts of radiation therapy, including radiation physics, radiobiology, anatomy and physiology, patient care, radiation safety, quality assurance, and treatment planning. The curriculum also includes instruction on the latest radiation therapy technologies, such as intensity-modulated radiation therapy (IMRT), volumetric-modulated arc therapy (VMAT), stereotactic radiosurgery (SRS), and stereotactic body radiation therapy (SBRT).",,https://www.stonybrook.edu/grad/academics/,"The Medical Radiation Dosimetry Program is accredited by the Joint Review Committee on Education in Radiologic Technology (JRCERT), 20 N. Wacker Drive, Suite 2850, Chicago, IL 60606-3182, (312) 704-5300, www.jrcert.org, mail@jrcert.org. The program was awarded an 8-year accreditation in 2021.",,462,False,False,,4.0,3.0,,396,,,,,,,,,16170.0,,,,,,,False,False,,,,,,,,,,,,,,,,,,,,,,,,,,,,,,,,
,Medical Radiation Dosimetry MS,,,,,MS,Fall,,,,Required,Required,Not Required,"If your native language is not English, you must demonstrate English proficiency. You must take the Test of English as a Foreign Language (TOEFL) or the International English Language Testing System (IELTS) test. Stony Brook University also accepts Duolingo English Test (DET) with a minimum score of 105 or Pearson Test of English (PTE Academic) with a minimum score of 53. You are exempt from this requirement if you: Have a bachelor's, master's, or doctoral degree from a U.S. college or university or a university in a TOEFL-exempt country.","Baccalaureate degree, preferably in a physical or biological science, from an accredited college or university. Minimum cumulative grade point average (GPA) of 3.0 on a 4.0 scale. Completion of the following prerequisite coursework from an accredited college or university: Mathematics (calculus) - one semester; Statistics - one semester; Physics (calculus-based) - two semesters with labs; Chemistry - two semesters with labs; Biology (with human focus) - two semesters with labs; English composition - one semester; Computer literacy - one semester. Prior clinical experience in radiation oncology is highly recommended but not required. The Medical Dosimetry Program does not require the GRE exam for admission.",,,True,False,False,False,False,False,False,False,False,False,False,False,False,False,False,False,,,,School of Health Professions,36777,,,,,,Medical Dosimetry,"The Medical Dosimetry specialization is a 12-month JRCERT-accredited advanced certificate program for experienced radiation therapists who hold a minimum of a bachelor's degree. A medical dosimetrist is a member of the radiation oncology team who has knowledge of the overall characteristics and clinical relevance of radiation oncology treatment machines and equipment, is cognizant of procedures commonly used in brachytherapy and has the education and expertise necessary to generate radiation dose distributions and dose calculations in collaboration with the medical physicist and radiation oncologist. The program is designed to provide students with the didactic and clinical skills necessary to be eligible to take the Medical Dosimetry Certification Board (MDCB) examination upon graduation. Courses are offered using a combination of in-class and online instruction. All students complete a 12-month, full-time (35 hours/week) clinical internship, which is completed at one of our affiliated medical facilities throughout the country.",,https://healthprofessions.stonybrookmedicine.edu/programs/hs/curriculum/clinical/medical-dosimetry,JRCERT-accredited,,943,True,True,,4.0,3.0,,396,,,,,,,,,36777.0,,,,,,,False,False,,,105.0,,,,6.5,,,53.0,,85.0,,,,,,,,,,,,,,,,,,,,
,Meteorology and Physical Oceanography MS,,,,,,Fall,,,,Required,Required,Not Required,"All graduate applicants who are not native or primary speakers of English must demonstrate English proficiency. Minimum scores required for admission: TOEFL iBT: 80, IELTS: 6.5 overall band score with no band score below 6, PTE Academic: 53, Duolingo English Test: 105.","A baccalaureate degree from an accredited college or university in meteorology or oceanography. Students with degrees in the basic sciences (physics, chemistry, mathematics) or engineering are also encouraged to apply provided they have taken courses in mathematics (through differential equations) and physics (through mechanics, heat, electricity, and magnetism). Your statement of purpose describing your interests and career goals is an important part of your application.",Not Required,,True,False,False,False,False,False,False,False,False,False,False,False,False,False,False,False,,,,School of Marine and Atmospheric Sciences (SoMAS),23580,,,,,,,"This program is designed for students with strong backgrounds in the physical, mathematical or engineering sciences who are interested in pursuing a career or further graduate studies in the fields of either meteorology or physical oceanography. Students are educated in the fundamentals of the dynamics of the atmosphere and ocean, and in the physical and mathematical principles underlying these disciplines. Thesis and non-thesis options are available. The thesis option involves in-depth research with a faculty member. The non-thesis option culminates with the submission of a research paper and requires a few more credits of coursework in lieu of thesis credits. All SoMAS M.S. degree programs are expected to be completed in four semesters.",,https://www.stonybrook.edu/commcms/somas/education/graduate/,,,983,,True,,4.0,3.0,,396,,,,,,,,,23580.0,,,,,,,False,False,,,105.0,,,,6.5,,,53.0,,80.0,,,,,,,,,,,,,"Teaching assistantships, Research assistantships, Partial tuition scholarships",,,,,,,
,Meteorology and Physical Oceanography PhD,,,,,PhD,Fall,,,January 15,Required,Required,Not Required,"All graduate applicants who are not native or primary speakers of English must demonstrate English proficiency. Acceptable exams and the minimum scores for PhD programs are: TOEFL iBT score of 90, IELTS overall score of 6.5, Duolingo English Test score of 115, or PTE Academic score of 65.",Official transcripts from all undergraduate and graduate institutions attended; Personal Statement; Three letters of recommendation; Curriculum Vitae/Resume; GRE General Test Scores: Optional; English Proficiency for International Applicants: TOEFL/IELTS/Duolingo; Completed online application and application fee.,Not Required,,True,True,False,False,False,False,False,False,False,False,False,False,False,False,False,False,,,,School of Marine and Atmospheric Sciences,22620,,,,,,"['meteorology', 'physical oceanography']","The graduate program in meteorology and physical oceanography is administered by the School of Marine and Atmospheric Sciences (SoMAS). It is designed to prepare students for careers in research, teaching and applied sciences. A Ph.D. is granted to a student who has fulfilled the course requirements and has completed a dissertation that makes a significant and original contribution to the body of knowledge in their chosen field of specialization. Both theoretical and observational studies are stressed. There are two major tracks of study: meteorology and physical oceanography. The meteorology track includes studies of atmospheric dynamics, atmospheric chemistry and radiation, and cloud and precipitation physics. The physical oceanography track is concerned with the study of the physics of the ocean, including ocean circulation, ocean-atmosphere interaction, coastal oceanography and sediment transport. In both tracks, the use of numerical models and state-of-the-art instrumentation form an essential component of the graduate education experience. SoMAS has a strong program in tropical meteorology. On-campus facilities include a computing cluster and meteorological instrumentation. Students and faculty have access to research aircraft and ships, and to radar and other remote sensing facilities. Students also can participate in a wide variety of field programs on a worldwide basis. There are many opportunities to develop interdisciplinary research programs with faculty in other fields, such as chemistry and engineering. Graduate students are encouraged to gain teaching experience as well as research expertise. The goal of the program is to produce professionally competent scientists who will make fundamental contributions to the understanding of the processes that govern the dynamics of the world’s atmosphere and oceans.",,https://www.stonybrook.edu/grad/academics/,,30000,943,False,True,0.0,4.0,3.25,,394,,,,,,,,,22620.0,,,,,,,False,False,,,115.0,,,,6.5,,,65.0,,90.0,,,,,,,,,,,30000,,"Research assistantships, Teaching assistantships",,,,,,,
