,Master of Science in Psychology,,,,,Graduate,Fall,,,,Required,Required,Not Required,REQUIRED,"A complete application must be submitted via Cal State Apply. Requirements include: a bachelor’s degree in psychology or a related field from an accredited institution; a minimum GPA of 3.0 on a 4.0 scale for the last 60 semester (90 quarter) units of coursework; completion of prerequisite courses (Introduction to Psychology, Research Methods in Psychology, and Statistics in Psychology) with a grade of B or higher. Applicants must submit official transcripts from all universities and colleges attended, three letters of recommendation, a Statement of Purpose, and a Résumé or Curriculum Vitae (CV). The Graduate Record Exam (GRE) General Test is optional for the Fall 2024 admissions cycle.",Not Required,,True,True,True,False,False,False,,True,False,False,False,True,True,False,False,False,,,,College of Behavioral and Social Sciences,"$4,642/Semester","$4,642/Semester",,,,,,Marriage and Family Therapy Option,"The Master of Science in Psychology with the Marriage and Family Therapy (MFT) option is a 60-unit program designed to prepare students for licensure as a Marriage and Family Therapist in the state of California. Students who graduate from the MFT program at Chico State are eligible to sit for the MFT licensure exams as regulated by the California Board of Behavioral Sciences (BBS). Our program is designed to train ethical, multiculturally-aware, and competent psychotherapists who can serve the diverse needs of the North State and beyond. We prepare students through a combination of coursework, clinical practicum, research, and professional development.",,https://www.csuchico.edu/academics/college/behavioral-social-sciences/departments/psychology/masters-programs/ms-marriage-family-therapy.shtml,"The Master of Science in Psychology degree at CSU, Chico is accredited by the Western Association of Schools and Colleges (WASC). The MFT program is NOT accredited by the Commission on Accreditation for Marriage and Family Therapy Education (COAMFTE). COAMFTE accreditation is not required for licensure as an MFT in California. Our MFT program is designed to meet the requirements of the California Board of Behavioral Sciences (BBS) to enable our graduates to pursue licensure.",,,,False,2.0,4.0,3.0,,,,,,,,,,,,,,,,,,False,False,,,110,,,,6.5,,,59,,80,,,,,,,,,,,"$500 - $1,500",,"Merit-based, Need-based, Community Service",,,,,,,
,Master of Public Administration,,,,,Graduate,Fall,,"October 1, 2025","June 1, 2026",Required,Required,Not Required,REQUIRED,"To apply to the MPA program, prospective students must submit the following materials: 1. Submit a CSU Graduate Application for Admission at calstate.edu/apply. 2. Submit official transcripts from all colleges and universities attended to the Graduate School (not the MPA program). 3. Two letters of recommendation should be submitted with your application, either through the online application portal or by sending them directly to the MPA Coordinator. 4. A professional résumé. 5. A Statement of Purpose that addresses your motivations for pursuing the MPA at Chico State and your professional aspirations. 6. A writing sample of no more than five pages that demonstrates your analytical writing and critical thinking skills. This can be a paper you have written for a prior course or a professional report.",Required,,True,False,True,False,False,False,,True,False,False,False,True,True,False,False,False,,,,College of Behavioral and Social Sciences,9380,"$9,380/Year",,,,,,"General MPA Option, Health Administration Option","The Master of Public Administration (MPA) at California State University, Chico is a nationally accredited, 39-unit professional degree for those who wish to enter or advance in a career in public or nonprofit service. The program is designed to develop the knowledge and skills necessary for the effective and ethical management and leadership of public and nonprofit organizations in an increasingly diverse and dynamic society. Graduates of the Master of Public Administration program will be able to: 1. Lead and manage in public governance; 2. Participate in and contribute to the policy process; 3. Analyze, synthesize, think critically, solve problems, and make decisions; 4. Articulate and apply a public service perspective; 5. Communicate and interact productively with a diverse and changing workforce and citizenry.",,https://www.csuchico.edu/_assets/documents/office/bss/mpa-handout-25-26.pdf,"Accredited by the Network of Schools of Public Policy, Affairs, and Administration (NASPAA) Commission on Peer Review & Accreditation.",,,False,False,,4.0,3.0,,,,,,,,,,,,,,,,,,False,False,,,110,,,,6.5,,,59,,80,,,,,,,,,,,"$500 to $2,000",,"Merit-based, Need-based",,,,,,,
,Master of Science in Regenerative Agriculture Interdisciplinary Studies,,,,,Graduate,Fall,,"October 1, 2025","May 15, 2026",Required,Required,Not Required,REQUIRED,"In addition to the general requirements of the university, specific requirements for admission to classified graduate status are:

A baccalaureate degree from an accredited institution with a grade point average of 3.0 or higher in the last 60 semester (90 quarter) units.
Completion of two semesters of college-level chemistry and one semester of college-level biology, or equivalent.
Two letters of recommendation from former professors or others who can judge the applicant's academic potential for graduate study.
A statement of purpose of approximately 1,000 words describing why you are interested in this degree program and how it relates to your personal and professional goals.
A resume or curriculum vitae.
Submission of the graduate school application through Cal State Apply.",,,True,False,True,True,False,False,,True,False,False,False,True,True,True,False,False,,,,College of Agriculture,9348,"$9,348/Year",,,,,,,"The Master of Science in Regenerative Agriculture is an interdisciplinary degree program housed within the College of Agriculture. The program is designed for students with a passion for agriculture and a commitment to build a more sustainable and equitable food system. The program's core philosophy is that agriculture must be regenerative of natural resources and socially just to be truly sustainable. The MS in Regenerative Agriculture is a research-focused degree where students work closely with a faculty advisor to conduct an original research project that culminates in a master's thesis. Throughout their program, students take a range of coursework across campus to build a solid foundation in the principles and practices of regenerative agriculture. Students also receive specialized training in research design, grant writing, and science communication.",,https://www.csuchico.edu/graduatestudies/programs/,,,396,True,False,,4.0,3.0,,,,,,,,,,,,,,,,,,False,False,,,110,112.0,,,6.5,,,59,,80,,,,,,,,,,,,,"Wildcat Scholarships, External Scholarships",,,,,,,
,Master of Arts in Social Science,,,,,Graduate,Fall,,October 1,April 15,,,Not Required,REQUIRED,,,,,,True,True,False,False,,True,False,False,False,True,True,False,False,False,,,,College of Behavioral and Social Sciences,10950,10950,,,,,,"['Special Case Pattern', 'Teaching College Social Science Pattern']","The Master of Arts in Social Science is an interdisciplinary program designed for students with diverse backgrounds and career goals. Students customize their programs of study in consultation with the graduate coordinator. The special case pattern allows students to design their own MA in consultation with the graduate coordinator. Special case students select courses from at least three different disciplines with no more than 12 units coming from any one discipline. The teaching college social science pattern is a more structured program focusing on sociology, political science, and United States history to prepare students who plan to teach in the California Community College system. Both patterns require the completion of a master's thesis or project.",,https://catalog.csuchico.edu/colleges-departments/college-behavioral-social-sciences/social-science/social-science-ma/,,,,,,,4.0,3.0,,,,,,,,,,,,,,,,,,,,,,110,112.0,,,6.5,,,59,,80,,,,,,,,,,,"Up to $4,000",,"Merit-based, Need-based, Research-based",,,,,,,
,Master of Social Work,,,,,Graduate,Fall,,"October 1, 2025","December 15, 2025",Required,Required,Not Required,REQUIRED,"A baccalaureate degree from an accredited college or university. An undergraduate major in social work is not required.
A grade point average of at least 3.0 on a 4.0 scale in the last 60 semester (90 quarter) units.
Completion of three prerequisite courses: One course in social and behavioral sciences, one course in biological sciences, and one course in statistics.
One year of relevant work experience is preferred, paid or volunteer.
Evidence of personal qualifications, motivation, and experience that indicate the likelihood of becoming a successful social worker.",Not Required,,True,False,True,True,False,False,,True,False,False,False,True,True,False,False,False,,,,"School of Social Work, College of Behavioral and Social Sciences",8490/Year,8490/Year,,,,,,,"The mission of the Master of Social Work (MSW) Program is to provide graduate students with a quality educational experience that prepares them for advanced generalist practice in a rural context. The program is specifically committed to educating students who will work with and on behalf of oppressed, impoverished and otherwise disenfranchised individuals, families, groups, and communities. The curriculum is delivered to facilitate the integration of foundation and advanced-level competencies for ethical and effective social work practice.",,https://www.csuchico.edu/graduatestudies/programs/,"The Master of Social Work program at California State University, Chico is fully accredited by the Council on Social Work Education (CSWE).",,,,False,,4.0,3.0,,,,,,,,,,,,,,,,,,False,False,,,110,112.0,,,6.5,,,59,,80,,,,,,,,,,,,,"Departmental, Merit-based",,,,,,,
,Master of Science in Wildland Management Interdisciplinary Studies,,,,,Graduate,Fall,,"October 1, 2025","June 1, 2026",,,GRE,REQUIRED,,,,,,True,False,True,False,,True,False,False,False,True,True,False,False,False,,,,College of Agriculture,"$8,006/Semester or $16,012/Year","$8,006/Semester or $16,012/Year",,,,,,,"The Master of Science in Wildland Management is an interdisciplinary program including course work in agriculture, biological sciences, geosciences, and social science. The program addresses the science and management of wildlands including the physical, biological, and social factors that influence them. The program is designed for students with undergraduate degrees in a range of fields, including biology, agriculture, geography, environmental science, recreation, and related resource management disciplines. The program provides the knowledge and skills for a variety of careers managing wildlands in public agencies and the private sector. It can also be a preparatory degree for a PhD program.",,https://www.csuchico.edu/graduatestudies/prospective-students/programs/wildland-management.shtml,,,,,,,4.0,3.0,,,,,,,,,,,,,,,,,,,,,,110,,,,6.5,,,59,,80,,,,,,,,,,,,,"Merit-based, financial need, leadership, and community service",,,,,,,
,Certificate in Land Use and Environmental Planning,,,,,Graduate-Certificate,"Fall, Spring",,"October 1, 2025",,,,Not Required,REQUIRED,,,,,,True,True,False,False,,True,False,False,False,True,True,True,False,False,,,,College of Behavioral and Social Sciences,"$4,773/Semester","$4,773/Semester",,,,,,,"The Certificate in Land Use and Environmental Planning is an 18-unit program for classified graduate students and for post-baccalaureate students not seeking a master's degree. It is designed to prepare students for professional practice as land use and environmental planners with city, county, and state agencies, and with private consulting firms. It is also designed to serve those already in planning or related fields (e.g., city managers, civil engineers, architects) who wish to acquire specialized professional training.",,https://www.csuchico.edu/graduatestudies/programs/,,,,,,,4.0,3.0,,,,,,,,,,,,,,,,,,,,,,110,112.0,,,6.5,,,59,,80,,,,,,,,,,,,,"Merit-based, Need-based, Major-specific",,,,,,,
,Certificate in Data Science,,,,,Graduate-Certificate,"Fall, Spring",,"October 1, 2025","November 30, 2025",,,Not Required,REQUIRED,"To be admitted to the certificate program, a student must be in good academic standing at the University. The certificate program must be completed with a grade of C- or higher in all required and elective coursework.",,,True,False,True,True,False,False,,True,False,False,False,True,True,False,False,False,,,,College of Natural Sciences,,,,,,,,,"The Certificate in Data Science is a multi-disciplinary certificate program offered by the Department of Mathematics and Statistics, the Department of Computer Science, and the Department of Business Information Systems that prepares students to use modern computational and statistical techniques to analyze, interpret, and visualize data from a wide variety of sources. This certificate helps students find employment in the rapidly growing field of data science, as well as prepare for graduate studies in data science, analytics, or a related field.",,https://catalog.csuchico.edu/colleges-departments/college-natural-sciences/mathematics/data-science-certificate/,,,,False,True,,4.0,2.0,82.6% (Fall 2023),,,,,,,,,,,,,,,,,False,False,,,110,112.0,,,6.5,,,59,,80,,,,,,,,,,,,,"Merit-based, Need-based",,,,,,,
