Resume,StatementOfPurpose,Requirements,WritingSample,IsAnalyticalNotRequired,IsAnalyticalOptional,IsRecommendationSystemOpted,IsStemProgram,IsACTRequired,IsSATRequired,MinimumACTScore,MinimumSATScore,extraction_level,Program name,Program Page url,error
Required,Required,"In addition to the general requirements of the university, specific requirements for admission to classified graduate status are:

A baccalaureate degree from an accredited institution with a grade point average of 3.0 or higher in the last 60 semester (90 quarter) units.
Completion of two semesters of college-level chemistry and one semester of college-level biology, or equivalent.
Two letters of recommendation from former professors or others who can judge the applicant's academic potential for graduate study.
A statement of purpose of approximately 1,000 words describing why you are interested in this degree program and how it relates to your personal and professional goals.
A resume or curriculum vitae.
Submission of the graduate school application through Cal State Apply.",,True,False,True,False,False,False,,,program,Master of Science in Regenerative Agriculture Interdisciplinary Studies,https://www.csuchico.edu/graduatestudies/programs/,
,,,,,,,,,,,,error,Master of Arts in Social Science,https://catalog.csuchico.edu/colleges-departments/college-behavioral-social-sciences/social-science/social-science-ma/,"Invalid operation: The `response.text` quick accessor requires the response to contain a valid `Part`, but none were returned. The candidate's [finish_reason](https://ai.google.dev/api/generate-content#finishreason) is 12."
Required,Required,"A baccalaureate degree from an accredited college or university. An undergraduate major in social work is not required.
A grade point average of at least 3.0 on a 4.0 scale in the last 60 semester (90 quarter) units.
Completion of three prerequisite courses: One course in social and behavioral sciences, one course in biological sciences, and one course in statistics.
One year of relevant work experience is preferred, paid or volunteer.
Evidence of personal qualifications, motivation, and experience that indicate the likelihood of becoming a successful social worker.",Not Required,True,False,,False,False,False,,,program,Master of Social Work,https://www.csuchico.edu/graduatestudies/programs/,
,,,,,,,,,,,,error,Master of Science in Wildland Management Interdisciplinary Studies,https://www.csuchico.edu/graduatestudies/prospective-students/programs/wildland-management.shtml,"Invalid operation: The `response.text` quick accessor requires the response to contain a valid `Part`, but none were returned. The candidate's [finish_reason](https://ai.google.dev/api/generate-content#finishreason) is 12."
,,,,,,,,,,,,error,Certificate in Land Use and Environmental Planning,https://www.csuchico.edu/graduatestudies/programs/,"Invalid operation: The `response.text` quick accessor requires the response to contain a valid `Part`, but none were returned. The candidate's [finish_reason](https://ai.google.dev/api/generate-content#finishreason) is 12."
,,"To be admitted to the certificate program, a student must be in good academic standing at the University. The certificate program must be completed with a grade of C- or higher in all required and elective coursework.",,True,False,False,True,False,False,,,program,Certificate in Data Science,https://catalog.csuchico.edu/colleges-departments/college-natural-sciences/mathematics/data-science-certificate/,
