Program name,Program Page url
Associate of Science in Culinary Arts,https://catalog.una.edu/undergraduate/
Associate of Science in Hospitality and Events Management,https://hospitalityprep.com/hospitality-management-degree-in-alabama/
Bachelor of Business Administration in Accounting,https://www.una.edu/business/undergraduate/bachelor-of-business-administration-bba/index.html
Bachelor of Science in Applied Health Science,https://publichealth.indiana.edu/undergraduate/degrees-majors/bs-applied-health-sciences/index.html
Bachelor of Arts in Biology,https://www.una.edu/biology/index.html
Bachelor of Science in Biology,https://catalog.una.edu/undergraduate/
Bachelor of Science in Biology (Cellular & Molecular Biology Option),https://catalog.una.edu/undergraduate/
Bachelor of Business Administration in Business Administration (Flex),https://catalog.una.edu/undergraduate/
Bachelor of Arts in Chemistry,https://catalog.una.edu/undergraduate/
Bachelor of Science in Chemistry,https://www.una.edu/chemistryandphysics/index.html
Bachelor of Fine Arts in Cinematic Arts and Theatre,https://catalog.una.edu/undergraduate/colleges-programs/arts-sciences/school-arts/cinematic-arts-theatre/bfa/
Bachelor of Arts in Communication Arts,https://www.una.edu/communication/Degree%20Program/communications-majors/communication-studies.html
Bachelor of Science in Communication Arts,https://catalog.una.edu/undergraduate/colleges-programs/arts-sciences/school-humanities-social-sciences/communications/ba-bs/ba-bs.pdf
Bachelor of Business Administration in Computer Information Systems,https://catalog.una.edu/undergraduate/
Bachelor of Science in Computer Science,https://catalog.una.edu/undergraduate/
Bachelor of Arts in Criminal Justice,https://catalog.una.edu/undergraduate/
Bachelor of Science in Criminal Justice,https://catalog.una.edu/undergraduate/
Bachelor of Science in Culinary Arts Management,https://catalog.una.edu/undergraduate/
Bachelor of Business Administration in Economics,https://catalog.una.edu/undergraduate/colleges-programs/business/business.pdf
Bachelor of Engineering,https://catalog.una.edu/undergraduate/
Bachelor of Science in Engineering Technology,https://catalog.una.edu/undergraduate/colleges-programs/arts-sciences/school-science-engineering-mathematics/engineering-industrial-professions/bs-engineering-technology/
Bachelor of Arts in English,https://catalog.una.edu/
Bachelor of Science in English,https://www.liberty.edu/arts-sciences/bachelors/english-writing/
Bachelor of Arts in Entertainment Industry,https://catalog.una.edu/undergraduate/colleges-programs/arts-sciences/school-arts/entertainment-industry/ba-bs/
Bachelor of Science in Entertainment Industry,https://catalog.una.edu/undergraduate/
Bachelor of Arts in Entertainment Industry (Entertainment Business Option),https://www.una.edu/sitemap.xml
Bachelor of Science in Entertainment Industry (Entertainment Business Option),https://catalog.una.edu/undergraduate/
Bachelor of Arts in Entertainment Industry (Entertainment Technology Option),https://catalog.una.edu/
Bachelor of Science in Entertainment Industry (Entertainment Technology Option),https://catalog.una.edu/undergraduate/
Bachelor of Science in Exercise Science,https://catalog.una.edu/undergraduate/colleges-programs/education-human-sciences/health-physical-education-recreation/bs-exercise-science/
Bachelor of Science in Fashion Merchandising and Design,https://www.una.edu/art/degree/fashion-merchandising-and-design.html
Bachelor of Business Administration in Finance,https://catalog.una.edu/undergraduate/colleges-programs/business/department-economics-finance/department-economics-finance.pdf
Bachelor of Science in Fitness Management,https://www.una.edu/education/bachelor-degrees/bachelor-of-science-health-and-fitness.html
Bachelor of Arts in Foreign Languages,https://www.una.edu/sitemap.xml
Bachelor of Arts in Geography,https://catalog.una.edu/undergraduate/colleges-programs/arts-sciences/school-science-engineering-mathematics/geoscience/ba-bs-geography/ba-bs-geography.pdf
Bachelor of Science in Geography,https://www.una.edu/registrar/Academic%20Calendars/index.html
Bachelor of Science in Health & Fitness,https://catalog.una.edu/undergraduate/
Bachelor_of_Science in Health Promotion,https://www.fhsu.edu/hhp/academic-programs/
Bachelor of Science in Hospitality and Events Management,https://catalog.una.edu/undergraduate/
Bachelor of Fine Arts in Interior Architecture and Design,https://catalog.una.edu/undergraduate/
Bachelor of Arts in Interdisciplinary Studies,https://catalog.una.edu/undergraduate/colleges-programs/arts-sciences/interdisciplinary-professional-studies/interdisciplinary-professional-studies.pdf
Bachelor of Science in Interdisciplinary Studies,https://www.una.edu/interdisciplinary-studies/docs/BIS_brochure.pdf
Bachelor of Business Administration in Professional Management (Accommodation and Service Industry Management Concentration),https://catalog.una.edu/undergraduate/colleges-programs/business/department-management-marketing/bba-professional-management/
Bachelor of Business Administration in Professional Marketing (Digital Marketing Concentration),https://catalog.una.edu/undergraduate/
Bachelor of Arts in Occupational Health Science,https://catalog.una.edu/undergraduate/colleges-programs/arts-sciences/school-science-engineering-mathematics/engineering-industrial-professions/ba-bs-ohs/
Bachelor of Science in Occupational Health Science,https://catalog.una.edu/undergraduate/
Bachelor of Arts in Physics (General Physics Option),https://catalog.una.edu/undergraduate/
Bachelor of Science in Physics (General Physics Option),https://vertexaisearch.cloud.google.com/grounding-api-redirect/AUZIYQEAbvS-Cg5Hx1T7Q-LelsoTZ0bzMFL5Aj0O3_mNVljYChjdHtCTGVJyOprpeno8lOHCCocxUOecBgIGSt0FBsCsDLlKxq3cBlLHzuLf3IYFpuPPXMVeqSrZ3Rk89atrnSEMO7mls3HhtzH3kSBvnA==
Bachelor of Arts in Political Science,https://www.una.edu/pjlp/index.html
Bachelor of Science in Political Science,https://catalog.una.edu/undergraduate/colleges-programs/arts-sciences/school-humanities-social-sciences/pjlp/pjlp.pdf
Bachelor_of_Arts in Psychology,https://catalog.una.edu/undergraduate/
Bachelor of Science in Psychology,https://catalog.una.edu/undergraduate/colleges-programs/arts-sciences/school-humanities-social-sciences/psychology-sociology/psychology-sociology.pdf
Bachelor of Science in Recreation,https://catalog.una.edu/undergraduate/
Bachelor of Social Work,https://catalog.una.edu/undergraduate/colleges-programs/arts-sciences/school-humanities-social-sciences/social-work/
Bachelor of Arts in Sociology (Family Life Education),https://www.una.edu/psychology-and-sociology/sociology-program/index.html
Bachelor of Science in Sociology (Family Life Education),https://catalog.una.edu/undergraduate/colleges-programs/arts-sciences/school-humanities-social-sciences/psychology-sociology/ba-bs-sociology/
Bachelor of Science in Sport and Recreation Management,https://catalog.una.edu/undergraduate/
Bachelor of Arts in Sustainability,https://catalog.una.edu/undergraduate/
Bachelor of Science in Sustainability,https://catalog.una.edu/undergraduate/colleges-programs/arts-sciences/school-science-engineering-mathematics/geoscience/bs-sustainability/
Bachelor of Fine Arts in Visual Arts and Design,https://catalog.una.edu/undergraduate/
Bachelor of Arts in Visual Arts and Design,https://www.una.edu/art/degree/bachelor-of-art.html
Bachelor of Science in Visual Arts and Design,https://catalog.una.edu/undergraduate/
Bachelor of Science in Education in Biology (Secondary Education),https://www.una.edu/academics/majors-minors.html
Bachelor of Science in Education in Business Marketing (Secondary Education),https://www.una.edu/sitemap.xml
Bachelor of Science in Education in Chemistry (Secondary Education),https://catalog.una.edu/undergraduate/
Bachelor of Science in Education in Collaborative Teacher (K-6),https://catalog.troy.edu/preview_program.php?catoid=4&poid=756&returnto=141
Bachelor of Science in Education in Early Childhood Education (P-3),https://catalog.una.edu/undergraduate/
Bachelor of Science in Education in Elementary Education (K-6),https://catalog.una.edu/undergraduate/
Bachelor of Science in Education in English Language Arts (Secondary Education),https://catalog.una.edu/undergraduate/
Bachelor of Science in Education in Family and Consumer Sciences (Secondary Education),https://catalog.una.edu/undergraduate/
Bachelor of Science in Education in French (Secondary Education),https://catalog.una.edu/undergraduate/colleges-programs/education-human-sciences/teaching-learning-leadership/
Bachelor of Science in Education in General Science (Secondary Education),https://catalog.una.edu/undergraduate/
Bachelor of Science in Education in General Social Science (Secondary Education),https://catalog.una.edu/undergraduate/
Bachelor of Science in Education in Geography (Secondary Education),https://catalog.una.edu/undergraduate/
Bachelor of Science in Education in German (Secondary Education),https://catalog.una.edu/undergraduate/colleges-programs/education-human-sciences/teaching-learning-leadership/bs-professional-education-german-6-12/
Bachelor of Science in Education in History (Secondary Education),https://catalog.una.edu/undergraduate/
Bachelor of Science in Education in Mathematics (Secondary Education),https://catalog.una.edu/undergraduate/
Bachelor of Science in Education in Music-Choral (P-12) (Secondary Education),https://catalog.una.edu/undergraduate/
Bachelor of Science in Education in Music-Instrumental (P-12) (Secondary Education),https://catalog.una.edu/undergraduate/
Bachelor of Science in Education in Physical Education (P-12) (Secondary Education),https://www.una.edu/education/bachelor-degrees/bachelor-of-science-in-education-physical-education-p-12.html
Bachelor of Science in Education in Physics (Secondary Education),https://catalog.una.edu/undergraduate/
Bachelor of Science in Education in Spanish (Secondary Education),https://catalog.una.edu/undergraduate/
Bachelor of Science in Education in Visual Arts (P-12) (Secondary Education),https://catalog.una.edu/undergraduate/colleges-programs/education-human-sciences/teaching-learning-leadership/bs-professional-education-visual-arts-p-12/
