Program name,Program Page url
Doctor of Business Administration,https://post.edu/blog/post-expands-graduate-programs-with-doctor-of-business-administration-degree/
Doctor of Nursing Practice,https://post.edu/wp-content/uploads/2023/12/POST_ASC_DNP_Overview_R18-PEM.pdf
Master of Business Administration,https://post.edu/academics/online-graduate-degrees/
Master of Business Administration – Healthcare,https://post.edu/academics/online-graduate-degrees/
Master of Education,https://post.edu/academics/online-graduate-degrees/
Master of Public Administration,https://post.edu/academics/online-graduate-degrees/
Master of Science in Accounting,https://post.edu/academics/online-graduate-degrees/
Master of Science in Business Intelligence and Analytics,https://post.edu/academics/online-graduate-degrees/
Master of Science in Clinical Mental Health Counseling,https://post.edu/academics/online-graduate-degrees/
Master of Science in Computer Science,https://post.edu/academics/online-graduate-degrees/
Master of Science in Counseling and Human Services,https://post.edu/academics/online-graduate-degrees/
Master of Science in Gaming and Esports Management,https://post.edu/academics/online-graduate-degrees/
Master of Science in Higher Education Leadership,https://post.edu/academics/online-graduate-degrees/
"Master of Science in Nursing, Area of Emphasis: Nursing Education",https://post.edu/academics/online-graduate-degrees/
"Master of Science in Nursing, Area of Emphasis: Nursing Informatics",https://post.edu/academics/online-graduate-degrees/
"Master of Science in Nursing, Area of Emphasis: Nursing – Case Management",https://post.edu/academics/online-graduate-degrees/
"Master of Science in Nursing, Area of Emphasis: Nursing – Family Nurse Practitioner",https://post.edu/academics/online-graduate-degrees/
"Master of Science in Nursing, Area of Emphasis: Nursing – Infection Prevention and Control",https://post.edu/academics/online-graduate-degrees/
"Master of Science in Nursing, Area of Emphasis: Nursing – Organizational Leadership",https://post.edu/academics/online-graduate-degrees/
"Master of Science in Nursing, Area of Emphasis: Mental Health Nursing",https://post.edu/academics/online-graduate-degrees/
"Master of Science in Nursing, Area of Emphasis: Nursing Administration",https://post.edu/academics/online-graduate-degrees/
"Master of Science in Nursing, Area of Emphasis: Nursing Science, Education, and Practice",https://post.edu/academics/online-graduate-degrees/
"Master of Science in Nursing, Area of Emphasis: Pediatric Nursing",https://post.edu/academics/online-graduate-degrees/
Master of Science in Nursing / Master of Business Administration – Healthcare (Dual Degree),https://post.edu/academics/online-graduate-degrees/
Master of Science in Project Management,https://post.edu/academics/online-graduate-degrees/
"Master's in Parks, Recreation and Leisure Studies",https://post.edu/academics/online-graduate-degrees/
Master's in Teaching,https://post.edu/academics/online-graduate-degrees/
Graduate Certificate in Accounting (Post-Baccalaureate),https://post.edu/academics/online-graduate-degrees/
Graduate Certificate in Alcohol and Drug Counseling,https://post.edu/academics/online-graduate-degrees/
Graduate Certificate in Autism Spectrum Disorders,https://post.edu/academics/online-graduate-degrees/
Graduate Certificate in Business Analytics,https://post.edu/academics/online-graduate-degrees/
Graduate Certificate in Corporate Innovation,https://post.edu/academics/online-graduate-degrees/
Graduate Certificate in Cybersecurity,https://post.edu/academics/online-graduate-degrees/
Graduate Certificate in Data Analytics,https://post.edu/academics/online-graduate-degrees/
Graduate Certificate in Data Science,https://post.edu/academics/online-graduate-degrees/
Graduate Certificate in Family Nurse Practitioner,https://post.edu/academics/online-graduate-degrees/
Graduate Certificate in Finance,https://post.edu/academics/online-graduate-degrees/
Graduate Certificate in Forensic Accounting,https://post.edu/academics/online-graduate-degrees/
Graduate Certificate in Geographical Information Systems,https://post.edu/academics/online-graduate-degrees/
Graduate Certificate in Gifted Education,https://post.edu/academics/online-graduate-degrees/
Graduate Certificate in Higher Education Administration,https://post.edu/academics/online-graduate-degrees/
Graduate Certificate in Human Resource Management,https://post.edu/academics/online-graduate-degrees/
Graduate Certificate in Infection Prevention and Control,https://post.edu/academics/online-graduate-degrees/
Graduate Certificate in Leadership,https://post.edu/academics/online-graduate-degrees/
Graduate Certificate in Learning Design and Technology,https://post.edu/academics/online-graduate-degrees/
Graduate Certificate in Marketing,https://post.edu/academics/online-graduate-degrees/
Graduate Certificate in Online Teaching,https://post.edu/academics/online-graduate-degrees/
Graduate Certificate in Paralegal Studies,https://post.edu/academics/online-graduate-degrees/
Graduate Certificate in Professional Counseling,https://post.edu/academics/online-graduate-degrees/
Graduate Certificate in Project Management,https://post.edu/academics/online-graduate-degrees/
Graduate Certificate in Social Media Marketing,https://post.edu/academics/online-graduate-degrees/
Graduate Certificate in Special Education,https://post.edu/academics/online-graduate-degrees/
Graduate Certificate in Strategic Communication,https://post.edu/academics/online-graduate-degrees/
Graduate Certificate in Teaching English Language Learners (TELL),https://post.edu/academics/online-graduate-degrees/
