Concentration name,description,program website url,Accreditation status,Program name,Program Page url,Level,level
,,https://www.una.edu/philosophy/index.html,,Philosophy PhD,https://www.una.edu/philosophy/index.html,,
,"The mission of the University of North Alabama Doctor of Physical Therapy Program is to educate and prepare compassionate and ethical entry-level physical therapists who are dedicated to life-long learning and evidence-based practice. Graduates will be prepared to provide patient-centered care to a diverse population to optimize function and improve the quality of life of individuals and society. The Doctor of Physical Therapy program is a full-time, three-year program consisting of nine consecutive semesters of coursework including 32 weeks of full-time clinical education experiences.",https://www.una.edu/physical-therapy/,"The Doctor of Physical Therapy Program at the University of North Alabama is accredited by the Commission on Accreditation in Physical Therapy Education (CAPTE), 3030 Potomac Ave., Suite 100, Alexandria, Virginia 22305-3085; telephone: 703-706-3245; email: accreditation@apta.org; website: http://www.capteonline.org. If needing to contact the program/institution directly, please call 256-765-5120 or email physicaltherapy@una.edu.",Physical Therapy DPT,https://www.una.edu/education/academic-programs/graduate.html,Doctoral,
"['Exercise Science Concentration', 'Health Promotion Concentration']","The Ph.D. in Exercise Science and Health Promotion is an interdisciplinary degree that will provide students an opportunity for advanced study in the theoretical and applied aspects of the fields of exercise science and health promotion. The program is designed to develop in students the knowledge and skills to conduct high-quality, evidence-based research; to create innovative, effective health and wellness programming; to successfully compete for external funding; and to teach and mentor the next generation of professionals. Students in the program will study with and conduct research under the mentorship of our nationally and internationally recognized graduate faculty in exercise science and health promotion who also serve as leaders in state and national professional organizations. The program consists of two concentrations from which students will select. Each concentration contains research methods, statistics, core, and elective courses. In addition, students will select a 12-hour cognate in an area of their interest from outside the Department of Kinesiology. The program culminates with students conducting an original dissertation study that expands the body of knowledge in their selected field of study.",https://www.una.edu/kinesiology/graduateprograms/doctor-of-philosophy-in-exercise-science-and-health-promotion.html,,Physical Therapy PhD,https://www.una.edu/kinesiology/graduateprograms/doctor-of-philosophy-in-exercise-science-and-health-promotion.html,PhD,
,,,,Physics MS,https://www.una.edu/education/academic-programs/graduate.html,,
,,,,Physics PhD,https://www.una.edu/education/academic-programs/graduate.html,,
,,,,Popular Music Pedagogy MA Online,https://uonline.miami.edu/programs/master-popular-music-pedagogy/,,
,"The Master of Science in Prevention Science and Community Health at UNA is a unique and innovative program focused on the training of prevention specialists who will have the education and skills to address health and social problems in communities. Our focus is on the training of professional, ethical, and culturally competent prevention specialists who are ready to serve and lead in the growing field of Prevention Science. Prevention Science is a multidisciplinary field that focuses on the development, evaluation, and dissemination of evidence-based strategies aimed at preventing social, physical, and mental health problems and promoting the well-being of individuals, families, and communities. Prevention science seeks to understand the factors that increase the risk for problems as well as the factors that enhance the likelihood of positive outcomes. Prevention specialists may develop and implement programs, write grants, evaluate programs, provide consulting services, and advocate for public policy.",https://www.una.edu/psychology-sociology/ms-prevention-science/index.html,,Prevention Science and Community Health MS,https://www.una.edu/arts-sciences-engineering/graduate-programs.html,MS,
,,,,Prevention Science and Community Health PhD,https://publichealth.lsuhsc.edu/education/academic-programs/chsp/phd.aspx,,
Cosmetics and Consumer Goods,"The University of North Alabama's Product Design: Cosmetics and Consumer Goods concentration is a graduate degree program that prepares students for careers in the cosmetic and consumer goods industry. Students in this program will learn the fundamentals of product design, from concept development to manufacturing and marketing. They will also gain experience working with a variety of materials and technologies, and they will have the opportunity to develop their own product ideas. The program culminates in a final project, in which students will create a new product from start to finish. Graduates of this program will be well-prepared for careers as product designers, product managers, and marketing specialists in the cosmetic and consumer goods industry.",https://www.una.edu/art/graduate-programs/ms-product-design-cosmetics-consumer-goods/index.html,The University of North Alabama Department of Visual Arts and Design is an accredited institutional member of the National Association of Schools of Art and Design (NASAD).,Product Design MS: Cosmetics and Consumer Goods,https://www.una.edu/education/academic-programs/graduate.html,MS,
Pharmaceutical and Biopharmaceutical,"The Pharmaceutical and Biopharmaceutical concentration will provide students with the foundational knowledge of scientific, regulatory, and business requirements of the global pharmaceutical and biopharmaceutical industries for product development from drug discovery through commercialization. The program is composed of five courses: Product Development for the Pharmaceutical and Biopharmaceutical Industries; Pharmaceutical and Biopharmaceutical Business Models; Pre-Clinical Development, IND, and Clinical Trials; Validation and Quality Control; Post-Approval Activities, Marketing, and Drug Safety. The program will not only educate professionals for the expanding pharmaceutical and biopharmaceutical industries but also provide the foundation to pursue post-graduate degrees.",https://www.una.edu/productdesign/,,Product Design MS: Pharmaceutical and Biopharmaceutical,https://www.una.edu/education/academic-programs/graduate.html,MS,
,,,,Product Design MS: Nanotechnology,https://e-catalogue.jhu.edu/engineering/full-time-residential-programs/degree-programs/chemical-biomolecular-engineering/chemical-biomolecular-engineering-master-science-engineering/,,
,"The Graduate Certificate in Program Evaluation consists of 12 semester hours of required coursework designed to prepare individuals for careers in education, public health, social work, community development, and other non-profit or for-profit organizations that seek skilled professionals to design and conduct program evaluations. This program is offered fully online.",https://www.una.edu/education/academic-programs/program-evaluation-cert.html,,Program Evaluation Cert Online,https://www.una.edu/education/academic-programs/graduate.html,Certificate,
Psychiatric Mental Health Nurse Practitioner,"The post-graduate APRN certificate curriculum is designed to provide the master’s or doctoral prepared nurse who is nationally certified and licensed as an advanced practice registered nurse (APRN), with the opportunity to expand their scope of practice into a new specialty area of advanced practice nursing. The curriculum provides a structured program of study in one of five concentrations. A certificate is awarded upon completion of the program. Certificate-prepared graduates are eligible to take the national certification examination in the area of their concentration.",https://catalog.una.edu/preview_program.php?catoid=31&poid=4919,"The post-graduate APRN certificate program at the University of North Alabama are accredited by the Commission on Collegiate Nursing Education, 655 K Street, NW, Suite 750, Washington, DC 20001, 202-887-6791.",Psychiatric Mental Health Nurse Practitioner Cert,https://www.una.edu/education/academic-programs/graduate.html,,
,"Applied Behavior Analysis (ABA) is a science that focuses on improving significant behaviors (e.g., social skills, communication, daily living skills, etc.) and decreasing challenging behaviors (e.g., aggression, self-injury, etc.) through the use of evidence-based procedures. Applied Behavior Analysis is the leading, most effective, evidence-based treatment for individuals with Autism Spectrum Disorder (ASD). The principles of ABA are often used to build skills and treat challenging behavior in other populations as well, including those with developmental and intellectual disabilities, attention deficit hyperactivity disorder, and conduct disorder. The Minor in Applied Behavior Analysis is designed to provide students with a fundamental understanding of the principles of behavior and how to apply them to improve the lives of others. The Association for Behavior Analysis International has verified the following courses toward the coursework requirements for eligibility to take the Board Certified Assistant Behavior Analyst® examination. Applicants will need to meet additional requirements before they can be deemed eligible to take the examination.",https://www.una.edu/psychology-and-sociology/minors/applied-behavior-analysis.html,,Psychology: Applied Behaviour Analysis MS,https://www.una.edu/psychology-and-sociology/minors/applied-behavior-analysis.html,Minor,
,,,,Psychology PhD,https://www.una.edu/education/academic-programs/graduate.html,,
,,,,Public Administration Cert,https://www.liberty.edu/online/government/masters/certificate/public-administration/,,
"['Generalist', 'Public Human Resource Management', 'Criminal Justice Administration']","The Master of Public Administration (MPA) degree is the recognized professional degree for individuals who are seeking a career in public service. The MPA program at UNA is a generalist program designed for individuals employed or seeking employment in public or non-profit sector. The mission of the Master of Public Administration (MPA) program at the University of North Alabama is to provide a quality and accessible graduate education for current and future leaders of public and nonprofit organizations, domestically and abroad. We promote public service values that include accountability, transparency, social equity, and diversity. This is achieved through an innovative and engaging curriculum, along with a faculty committed to teaching, research and service. Students can participate in our student led Public Administration Club as well as join the Pi Alpha Alpha National Honors Society for Public Affairs and Administration. The MPA Program has three tracks: Generalist, Public Human Resource Management, and Criminal Justice Administration. The 36-hour program includes 24 hours of core courses and 12 hours of electives from one of the three tracks.",https://www.una.edu/political-science/mpa-program.html,"The UNA Master of Public Administration (MPA) program is accredited by the Network of Schools of Public Policy, Affairs, and Administration (NASPAA) – The Global Standard in Public Service Education.",Public Administration MPA,https://www.una.edu/political-science/index.html,Masters,
"Criminal Justice Administration, Public Human Resources Management, Public Policy","The Master of Public Administration (MPA) degree at the University of North Alabama is an interdisciplinary graduate degree designed to prepare students for leadership and management careers in the public and non-profit sectors. The MPA degree combines the theory and practice of public administration, enabling students to develop the skills necessary for a career in government, nonprofit management, or a related field. The UNA MPA program has a diverse student population and is delivered entirely online, providing the flexibility students need to succeed. Our mission is to produce highly competent, ethical leaders committed to public service and the betterment of their communities. The MPA program serves a diverse student population, preparing them for leadership roles in a variety of public and non-profit organizations. Through innovative online coursework and engaged, applied learning, we empower students with the knowledge, skills, and values required to address complex societal challenges and promote the public good. We value professionalism, ethics, equity, diversity, and collaboration in all that we do.",https://www.una.edu/political-science-public-administration/graduate-programs/master-of-public-administration.html,"The Master of Public Administration (MPA) program at the University of North Alabama is accredited by the Network of Schools of Public Policy, Affairs, and Administration (NASPAA) Commission on Peer Review and Accreditation and is listed on the Annual Roster of Accredited Programs in conformity with NASPAA standards.",Public Administration MPA Online,https://www.collegefactual.com/graduate-schools/university-of-north-alabama/masters-degrees/social-services-public-administration/,,
,"The Graduate Certificate in Public Health is a 15-credit hour program designed for current graduate students or post-baccalaureate students who desire foundational knowledge in public health. This certificate is open to students from all academic disciplines who desire to enhance their knowledge and skills in public health. The coursework can be completed in two semesters, and all courses are taught online. Students completing the certificate program can apply these credits toward completion of the Master of Science in Health and Human Performance, Public Health concentration.",https://catalog.una.edu/preview_program.php?catoid=49&poid=7504,,Public Health Cert,https://www.una.edu/education/academic-programs/graduate.html,Certificate,
,,,,Public Health MPH,https://graduatestudies.publichealth.med.miami.edu/academic-programs/masters-degrees/mph-program-plan/index.html,,
,,,,Public Health MPH Online,https://online.ua.edu/degrees/master-of-public-health/,,
,,,,Public Health Accelerated MPH,https://www.una.edu/business/graduate/mha.html,,
,"The Anderson College of Nursing and Health Professions, School of Nursing offers a Master of Science in Public Health degree program. The program is designed for students seeking a graduate degree for professional advancement in the public health workforce. The program will equip students for public health careers in a wide range of settings, including community organizations, government agencies, health care, and academics. Students will gain knowledge and skills in the five core public health discipline areas: biostatistics, epidemiology, health policy and management, social and behavioral sciences, and environmental health sciences. The program consists of 42 credit hours. It is offered entirely online, allowing flexibility for students. The program includes an Applied Practice Experience and an Integrative Learning Experience that allow students to apply their knowledge and skills in real-world settings.",https://www.una.edu/nursing/degrees-and-programs/public-health.html,The Master of Science in Public Health at the University of North Alabama is an applicant for accreditation by the Council on Education for Public Health (CEPH). The accreditation review will address the Master of Science in Public Health. Other degrees and areas of study offered by this institution will not be included in the unit of accreditation review.,Public Health MSPH,https://www.una.edu/education/academic-programs/graduate.html,,
,"The University of North Alabama’s Accelerated Master of Science in Public Health (AMSPH) is a 42-credit hour, fully online program that will prepare students to address the most pressing public health issues regionally, nationally, and globally. Our program builds on public health’s core functions: assessment, policy development, and assurance, while integrating the social determinants of health. Students will learn how to identify community assets and needs, plan and implement evidence-based programs, evaluate program and policy effectiveness, and advocate for health equity.",https://www.una.edu/public-health/msph/,The UNA Public Health Program is a new and developing program. The program is an applicant for accreditation by the Council on Education for Public Health (CEPH). The program is not accredited by CEPH at this time.,Public Health Accelerated MSPH,https://www.una.edu/education/academic-programs/graduate.html,Masters,
"Public Management, Community Development","The Master of Public Policy (M.P.P.) is the professional public service degree that prepares students for careers as analysts, managers, and leaders in the public, non-profit, and private sectors. The curriculum is designed to teach students to be creative problem-solvers, providing them with the tools and skills necessary to address a wide range of societal problems. With a focus on applied learning, the M.P.P. emphasizes hands-on experience and real-world problem-solving. This includes opportunities for research, community-engaged learning projects, and internships. The M.P.P. is a 36-hour program that students can complete online, in person, or a combination of both. It can be completed in as little as 12 months for full-time students. The program is flexible to accommodate the schedules of working professionals.",https://www.una.edu/political-science-public-administration/graduate-programs/mpp/index.html,,Public Policy MPP,https://www.una.edu/education/academic-programs/graduate.html,Masters,
,,,,Public Relations MA,https://www.uh.edu/class/communication/graduate/index.php,,
"Composition/Rhetoric, Creative Writing","The Master of Arts in Writing at the University of North Alabama offers students the opportunity for advanced study in the fields of creative and professional writing. The program helps prepare students for careers in writing and for further graduate study. Students can specialize in creative writing, which offers a variety of workshops and literature courses, or composition/rhetoric, which offers courses in rhetorical theory, composition pedagogy, and the history of rhetoric. Both tracks require 36 hours of coursework, which can be completed in two years. With a graduate degree in writing from UNA, students may enter writing and editing professions in business and industry, teach in high schools or two-year colleges, or pursue doctoral degrees in English, Composition/Rhetoric, or Creative Writing.",https://catalog.una.edu/graduate/arts-sciences/writing-ma/,,Writing MA,https://catalog.una.edu/graduate/arts-sciences/writing-ma/,MA,
