Concentration name,description,program website url,Accreditation status,Program name,Program Page url,Level,level
,"The UNA Department of Biology is pleased to offer a Master of Science (M.S.) degree program in Biomedical Sciences. This program prepares students to meet the demand for highly-skilled, professional scientists in the rapidly-growing health sciences and biotechnology fields. The curriculum for the M.S. in Biomedical Sciences program will allow students to customize their coursework to meet their specific professional goals, including entrance into competitive professional programs (medical, dental, physician assistant, pharmacy, etc.), or for employment in the biomedical or biotechnology industries. The M.S. in Biomedical Sciences program is a one-year, non-thesis program that requires the completion of 30 credit hours.",https://www.una.edu/biology/ms-biomedical-sciences.html,,Biomedical Sciences MS,https://www.una.edu/education/academic-programs/graduate.html,MS,
,,,,Biomedical Sciences PIBS (umbrella pathway program),https://www.una.edu/education/academic-programs/graduate.html,,
Biostatistics,"The Biostatistics track is designed for students with an interest in applying statistical methods to the biological sciences, including public health, medicine, and genetics. A graduate with this degree will be able to contribute to research in these areas by analyzing and interpreting data. Our students complete coursework in both the mathematics and biology departments. Coursework includes a one-year sequence in both mathematical statistics and applied statistics. In addition, students have opportunities to collaborate with faculty on research projects as a part of their curriculum.",https://www.una.edu/math/graduate-programs/ms-in-mathematics-biostatistics-track.html,,Biostatistics MS,https://www.una.edu/education/academic-programs/graduate.html,MS,
,,,,Biostatistics PhD,https://www.una.edu/education/academic-programs/graduate.html,,
,The University of North Alabama's MPS in Broadcast Meteorology degree provides students a path for a career in broadcast meteorology by providing the coursework needed to obtain the National Weather Association's Seal of Approval. The degree can be earned either fully online or through hybrid delivery.,https://www.una.edu/interdisciplinary-studies/graduate/index.html,,Broadcast Meteorology MPS,https://www.una.edu/interdisciplinary-studies/graduate/index.html,MPS,
,The Certificate in Business is a 12 hour certificate designed for non-business majors. It provides an introductory foundation in the functional areas of business. Non-business majors who complete the certificate will enhance their chosen major with the business acumen that will increase their career success.,https://catalog.una.edu/undergraduate/colleges-programs/business/business.pdf,The UNA College of Business is an accredited member of AACSB International-The Association to Advance Collegiate Schools of Business. The undergraduate and graduate programs are accredited.,Business Cert,https://catalog.una.edu/undergraduate/colleges-programs/business/business.pdf,Certificate,
"['Global Business', 'Data Analytics', 'Leadership']",The Executive Doctor of Business Administration (EDBA) program at the University of North Alabama is an applied professional doctoral degree program designed to equip senior business leaders with advanced knowledge and skills in key business functional areas. The program curriculum is designed to be completed in three years in a blended delivery format that is convenient for working professionals with a minimum of five years of progressive managerial or leadership experience. The EDBA curriculum has a strong focus on applied research to solve real-world business problems and is delivered by an outstanding team of experienced faculty.,https://www.una.edu/business/departments-and-programs/edba/index.html,AACSB-accredited,Business Executive DBA,https://www.dba-compass.com/programs/university-of-north-alabama/executive-doctor-of-business-administration-edba/,,
Accounting,"The Executive Doctorate of Business Administration (EDBA) at the University of North Alabama is a professional doctoral program for executives and senior managers who want to advance into the highest levels of their organizations. Our program is a unique blend of rigor and relevance, and the hybrid format provides the necessary flexibility for working professionals to balance work, life, and school commitments. This three-year, 60 credit hour cohort model program will provide you with the skills and expertise needed to drive organizational change through evidence-based decision-making. Students can select from various focus areas to develop specialized knowledge and skills.",https://www.una.edu/business/graduate/executive-doctorate-business-administration/index.html,The UNA Sanders College of Business and Technology is accredited by AACSB International—The Association to Advance Collegiate Schools of business.,Business PhD: Accounting,https://www.una.edu/business/graduate/executive-doctorate-business-administration/index.html,Doctoral,
,The Executive Doctor of Business Administration (EDBA) is a professional doctoral program for executives and senior managers who want to address business practice challenges through applied research. The program emphasizes the development of advanced critical thinking and research skills and their application to real-world business problems. The program will offer concentrations in specific areas of business to equip senior managers with the background needed to address complex organizational issues. The program is a hybrid program with students coming to campus three times a semester for a Friday/Saturday residency.,https://www.una.edu/business/graduate/executive-doctorate-business-administration/index.html,"The Sanders College of Business and Technology is accredited by AACSB International, which represents the highest standard of achievement for business schools worldwide. Less than 5% of business schools worldwide have earned this prestigious designation.",Business PhD: Finance,https://www.una.edu/business/graduate/executive-doctorate-business-administration/index.html,Doctoral,
Management,"The University of North Alabama Executive Doctor of Business Administration (EDBA) is a professional doctoral program designed for working executives and senior managers who desire to become thought-leaders at their organizations. Our blended EDBA program offers executives a doctoral degree that is both rigorous and relevant. The program allows students to learn the essential skills and complex concepts to create a new vision for their organization’s future. The EDBA program provides a flexible path to a doctoral degree without disrupting personal and professional commitments. The program allows students to gain the expertise to make significant contributions to both business practice and theory. The EDBA program is designed to enhance executive capacity for undertaking applied research and to ensure graduates can manage organizations of all kinds in a dynamic, global environment.",https://catalog.una.edu/graduate/business/edba/,The College of Business and Technology at the University of North Alabama is accredited by AACSB International – The Association to Advance Collegiate Schools of Business.,Business PhD: Management,https://catalog.una.edu/graduate/business/edba/,Doctoral,
,"The Executive Doctor of Business Administration (EDBA) is a professional doctoral program for executives and senior managers who want to solve the complex challenges facing business and society. The program curriculum is not concentration specific, but instead focuses on applied research to solve contemporary business problems within the context of the student’s career and industry. EDBA students gain advanced knowledge in the business disciplines, learn to apply relevant theories and methodologies to real-world business problems, and develop applied research and writing skills. This approach enables graduates to make significant contributions to the advancement of business knowledge and practice.",https://www.una.edu/business/graduate/executive-doctorate-business-administration/index.html,"The Sanders College of Business and Technology is accredited by AACSB International, the premier global accrediting body for business schools. AACSB Accreditation is the hallmark of excellence in business education and has been earned by less than five percent of the world's business programs.",Business PhD: Management Science,https://www.una.edu/business/graduate/executive-doctorate-business-administration/index.html,Doctoral,
,"The Accelerated Master’s Program (AMP) in Business Administration allows qualified UNA undergraduate students to begin their Master of Business Administration (MBA) graduate course work during their senior year. A student may take up to 9 hours of graduate courses during the senior year which may be applied to one of the ten concentrations offered in the traditional MBA program. By completing up to 9 hours of graduate course work prior to the completion of the baccalaureate degree, a student may earn an MBA degree in approximately 12 months after receiving the baccalaureate degree.",https://catalog.una.edu/undergraduate/colleges-programs/business/special-programs-activities/accelerated20masters20program/,All undergraduate and graduate programs in the College of Business and Technology are accredited by AACSB International-The Association to Advance Collegiate Schools of Business. The University of North Alabama is accredited by the Southern Association of Colleges and Schools Commission on Colleges (SACSCOC).,Business Administration Accelerated MBA,https://catalog.una.edu/undergraduate/colleges-programs/business/special-programs-activities/accelerated20masters20program/,MBA,
Real Estate,"The University of North Alabama Master of Business Administration (MBA) degree is a graduate-level degree with a rich history. We’ve been a top choice for business professionals for more than 40 a years, having launched our program in 1975. Today we continue to grow and welcome students from across the globe. Our students join us on campus, online, or in a hybrid format. Our faculty bring real-world experience to the classroom to give you a competitive edge. Our MBA will teach you how to lead and manage in the global business environment. You can customize your MBA to align with your career goals, and with nine concentrations, you have a variety of choices. From Accounting to Information Systems to Sales, our MBA will help you reach your professional goals.",https://www.una.edu/mba/index.html,"The UNA College of Business and Technology is accredited by AACSB International - The Association to Advance Collegiate Schools of Business. AACSB is the premier agency for bachelor, master, and doctoral degree programs in business administration and accounting. AACSB International accreditation is the hallmark of excellence in management education.",Business Administration Accelerated MBA in Real Estate,https://www.una.edu/mba/index.html,MBA,
,,,,Business Administration Executive MBA in Health Management and Policy,https://www.una.edu/education/academic-programs/graduate.html,,
,"The UNA Executive MBA is a cohort-based program designed for experienced professionals seeking to advance their careers by developing their management and leadership skills. This one-year online program can be completed in as little as 12 months with both online and hybrid learning options. The UNA Executive MBA offers a unique international study component that includes 8-10 days of international travel. Students visit a variety of global businesses and company executives while learning about the history, business practices, economics, and culture of a country. The Executive MBA is a part of our AACSB-accredited College of Business and Technology. In 2022, CEO Magazine named the UNA EMBA program as a Tier One program in their Global Executive MBA Rankings. Students in the program progress through the same sequence of courses as their cohort.",https://www.una.edu/business/departments-majors/mba-programs/executive-mba.html,The Executive MBA is a part of our AACSB-accredited College of Business and Technology.,Business Administration Global Executive MBA,https://www.una.edu/education/academic-programs/graduate.html,MBA,
Business Analytics,"The Business Analytics concentration will give students the skills and knowledge to turn data into actionable insights for better business decision-making. Students will gain experience with descriptive, predictive, and prescriptive analytics using a variety of statistical and analytical tools. Students learn to utilize data visualization, statistical and machine learning modeling, and optimization to address business problems across a wide variety of industries including finance, marketing, healthcare, and manufacturing. UNA’s Business Analytics MBA concentration will help prepare students to take certification exams such as the Certified Analytics Professional (CAP) exam.",https://www.una.edu/mba/index.html,The Steele-Cobb College of Business and Technology is accredited by AACSB International.,Business Analytics MSBA,https://www.una.edu/mba/index.html,MBA,
"Business Analytics, Information Systems","The Master of Science in Business Technology (MSBT), offered exclusively online, is a 30-hour program designed to prepare students for technical careers in business. In this program, students will learn to apply information technology to solve business problems. The program has been developed by faculty with real-world experience and is designed to provide students with the knowledge, skills, and abilities needed to obtain employment in the information technology field. The MSBT program offers two concentrations: Business Analytics and Information Systems.",https://www.una.edu/business/departments-and-programs/computer-science-and-information-systems/graduate-programs.html,The College of Business and Technology at the University of North Alabama is accredited by AACSB International.,Business Technology MS Online,https://www.una.edu/education/academic-programs/graduate.html,MS,
,,,,Cancer Biology PhD,https://catalog.una.edu/graduate/courses/bi/,,
,,,,Cellular Physiology and Molecular Biophysics PhD,https://www.una.edu/education/academic-programs/graduate.html,,
,"The 60-semester hour Master of Arts degree in Clinical Mental Health Counseling prepares graduates for employment in a variety of public and private human service agencies including mental health centers, hospitals, substance abuse treatment facilities, correctional facilities, family counseling centers, and pastoral counseling settings. Graduates are prepared to apply for licensure as a Licensed Professional Counselor (LPC) in Alabama and other states.",https://catalog.una.edu/graduate/colleges-programs/education-human-sciences/counselor-education/clinical-mental-health-counseling-ma/,The Clinical Mental Health Counseling program at UNA is accredited by the Council for Accreditation of Counseling and Related Educational Programs (CACREP).,Clinical Mental Health Counseling MA,https://catalog.una.edu/undergraduate/colleges-programs/education-human-sciences/counselor-education/,MA,
,"The Master of Science in Education with a major in Data Analytics and Program Evaluation is designed to prepare educators and other professionals for careers that require expertise in data analysis, assessment, research, and program evaluation. The 30-hour program is designed for students from a variety of professional backgrounds, including but not limited to, P-12 education, higher education, healthcare, social services, military, and business.",https://www.una.edu/education/academic-programs/graduate/data-analytics.html,,Data Analytics and Program Evaluation MS Online,https://www.una.edu/education/academic-programs/graduate.html,MS,
,UNA's BSN-DNP program prepares nurses for advanced practice and for leadership roles as clinical scholars. The curriculum is delivered in an online format to provide flexibility for working students. On-campus intensives are required each semester to provide opportunities for students to engage with faculty and colleagues and demonstrate specific skills and competencies. Clinical hours are completed in the student's own community. Students are prepared to sit for national certification in their specialty area upon graduation.,https://www.una.edu/nursing/graduate-nursing-programs/dnp-bsn.html,"The baccalaureate degree program in nursing, master's degree program in nursing, and Doctor of Nursing Practice program at the University of North Alabama are accredited by the Commission on Collegiate Nursing Education (http://www.ccneaccreditation.org).",Doctor of Nursing Practice (DNP): Advanced Practice,https://www.una.edu/education/academic-programs/graduate.html,,
Population Health Leadership,"The Doctor of Nursing Practice (DNP) degree is a practice-focused doctorate designed to prepare experts in specialized advanced nursing practice. The DNP curriculum at the University of North Alabama Anderson College of Nursing and Health Professions focuses on providing the skills and knowledge to enable graduates to provide the most advanced level of nursing care for individuals, families, and communities. The DNP program provides a curriculum that is consistent with professional standards and is designed to prepare graduates to:

Utilize advanced levels of clinical judgment, systems thinking, and accountability in designing, delivering, and evaluating evidence-based care to improve patient outcomes.
Critically appraise and synthesize evidence for the development of practice guidelines and projects.
Assume complex leadership roles to advance clinical practice and healthcare.
Advocate for social justice, equity, and ethical policies in healthcare.
Employ information systems and technology in the delivery of healthcare.
Collaborate with interprofessional teams to analyze and improve health outcomes.

Our Population Health focus prepares our graduates for leadership roles in a variety of settings. Students learn how to analyze data and evidence to improve patient outcomes and to design, implement, and evaluate new models of care delivery.",https://www.una.edu/nursing/graduate/doctor-nursing-practice.html,The Doctor of Nursing Practice program at the University of North Alabama are accredited by the Commission on Collegiate Nursing Education (http://www.ccneaccreditation.org).,Doctor of Nursing Practice (DNP): Population Health,https://www.una.edu/nursing/graduate/doctor-nursing-practice.html,Doctoral,
,,,,Doctor of Nursing Practice (DNP): Educational Leadership,https://www.una.edu/education/academic-programs/graduate.html,,
,,,,Economics PhD,https://www.una.edu/business/graduate/executive-doctorate-business-administration/index.html,,
Elementary Education,"The Education Specialist (Ed.S.) degree is an advanced program designed for teachers, teacher leaders, and administrators who hold a master’s degree. The Ed.S. degree is offered with Class AA professional educator certification in the following teaching fields: Elementary Education; Instructional Leadership; and Secondary Education with concentrations in English for Speakers of Other Languages, English Language Arts, General Science, History, and Mathematics. An Ed.S. degree is also offered in School Counseling. Students should consult with a faculty advisor in the appropriate department before enrolling in any courses.",https://catalog.una.edu/graduate/colleges-departments/education-human-sciences/teaching-learning-leadership/education-specialist/,Council for the Accreditation of Educator Preparation (CAEP),Education Specialist: Elementary Education,https://catalog.una.edu/graduate/courses/eds/,Education Specialist,
,"The Education Specialist (Ed.S.) degree program in Instructional Leadership is a 30-hour, post master’s program that provides the opportunity for educators to develop as instructional leaders who can serve in a variety of school settings. The program is designed to develop educators who are prepared to be highly effective school principals, assistant principals, or other administrators at the elementary, middle, and high school levels. The program leads to Alabama Class AA certification in Instructional Leadership for those who are eligible.",https://www.una.edu/education/academic-programs/graduate.html,The programs in the College of Education and Human Sciences are accredited by the Southern Association of Colleges and Schools Commission on Colleges (SACSCOC) and the Council for the Accreditation of Educator Preparation (CAEP).,Education Specialist: Instructional Leadership,https://www.una.edu/education/academic-programs/graduate.html,,
,"The Education Specialist (Ed.S.) degree program with a major in Teacher Leader is designed to prepare educators to serve as teacher leaders in P-12 schools. The program supports the development of expertise in the areas of curriculum, instruction, assessment, and mentoring/coaching. This program is a 30-33 credit hour program that leads to Class AA certification.",https://www.una.edu/education/academic-programs/teacher-leader-eds.html,All educator preparation programs at the University of North Alabama are accredited by the Council for the Accreditation of Educator Preparation (CAEP).,Education Specialist: Teacher Leader,https://www.una.edu/education/academic-programs/graduate.html,Education Specialist,
,,,,Electrical and Computer Engineering MSECE,https://engineering.purdue.edu/ECE/Academics/Graduates/MASTERS,,
Artificial Intelligence,"This master’s program offers students the opportunity to learn modern Electrical and Computer Engineering (ECE) topics with a focus in Artificial Intelligence (AI). Students learn through both foundational courses and cutting-edge electives. The curriculum provides a strong background to ECE and prepares students to become experts in the rapidly expanding field of AI, machine learning, and deep learning. The program also provides multiple opportunities for both independent and collaborative research to build a strong profile for either a career in industry or for advanced studies in a Ph.D. program.",https://www.una.edu/cse/graduate/msece-ai.html,,Electrical and Computer Engineering MSECE with emphasis in Artificial Intelligence,https://www.una.edu/education/academic-programs/graduate.html,Master,
,,,,Electrical and Computer Engineering MSECE with emphasis in Cybersecurity,https://www.una.edu/education/academic-programs/graduate.html,,
,,,,Electrical and Computer Engineering PhD,https://www.una.edu/education/academic-programs/graduate.html,,
"['Writing Track', 'Literature Track']","The Master of Arts in English at the University of North Alabama offers advanced study of literature and writing in an intellectually stimulating and creative environment. The program is flexible enough to meet the varied goals of a wide range of students and is structured to provide an intensive, comprehensive foundation in English studies. Students in the MA in English program receive considerable individual attention from a highly-qualified and dedicated faculty and enjoy opportunities to work as graduate assistants, to present their work at conferences, to publish their creative writing in a nationally distributed literary journal, to gain valuable editorial experience, and to participate in a variety of other activities. The program is designed to be completed in two years, though some students, particularly those who work full time, may take longer.",https://www.una.edu/english/master-of-arts-in-english.html,,English MA,https://www.una.edu/english/master-of-arts-in-english.html,MA,
,,,,English PhD,https://www.una.edu/english/index.html,,
"Professional Track, Research Track","The Master of Science in Environmental Health and Safety degree at the University of North Alabama offers two track options: one for working professionals and one for students interested in research. The professional track prepares you for immediate entry into the workforce in the business, industry, and government sectors. The research track prepares students for doctoral work and a career in research and academia. The degree can be completed in person or 100% online.",https://www.una.edu/health-professions/academic-programs/ms-ehs.html,,Environmental Health and Safety MS,https://www.una.edu/education/academic-programs/graduate.html,MS,
,"The PhD in Environmental Science and Policy at the University of North Alabama offers students the opportunity to conduct intensive research and scholarship in an interdisciplinary environment that will prepare them to be leaders in industry, government, and the non-profit sector. Students in the program will become experts in a particular area of environmental science, understand how to interpret and disseminate the results of their scholarship, and have the ability to formulate policy based on a firm scientific foundation. Faculty and students in the PhD in Environmental Science and Policy work to solve complex environmental problems at the local, regional, and global scales. The program has particular strengths in aquatic science, conservation biology, environmental health, geospatial science, and climate science.",https://www.una.edu/artsci/departments-majors/earth-and-environmental-sciences/phd-environmental-science-and-policy.html,,Environmental Science and Policy PhD,https://www.una.edu/education/academic-programs/graduate.html,PhD,
,,,,Epidemiology PhD,https://www.una.edu/education/academic-programs/graduate.html,,
